for just now a very huge beast with four great feet came to the pool and crushed him to death with his cloven heel."	四つ足のとっても大きな生き物がやって来て、先の二つに割れた蹄で、弟を踏みつぶしてしまったのです」
The Frog, puffing herself out, inquired,	すると、母親は、お腹をぷうっと膨らませ、息子たちに尋ねた。
"if the beast was as big as that in size."	「そいつは、このくらい大きかったかい？」
"Cease, Mother, to puff yourself out,"	すると一匹が言った。
said her son,	「お母さんやめてください。
"and do not be angry;	いくら頑張っても無理です。
for you would, I assure you, sooner burst than successfully imitate the hugeness of that monster."	あの化物と同じ大きさになる前に、きっと破裂してしまいます」
The Shepherd and the Wolf	７８．ヒツジ飼とオオカミ
A SHEPHERD once found the whelp of a Wolf and brought it up,	ある日のこと、ヒツジ飼はオオカミの仔を見つけて、連れ帰った。
and after a while taught it to steal lambs from the neighboring flocks.	その後、しばらくたってから、ヒツジ飼は、オオカミの仔に、近くの牧場から仔ヒツジを盗んでくることを教えた。
The Wolf, having shown himself an apt pupil, said to the Shepherd,	オオカミは、教わったことを完璧にこなすようになると、ヒツジ飼にこう言った。
"Since you have taught me to steal,	「あなたは、私に盗むことをお教えになりました。
you must keep a sharp lookout, or you will lose some of your own flock."	ですから、これからは、自分の群を失わぬように、いつも目を光らせていなければなりませんよ」
The Father and His Two Daughters	７９．父親と二人の娘
A MAN had two daughters,	男には二人の娘があった。
the one married to a gardener, and the other to a tile-maker.	一人は、庭師と結婚し、もう一人は、煉瓦職人と結婚した。
After a time he went to the daughter who had married the gardener, and inquired how she was and how all things went with her.	ある日のこと、男は、庭師と結婚した娘の所へ行き、暮らし向きはどうかと尋ねた。
"All things are prospering with me,	「すべて順調です。
and I have only one wish,	ただ、願い事が一つだけあります。
that there may be a heavy fall of rain, in order that the plants may be well watered."	草花にたくさん水をやれるように、大雨になってもらいたいのです」
Not long after, he went to the daughter who had married the tilemaker, and likewise inquired of her how she fared;	その後すぐ、男は、もう一方の煉瓦職人と結婚をした娘の所へ行き、暮らし向きはどうかと尋ねた。
"I want for nothing,	「私は取り立てて何もいりません。
and have only one wish,	ただ、願い事が一つだけあります。
that the dry weather may continue, and the sun shine hot and bright,	それは、太陽が照り、乾燥した暖かい日が続くことです。
so that the bricks might be dried."	そうすれば、煉瓦が乾きますから……」
wHe said to her,	父親は娘の話を聞くとこう言った。
"If your sister wishes for rain, and you for dry weather,	「お前の姉さんは雨の日を願い、お前は晴れの日を願う。
with which of the two am I to join my wishes?'	わしは、どちらを願えばよいのだ？」
The Farmer and His Sons	８０．農夫と息子たち
A FATHER, being on the point of death, wished to be sure that his sons would give the same attention to his farm as he himself had given it.	ある農夫が死に際して、自分が畑に心血を注いだように、息子たちにも畑仕事に精を出してもらいたいと願った。
He called them to his bedside and said,	彼は息子たちを、枕元に呼び寄せるとこんなことを言った。
"My sons, there is a great treasure hid in one of my vineyards."	「息子たちよ、よくお聞き、実はブドウ畑に、宝が隠してあるのだ」
The sons, after his death, took their spades and mattocks and carefully dug over every portion of their land.	父親が死ぬと、息子たちは、スコップとクワを手に、畑を隅々まで掘り返した。
They found no treasure,	だが結局、宝は見つからなかった。
but the vines repaid their labor by an extraordinary and superabundant crop.	しかしその秋、息子たちは、莫大なブドウの収穫という宝を手にしたのだった。
The Crab and Its Mother	８１．カニとその母親
A CRAB said to her son,	カニの母親が息子に言った。
"Why do you walk so one-sided, my child?	「なぜ、横歩きばかりするの？
It is far more becoming to go straight forward."	真っ直ぐ歩くようにしなさい」
The young Crab replied:	すると仔ガニはこう答えた。
"Quite true, dear Mother; and if you will show me the straight way, I will promise to walk in it."	「お母さんが、真っ直ぐ歩いてくれたら、僕も真っ直ぐに歩くよ」
The Mother tried in vain, and submitted without remonstrance to the reproof of her child.	母ガニは、真っ直ぐ歩こうとしたが、どうしても出来なかった。
Example is more powerful than precept.	実例は教訓より説得力がある。
The Heifer and the Ox	８２．牝の仔ウシと牡ウシ
A HEIFER saw an Ox hard at work harnessed to a plow, and tormented him with reflections on his unhappy fate in being compelled to labor.	牝の仔ウシは、牡ウシが鋤に繋がれ、こき使われているのを見ると、ウシの仲間の面汚しだと責め立てた。
Shortly afterwards, at the harvest festival, the owner released the Ox from his yoke,	それからすぐに、収穫祭があり、牡ウシは野に放たれた。
but bound the Heifer with cords and led him away to the altar to be slain in honor of the occasion.	しかし、牝の仔ウシは、縄で縛られ、祭壇へと連れて行かれた。
The Ox saw what was being done, and said with a smile to the Heifer:	牡ウシは、その様子を見て、笑いながら言った。
"For this you were allowed to live in idleness, because you were presently to be sacrificed."	「お前さんは、生贄に捧げられることになっていたから、怠けていられたんだよ」
The Swallow, the Serpent, and the Court of Justice	８３．ツバメとヘビと裁判所
A SWALLOW, returning from abroad and especially fond of dwelling with men, built herself a nest in the wall of a Court of Justice	ツバメの中でも、人と暮らすのを特に好んだツバメが、春渡って来ると、裁判所の壁に巣を作った。
and there hatched seven young birds.	そして七羽の雛が誕生した。
A Serpent gliding past the nest from its hole in the wall ate up the young unfledged nestlings.	ところが、一匹のヘビが、壁の穴から、巣の中へスルスルと入り込み、まだ羽の生えそろっていない雛を次から次へと全部食べてしまった。
The Swallow, finding her nest empty, lamented greatly and exclaimed:	巣が空っぽであることに気が付いたツバメは、嘆き悲しんでこう叫んだ。
"Woe to me a stranger!	「なんて理不尽な！
that in this place where all others' rights are protected, I alone should suffer wrong."	ここは、皆の権利を守る場所なのに、私だけが被害を受けるとは……」
The Thief and His Mother	８４．盗人と彼の母親
A BOY stole a lesson-book from one of his schoolfellows and took it home to his Mother.	ある少年が、友達の教科書を盗んで、家に持ち帰った。
She not only abstained from beating him, but encouraged him.	母親は、少年を打ち据えるどころか、もっと盗って来るようにと促した。
He next time stole a cloak and brought it to her,	少年は次に外套を盗み、母親の許へと持って行った。
and she again commended him.	すると彼女はまたしても、少年を褒めそやした。
The Youth, advanced to adulthood, proceeded to steal things of still greater value.	少年は成長すると、大泥棒になり、ついに捕まった。
At last he was caught in the very act, and having his hands bound behind him, was led away to the place of public execution.	そして、両手を後ろ手に縛られ、処刑場へと引っ立てられて行った。
His Mother followed in the crowd and violently beat her breast in sorrow,	母親は、悲嘆に暮れて、群衆の中をついて行った。
whereupon the young man said,	そのとき、息子が母親にこう言った。
"I wish to say something to my Mother in her ear."	「お母さん、ちょっと耳打ちしたいことがあります」
She came close to him, and he quickly seized her ear with his teeth and bit it off.	母親が、息子のそばまで行くと、彼は突然、母親の耳に噛みついて、耳を噛み切った。
The Mother upbraided him as an unnatural child,	彼女は息子を、残忍この上ない子だと罵った。
whereon he replied,	すると息子はこう言い返した。
"Ah! if you had beaten me when I first stole and brought to you that lesson-book, I should not have come to this,	「もし、私が、教科書を盗んだ時に、打ち据えていてくれたら、こんな事にはならなかったろうに
nor have been thus led to a disgraceful death."	・・・ああ、私はこうして死の淵へと引っ立てられて行くのだ！」
The Old Man and Death	８５．老人と死神
AN OLD MAN was employed in cutting wood in the forest, and, in carrying the faggots to the city for sale	その老人は、森で木を切り出し、切り出した木材を町へ運ぶ仕事をしていた。
one day, became very wearied with his long journey.	ある日のこと、老人はいつものように、重い荷物を背負って、長い道のりを歩いていたのだが、
He sat down by the wayside, and throwing down his load,	とうとう、精も根も尽きてしまい、道ばたにへたり込むと、背中の荷を放り出し、
besought "Death" to come.	「ああ、もう死んでしまいたい。」
"Death" immediately appeared in answer to his summons and asked for what reason he had called him.	すると、突然、死神が現れ、私を呼んだのはお前か？　と尋ねた。
The Old Man hurriedly replied,	老人は、慌ててこう答えた。
"That, lifting up the load,	「おお、ちょうどよいところへ来てくれました。
you may place it again upon my shoulders."	この荷物を背負うのを、ちょっと手伝ってくれませんか？」
The Fir-Tree and the Bramble	８６．樅の木とイバラ
A FIR-TREE said boastingly to the Bramble,	樅の木がイバラを見下して言った。
"You are useful for nothing at all; while I am everywhere used for roofs and houses."	「私は、世の中に色々と役に立つが、お前には一体何の取り柄がある？」
The Bramble answered:	するとイバラがこう言った。
'You poor creature,	「確かに、私には何の取り柄もありません。
if you would only call to mind the axes and saws which are about to hew you down,	でも、ほら、斧を持った樵がやって来ましたよ。
you would have reason to wish that you had grown up a Bramble, not a Fir-Tree."	風もないのに急に震え出したりして、私は本当にイバラでよかった！」
Better poverty without care, than riches with.	不安を抱える金持ちよりも、貧乏でも憂いがない方がよい。
The Mouse, the Frog, and the Hawk	８７．ネズミとカエルとタカ
A MOUSE who always lived on the land, by an unlucky chance formed an intimate acquaintance with a Frog, who lived for the most part in the water.	陸に棲むネズミが、水に棲むカエルと友達になった。
The Frog, one day intent on mischief, bound the foot of the Mouse tightly to his own.	ある日、カエルは、自分の足にネズミの足をしっかりとくくりつけ、
After this, he gradually led him towards the pool in which he lived,	自分の棲む池へと向かった。
until reaching the very brink, he suddenly jumped in, dragging the Mouse with him.	そして、水辺へやってきた途端、池の中へ飛び込んで、
The Frog enjoyed the water amazingly, and swam croaking about, as if he had done a good deed.	善行を施しているとでも言うように、ケロケロ鳴いて泳ぎ回った。
The unhappy Mouse was soon suffocated by the water,	哀れネズミは、あっという間に溺れ死んだ。
and his dead body floated about on the surface, tied to the foot of the Frog.	ネズミの死体は水面に浮かんだ。
A Hawk observed it, and, pouncing upon it with his talons, carried it aloft.	一羽のタカがそれを見つけると、鈎爪でひっつかみ、空高く舞い上がった。
The Frog, being still fastened to the leg of the Mouse, was also carried off a prisoner, and was eaten by the Hawk.	ネズミの足には、カエルの足がしっかりと結ばれていたので、カエルも共にさらわれて、タカの餌食となった。
Harm hatch, harm catch.	害を成す者は、また、害を被る者なり。
The Man Bitten by a Dog	８８．イヌに噛まれた男
A MAN who had been bitten by a Dog went about in quest of someone who might heal him.	ある男が、イヌに噛まれ、誰か治療してくれる人はないかと方々訪ね歩いた。
A friend, meeting him	そして、ある友人に出会った。
and learning what he wanted, said,	その友人は、こんなことを言った。
"If you would be cured, take a piece of bread, and dip it in the blood from your wound, and go and give it to the Dog that bit you."	「傷を癒したいならば、傷から流れる血にパンを浸して、君を噛んだイヌに与えてごらん」
The Man who had been bitten laughed at this advice and said,	男は、この忠告に笑って答えた。
"Why?	「どうしてそんなことをしなくちゃいけないんだい？
If I should do so, it would be as if I should beg every Dog in the town to bite me."	そんなことをしたら、街中のイヌに噛んでくれと、お願いするようなものではないか！」
Benefits bestowed upon the evil-disposed increase their means of injuring you.	自分を害する者に、情けをかけてはならぬ。
The Two Pots	８９．二つの壷
A RIVER carried down in its stream two Pots,	二つの壷が、川に流されていた。
one made of earthenware and the other of brass.	一つは陶器の壷で、一つは真鍮の壷だった。
The Earthen Pot said to the Brass Pot,	陶器の壷が真鍮の壷に言った。
"Pray keep at a distance and do not come near me,	「どうか、私から離れていて下さい。
for if you touch me ever so slightly, I shall be broken in pieces,	あなたが、ほんの少しでも触れたら、私は粉々に砕けてしまいます」
Equals make the best friends.	分相応の相手が最上の友である。
The Wolf and the Sheep	９０．オオカミとヒツジ
A WOLF, sorely wounded and bitten by dogs, lay sick and maimed in his lair.	オオカミは、イヌに噛まれて、ひどい傷を負い、自分のねぐらで、身動きがとれずにいた。
Being in want of food, he called to a Sheep who was passing, and asked him to fetch some water from a stream flowing close beside him.	腹を空かせたオオカミは、そばを通りかかったヒツジを呼び止めて、川から水をくんできてくれるようにと頼んだ。
"For," he said, "if you will bring me drink, I will find means to provide myself with meat."	「もし、君が水をくんできてくれたら、肉はなんとか用立てられるから。」
"Yes," said the Sheep,	すると、ヒツジはこう応えた。
"if I should bring you the draught, you would doubtless make me provide the meat also."	「ははーん、あなたは、水だけでなく、肉も、私からせしめるつもりなんでしょう。
Hypocritical speeches are easily seen through.	偽善者の言説は、簡単に見透かされる。
The Aethiop	９１．エチオピア人
THE PURCHASER of a black servant was persuaded that the color of his skin arose from dirt contracted through the neglect of his former masters.	黒人の奴隷を買った男が、彼の黒い肌を見て、前の主人が怠慢で、彼を洗ってやらなかったので、汚れがこびりついているのだと思った。
On bringing him home he resorted to every means of cleaning, and subjected the man to incessant scrubbings.	男は、彼を家に連れてくると、ひっきりなしにごしごし洗った。
The servant caught a severe cold, but he never changed his color or complexion.	しかし、肌の色は落ちなかった。
What's bred in the bone will stick to the flesh.	生まれつきは変わらない。
The Fisherman and His Nets	９２．漁師と網
A FISHERMAN, engaged in his calling, made a very successful cast and captured a great haul of fish.	腕のよい漁師が上手に網を投じて、魚を一網打尽にした。
He managed by a skillful handling of his net to retain all the large fish and to draw them to the shore;	そして、熟練した網さばきで、大きな魚を残らず岸壁まで曳き上げた。
but he could not prevent the smaller fish from falling back through the meshes of the net into the sea.	しかしさしもの漁師も、小魚が、網の目をすり抜けるのは如何ともし難かった。
The Huntsman and the Fisherman	９３．猟師と漁師
A HUNTSMAN, returning with his dogs from the field, fell in by chance with a Fisherman who was bringing home a basket well laden with fish.	森から帰って来た猟師が、海から帰って来た漁師と出会った。
The Huntsman wished to have the fish, and their owner experienced an equal longing for the contents of the game-bag.	猟師は魚が欲しくなり、漁師は獣が欲しくなった。
They quickly agreed to exchange the produce of their day's sport.	二人は、その日の猟と漁の成果を交換することにした。
Each was so well pleased with his bargain that they made for some time the same exchange day after day.	両者ともこの取引が気に入り、毎日、獲物の交換をした。
Finally a neighbor said to them,	それを見かねた近所の人が彼らに言った。
"If you go on in this way, you will soon destroy by frequent use the pleasure of your exchange, and each will again wish to retain the fruits of his own sport."	「あんた方、毎日そんなことをしていたら、すぐに、飽きてしまうよ」
Abstain and enjoy.	たまにだから楽しいのである。
The Old Woman and the Wine-Jar	９４．老婆とワイン壷
AN OLD WOMAN found an empty jar which had lately been full of prime old wine and which still retained the fragrant smell of its former contents.	老婆は地下室を片づけていて、空のワイン壷を見つけた。
She greedily placed it several times to her nose, and drawing it backwards and forwards said,	そして匂いを嗅いでみた。
"O most delicious!	「ああ、なんて素晴らしい匂いなんだろう！
How nice must the Wine itself have been,	この壷に入っていたワインは、よっぽど上等だったに違いない。
when it leaves behind in the very vessel which contained it so sweet a perfume!"	だって、こんなに甘い香りを残して行ったのだからね！」
The memory of a good deed lives.	美しい思い出は、生き続ける。
The Fox and the Crow	９５．キネツとカラス
A CROW having stolen a bit of meat, perched in a tree and held it in her beak.	カラスが、肉をくわえて、木にとまっていた。
A Fox, seeing this, longed to possess the meat himself, and by a wily stratagem succeeded.	キツネはそれを見ると、うまくせしめてやろうとこう言った。
"How handsome is the Crow,"	「ああ、なんて素敵なカラスなんだ！
he exclaimed, in the beauty of her shape and in the fairness of her complexion!	容姿端麗、肌はきめ細やかで、非の打ち所がない。
Oh, if her voice were only equal to her beauty, she would deservedly be considered the Queen of Birds!"	もし、姿と同じように声も美しかったら、鳥の女王様に違いないんだけど……」
This he said deceitfully; but the Crow, anxious to refute the reflection cast upon her voice, set up a loud caw and dropped the flesh.	カラスはキツネの言葉を真に受けて、自分の声の素晴らしさを披露しようと、「カア」と啼いた。
The Fox quickly picked it up, and thus addressed the Crow:	カラスの口から肉は落ち、キツネが、さっと拾い上げた。
"My good Crow,	「おお、カラスさんや。
your voice is right enough,	声の美しさは申し分ありません。
but your wit is wanting."	でも、おつむが少し足りないかもしれませんね」
The Two Dogs	９６．二匹のイヌ
A MAN had two dogs:	ある人が、イヌを二匹飼っていた。
a Hound, trained to assist him in his sports, and a Housedog, taught to watch the house.	一匹は猟犬として訓練し、一匹は家の番をするように仕込んだ。
When he returned home after a good day's sport, he always gave the Housedog a large share of his spoil.	男は猟を終えて家に帰ってくると、いつも番犬の方に獲物をたくさん与えた。
The Hound, feeling much aggrieved at this, reproached his companion, saying,	猟犬は、憤懣やるかたなく、番犬を咎めだてた。
"It is very hard to have all this labor, while you, who do not assist in the chase, luxuriate on the fruits of my exertions."	「お前は、猟の手伝いもしないくせに、俺の獲物を貪り食う」
The Housedog replied,	すると、番犬はこう答えた。
"Do not blame me, my friend,	「私を非難するのはお門違いですよ。
but find fault with the master,	文句を言うならご主人様に言って下さいな。
who has not taught me to labor, but to depend for subsistence on the labor of others."	だって、ご主人様は、私に働くことを教えずに、他人のあがりで暮らすように躾たのですからね」
Children are not to be blamed for the faults of their parents.	親の躾が悪かった場合、子供に責任はない。
The Stag in the Ox-Stall	９７．ウシ小屋にいる牡ジカ
A STAG, roundly chased by the hounds and blinded by fear to the danger he was running into, took shelter in a farmyard and hid himself in a shed among the oxen.	猟犬に追い回された、牡ジカが、そこが危険なところであるということも知らずに、農場へと逃げ込んで、ウシ小屋に隠れた。
An Ox gave him this kindly warning:	すると牡ウシが言った。
"O unhappy creature! why should you thus, of your own accord, incur destruction and trust yourself in the house of your enemy?'	「敵の家に身を隠すとは、君も不運だな！」
The Stag replied:	すると、牡ジカが言った。
"Only allow me, friend,	「そう責めないで下さい。
to stay where I am, and I will undertake to find some favorable opportunity of effecting my escape."	ここにとどまっていれば、逃げるチャンスがきっとありますよ」
At the approach of the evening the herdsman came to feed his cattle,	夕闇が迫り、牧者がウシに餌をやりに来た。
but did not see the Stag;	しかし、牡ジカは見つからなかった。
and even the farm-bailiff with several laborers passed through the shed	さらに、農場の支配人が、数人の従者を従えてやって来た。
and failed to notice him.	しかし今回も、牡ジカは気付かれなかった。
The Stag, congratulating himself on his safety, began to express his sincere thanks to the Oxen who had kindly helped him in the hour of need.	シカは、無事にすんだことを喜んで……困っている折りに、親切にかばってくれた、牡ウシたちに心からのお礼を述べた。
One of them again answered him:	すると、一匹の牡ウシがこういった。
"We indeed wish you well,	「我々は、君の無事を心から願っているよ。
but the danger is not over.	でも、まだ危険が去ったわけではない。
There is one other yet to pass through the shed,	この小屋を抜け出すには、大きな難関が、まだ一つ残っている。
who has it were a hundred eyes, and until he has come and gone, your life is still in peril."	そいつは、百個の目を持っているような奴なんだよ」
At that moment the master himself entered,	と、その時、農場主自らが入って来た。
and having had to complain that his oxen had not been properly fed, he went up to their racks and cried out:	そして、まぐさ棚へ歩み寄ると、ウシたちの餌が不十分だと怒鳴り散らした。
"Why is there such a scarcity of fodder?	「なぜ、かい葉がこんなに少ないんだ？
There is not half enough straw for them to lie on. Those lazy fellows have not even swept the cobwebs away."	クモの巣はとらない、かい葉は足りない、お前たちは一体何をしているんだ！」
While he thus examined everything in turn,	農場主は、こうして、詳細に調べていった。
he spied the tips of the antlers of the Stag peeping out of the straw.	そして、干し草の中から牡ジカの角がのぞいているのを、
