Aesop's Fables	タウンゼント版イソップ寓話集
The Wolf and the Lamb	１．オオカミと仔ヒツジ
WOLF, meeting with a Lamb astray from the fold,	ある日のこと、オオカミは、群とはぐれて迷子になった仔ヒツジと出会った。
resolved not to lay violent hands on him,	オオカミは、仔ヒツジを食ってやろうと思ったが、牙を剥いて襲いかかるばかりが能じゃない。
but to find some plea to justify to the Lamb the Wolf's right to eat him.	何か上手い理由をでっち上げて手に入れてやろうと考えた。
He thus addressed him:	そこで、オオカミはこんなことを言った。
"Sirrah, last year you grossly insulted me."	「昨年お前は、俺様にひどい悪口を言ったな！」
"Indeed,"	仔ヒツジは、声を震わせて答えた。
bleated the Lamb in a mournful tone of voice,	「誓って真実を申しますが、私はその頃、まだ生まれていませんでした。」
Then said the Wolf,	するとオオカミが言った。
"You feed in my pasture."	「お前は、俺様の牧草を食べただろう！」
"No, good sir," replied the Lamb, "I have not yet tasted grass."	「いえいえ、私はまだ、草を食べたことがありません。」
Again said the Wolf,	するとまたしてもオオカミが言った。
"You drink of my well."	「お前は、俺様の井戸の水を飲んだな！」
"No,"	仔ヒツジは悲鳴を上げて答えた。
exclaimed the Lamb,	「いえ。
"I never yet drank water,	まだ、水も飲んだことがありません。
for as yet my mother's milk is both food and drink to me."	……だって、お母さんのお乳以外は、まだ何も口にしたことがないのですから……」
Upon which the Wolf seized him and ate him up, saying,	「ええい！
"Well!	もうたくさんだ！
I won't remain supperless, even though you refute every one of my imputations."	お前がなんと言おうとも、俺様が、夜飯を抜いたままでいるとでも思っているのか？」
The tyrant will always find a pretext for his tyranny.	オオカミはそう言うと、仔ヒツジに襲いかかった。
The Bat and the Weasels	２．コウモリと二匹のイタチ
A BAT who fell upon the ground and was caught by a Weasel pleaded to be spared his life.	コウモリが、地面に落っこちてイタチに捕まった。
The Weasel refused, saying that he was by nature the enemy of all birds.	しかしこのイタチは生まれてこの方ずうっと、鳥と戦ってきたと言うのだ。
The Bat assured him that he was not a bird, but a mouse,	そこでコウモリは、自分は鳥ではない……ネズミだと言い張った。
and thus was set free.	それを聞いてイタチは、コウモリを逃がしてやった。
Shortly afterwards the Bat again fell to the ground and was caught by another Weasel,	それからまもなく、コウモリは、また、地面に落っこち、そしてまたしても、イタチに捕まってしまった。
whom he likewise entreated not to eat him.	コウモリは今度も……命ばかりはお助けを……と懇願した。
The Weasel said that he had a special hostility to mice.	しかし今度のイタチは、ネズミを大変憎んでいると言う……。
The Bat assured him that he was not a mouse, but a bat,	そこでコウモリは、自分はネズミではなくコウモリだと言った。
and thus a second time escaped.	こうして、コウモリは、二度までも窮地を脱した。
It is wise to turn circumstances to good account.	賢い人は、その場その場でうまく立ち回る。
The Ass and the Grasshopper	３．ロバとキリギリス
AN ASS having heard some Grasshoppers chirping, was highly enchanted; and, desiring to possess the same charms of melody,	ロバは、キリギリスの歌声を聞いて魅了され、自分もあんな風に美しい声で歌ってみたいものだと考えた。
demanded what sort of food they lived on to give them such beautiful voices.	そこでロバは、キリギリスたちに、どんなものを食べるとそんなに素敵な声が出るのかと尋ねてみた。
They replied,	キリギリスたちは答えた。
"The dew."	「水滴だよ」
The Ass resolved that he would live only upon dew,	それで、ロバは、水しか摂らないことに決めた。
and in a short time died of hunger.	ロバは、空腹ですぐに死んでしまった。
The Lion and the Mouse	４．ライオンとネズミ
A LION was awakened from sleep by a Mouse running over his face.	ライオンが気持ちよく寝ていると、何者かに眠りを妨げられた。
Rising up angrily, he caught him and was about to kill him,	ライオンは、いきりたってネズミを捕まえると殺そうとした。
when the Mouse piteously entreated, saying:	ネズミは、必死に哀願した。
"If you would only spare my life, I would be sure to repay your kindness."	「命を助けて下されば、必ず恩返しを致します。」
The Lion laughed and let him go.	ライオンは、鼻で笑ってネズミを逃がしてやった。
It happened shortly after this that the Lion was caught by some hunters, who bound him by st ropes to the ground.	それから数日後、ライオンは、猟師の仕掛けた網にかかって動けなくなってしまった。
The Mouse, recognizing his roar, came gnawed the rope with his teeth, and set him free, exclaim	ネズミは、ライオンのうなり声を聞きつけると、飛んで行き、歯でロープを、ガリガリとかじり、ライオンを逃がしてやった。
"You ridiculed the idea of my ever being able to help you, expecting to receive from me any repayment of your favor;	「この前、あなたは私を嘲笑しましたが、
I now you know that it is possible for even a Mouse to con benefits on a Lion."	私にだって、あなたを、助けることができるのですよ。
The Charcoal-Burner and the Fuller	５．炭屋と洗濯屋
A CHARCOAL-BURNER carried on his trade in his own house.	あるところに、働き者の炭屋が住んでいた。
One day he met a friend, a Fuller,	ある日のこと、炭屋は友人の洗濯屋にばったり出合った。
and entreated him to come and live with him,	そして洗濯屋に、自分の所へ来て、一緒に住まないか……？
saying that they should be far better neighbors and that their housekeeping expenses would be lessened.	そうすれば、家計は助かるし、一生楽しく暮らせるからと熱心に誘った。
The Fuller replied,	すると、洗濯屋はこう答えた。
"The arrangement is impossible as far as I am concerned,	「私は、あなたと住むことなどできません。
for whatever I should whiten, you would immediately blacken again with your charcoal."	だって、私が洗濯して、白くしたそばから、あなたは、黒くしてしまうでしょうからね……」
Like will draw like.	水と油は混ざらない。
The Father and His Sons	６．父親とその息子たち
A FATHER had a family of sons who were perpetually quarreling among themselves.	その男には、息子が大勢いたのだが、兄弟喧嘩が絶えず、いつもいがみ合ってばかりいて、
When he failed to heal their disputes by his exhortations,	父親が止めても、喧嘩をやめないというありさまだった。
he determined to give them a practical illustration of the evils of disunion;	この期に及んで、父親は、内輪もめが如何に愚かなことであるかを、教え諭さなければならぬと痛感した。
and for this purpose he one day told them to bring him a bundle of sticks.	頃合いを見計らって、男は息子たちに、薪の束を持ってくるようにと言いつけた。
When they had done so, he placed the faggot into the hands of each of them in succession, and ordered them to break it in pieces.	息子たちが薪の束を持って来ると、男は、一人一人にその束を手渡し、そして、それを折るようにと命じた。
They tried with all their strength, and were not able to do it.	息子たちは、懸命に力を振り絞ってみたが、薪の束はびくともしなかった。
He next opened the faggot, took the sticks separately, one by one, and again put them into his sons' hands,	そこで、男は、束をほどくと、今度は、一本一本バラバラにして、息子たちに手渡した。
upon which they broke them easily.	すると息子たちは、たやすく薪を折った。
He then addressed them in these words:	そこで、彼は息子たちに、こんなことを語って聞かせた。
"My sons,	「よいか、息子たちよ。
if you are of one mind, and unite to assist each other, you will be as this faggot, uninjured by all the attempts of your enemies;	もしお前たちが、心一つに団結し、互いに助け合うならば、この薪の束のように、どんな敵にもびくともしない。
but if you are divided among yourselves, you will be broken as easily as these sticks."	しかし、互いがバラバラだったなら、この棒きれのように、簡単にへし折られてしまうのだ。」
The Boy Hunting Locusts	７．イナゴを捕まえる少年
A BOY was hunting for locusts.	ある少年がイナゴを捕まえていた。
He had caught a goodly number, when he saw a Scorpion, and mistaking him for a locust, reached out his hand to take him.	そしてかなりの数が集まったのだが、少年は、イナゴと間違えてサソリに手を伸ばそうとした。
The Scorpion, showing his sting, said:	するとサソリは、鋭い毒針を振り立てて少年に言った。
If you had but touched me, my friend, you would have lost me, and all your locusts too!"	「さあ、捕まえてごらん。
The Cock and the Jewel	８．オンドリと宝石
A COCK, scratching for food for himself and his hens, found a precious stone	オンドリが餌を探していて、宝石を見つけた。
and exclaimed:	すると、オンドリはこう叫んだ。
but I have found thee for no purpose.	「なんと詰まらぬものを見つけたことか！
I would rather have one barleycorn than all the jewels in the world."	俺にとっちゃ、世界中の宝石よりも、麦一粒の方がよっぽど価値がある。」
The Kingdom of the Lion	９．ライオンの御代
THE BEASTS of the field and forest had a Lion as their king.	野や森の動物たちは、王様にライオンを戴いていた。
He was neither wrathful, cruel, nor tyrannical,	ライオンは残酷なことを嫌い、力で支配することもなかった。
but just and gentle as a king could be.	つまり、人間の王様のように、公正で心優しかったのだ。
During his reign he made a royal proclamation for a general assembly of all the birds and beasts, and drew up conditions for a universal league,	彼の御代に、鳥や獣たちの会議が開かれた。
in which the Wolf and the Lamb, the Panther and the Kid, the Tiger and the Stag, the Dog and the Hare, should live together in perfect peace and amity.	「共同体の決まりとして、……オオカミと仔ヒツジ、ヒョウと仔ヤギ、トラとニワトリ、イヌとウサギは、争わず、親睦をもって、共に暮らすこと……」
The Hare said,	ウサギが言った。
"Oh, how I have longed to see this day, in which the weak shall take their place with impunity by the side of the strong."	「弱者と強者が共に暮らせるこんな日を、私はどんなに待ちこがれたことか……」
And after the Hare said this, he ran for his life.	ウサギはそう言うと死にものぐるいで逃げていった。
The Wolf and the Crane	１０．オオカミとサギ
A WOLF who had a bone stuck in his throat hired a Crane,	喉に骨が刺さったオオカミが、多大な報酬を約束してサギを雇った。
for a large sum, to put her head into his mouth and draw out the bone.	というのも、口の中へ頭を突っ込んでもらって、彼女に骨を抜いて貰おうと考えたからだった。
When the Crane had extracted the bone and demanded the promised payment, the Wolf, grinning and grinding his teeth, exclaimed:	サギが、骨を抜き出し、約束の金を要求するとオオカミは、牙を光らせて叫んだ。
"Why,	「何を言ってやがる！
you have surely already had a sufficient recompense,	お前は、もう俺様から、十分すぎる報酬を受け取ったはずだぞ。
in having been permitted to draw out your head in safety from the mouth and jaws of a wolf."	俺様の口から無事に出られたのだからな！」
In serving the wicked, expect no reward,	悪者へ施す時には、報酬など期待してはならぬ。
and be thankful if you escape injury for your pains.	もしなんの危害も受けずにすんだなら、それでよしとすべきである。
The Fisherman Piping	１１．笛を吹く漁師
A FISHERMAN skilled in music took his flute and his nets to the seashore.	笛の上手な漁師が、笛と網を持って海へ出掛けた。
Standing on a projecting rock, he played several tunes	彼は、突き出た岩に立ち、数曲、笛を奏でた。
in the hope that the fish, attracted by his melody, would of their own accord dance into his net, which he had placed below.	と言うのも、魚たちが笛の音に引き寄せられて、足下の網に、自ら踊り入るのではないかと考えたからだった。
At last, having long waited in vain,	結局、長いこと待ったが無駄であった。
he laid aside his flute, and casting his net into the sea,	そこで、男は笛を置き、網を投じた。
made an excellent haul of fish.	すると、一網でたくさんの魚が捕れた。
When he saw them leaping about in the net upon the rock he said:	男は、網の中で跳ね回る魚たちを見て言った。
"O you most perverse creatures,	「なんとお前たちは、ひねくれ者なんだ！
when I piped you would not dance, but now that I have ceased you do so merrily."	俺が笛を吹いていた時には踊らなかったくせに、吹くのをやめた今、こんなに陽気に踊りやがる。」
Hercules and the Wagoner	１２．ヘラクレスとウシ追い
A CARTER was driving a wagon along a country lane,	あるウシ追いが、ウシに車をひかせて、田舎道を進んで行った。
when the wheels sank down deep into a rut.	すると、車輪が溝に深くはまり込んでしまった。
The rustic driver, stupefied and aghast, stood looking at the wagon, and did nothing	頭の弱いウシ追いは、牛車の脇に立ち、ただ呆然と見ているだけで、何もしようとはしなかった。
but utter loud cries	そして、突然大声でお祈りを始めた。
to Hercules to come and help him.	「ヘラクレス様、どうか、ここに来てお助け下さい」
Hercules, it is said, appeared and thus addressed him:	すると、ヘラクレスが現れて、次ぎのように語ったそうだ。
"Put your shoulders to the wheels, my man.	「お前の肩で、車輪を支え、
Goad on your bullocks,	ウシたちを追い立てなさい。
and never more pray to me for help, until you have done your best to help yourself,	それからこれが肝心なのだが、自分で何もしないで、助けを求めてはならない。
or depend upon it you will henceforth pray in vain."	今後そのような祈りは一切無駄であることを肝に銘じなさい」
Self-help is the best help.	自助の努力こそが、最大の助け
The Ants and the Grasshopper	１３．アリとキリギリス
THE ANTS were spending a fine winter's day drying grain collected in the summertime.	ある晴れた冬の日、アリたちは、夏の間に集めておいた、穀物を干すのに大わらわだった。
A Grasshopper, perishing with famine, passed by and earnestly begged for a little food.	そこへ腹をすかせて、死にそうになったキリギリスが通りかかり、ほんの少しでよいから食べ物を分けてくれるようにと懇願した。
The Ants inquired of him,	アリたちは、彼に尋ねた。
"Why did you not treasure up food during the summer?'	「なぜ、夏の間に食べ物を貯えておかなかったのですか？」
He replied,	キリギリスは、答えた。
"I had not leisure enough.	「暇がなかったんだよ。
I passed the days in singing."	日々歌っていたからね」
They then said in derision:	するとアリたちは、嘲笑って言った。
"If you were foolish enough to sing all the summer, you must dance supperless to bed in the winter."	「夏の間、歌って過ごしたお馬鹿さんなら、冬には、夕食抜きで踊っていなさい」
The Traveler and His Dog	１４．旅行者と彼のイヌ
A TRAVELER about to set out on a journey saw his Dog stand at the door stretching himself.	男が、旅に出かけようとすると、彼のイヌがドアのところで、伸びをしていた。
He asked him sharply:	「なぜ、伸びなどしているんだ？
"Why do you stand there gaping?	用意万端、直ぐに出かけられるのか？」
Everything is ready but you, so come with me instantly."	男は、イヌをピシャリと叱った。
The Dog, wagging his tail, replied:	すると、イヌは、しっぽを振りながら答えた。
"O, master!	「ご主人様、
I am quite ready;	わたしゃ、支度は済んでます。
it is you for whom I am waiting."	待っていたのはわたしの方です」
The loiterer often blames delay on his more active friend.	自分のせいで遅くなったくせに、難癖をつけて相手のせいにする者がいる。
The Dog and the Shadow	１５．イヌと影
A DOG, crossing a bridge over a stream with a piece of flesh in his mouth,	イヌが肉をくわえて、橋を渡っていた。
saw his own shadow in the water and took it for that of another Dog, with a piece of meat double his own in size.	すると、水面に写る自分の影を見て、どこかのイヌがもの凄く大きな肉をくわえているのだと思った。
He immediately let go of his own, and fiercely attacked the other Dog to get his larger piece from him.	彼は、自分の肉を放り出すと、大きな肉を目指して、烈火の如く躍り掛かった。
He thus lost both:	こうして、彼はどちらの肉も失った。
that which he grasped at in the water, because it was a shadow;	彼が、水の中で奪おうとした肉は影であったし、
and his own, because the stream swept it away.	自分の肉は、流が運び去ってしまったからだ。
The Mole and His Mother	１６．モグラと彼の母親
A MOLE, a creature blind from birth, once said to his Mother:	モグラは、生まれながらに目が見えないのだが、そんな彼が、ある日母親に言った。
"I am sure than I can see, Mother!"	「僕は、ちゃんと目が見えます！」
In the desire to prove to him his mistake, his Mother placed before him a few grains of frankincense, and asked,	母親は、息子の間違いをきちんと正さなければと考え、彼の前に、一片の乳香を置き、そして尋ねた。
"What is it?'	「これは何だと思う？」
"It is a pebble."	「これは、水晶です」
His Mother exclaimed:	すると母親は、大声で言った。
"My son,	「なんてことだい！
I am afraid that you are not only blind, but that you have lost your sense of smell.	お前は、目が見えないだけでなく、鼻まで利かなくなってしまったんだね」
The Herdsman and the Lost Bull	１７．ウシ飼と盗まれたウシ
A HERDSMAN tending his flock in a forest lost a Bull-calf from the fold.	あるウシ飼が、森でウシたちの世話をしていたのだが、一匹の雄の仔ウシが囲いからいなくなってしまった。
After a long and fruitless search,	ウシ飼は、あちこち仔ウシを探し回ったが、徒労に終わった。
he made a vow that, if he could only discover the thief who had stolen the Calf, he would offer a lamb in sacrifice to Hermes, Pan, and the Guardian Deities of the forest.	そこで、ウシ飼は、ヘルメスやパーンなど森の神々に、もし、ウシ泥棒を見つけることができたならば、生贄に仔ヒツジを捧げると誓った。
Not long afterwards, as he ascended a small hillock, he saw at its foot a Lion feeding on the Calf.	それからすぐに、ウシ飼が小高い丘に登ると、丘の麓で、ライオンが仔ウシを食べているのを発見した。
Terrified at the sight, he lifted his eyes and his hands to heaven, and said:	その恐ろしい光景に、ウシ飼は、天を仰ぎ、両手をさしのべてこう言った。
"Just now I vowed to offer a lamb to the Guardian Deities of the forest if I could only find out who had robbed me; but now that I have discovered the thief, I would willingly add a full-grown Bull to the Calf I have lost, if I may only secure my own escape from him in safety."	「おお、森の神々よ！
The Hare and the Tortoise	１８．ウサギとカメ
A HARE one day ridiculed the short feet and slow pace of the Tortoise,	ある日のこと、ウサギがカメを、足が短くてのろまだと嘲笑った。
who replied, laughing:	するとカメは笑みを浮かべてこう答えた。
"Though you be swift as the wind,	「確かに、あなたは、風のように速いかもしれない。
I will beat you in a race."	でも、あなたをうち負かしてみせます。」
The Hare, believing her assertion to be simply impossible, assented to the proposal;	ウサギはそんなことは、無理に決まっていると思い、カメの挑戦を受けることにした。
and they agreed that the Fox should choose the course and fix the goal.	キツネがコースとゴールの位置を決めることになり、両者はそれに同意した。
On the day appointed for the race	競争の日が来た。
the two started together.	二人は同時にスタートした。
The Tortoise never for a moment stopped, but went on with a slow but steady pace straight to the end of the course.	カメは、遅かったが、一瞬たりとも止まらずに一歩一歩着実にゴールへと向かった。
The Hare, lying down by the wayside, fell fast asleep.	ウサギは、道端でごろりと横になると、眠りこんだ。
At last waking up, and moving as fast as he could, he saw the Tortoise had reached the goal, and was comfortably dozing after her fatigue.	しまった！と思って、目を覚ましたウサギは、あらん限りのスピードで走ったが、カメはすでに、ゴールインして、気持ちよさそうに寝息を立てていた。
Slow but steady wins the race.	ゆっくりでも、着実な者が勝つ。
The Pomegranate, Apple-Tree, and Bramble	１９．ザクロとリンゴとイバラ
THE POMEGRANATE and Apple-Tree disputed as to which was the most beautiful.	ザクロの木とリンゴの木が、どちらが美しいかということで言い争っていた。
When their strife was at its height, a Bramble from the neighboring hedge lifted up its voice, and said in a boastful tone:	両者の議論が最高潮に達した時、近くの垣根から、イバラがしゃしゃり出た。
"Pray, my dear friends,	「ねえ、お友達のザクロさんにリンゴさん。
in my presence at least cease from such vain disputings."	せめて、私のいる前では、そんな無益な議論はおやめ遊ばせ。」
The Farmer and the Stork	２０．農夫とコウノトリ
A FARMER placed nets on his newly-sown plowlands and caught a number of Cranes, which came to pick up his seed.	ある農夫が、種蒔きを終えたばかりの畑に網を仕掛け、種を食べに来たツルの群を一網打尽にした。
With them he trapped a Stork that had fractured his leg in the net	するとツルの群と一緒に、コウノトリが一匹捕らえられていた。
and was earnestly beseeching the Farmer to spare his life.	網に足が絡まり傷ついたコウノトリは、農夫に泣きついた。
"Pray save me, Master," he said, "and let me go free this once. My broken limb should excite your pity.	「私は骨を折っているのです、どうか私を哀れんで今回は見逃して下さい。
Besides, I am no Crane, I am a Stork, a bird of excellent character;	それに、私は下世話なツルではなく、コウノトリなのです。
and see how I love and slave for my father and mother.	私が、父や母をどんなに慈しみお世話するか、あなたもご存じでしょう？
Look too, at my feathers	私の羽を見て下さい。
--they are not the least like those of a Crane."	ツルの羽とは違うでしょう」
The Farmer laughed aloud and said,	すると農夫は、大きな声で笑った。
"It may be all as you say,	「言いたいことは全部言ったか？
I only know this:	では、俺の番だ。
I have taken you with these robbers, the Cranes,	お前は、あの盗人どもと一緒に捕まった。
and you must die in their company."	よってお前は奴らと一緒に死なねばならぬ。」
Birds of a feather flock together.	同じ穴の狢
The Farmer and the Snake	２１．農夫とヘビ
ONE WINTER a Farmer found a Snake stiff and frozen with cold.	ある冬の日のこと、農夫は、寒さに凍えて今にも死にそうになったヘビを見つけた。
