The Fox accumulated all that they had killed into one large heap and left to himself the smallest possible morsel.	キツネは、自分にほんの一口分だけ残し、その他は全てライオンに差し出した。
The Lion said,	するとライオンがこう言った。
"Who has taught you, my very excellent fellow, the art of division?	「おお、素晴らしき我が友よ。
You are perfect to a fraction."	君の分け方は申し分がない！」
He replied,	すると狐はこう応えた。
"I learned it from the Ass, by witnessing his fate."	「このような分け方を教えてくれたのは、ロバさんの運命ですよ」
Happy is the man who learns from the misfortunes of others.	他人の不幸から学ぶ者は幸いです。
The Bull, the Lioness, and the Wild-Boar Hunter	１６１．牡ウシと雌のライオンとイノシシ狩りをする猟師
A BULL finding a lion's cub asleep gored him to death with his horns.	牡ウシが、眠っているライオンの仔を見つけて、角で突いて殺した。
The Lioness came up, and bitterly lamented the death of her whelp.	戻ってきた母親は、子供の痛ましい亡骸を見て、嘆き悲しんだ。
A wild-boar Hunter, seeing her distress, stood at a distance and said to her,	すると、イノシシ狩りに来ていた猟師がそれを見て、少し離れた所からこう言った。
"Think	「考えてみなさいな。
how many men there are who have reason to lament the loss of their children,	どれほどの人々が、子供を失って悲しんだことか。
whose deaths have been caused by you."	皆、あなたに殺されたんだよ」
The Oak and the Woodcutters	１６２．カシの木と樵
THE WOODCUTTER cut down a Mountain Oak and split it in pieces,	樵は、カシの木を切り倒すと、その枝で楔を作った。
making wedges of its own branches for dividing the trunk.	そして、幹に楔をあてがってカシの木を易々と解体した。
The Oak said with a sigh,	するとカシの木は、ため息混じりにこう言った。
"I do not care about the blows of the axe aimed at my roots,	「斧が、根本へ打ち下ろされるのは、我慢できる。
but I do grieve at being torn in pieces by these wedges made from my own branches."	しかし、自身の枝から作られた楔で引き裂かれるのには泣けてくる」
Misfortunes springing from ourselves are the hardest to bear.	身から出た不幸は、耐え難い。
The Hen and the Golden Eggs	１６３．メンドリと金の卵
A COTTAGER and his wife had a Hen that laid a golden egg every day.	ある農家の夫婦が、金の卵を産むニワトリを持っていた。
They supposed that the Hen must contain a great lump of gold in its inside, and in order to get the gold they killed it.	二人は、ニワトリの腹の中には、大きな金塊があるに違いないと思い腹を裂いてみた。
Having done so, they found to their surprise that the Hen differed in no respect from their other hens.	しかし、腹の中には金塊などなかった。
The foolish pair, thus hoping to become rich all at once, deprived themselves of the gain of which they were assured day by day.	こうして、いっぺんに、金持ちになろうと望んだ夫婦は、毎日保証された利益をふいにしてしまった。
The Ass and the Frogs	１６４．ロバとカエルたち
AN ASS, carrying a load of wood, passed through a pond.	木材を運んでいたロバが、水たまりを渡っていると、足を取られて転んだ。
As he was crossing through the water he lost his footing, stumbled and fell, and not being able to rise on account of his load, groaned heavily.	そして重荷のせいで起きあがることが出来ずに、烈しく嘶いた。
Some Frogs frequenting the pool heard his lamentation, and said,	すると、水たまりに集まっていたカエルたちが、ロバの悲鳴を聞いてこう言った。
"What would you do if you had to live here always as we do, when you make such a fuss about a mere fall into the water?"	「水に倒れたくらいでそんな大騒ぎして、もし、あんたが、我々のように毎日ここに住まなければならなかったら、どんな騒ぎをするんだろうね」
Men often bear little grievances with less courage	人が不幸に堪えられるのは、勇気があるからではない。
than they do large misfortunes.	大きな不幸を省みて小さな不幸に安堵しているだけなのだ。
The Crow and the Raven	１６５．小カラスと渡りカラス
A CROW was jealous of the Raven,	ある小カラスが、渡りカラスを羨んだ。
because he was considered a bird of good omen and always attracted the attention of men, who noted by his flight the good or evil course of future events.	というのも、渡りカラスは、瑞鳥と目されており、人々は、渡りカラスを見て、吉凶を占うからだった。
Seeing some travelers approaching, the Crow flew up into a tree, and perching herself on one of the branches, cawed as loudly as she could.	数人の旅人が近づいてくるのを見た小カラスは、木に飛んで行き、枝にとまると、あらん限りの声で、カァーと鳴いた。
The travelers turned towards the sound and wondered what it foreboded,	旅人たちは、何かの予兆かと耳をそばだてた。
when one of them said to his companion,	その時、仲間の一人がこう言った。
"Let us proceed on our journey, my friend,	「さあ、旅を続けよう。
for it is only the caw of a crow,	あれは、小カラスの鳴き声だ。
and her cry, you know, is no omen."	君たちも知っているだろう、あれには、予兆などない」
Those who assume a character which does not belong to them, only make themselves ridiculous.	自分に備わってもいない物を、あたかもあるように装うのは、滑稽なだけだ。
The Trees and the Axe	１６６．木々と斧
A MAN came into a forest and asked the Trees to provide him a handle for his axe.	ある人が森に入って、木々に、斧の柄をくれないかと頼んだ。
The Trees consented to his request and gave him a young ash-tree.	木々たちは、彼の願いを承知して、若いトリネコの木を与えた。
No sooner had the man fitted a new handle to his axe from it, than he began to use it and quickly felled with his strokes the noblest giants of the forest.	男は新しい柄を斧に取り付けるが早いか、高い立派な木々に斧を打ち下ろしていった。
An old oak, lamenting when too late the destruction of his companions, said to a neighboring cedar,	もう後の祭りであったが、古いカシの木は、仲間の木々が切り倒されるのを嘆き悲しんで、隣のスギにこう言った。
"The first step has lost us all.	「我々は、最初のボタンの掛け違いで、全てを失ってしまった。
If we had not given up the rights of the ash, we might yet have retained our own privileges and have stood for ages."	もし、トリネコを手放してなかったら、我々は未だ安泰であったろうし、末永く立っていられたろうに……」
The Crab and the Fox	１６７．カニとキツネ
A CRAB, forsaking the seashore, chose a neighboring green meadow as its feeding ground.	ある蟹が、浜辺を見捨て、近くの緑の草原を餌場に選んだ。
A Fox came across him, and being very hungry ate him up.	そこへ腹ぺこのキツネがやって来て、カニを平らげた。
Just as he was on the point of being eaten, the Crab said,	カニは、食われようとするその時にこう言った。
"I well deserve my fate,	「ああ、こうなったのも当然だ。
for what business had I on the land,	一体私は、陸で何をするつもりだったのだ？
when by my nature and habits I am only adapted for the sea?'	私の本性は、海だけにしか適していないものを……」
Contentment with our lot is an element of happiness.	自分の持っているもので満足できるということは、幸福なことである。
The Woman and Her Hen	１６８．女将とメンドリ
A WOMAN possessed a Hen that gave her an egg every day.	ある女将が、毎日卵を一つ産むメンドリを持っていた。
She often pondered how she might obtain two eggs daily instead of one, and at last, to gain her purpose,	彼女は、一度に二つの卵を手に入れるにはどうすればよいかと、あれこれ考えた。
determined to give the Hen a double allowance of barley.	そして、メンドリに二倍の大麦を与えることにした。
From that day the Hen became fat and sleek,	それ以来、メンドリは太り、羽毛もつやつやした。
and never once laid another egg.	しかし、メンドリは一度に二つの卵を産むことはなかった。
The Ass and the Old Shepherd	１６９．ロバと年老いたヒツジ飼
A SHEPHERD, watching his Ass feeding in a meadow, was alarmed all of a sudden by the cries of the enemy.	ヒツジ飼は、草原でロバの番をしていたのだが、突然の敵の叫び声に慄然とした。
He appealed to the Ass to fly with him, lest they should both be captured,	ヒツジ飼は、捕まるといけないので、一緒に逃げようとロバに言った。
but the animal lazily replied,	しかし、ロバはめんどくさそうにこう答えた。
"Why should I, pray?	「なぜ私が逃げなければならないのです？
Do you think it likely the conqueror will place on me two sets of panniers?'	敵が私を捕まえたら、倍の荷を担がせるのですか？」
"No,"	「いや、そんなことはないとおもうが……」
"Then,"	「それじゃあ、誰に仕えようが構いませんよ。
said the Ass,	荷物を運ぶのには代わりがないのですからね」
In a change of government the poor change nothing beyond the name of their master.	貧しい者は、政府が転覆しても、仕える主人が変わるだけで、他は、何も変わらない。
The Kites and the Swans	１７０．トンビとハクチョウ
TEE KITES of olden times, as well as the Swans, had the privilege of song.	昔、トンビたちは、ハクチョウと同じように、歌の才能に恵まれていた。
But having heard the neigh of the horse, they were so enchanted with the sound, that they tried to imitate it;	しかし、ウマのいななきを聞いて、すっかりその声に魅了されてしまい、その声を真似ようとした。
and, in trying to neigh, they forgot how to sing.	そして、ウマの真似ばかりしていたものだから、自分たちの歌を忘れてしまった。
The desire for imaginary benefits often involves the loss of present blessings.	何かを望むあまり、今持っている天恵をも失うことがある。
The Wolves and the Sheepdogs	１７１．オオカミどもと牧羊犬たち
THE WOLVES thus addressed the Sheepdogs:	オオカミたちが、牧羊犬たちにこんな風に話しかけた。
"Why should you, who are like us in so many things, not be entirely of one mind with us,	「君たちは、我々とそっくりなのに、どうして、気心を通わそうとしないのだ？
and live with us as brothers should?	兄弟のように仲良く暮らすべきじゃないのかね？
We differ from you in one point only.	君たちと我々の違いは一つだけだ。
We live in freedom, but you bow down to and slave for men,	我々は自由に生き、君たちは、人間にへりくだって仕えている。
who in return for your services flog you with whips and put collars on your necks.	その見返りはと言えば、鞭で打たれて、首輪をはめられるという始末。
They make you also guard their sheep, and while they eat the mutton throw only the bones to you.	それに、人間たちは、君たちにヒツジの番をさせているくせに、自分たちはヒツジの肉を食べ、君たちには骨を投げてやるのが関の山。
If you will be persuaded by us, you will give us the sheep,	どうだね我々の話に嘘はないだろう？
and we  will enjoy them in common, till we all are surfeited."	そして、一緒に、げっぷが出るまで、食い尽くそうじゃないか」
The Dogs listened favorably to these proposals, and, entering the den of the Wolves,	イヌたちは、オオカミどもの話に涎を垂らすと、オオカミの棲む洞穴へと入って行った。
they were set upon and torn to pieces.	そして、ばらばらに引き裂かれた。
The Hares and the Foxes	１７２．野ウサギとキツネたち
THE HARES waged war with the Eagles,	野ウサギとワシが戦争をした。
and called upon the Foxes to help them.	そして、野ウサギたちは、キツネに援軍を求めた。
They replied,	すると、キツネたちはこう応えた。
"We would willingly have helped you, if we had not known who you were, and with whom you were fighting."	「君たちが何者で、誰と闘っているのか知らなければ、喜んで助けに行くけどね……」
Count the cost before you commit yourselves.	態度を明らかにする前に、あらゆる事情を思量せよ。
The Bowman and Lion	１７３．射手とライオン
A VERY SKILLFUL BOWMAN went to the mountains in search of game,	弓の名人が、獲物を求めて山へと入って行った。
but all the beasts of the forest fled at his approach.	森の動物たちは、彼が近づくと皆、逃げてしまうのだが、
The Lion alone challenged him to combat.	ただ、ライオンだけが、男に戦いを挑んだ。
The Bowman immediately shot out an arrow and said to the Lion:	男は、すぐさま、一本の矢を打ち込むと、ライオンに言った。
"I send thee my messenger, that from him thou mayest learn what I myself shall be	「さあ、我が使者を送ったぞ、汝は、その使者から学んだことであろう。
when I assail thee."	我自身が、汝を責めたらどうなるかをな……」
The wounded Lion rushed away in great fear,	傷ついたライオンは、恐怖に駆られて、急いで逃げた。
and when a Fox who had seen it all happen told him to be of good courage and not to back off at the first attack	と、その時、事の次第をつぶさに見ていたキツネが･･････あなたはとびきりの勇者なのですから、一度の攻撃ぐらいで、逃げたりしないで下さい。
he replied:	するとライオンはこう答えた。
"You counsel me in vain;	「お前の助言など聞く耳持たぬ。
for if he sends so fearful a messenger,	あ奴はあんなに恐ろしい使者を送ってよこしたのだ。
how shall I abide the attack of the man himself?'	あ奴自身の攻撃など、堪えようがあろうか？」
Be on guard against men who can strike from a distance.	離れた所から攻撃する術を心得た敵には、用心せよ。
The Camel	１７４．ラクダ
WHEN MAN first saw the Camel, he was so frightened at his vast size that he ran away.	人が初めてラクダを見た時、その余りの大きさに肝を冷やし逃げて行った。
After a time, perceiving the meekness and gentleness of the beast's temper, he summoned courage enough to approach him.	その後、その動物が、気性は穏やかで、従順であることに気付くと、彼は、勇気を奮い起こしてその生き物に近づいた。
Soon afterwards, observing that he was an animal altogether deficient in spirit, he assumed such boldness as to put a bridle in his mouth, and to let a child drive him.	その後すぐに、その動物が全くの馬鹿であることに気付くと、彼は、その動物にクツワをつけ、そして、ついには子供に引かせた。
Use serves to overcome dread.	恐怖を払拭するには慣れるのが一番
The Wasp and the Snake	１７５．スズメバチとヘビ
A WASP seated himself upon the head of a Snake and, striking him unceasingly with his stings, wounded him to death.	スズメバチが、ヘビの頭にとまって、死ぬほど刺した。
The Snake, being in great torment and not knowing how to rid himself of his enemy,	ヘビは、激痛に苦しんだが、ハチを追い払う術がなかった。
saw a wagon heavily laden with wood,	そこへ材木を満載した荷車がやって来た。
and went and purposely placed his head under the wheels, saying,	ヘビは自らその車輪に頭を突っ込んでこう言った。
"At least my enemy and I shall perish together."	「どうせ死ぬなら、敵を道連れに……」
The Dog and the Hare	１７６．イヌとウサギ
A HOUND having started a Hare on the hillside pursued her for some distance,	猟犬が、ウサギを追いかけていた。
at one time biting her with his teeth as if he would take her life,	そしてすぐに追いつくと、一度は死ぬ程噛みついた。
and at another fawning upon her, as if in play with another dog.	しかし、次には、他のイヌと戯れるかのように、じゃれついた。
The Hare said to him,	するとウサギがこう言った。
"I wish you would act sincerely by me, and show yourself in your true colors.	「いいですか、もっと素直になって、本心を見つめて下さい。
If you are a friend, why do you bite me so hard? If an enemy, why do you fawn on me?'	友達ならば、そんなに強く噛むのはおかしいし、敵ならば、じゃれついたりしないでしょう？……」
No one can be a friend if you know not whether to trust or distrust him.	一体何を考えているか分からないような人は、友達ではありません。
The Bull and the Calf	１７７．牡ウシと仔ウシ
A BULL was striving with all his might to squeeze himself through a narrow passage which led to his stall.	牡ウシが、牛房に続く狭い通路を通り抜けようと、全身の力を振り絞って、身体を割り込ませようとしていた。
A young Calf came up, and offered to go before and show him the way by which he could manage to pass.	そこへ仔ウシがやって来て、････先に行って、通り方を教えて上げる。
"Save yourself the trouble,"	すると牡ウシが答えた。
said the Bull;	「それには及ばぬよ。
"I knew that way long before you were born."	そんなことは、お前さんの生まれる前から知っている」
The Stag, the Wolf, and the Sheep	１７８．シカとオオカミとヒツジ
A STAG asked a Sheep to lend him a measure of wheat, and said that the Wolf would be his surety.	シカがヒツジに、オオカミを保証人に立てるから小麦を貸してくれと頼んだ。
The Sheep, fearing some fraud was intended, excused herself, saying,	するとヒツジはこう答えた。
"The Wolf is accustomed to seize what he wants and to run off;	「オオカミさんは、自分の欲しいものと見れば、襲いかかってとんずらするのがいつもの手だし、
and you, too, can quickly outstrip me in your rapid flight.	あなただって、足が速いので、私などあっという間に置いてけぼり。
How then shall I be able to find you, when the day of payment comes?'	支払日になって、あなた方をどうやって見つければよいのですか？」
Two blacks do not make one white.	悪人二人が力を合わせて、善いことなどするはずがない。
The Peacock and the Crane	１７９．クジャクとツル
A PEACOCK spreading its gorgeous tail mocked a Crane that passed by, ridiculing the ashen hue of its plumage and saying,	クジャクはツルに出合うと、きらびやかな尾を広げてこう言った。
"I am robed, like a king, in gold and purple and all the colors of the rainbow;	「私は王様のように、金色や高貴な紫、そして虹の色を全て彩った服を着ています。
while you have not a bit of color on your wings."	それにひきかえあなたの羽ときたら、薄汚れた灰色だらけ」
"True,"	するとツルがこう言い返した。
replied the Crane;	「確かにその通りかもしれません。
"but I soar to the heights of heaven	でも、私は、天高く、それこそ天国まで飛翔することができるのです。
and lift up my voice to the stars,	そして、星の彼方まで、声をとどろかすことができるのです。
while you walk below, like a cock, among the birds of the dunghill."	それにひきかえあなたときたら、あの、下劣なニワトリのように、はいつくばっているだけではないですか」
Fine feathers don't make fine birds.	馬子にも衣装というけれど、いくら着飾っても馬子は馬子。
The Fox and the Hedgehog	１８０．キツネとハリネズミ
A FOX swimming across a rapid river was carried by the force of the current into a very deep ravine,	川を泳いで渡っていたキツネが、急流にさらわれ、深い谷底へと押し流されてしまった。
where he lay for a long time very much bruised, sick, and unable to move.	キツネは傷ついてそこに横たわり、長いこと身動きできないでいた。
A swarm of hungry blood-sucking flies settled upon him.	すると、血の臭いを嗅ぎつけた、アブの大群がわんさか押し寄せ、キツネにとりついた。
A Hedgehog, passing by,	そこへ、ハリネズミが通りかかった。
saw his anguish and inquired if he should drive away the flies that were tormenting him.	ハリネズミは、キツネの悲惨な姿を見ると、そのアブどもを追い払ってやろうか？
"By no means,"	するとキツネはこう答えた。
replied the Fox;	「どうか、
"pray do not molest them."	その者どもに害を加えないでくれ！」
"How is this?'	「ええ？
said the Hedgehog;	ハリネズミが訝しげに聞き返した。
"do you not want to be rid of them?'	「君はこいつらを取り除いてもらいたくないと言うのか？」
"No,"	「もちろんだとも」
returned the Fox,	キツネはそう答えるとこう続けた。
"for these flies which you see are full of blood, and sting me but little,	「だってね、このアブどもは、血をたらふく食らっているから、もうほとんど刺さない。
and if you rid me of these which are already satiated, others more hungry will come in their place, and will drink up all the blood I have left."	けれども、君が、この満腹している奴らを追い払ったりしたら、腹を空かせた奴らがやって来て、残りの血まで全部吸われちまうよ」
The Eagle, the Cat, and the Wild Sow	１８１．ワシとネコとイノシシ
AN EAGLE made her nest at the top of a lofty oak;	そびえ立つ樫の木のてっぺんに、ワシが巣をつくった。
a Cat, having found a convenient hole, moved into the middle of the trunk;	ネコが、その木の中間に、ほどよい穴を見つけて引っ越して来た。
and a Wild Sow, with her young, took shelter in a hollow at its foot.	そして、イノシシが木の根元の穴に、子供と共に住まわった。
The Cat cunningly resolved to destroy this chance-made colony.	ネコは、このたまたま知り合った者たちを、出し抜いてやろうと悪賢いことを考えた。
To carry out her design, she climbed to the nest of the Eagle, and said,	まず彼女は、ワシの巣へと登って行ってこんな風に言った。
"Destruction is preparing for you, and for me too, unfortunately.	「大変です。
The Wild Sow, whom you see daily digging up the earth, wishes to uproot the oak,	あなたもご存じのように、あのイノシシは、毎日地面を掘り返していますが、あれは、この樫の木を根っこから倒してしまおうと目論んでいるのです。
so she may on its fall seize our families as food for her young."	そして、我々の家族が落っこちたら、捕まえて子供の餌食にしようとしているのです」
Having thus frightened the Eagle out of her senses, she crept down to the cave of the Sow, and said,	ネコは、このように、ワシに恐怖を吹き込んで、彼女を恐慌状態に陥れると、今度は、イノシシの許へそおっと下りて行き、そしてこんなことを言った。
"Your children are in great danger;	「お子さんたちに、大変な危機が迫っています。
for as soon as you go out with your litter to find food, the Eagle is prepared to pounce upon one of your little pigs."	ワシの奴は、あなたが、子供たちと穴から出ようとするところを狙っているのです、あなたたちが餌を探しに穴から出たら、すぐさま一匹さらってしまおうと目論んでいるのです」
Having instilled these fears into the Sow, she went and pretended to hide herself in the hollow of the tree.	ネコはこのように、イノシシにも恐怖を吹き込むと、自分の穴に籠もって身を隠すふりをした。
When night came she went forth with silent foot and obtained food for herself and her kittens,	夜になると彼女は、そおっと出掛けて行き、自分と子供たちのために餌を捕った。
but feigning to be afraid, she kept a lookout all through the day.	しかし、昼間は、一日中外を見張り続けて、恐怖に駆られているふりをした。
