so that the Partridge became grievously troubled and supposed that he was thus evilly treated because he was a stranger.	ヤマウズラは、自分がよそ者だから、こんなひどい仕打ちを受けるのだと思い、陰鬱に沈んだ。
Not long afterwards he saw the Cocks fighting together and not separating before one had well beaten the other.	しかしその後すぐ、シャモたちが共に戦い、片方が一方を打ちのめすまで執拗に追いかけるのを見て、
He then said to himself,	ヤマウズラは独りつぶやいた。
"I shall no longer distress myself at being struck at by these Gamecocks,	「もう、彼らにぶたれても、悲しむことはない。
when I see that they cannot even refrain from quarreling with each other."	だって、彼らは仲間同士でも喧嘩せずにはいられないのだから」
The Quack Frog	２３５．蛙のお医者様
A FROG once upon a time came forth from his home in the marsh and proclaimed to all the beasts	昔々の話だが、沼の家から出てきた蛙、動物みんなに言ったとさ。
that he was a learned physician,	我こそは偉い医者なるぞ。
skilled in the use of drugs and able to heal all diseases.	あらゆる薬に通じたれば、どんな病気も治して見せよう。
A Fox asked him,	それを聞いた狐が言うには、
"How can you pretend to prescribe for others, when you are unable to heal your own lame gait and wrinkled skin?'	「人に薬を出す前に、お前自身のチンバを治せ、皮もしわしわしているぞ」
The Lion, the Wolf, and the Fox	２３６．ライオンとオオカミとキツネ
A LION, growing old, lay sick in his cave.	年老いたライオンが、病気になって巣穴で横たわっていた。
All the beasts came to visit their king, except the Fox.	あらゆる動物たちが、自分たちの王であるライオンを見舞ったが、キツネだけは見舞いに来なかった。
The Wolf therefore, thinking that he had a capital opportunity, accused the Fox to the Lion of not paying any respect to him who had the rule over them all and of not coming to visit him.	するとオオカミは、願ってもない機会とばかりに、キツネの奴は、支配者であらせられるあなた様を蔑ろにして、見舞いにもやってきません。
At that very moment the Fox came in and heard these last words of the Wolf.	と、まさにその時、キツネがやって来て、その讒言を耳にした。
The Lion roaring out in a rage against him,	ライオンは、キツネに腹を立て、うなり声を轟かせた。
the Fox sought an opportunity to defend himself and said,	キツネはなんとか身を守ろうと機会を窺ってこう言った。
"And who of all those who have come to you have benefited you so much as I,	「あなたをお見舞いした者たちの中に、私のように役立つ者はいたでしょうか？
who have traveled from place to place in every direction, and have sought and learnt from the physicians the means of healing you?'	実は私は、あなたを治す手だてを教えてもらおうと、あらゆる地方をくまなく旅して探し回ったのです。」
The Lion commanded him immediately to tell him the cure,	ライオンはすぐに、その治療法を教えるようにと命じた。
when he replied,	そこでキツネはこう答えた。
"You must flay a wolf alive and wrap his skin yet warm around you."	「活きのよいオオカミの毛皮を剥いで、その皮で身をくるんで暖めるのです」
The Wolf was at once taken and flayed;	オオカミは、すぐに捕まえられて皮を剥がれた。
whereon the Fox, turning to him, said with a smile,	そこでキツネは、オオカミに向かってにこやかに言った。
"You should have moved your master not to ill, but to good, will."	「主人を悪ではなく、善き方に導くが肝要である」
The Dog's House	２３７．イヌの家
IN THE WINTERTIME, a Dog curled up in as small a space as possible on account of the cold, determined to make himself a house.	冬のこと、イヌは、寒さのために、できるだけ身体を小さく縮めて丸くなると、家を作ろうと決意した。
However when the summer returned again, he lay asleep stretched at his full length and appeared to himself to be of a great size.	ところが、夏がやってきて、身体をめいいっぱい伸ばして横になって寝ると、イヌは自分がとても大きくなったように思われた。
Now he considered that it would be neither an easy nor a necessary work to make himself such a house as would accommodate him.	そして、自分に合う家を作るのは、容易なことではないし、それに必要もないと考えた。
The Wolf and the Lion	２３８．オオカミとライオン
ROAMING BY the mountainside at sundown, a Wolf saw his own shadow become greatly extended and magnified, and he said to himself,	夕暮れ時に、山の麓を徘徊していたオオカミは、とても長く大きくなった自分の影を見て、こうつぶやいた。
"Why should I, being of such an immense size	「俺様は巨大だ。
and extending nearly an acre in length,	１エーカー近くはある。
be afraid of the Lion?	ライオンなど恐るに足りぬ。
Ought I not to be acknowledged as King of all the collected beasts?'	俺様こそが百獣の王として認められるべきではないのか？」
While he was indulging in these proud thoughts, a Lion fell upon him and killed him.	オオカミが、このように高慢な思いに浸っていると、ライオンがオオカミに襲い掛かった。
He exclaimed with a too late repentance,	オオカミは、こう叫んだのだが後の祭りだった。
"Wretched me!	「ああ、惨めだ。
this overestimation of myself is the cause of my destruction."	自惚れにより身を亡ぼすとは……」
The Birds, the Beasts, and the Bat	２３９．鳥と獣とコウモリ
THE BIRDS waged war with the Beasts, and each were by turns the conquerors.	鳥と獣たちが戦争をしていたのだが、両陣営は、ともに、勝ち負けを繰り返していた。
A Bat, fearing the uncertain issues of the fight, always fought on the side which he felt was the strongest.	コウモリは、先の見えない戦いに不安を感じ、いつも、優勢な陣営の側について戦った。
When peace was proclaimed, his deceitful conduct was apparent to both combatants.	しかし、平和の宣言がなされた時、コウモリの卑怯な行状が、両軍に知れ渡ることとなった。
Therefore being condemned by each for his treachery, he was driven forth from the light of day,	その裏切り行為は、両陣営から糾弾され、コウモリは、白日の下から追放されてしまった。
and henceforth concealed himself in dark hiding-places, flying always alone and at night.	それからというもの、コウモリは、暗い隠れ家に身を隠し、夜、一人っきりで飛ぶようになった。
The Spendthrift and the Swallow	２４０．放蕩者とツバメ
A YOUNG MAN, a great spendthrift, had run through all his patrimony and had but one good cloak left.	放蕩の限りを尽くした若者は、全財産を使い果たし、残っているものといえば、上等なマント一着きりという有様だった。
One day he happened to see a Swallow,	ある日のこと、彼はたまたま、ツバメを見掛けた。
which had appeared before its season, skimming along a pool and twittering gaily.	実はまだ季節前にツバメはやってきたのだが、池を掠めて飛んで、陽気に囀った。
He supposed that summer had come, and went and sold his cloak.	若者は、夏が来たのだと思い、マントを売ってしまった。
Not many days later, winter set in again with renewed frost and cold.	それから幾日もたたないうちに、寒が戻り、辺り一面霜で被われた。
When he found the unfortunate Swallow lifeless on the ground, he said,	彼は、ツバメが地面に落ちて死んでいるのを見つけて、こう言った。
"Unhappy bird!	「不幸な鳥よ！
what have you done?	お前はなんてことをしてくれたんだ。
By thus appearing before the springtime you have not only killed yourself, but you have wrought my destruction also."	春が来る前におまえが現れたせいで、おまえばかりではなく、私をも破滅させるのだ」
The Fox and the Lion	２４１．キツネとライオン
A FOX saw a Lion confined in a cage, and standing near him, bitterly reviled him.	キツネは、檻に閉じこめられているライオンを見て、近くへ行くと、口を極めて罵った。
The Lion said to the Fox,	するとライオンはキツネにこう言った。
"It is not thou who revilest me;	「我を罵っているのは、お主ではない。
but this mischance which has befallen me."	我に降りかかった災難がお主に言わせておるのじゃ！」
The Owl and the Birds	２４２．フクロウと鳥たち
AN OWL, in her wisdom, counseled the Birds that when the acorn first began to sprout, to pull it all up out of the ground and not allow it to grow.	物知りのフクロウは、ドングリが芽生えると、これが大きくなる前に、全部地面から引き抜くようにと、鳥たちに忠告した。
She said acorns would produce mistletoe, from which an irremediable poison, the bird-lime, would be extracted and by which they would be captured.	なぜなら、ドングリが成長すると、やがてヤドリギを寄生させ、そのヤドリギからは、災厄をもたらす薬、トリモチが抽出され、それで皆捕まえられてしまうと言うのだった。
The Owl next advised them to pluck up the seed of the flax, which men had sown, as it was a plant which boded no good to them.	次にフクロウは、人間が播いた麻の種は、鳥たちに災いをもたらす予兆となる植物なので取り除くようにと忠告した。
And, lastly, the Owl, seeing an archer approach, predicted that this man, being on foot, would contrive darts armed with feathers which would fly faster than the wings of the Birds themselves.	そして、最後に、射手がやって来るのを見て、この人間は歩いているが、彼は、我々よりも速く飛ぶことのできる、羽を付けた矢を射ようとしているのだ。
The Birds gave no credence to these warning words, but considered the Owl to be beside herself and said that she was mad.	ところが、鳥たちは、フクロウの予言を信用せず、それどころか、彼女のことを心身症の気狂いだと罵った。
But afterwards, finding her words were true,	しかしその後、鳥たちは彼女の言葉が正しかったことを思い知った。
they wondered at her knowledge	鳥たちは、彼女の知識に驚嘆した。
Hence it is that when she appears they look to her as knowing all things, while she no longer gives them advice, but in solitude laments their past folly.	その後、彼女が現れると、鳥たちはあらゆることを知っている彼女の知恵にあやかろうと集まってくるのだが、彼女はもはや忠告を与えず、かつての鳥たちの愚鈍な行いを一人嘆くだけだった。
The Trumpeter Taken Prisoner	２４３．捕らえられたラッパ兵
A TRUMPETER, bravely leading on the soldiers, was captured by the enemy.	勇ましく兵士たちを先導していたラッパ兵が、敵に捕まってしまった。
He cried out to his captors,	彼は、捕縛者にこう叫んだ。
"Pray spare me, and do not take my life without cause or without inquiry.	「俺は、あんた方を誰一人として殺してはいない。
I have not slain a single man of your troop.	俺は武器を、何一つ持っていないのだ。
I have no arms, and carry nothing but this one brass trumpet."	俺が持っているのは、真鍮のトランペット、唯一つなんだよ」
"That is the very reason for which you should be put to death,"	すると、敵の兵隊たちはこう言った。
they said;	「それが、お前の処刑される理由だ、お前は自分では戦わぬが、ラッパで、兵士たちを鼓舞するのだからな！」
The Ass in the Lion's Skin	２４４．ライオンの皮を被ったロバ
AN ASS, having put on the Lion's skin, roamed about in the forest	ロバがライオンの皮を被って、森を歩き回った。
and amused himself by frightening all the foolish animals he met in his wanderings.	道すがら、出合う動物たちが慌てふためくのを見て、ロバはすっかり気をよくした。
At last coming upon a Fox,	そうこうしているうちに、キツネに出会った。
he tried to frighten him also,	ロバは、キツネもおどかしてやろうと思った。
but the Fox no sooner heard the sound of his voice than he exclaimed,	しかし、キツネは、ロバの声を聞くが早いか、こう言った。
"I might possibly have been frightened myself, if I had not heard your bray."	「もし、君の声を聞かなかったなら、僕も、恐れおののいたかもしれないけどね・・・」
The Sparrow and the Hare	２４５．スズメとウサギ
A HARE pounced upon by an eagle sobbed very much and uttered cries like a child.	ワシに捕まえられたウサギが、子供のようにむせび泣いた。
A Sparrow upbraided her and said,	スズメがそれを見て揶揄して言った。
"Where now is thy remarkable swiftness of foot?	「君のその素早い足はどうしたの？
Why were your feet so slow?"	君はどうしてそんなにのろまなんだ！」
While the Sparrow was thus speaking, a hawk suddenly seized him and killed him.	スズメがこのように罵声を浴びせかけていると、突然タカがスズメをひっつかみ、彼を殺してしまった。
The Hare was comforted in her death, and expiring said,	ウサギは心安らかに死に臨み、今際の際にこう言った。
"Ah!	「ふん。
you who so lately, when you supposed yourself safe, exulted over my calamity, have now reason to deplore a similar misfortune."	お前さんは、自分が安全だと思って、私の災難を喜んでいたのだろうが、早々に、同じ不幸を嘆く羽目になろうとはね！」
The Flea and the Ox	２４６．ノミと牡ウシ
A FLEA thus questioned an Ox:	ノミが牡ウシに尋ねた。
"What ails you, that being so huge and strong, you submit to the wrongs you receive from men and slave for them day by day,	「あんたは、そんなに大きくて強いのに、人間たちのひどい扱いにも反抗せず、来る日も来る日も、彼らのために働くのはなぜなんですか？
while I, being so small a creature, mercilessly feed on their flesh and drink their blood without stint?'	私などは、こんなに小さいのに、人間たちの肉をかじり、そして思う存分血を吸うんですよ」
The Ox replied:	すると牡ウシはこう答えた。
"I do not wish to be ungrateful, for I am loved and well cared for by men,	「私は、恩知らずではないからね、人間たちは、私を愛してくれているし、よく世話してくれるんだよ。
and they often pat my head and shoulders."	彼らはね、しょっちゅう、頭や肩をとんとん叩いてくれるんだよ」
"Woe's me!"	するとノミが言った。
said the flea;	「なんてこった！
"this very patting which you like, whenever it happens to me, brings with it my inevitable destruction."	あんたの好きな、とんとんで、私は、間違いなく、あの世行きだよ」
The Goods and the Ills	２４７．善い者と悪い者たち
ALL the Goods were once driven out by the Ills from that common share which they each had in the affairs of mankind;	昔、善い者たちと悪い者たちは、共に人間の面倒をみていたのだが、ある日、悪い者たちによって、善い者たちは追い出された。
for the Ills by reason of their numbers had prevailed to possess the earth.	というのも、地上では悪い者たちの数が勝っていたからである。
The Goods wafted themselves to heaven and asked for a righteous vengeance on their persecutors.	善い者たちは、天国へと昇って行くと、自分たちを迫害した者たちに対し、公正な処置がとられるようにとジュピター神にお願いした。
They entreated Jupiter that they might no longer be associated with the Ills, as they had nothing in common and could not live together, but were engaged in unceasing warfare;	彼らが言うには、・・・・自分たちは、悪い者たちと共通点が全くないので、一緒に暮らすことは出来ない、それどころか、悪い者たちの間では、争いが絶えないので、もう彼らと関わるのさえ嫌だと言うのだ。
and that an indissoluble law might be laid down for their future protection.	そして、絶対的な法により、自分たちを永遠にお救い下さいと訴えた。
Jupiter granted their request and decreed that henceforth the Ills should visit the earth in company with each other, but that the Goods should one by one enter the habitations of men.	ジュピター神は、彼らの訴えを聞き入れて、これからは悪い者たちは、集団で地上へ行き、善い者たちは、一人一人ばらばらに、人間の住まいへ入るようにと定めた。
Hence it arises that Ills abound, for they come not one by one, but in troops, and by no means singly:	それ故、悪い者が大勢いるのは、彼らが集団でやって来て、決して一人一人ばらばらにはやってこないからである。
while the Goods proceed from Jupiter, and are given, not alike to all, but singly, and separately;	一方、善い者たちは、ばらばらと、一人一人やって来て、決して集団で来ることはない。
and one by one to those who are able to discern them.	そして、善良な人を見つけると順番に彼らの許に入って行くのである。
The Dove and the Crow	２４８．ハトとカラス
A DOVE shut up in a cage was boasting of the large number of young ones which she had hatched.	篭の中のハトが、自分が産んだ子供が大勢いることを自慢した。
A Crow hearing her, said:	カラスがそれを聞いて、こう言った。
"My good friend, cease from this unseasonable boasting.	「ねえ、ハトさんや、そんな場違いな自慢はおよしなさいよ。
The larger the number of your family, the greater your cause of sorrow, in seeing them shut up in this prison-house."	こんな牢獄の中では、家族が増えれば増えるだけ、悲しみも増すものですよ」
Mercury and the Workmen	２４９．マーキュリー神と樵
A WORKMAN, felling wood by the side of a river, let his axe drop - by accident into a deep pool.	川のそばで木を切り倒していた樵が、ひょんなことから、斧を川の深い淀みに落としてしまった。
Being thus deprived of the means of his livelihood, he sat down on the bank and lamented his hard fate.	樵は生活の糧とする斧を失ってしまい、土手に座り込んで、この不運を嘆き悲しんだ。
Mercury appeared and demanded the cause of his tears.	すると、マーキュリー神が現れて、なぜ泣いているのかと尋ねた。
After he told him his misfortune, Mercury plunged into the stream, and, bringing up a golden axe, inquired if that were the one he had lost.	樵がマーキュリー神に自分の不運を語ると、マーキュリー神は、流れの中へ消えて行き、金の斧を持ってきて、彼がなくしたのはこの斧かと尋ねた。
On his saying that it was not his, Mercury disappeared beneath the water a second time, returned with a silver axe in his hand,	樵が自分のではないと答えると、マーキュリー神は、再び水の中へ消え、そして手に銀の斧を持って戻ってきた。
and again asked the Workman if it were his.	そして、これが樵の斧かと尋ねた。
When the Workman said it was not, he dived into the pool for the third time and brought up the axe that had been lost.	樵はそれも違うと答えると、マーキュリー神は、三度川の淀みに沈んで、樵がなくした斧を持ってきた。
The Workman claimed it and expressed his joy at its recovery.	樵は、これこそ自分の斧だと言って、斧が返ってきた喜びを神に伝えた。
Mercury, pleased with his honesty, gave him the golden and silver axes in addition to his own.	すると、マーキュリー神は、樵が正直なことを喜んで、彼自身の斧に加えて、金の斧も銀の斧も樵に与えた。
The Workman, on his return to his house, related to his companions all that had happened.	樵は家に帰ると、起こったことを仲間に話して聞かせた。
One of them at once resolved to try and secure the same good fortune for himself.	すると、その中の一人が、自分も同じような良い目を見ようと考えた。
He ran to the river and threw his axe on purpose into the pool at the same place,	男は川へ走って行くと、同じ川の淀みにわざと斧を投げ込んだ。
and sat down on the bank to weep.	そして、土手に座ってしくしく泣いた。
Mercury appeared to him just as he hoped he would;	すると、彼が思った通りにマーキュリー神が現れて、
and having learned the cause of his grief, plunged into the stream and brought up a golden axe, inquiring if he had lost it.	男が嘆いている理由を知ると、流れの中に消えて行き、金の斧を持ってきて、彼がなくしたのはこの斧かと尋ねた。
The Workman seized it greedily, and declared that truly it was the very same axe that he had lost.	欲に駆られた樵は、金の斧をしっかりと抱えると、これこそ間違いなく自分がなくした斧だと言った。
Mercury, displeased at his knavery, not only took away the golden axe, but refused to recover for him the axe he had thrown into the pool.	マーキュリー神は、男の不正直に腹を立て、金の斧を取り上げただけでなく、彼が投げ込んだ斧も持ってきてやらなかった。
The Eagle and the Jackdaw	２５０．ワシとカラス
AN EAGLE, flying down from his perch on a lofty rock,	ワシが高空から峨々たる岩の上へと舞い降りた。
seized upon a lamb and carried him aloft in his talons.	そして、鉤爪で仔ヒツジを捕まえると、空へと運んでいった。
A Jackdaw, who witnessed the capture of the lamb, was stirred with envy and determined to emulate the strength and flight of the Eagle.	カラスはそれを目の当たりにして、妬ましく思い、ワシの飛ぶ力や強さと、張り合ってみたくなった。
He flew around with a great whir of his wings and settled upon a large ram, with the intention of carrying him off,	カラスは羽を大きくバタつかせながら飛び回ると、大きなヒツジに止まって、そいつを運び去ろうとした。
but his claws became entangled in the ram's fleece and he was not able to release himself, although he fluttered with his feathers as much as he could.	しかし、彼の爪はヒツジの毛に絡まってしまい、いくらバタついても、抜け出すことができなくなってしまった。
The shepherd, seeing what had happened, ran up and caught him.	事の次第を見ていたヒツジ飼は、走って行ってカラスを捕まえると、
He at once clipped the Jackdaw's wings,	すぐさま、カラスの羽を刈り込んだ。
and taking him home at night, gave him to his children.	ヒツジ飼は、夜になって家に帰ると、そのカラスを子供たちに与えた。
On their saying,	すると子供たちが言った。
"Father, what kind of bird is it?'	「お父さん、これは何ていう鳥ですか？」
he replied,	すると彼はこう答えた。
"To my certain knowledge he is a Daw;	「どう見てもカラスなんだが、
but he would like you to think an Eagle."	自分では、ワシと思われたいようだ」
The Fox and the Crane	２５１．キツネとツル
A FOX invited a Crane to supper	キツネがツルを夕食に招待した。
and provided nothing for his entertainment but some soup made of pulse,	これといって何もなかったが、美味そうなスープにツルは心躍った。
which was poured out into a broad flat stone dish.	しかし、スープは平らな石の皿に注がれ、
The soup fell out of the long bill of the Crane at every mouthful,	ツルが飲もうとすると、スープは長い嘴からこぼれてしまう。
and his vexation at not being able to eat afforded the Fox much amusement.	キツネは、スープが飲めないでいらだっているツルがおかしくて仕方がなかった。
The Crane, in his turn,	今度はツルの番である。
asked the Fox to sup with him, and set before her a flagon with a long narrow mouth,	ツルは、一緒にスープを飲もうとキツネを誘い、キツネの前に首の細長い壺を置いた。
so that he could easily insert his neck and enjoy its contents at his leisure.	そして、自分は壺の中に嘴を突っ込むと、ゆうゆうとスープを味わった。
