Upon leaving him on the night of our adventure, he solicited me, in what I thought an urgent manner, to call upon him _very_ early the next morning.	この騒動のあった晩、別れ際に、青年が明朝一番に自分の館を訪ねてほしいとそれはもう、半ば強制的とも思えるような調子で私に頼むのです。
Shortly after sunrise, I found myself accordingly at his Palazzo,	結局、私は陽が昇るとすぐこの友人の館を訪ねていました。
one of those huge structures of gloomy, yet fantastic pomp, which tower above the waters of the Grand Canal in the vicinity of the Rialto.	リアルト橋付近のグランドカナルの水面よりもはるかに高くそびえ立っている立派な建物で、陰鬱な雰囲気の中にも幻想的な美しさが漂っています。
I was shown up a broad winding staircase of mosaics, into an apartment whose unparalleled splendor burst through the opening door with an actual glare, making me blind and dizzy with luxuriousness.	彼の後についてモザイク模様でできた幅広の廻り階段を登り、ある部屋に案内されたのですが、その部屋の類い希なる豪華さが、開け放された扉の向こうからその贅沢な輝きで眼がくらんでつぶれてしまいそうなくらいの本物の光を伴って外にはじき出ているではありませんか。
I knew my acquaintance to be wealthy.	私の友人には莫大な財産があることは知っていました。
Report had spoken of his possessions in terms which I had even ventured to call terms of ridiculous exaggeration.	かって私は、こんなことは馬鹿げた誇張だと思い切って言ったことがあるのですが、世間でも同じ噂が囁かれていたようです。
But as I gazed about me, I could not bring myself to believe that the wealth of any subject in Europe could have supplied the princely magnificence which burned and blazed around.	それにしても周りを見渡してみますと、この部屋は辺り一面が燃えるように明るく輝き、眼を刺すような光を放って極上の絢爛さを生み出しているのです。
Although, as I say, the sun had arisen, yet the room was still brilliantly lighted up.	私が申し上げました通り、陽はすでに昇っていましたが、部屋の中にはまだ灯が赤々と灯っていました。
I judge from this circumstance, as well as from an air of exhaustion in the countenance of my friend, that he had not retired to bed during the whole of the preceding night.	この部屋の様子や疲れ切ったような彼の表情から判断して、どうやら昨日の晩、彼は自分の寝室に戻って休まなかったようです。
In the architecture and embellishments of the chamber, the evident design had been to dazzle and astound.	この建造物と装飾品の数々は確かに驚きと幻惑を起こさせます。
Little attention had been paid to the _decora_ of what is technically called _keeping_, or to the proprieties of nationality.	専門家の目から見て調和と呼ばれるような飾り付けも、お国柄にふさわしいかどうかもそういったことには関心が払われていません。
The eye wandered from object to object, and rested upon none - neither the _grotesques_ of the Greek painters, nor the sculptures of the best Italian days, nor the huge carvings of untutored Egypt.	私の目は物から物へと移っていき、グロテスクなギリシャの絵画にも、イタリアの最盛期の彫刻にも、古代エジプトの巨大な彫り物にも、どこにも目を留めることはしませんでした。
Rich draperies in every part of the room trembled to the vibration of low, melancholy music, whose origin was not to be discovered.	部屋のいたるところに掛かっている豪華な厚手の壁掛けが 何処から聞こえてくるともしれぬ重苦しい曲の低音の響きで揺らめいているのです。
The senses were oppressed by mingled and conflicting perfumes, reeking up from strange convolute censers, together with multitudinous flaring and flickering tongues of emerald and violet fire.	奇妙な渦巻き型をした香炉からは違和感を覚えるさまざまな香りが立ち上り、それがゆらゆらと燃え輝いているエメラルドと青紫のおびただしい炎の舌と合わさり混ざり合って私の感覚を重く押さえつけてくるのです。
The rays of the newly risen sun poured in upon the whole, through windows, formed each of a single pane of crimson-tinted glass.	つい先ほど昇ったばかりの太陽の光が深紅色の一枚ガラスを左右にはめこんだ窓から部屋中に注ぎ込んでいます。
Glancing to and fro, in a thousand reflections, from curtains which rolled from their cornices like cataracts of molten silver, the beams of natural glory mingled at length fitfully with the artificial light, and lay weltering in subdued masses upon a carpet of rich, liquid-looking cloth of Chili gold.	天井から螺旋を描いて垂れ下がっているカーテンは、まるで溶けた銀の大滝のようで、それが何千という光を反射してあちこちに跳ね返し、太陽の自然の光と人口の光がじわじわと混ざり合い、黄金色の布地でできたまるで流れ動いているように見える豪華な絨毯の上で和らいだ光の束になってうねっているのです。
"Ha !  ha !  ha !	「わっはっは！
- ha !  ha !  ha !  "	あっはっは！」
- laughed the proprietor, motioning me to a seat as I entered the room, and throwing himself back at full-length upon an ottoman.	この館の主は笑いながら、部屋の中に入った私に座るように手招いて自分は背もたれのない長いすに長々と寝そべりました。
"I see,"	「そうだろうね」
said he, perceiving that I could not immediately reconcile myself to the _bienseance_ of so singular a welcome -	私がこの奇をてらったかなり風変わりな歓迎をうけて、すぐには慣れることができないでいるのを察したのか、彼はこう言いました。
"I see you are astonished at my apartment - at my statues - my pictures - my originality of conception in architecture and upholstery !	「君は僕の部屋に、ここの彫刻や絵画、建物や室内装飾の独創的な僕の趣向にびっくりしたようだね。
absolutely drunk, eh, with my magnificence ?	この壮麗さにすっかり陶酔しているのではないかい？
But pardon me, my dear sir,	それはそうと、君に謝らなければいけない。
(here his tone of voice dropped to the very spirit of cordiality,)	（このとき彼の声が低くなってとても丁寧な口調になりました）
pardon me for my uncharitable laughter.	意地悪に笑ったりして申し訳なかった。
You appeared so _utterly_ astonished.	君は随分驚いているようじゃないか。
Besides, some things are so completely ludicrous, that a man _must_ laugh or die.	だけど物事には、あんまり馬鹿らしくて笑うか死ぬかしか他にしようがないってこともあるじゃないか。
To die laughing, must be the most glorious of all glorious deaths !	笑いながら死ぬというのは最高の死に方だよ。
Sir Thomas More - a very fine man was Sir Thomas More	トマス・モア卿は、彼は実にすばらしい人だった。
- Sir Thomas More died laughing, you remember.	君も知ってると思うけど、笑いながら息を引き取ったんだ。
Also in the _Absurdities_ of Ravisius Textor, there is a long list of characters who came to the same magnificent end.	ラヴィシアス・テクストルの笑い話の中に同じような見事な死に方をした人の話がたくさん書いてある。
Do you know, however,"	だけど、君は知ってるだろうか？」
continued he musingly,	彼は考え込んでは話を続けます。
"that at Sparta (which is now Pale ;  ochori,) at Sparta, I say, to the west of the citadel, among a chaos of scarcely visible ruins, is a kind of _socle_,	「スパルタには（現在のPalaeochori）、そう、そのスパルタの街の砦から西の方へいくと一見して廃墟とわかる雑然とした場所があって、そこに何かの柱の台座だけ残っているんだ。
upon which are still legible the letters  7!=9 .	&Lambda;&Alpha;&Xi;&Mu; という字が読みとれるんだけど、
They are undoubtedly part of  '+7!=9! .	これは&Gamma;&Epsilon;&Lambda;&Alpha;&Xi;&Mu;&Lambda; （ギリシャ語で笑の意味）という字の一部に間違いないね。
Now, at Sparta were a thousand temples and shrines to a thousand different divinities.	そういえばスパルタにはさまざまな神を何体も飾ってある寺院や聖堂がたくさんあったと思ったけど。
How exceedingly strange that the altar of Laughter should have survived all the others !	その中でよりにもよって「笑」の字のついた台座だけ残ってるというのも不思議な話だね。
But in the present instance,"	でも今の場合は」
he resumed, with a singular alteration of voice and manner,	彼の声と態度が今までとはうってかわって
"I have no right to be merry at your expense.	「僕には君をからかって喜ぶ権利はない。
You might well have been amazed.	君が驚くのも当然のことだ。
Europe cannot produce anything so fine as this, my little regal cabinet.	僕のこの小部屋ぐらいすばらしい部屋はヨーロッパのどこを探してもありはしないんだから。
My other apartments are by no means of the same order	他の部屋はこんな風にはなっていない。
- mere _ultras_ of fashionable insipidity.	何の面白みもない今のはやりの最先端というところだね。
This is better than fashion	この部屋はそれよりはましだと思っているんだけどね。
- is it not ?	そうは思わないかい？
Yet this has but to be seen to become the rage	この部屋を見せたら大流行になるよ。
- that is, with those who could afford it at the cost of their entire patrimony.	ま、親から譲り受けた財産を全部つぎこんでこういう部屋を作りたいという人ならということだけど。
I have guarded, however, against any such profanation.	でも、この神聖な部屋は人目にさらさないように用心してきたんだ。
With one exception, you are the only human being besides myself and my _valet_, who has been admitted within the mysteries of these imperial precincts, since they have been bedizzened as you see !"	今君が見ているこういう室内装飾にしてからは、この神聖で神秘的な帝国に足をふみいれたのは、僕と僕の従者と君以外にもう一人いるけど、あとは君だけなんだよ！」
I bowed in acknowledgment	と言われて、私は感謝のつもりで会釈をしました。
- for the overpowering sense of splendor and perfume, and music, together with the unexpected eccentricity of his address and manner, prevented me from expressing, in words, my appreciation of what I might have construed into a compliment.	というのも、この部屋の豪華さや部屋に充満している芳香に圧倒されてしまい、それに彼の話や態度が全く思いがけないものだったのでお世辞ともとれる彼の言葉に対して感謝の気持ちを言葉で言うことができなくなってしまったのです。
"Here,"	「ここにはね、」
he resumed, arising and leaning on my arm as he sauntered around the apartment,	彼は起きあがって私の腕にもたれかかるようにして部屋の中を歩き回りながら次の言葉を続けました。
"here are paintings from the Greeks to Cimabue, and from Cimabue to the present hour.	「ここに飾ってある絵はギリシャの時代からチマブエ、チマブエから現代までの作品でね。
Many are chosen,	みんな僕が選んだんだ。
as you see,	ほら、見てわかるだろう。
with little deference to the opinions of Virtu.	美術品愛好家の趣味とはかなり違ってるってことが。
They are all, however, fitting tapestry for a chamber such as this.	でも、こういう部屋の壁を飾るには実によくあってるじゃないか。
Here, too, are some _chefs d'uvre_ of the unknown great ;	それからここにあるのは世に知られていない埋もれた天才の作品だ。
and here, unfinished designs by men, celebrated in their day, whose very names the perspicacity of the academies has left to silence and to me.	これは当時、随分ともてはやされたんだが、美術院のお気に召さなかったようでそのうちに忘れられてしまい、この作家の名を知ってるのは今では僕ぐらいのもんじゃないかな。
What think you,"	ところで、」
said he, turning abruptly as he spoke -	急に私の方を振り向いて、
"what think you of this Madonna della Pieta ?"	「どうだろう、この嘆きの聖母像は？」
"It is Guido's own !  "	「本物のギドーでしょ」
I said, with all the enthusiasm of my nature,	と、すぐに夢中になる私の癖が口調に出てしまいました。
for I had been poring intently over its surpassing loveliness.	私は先ほどから美の極みともいうべきこの絵にすっかりはまりこんでしまっていたのです。
"It is Guido's own !	「本物のギドーの絵ですよね。
- how _could_ you have obtained it ?	一体どうやって手にいれたんです？
- she is undoubtedly in painting what the Venus is in sculpture."	この聖母像は彫刻の世界で言ったら、ビーナス像に匹敵すると私は断固うけあいますね」
"Ha !  "	「え！」
said he thoughtfully,	彼は何やら考え深げに
"the Venus	「ビーナス像？
- the beautiful Venus ?	美しきビーナス、
- the Venus of the Medici ?	メディチのビーナス像？
- she of the diminutive head and the gilded hair ?	頭が小さくて髪の毛が金色の、あの像のこと？
Part of the left arm (here his voice dropped so as to be heard with difficulty,) and all the right, are restorations ;	左腕の一部と（彼の声が聞き取れないほど低くなって）　右腕は全部修復されているんだよ。
and in the coquetry of that right arm lies, I think, the quintessence of all affectation.	それにあの右腕の艶っぽさときたら、いかにもわざとらしい感じがして、
Give _me_ the Canova !	僕ならカノヴァ像の方にするね。
The Apollo, too,	アポロ像だってそうさ。
is a copy	これも模造品だ。
- there can be no doubt of it	絶対そうさ。
- blind fool that I am, who cannot behold the boasted inspiration of the Apollo !	アポロ像からご自慢の霊感が見えないのだから僕は目の不自由な馬鹿者ということかな。
I cannot help - pity me !	情けないとは思うが、しょうがない。
- I cannot help preferring the Antinous.	僕はアンティノスの像の方を選ぶほかないんだ。
Was it not Socrates who said that the statuary found his statue in the block of marble ?	彫刻家は大理石の固まりの中に自身の姿を見ると言ったのはソクラテスじゃなかったかな？
Then Michael Angelo was by no means original in his couplet - 'Non ha l'ottimo artista alcun concetto Che un marmo solo in se non circunscriva.' "	だったら、『最高の芸術家であり、独創的な理想を持っていたとしても、それは大理石自らが描き出したのだ』とかいたミケランジェロの対句も独創的というわけにはいかなくなる」
It has been, or should be remarked, that, in the manner of the true gentleman, we are always aware of a difference from the bearing of the vulgar, without being at once precisely able to determine in what such difference consists.	本物の紳士と通俗なやからとではその立ち居振る舞いに違いがあると昔から言われており、至極もっともなことですし、私達もそのようなことに気が付いてはいますが、何処にその違いがあるかと問われると即、解答できないのです。
Allowing the remark to have applied in its full force to the outward demeanor of my acquaintance, I felt it, on that eventful morning, still more fully applicable to his moral temperament and character.	この言葉は私の友人の立ちい振る舞いを表しているといってもよさそうなのですが、あの事件が持ち上がった朝、この言葉は私の友人に備わっている道徳観や性格に見事に合致しているように感じたのです。
Nor can I better define that peculiarity of spirit which seemed to place him so essentially apart from all other human beings, than by calling it a _habit_ of intense and continual thought,	それに他の人間と根本的に違うと思われるあの一種独特な精神を、激しい継続する思考癖と呼ぶよりももっと上手く言い表していると思うのです。
pervading even his most trivial actions	この精神は彼の些細な動作にまで浸透し、
- intruding upon his moments of dalliance	女性と戯れている最中にも入り込み、
- and interweaving itself with his very flashes of merriment	不意に浮かれて騒ぎ出す時も紛れ込み、
- like adders which writhe from out the eyes of the grinning masks in the cornices around the temples of Persepolis.	まるで、ペルセポリスの神殿を取り巻く軒蛇腹でにやにや笑っているお面の目から身もだえしながらはいずり出てきた毒蛇のようです。
I could not help, however, repeatedly observing, through the mingled tone of levity and solemnity with which he rapidly descanted upon matters of little importance, a certain air of trepidation	彼がさほど重要ではない事柄を意気揚々とまくし立てているときの軽薄さと真剣さの入り交ざった口調から何度となく目にせざるを得なかったものは、何かに怯えているような恐怖感、
- a degree of nervous _unction_ in action and in speech - an unquiet excitability of manner which appeared to me at all times unaccountable, and upon some occasions even filled me with alarm.	動作や話の中にわざと精神を高ぶらせているような感じ、私には常に不可解にみえ、何かにつけて私を不安に落とし込めてしまうような人の感情を刺激する落ち着きのない態度なのです。
Frequently, too, pausing in the middle of a sentence whose commencement he had apparently forgotten, he seemed to be listening in the deepest attention, as if either in momentary expectation of a visiter, or to sounds which must have had existence in his imagination alone.	それに、話すことを忘れてしまったように途中で口をつぐんでしまうことも度々あり、彼の心の中だけにしか存在しない音か誰かを待ち望んでいるような、心の奥深くでじっと聞き耳をたてているような、そんな感じがするのです。
It was during one of these reveries or pauses of apparent abstraction, that, in turning over a page of the poet and scholar Politian's beautiful tragedy "The Orfeo," (the first native Italian tragedy,) which lay near me upon an ottoman,	こうして彼の意識が別の空間に遠のいていったり何かを畏怖しているようなときには、私は長椅子の上の手の届くところに置いてある詩人にして学者であったポリティアンの悲しくも美しい物語『オルフェオ』 の頁をくっていました。
I discovered a passage underlined in pencil.	その中に鉛筆で下線の引いてある箇所をみつけたのです。
It was a passage towards the end of the third act - a passage of the most heart-stirring excitement - a passage which, although tainted with impurity, no man shall read without a thrill of novel emotion - no woman without a sigh.	それは第三幕の終わり頃、心が揺さぶられるほど感動する場面、不道徳なところがあるとはいえ、男性にはいまだかって経験したことのない新たな感動を、女性は、涙と溜息なしにはおれない場面、
The whole page was blotted with fresh tears ;	その頁には新たな涙のしみが全体に広がっていて、
and, upon the opposite interleaf, were the following English lines,	反対側の頁には英語の詩が書かれてありました。
written in a hand so very different from the peculiar characters of my acquaintance, that I had some difficulty in recognising it as his own :  -	その筆跡は、私の友人の特異な性格からはおよそ想像のつかないものだったので、すぐには彼の書いた詩だとはわかりませんでした。
Thou wast that all to me, love,	恋人よ
For which my soul did pine -	我が魂の道連れなり
A green isle in the sea, love,	恋人よ
A fountain and a shrine, All wreathed with fairy fruits and flowers ; 	たわわに実る果実と花にかこまれし泉と社
And all the flowers were mine.	花はすべて我のものなり
Ah, dream too bright to last !	ああ、かくも短き麗しき夢よ
Ah, starry Hope, that didst arise But to be overcast !	星の如くにまたたく望みは雲でおおわれぬ
A voice from out the Future cries,	時の彼方より叫ぶ声あり
"Onward !  "	「すすめ！」
- but o'er the Past (Dim gulf !  ) my spirit hovering lies,	その声きけど、我は恐れおののき青ざめて、声もでず、動きもやらで
Mute - motionless - aghast !	薄暗き過去の割れ目によこたわる
For alas !	ああ、なんと！
alas !  with me	なんと悲しや
The light of life is o'er.	我が命の灯はきえぬ
"No more - no more - no more,"	「もはやこれまで、もはやこれまで、もはやこれまで」
(Such language holds the solemn sea To the sands upon the shore,)	厳かなる海に、その浜辺の砂にさえ染み渡るその言葉
Shall bloom the thunder-blasted tree,	雷にうたれて枯れた木は実をつけず
Or the stricken eagle soar !	傷ついた鷲は飛翔せず
Now all my hours are trances ;	今、陽のある時は夢幻なり
And all my nightly dreams	夜ごと見る我が夢は
Are where the dark eye glances,	君が黒き瞳の輝くところ
And where thy footstep gleams,	白く輝く君が足もと
In what ethereal dances,	イタリアの水辺にて
By what Italian streams.	君が踊るは彼の世の舞か
Alas !  for that accursed time	ああ、あの悲しき時は呪われよ
They bore thee o'er the billow,	よせくる波は君を彼方へつれさりき
From Love to titled age and crime,	我がもとから、我らの罪を包む深い霧の中から
And an unholy pillow !  - From me, and from our misty clime,	年老いて罪深き偽りの枕べへ
Where weeps the silver willow  !	涙にむせぶ銀の柳よ！
That these lines were written in English	この数行の詩は英語で、
- a language with which I had not believed their author acquainted	それも作者が知らないだろうと思っていた言語で書かれていたのですが、
- afforded me little matter for surprise.	私は別段驚きもしませんでした。
I was too well aware of the extent of his acquirements, and of the singular pleasure he took in concealing them from observation, to be astonished at any similar discovery ;	彼の知識は広範囲に及んでいること、その知識を知られないように隠すことに異常な喜びを感じる性格であることを知っていたからです。
but the place of date, I must confess, occasioned me no little amazement.	ですが、この詩の日付の横に記されてある場所、これには多少なりとも驚かされたと正直に告白しましょう。
It had been originally written _London_, and afterwards carefully overscored	始めはロンドンと書いてあった字を後で線を引いて丹念に消してあるのです。
- not, however, so effectually as to conceal the word from a scrutinizing eye.	細かいところにも目がきく私には、文字を隠したところであまり効果はありませんが。
I say, this occasioned me no little amazement ;	多少なりとも驚いたと言いましたのは、
for I well remember that,	以前、彼と二人で話したことをはっきり覚えていたからなのです。
in a former conversation with a friend, I particularly inquired if he had at any time met in London the Marchesa di Mentoni,	と言いますのは、彼にロンドンでいつかメントーニ公爵夫人に会ったことがあるのかと聞いたことがあったのです。
(who for some years previous to her marriage had resided in that city,)	（婦人は結婚する前に数年間、ロンドンに住んでいました）
when his answer, if I mistake not, gave me to understand that he had never visited the metropolis of Great Britain.	私の思い違いでなければ、その時の彼の返事は、大英帝国の首都を訪れたことは一度もないと受け取れる答えでした。
I might as well here mention, that I have more than once heard,	さて、この辺で私が一度ならず耳にしたことを話しておいたほうがよろしいでしょう。
(without, of course, giving credit to a report involving so many improbabilities,)	（あまたの胡散臭い話は横に置くとして）
