that the person of whom I speak, was not only by birth, but in education, an _Englishman_.	私が話しているこの青年は出身ばかりでなく、教育の点に関しても生粋の英国人であるということなのです。
"There is one painting,"	「もう一枚絵があるんだが」
said he, without being aware of my notice of the tragedy -	と、彼は私が今オルフェオの悲劇に関心がいっていることなどまるで気づいていない様子でこう言いました。
"there is still one painting which you have not seen."	「君がまだ見てない絵がもう一枚あるんだ」
And throwing aside a drapery, he discovered a full-length portrait of the Marchesa Aphrodite.	そういって壁の掛け布をまくり上げた下から現れたのはアフロディテ公爵夫人の等身大の肖像画だったのです。
Human art could have done no more in the delineation of her superhuman beauty.	婦人のこの世のものとは思えないほどの美しさをこれほど見事に表現したものは人の手による芸術作品のなかでも此より他にはありますまい。
The same ethereal figure which stood before me the preceding night upon the steps of the Ducal Palace, stood before me once again.	昨日の晩、デュカーレ宮殿の階段の上で私の前に立っていたのと同じ天女と見まがうほどの美しい姿。
But in the expression of the countenance, which was beaming all over with smiles, there still lurked (incomprehensible anomaly !) that fitful stain of melancholy which will ever be found inseparable from the perfection of the beautiful.	その顔は微かな笑みをたたえて神々しいばかりなのですが、完璧な美に付き物の憂鬱のかげりが潜んでいるのです。（何故かはわからない例外とでもいいましょうか）
Her right arm lay folded over her bosom.	婦人は右腕を胸の前で曲げ、
With her left she pointed downward to a curiously fashioned vase.	左腕は妙な形をした壺の方に向けられています。
One small, fairy foot, alone visible, barely touched the earth ;	片方だけ見える小さくて優雅な足は地にかろうじて付いているというふうです。
and, scarcely discernible in the brilliant atmosphere which seemed to encircle and enshrine her loveliness, floated a pair of the most delicately imagined wings.	婦人の美しさを大切に取り囲んでいる輝くばかりの背景の中に浮かんで見えるのは、想像で描かれた至極薄い一対の翼です。
My glance fell from the painting to the figure of my friend,	私は視線をこの絵から友人に移しました。
and the vigorous words of Chapman's _Bussy D'Ambois_, quivered instinctively upon my lips :	と、不意に閃いて私の唇からもれたのは、チャップマンのビュッシーダンボアの男性的な詩の一節です。
"He is up	彼は立つ
There like a Roman statue !  He will stand	ローマの彫像の如く立ち続けるのだ
Till Death hath made him marble !"	死が彼を大理石に変えるまで
"Come,"	「さあ！」
he said at length, turning towards a table of richly enamelled and massive silver,	やがて彼は豪華なエナメルを施した銀製の立派なテーブルの方に向き直りました。
upon which were a few goblets fantastically stained, together with two large Etruscan vases, fashioned in the same extraordinary model as that in the foreground of the portrait,	その上には、婦人の肖像画に描かれているのと同じ変わった形をした大きなエトルリアの壺が二つと、不思議な色をした酒杯が２〜３個置かれていました。
and filled with what I supposed to be Johannisberger.	壺のくちもとまで入っているのはおそらくヨハネスブルグ酒でしょう。
"Come,"	「さあ！」
he said, abruptly,	藪から棒に彼が言いました。
"let us drink !	「一杯どうです。
It is early - but let us drink.	飲むには時間が早いけど、でも一杯やろうよ。
It is _indeed_ early,"	ほんとに早すぎるんだけど」
he continued, musingly,	と、彼はとつとつと話続けるのです。
as a cherub with a heavy golden hammer made the apartment ring with the first hour after sunrise :	そのとき、重い黄金の槌を持った天使ケルビムが日の出後第一番目の時を知らせる鐘をうち鳴らしました。
"It is _indeed_ early	「まったくもって早すぎるけど、
- but what matters it ?	まあ、そんなことはどうでもいい、
let us drink !	とにかく一杯飲もうよ。
Let us pour out an offering to yon solemn sun which these gaudy lamps and censers are so eager to subdue !"	この部屋でぎらついているランプや香炉が太陽の光を必死で征服しようとしてるよ。
And, having made me pledge him in a bumper, he swallowed in rapid succession several goblets of the wine.	そうして彼は私の杯に並々と酒をついで乾杯させるや、葡萄酒を５〜６杯、たて続けに飲み干したのです。
"To dream,"	「夢見ることは」
he continued, resuming the tone of his desultory conversation, as he held up to the rich light of a censer one of the magnificent vases -	彼は見事な壺をひとつ、明るく輝く香炉のほうへ掲げて、とりとめのない話をまた続けていきます。
"to dream has been the business of my life.	「夢見ることは、僕の生涯の仕事だったんだ。
I have therefore framed for myself, as you see, a bower of dreams.	だから、自分の為にこの夢の個室を作ったんだ。
In the heart of Venice could I have erected a better ?	ベニスの真ん中にこの部屋以上のものを作れるかい？
You behold around you, it is true, a medley of architectural embellishments.	部屋を見回せば、確かに建築用の装飾品を羅列してあるだけにしかみえないけどね。
The chastity of Ionia is offended by antediluvian devices, and the sphynxes of Egypt are outstretched upon carpets of gold.	イオニア風の素朴さが大昔の図柄で台無しになってるし、エジプトのスフィンクスが黄金の絨毯の上でのうのうと寝そべっているといったところかな。
Yet the effect is incongruous to the timid alone.	これが不調和に映るのはその人間が臆病だからだ。
Proprieties of place, and especially of time, are the bugbears which terrify mankind from the contemplation of the magnificent.	場所柄にふさわしいかとか特に時代にかなってるかとか、そんなことが気になって荘厳なものがわからなくなってしまうんだ。
Once I was myself a decorist ;	そういう僕も昔は端正さを好んだものさ。
but that sublimation of folly has palled upon my soul.	でも、あんな愚劣極まりないものを、さも高尚なものとして扱うなんて僕はもううんざりなんだ。
All this is now the fitter for my purpose.	ここにあるものはみんな、僕の思いにぴったりのものばかりさ。
Like these arabesque censers, my spirit is writhing in fire,	この部屋にあるアラビア風のつり香炉みたいに、僕の魂は火の中でのたうちまわっているのさ。
and the delirium of this scene is fashioning me for the wilder visions of that land of real dreams whither I am now rapidly departing."	精神錯乱をおこしそうなこの部屋の雰囲気が、僕がこれから旅立とうとしている本当の夢の世界、狂気じみた理想の世界にふさわしい人間にしてくれるはずだ」
He here paused abruptly, bent his head to his bosom, and seemed to listen to a sound which I could not hear.	というと、こうべ頭をたれて、私には聞こえないある音に耳をかたむけているようなです。
At length, erecting his frame, he looked upwards, and ejaculated the lines of the Bishop of Chichester :	やがて姿勢をもどすと、上を見上げて、チチェスターの司教の詩を口ずさみました。
_"Stay for me there !  I will not fail_	この地にて我を待たなむ！
_To meet thee in that hollow vale."_	空ろなるこの狭間にて、我、必ずや君とあい見む
In the next instant, confessing the power of the wine, he threw himself at full-length upon an ottoman.	それからすぐに彼は酒に酔ったようだと言うと、長椅子の上に長々と身を投げ出してしまいました。
A quick step was now heard upon the staircase,	と、階段を駆け上がってくるあわただしい足音。
and a loud knock at the door rapidly succeeded.	そして次にはこの部屋の扉をたてつずけにがんがん叩くのです。
I was hastening to anticipate a second disturbance, when a page of Mentoni's household burst into the room,	一瞬、今度は何だと思ったとたん、メントーニ邸の使いの者が部屋に飛び込んできました。
and faltered out, in a voice choking with emotion, the incoherent words,	足もとはふらふらで、息が切れて、気が動転しているのか、言葉もしどろもどろで、
"My mistress !  - my mistress !  - Poisoned !  - poisoned ! Oh, beautiful - oh, beautiful Aphrodite !"	「奥様が、奥様が、毒を、毒を飲まれて、ああ、美しいアフロディテ様が！」
Bewildered, I flew to the ottoman, and endeavored to arouse the sleeper to a sense of the startling intelligence.	私はうろたえてしまい、この恐ろしい出来事を知らせなくてはと長椅子にかけより眠っている彼を起こそうとしたのです。
But his limbs were rigid	でも彼の四肢は硬直し
- his lips were livid	唇は鉛色になっているではありませんか。
- his lately beaming eyes were riveted in _death_.	今しがたまで輝いていた眼は死に捕らえられてしまったのです。
I staggered back towards the table	私はよろけるようにテーブルの方に後ずさりし、
- my hand fell upon a cracked and blackened goblet	そのとき、割れて黒ずんだ酒杯に手がふれたのです。
- and a consciousness of the entire and terrible truth flashed suddenly over my soul.	その途端、私の脳裏に閃いたのは恐ろしい真実の全貌だったのです。
