which might aid us in clearing it up.''	それを聞けば、事件を整理するのに役立つと思うよ」
``I think there will be no difficulty in clearing it up,''	「事件の整理は、何ら支障もなく行えると考えますが」
said Lestrade, grimly.	とレストレイドは苦々しげに言った。
``None the less, with your permission, I should be much interested to hear his account.''	「それでもやはりね、もし君さえよければ、この方の説明を聞いてみたいんだよ」
``Well, Mr. Holmes, it is difficult for me to refuse you anything,	「ま、ミスター・ホームズ、あなたの申し出を拒絶するわけにはいきませんね。
for you have been of use to the force once or twice in the past, and we owe you a good turn at Scotland Yard,''	以前も若干警察の役に立ってくださったことですし、我々スコットランドヤードも大きな借りを作っていますから」
said Lestrade.	とレストレイド。
``At the same time I must remain with my prisoner	「ただし、私も容疑者と一緒に残らねばなりません。
and I am bound to warn him that anything he may say will appear in evidence against him.''	職務上、警告しておきますが、容疑者の発言は、容疑に対する証拠として扱われるでしょう」
``I wish nothing better,''	「それでかまいません」
said our client.	と依頼人は言った。
``All I ask is that you should hear and recognize the absolute truth.''	「ただ、真実に耳を傾け、真実を認識していただきたいだけです」
Lestrade looked at his watch.	レストレイドは自分の時計に目をやった。
``I'll give you half an hour,'' said he.	「30分、譲りましょう」
``I must explain first,'' said McFarlane,	「まず最初にお断りしますが、
``that I knew nothing of Mr. Jonas Oldacre.	私はミスター・ジョナス・オールデイカーをまったく知りませんでした。
His name was familiar to me, for many years ago my parents were acquainted with him, but they drifted apart.	何年も昔、両親の知人だったということで名前は聞いていましたが、今はもう両親とのつきあいもありません。
I was very much surprised, therefore, when yesterday, about three o'clock in the afternoon, he walked into my office in the city.	ですから、昨日の午後3時ごろ、ミスター・オールデイカーが事務所にきたときには驚きました。
But I was still more astonished when he told me the object of his visit.	訪問の理由を伺うと、さらに驚かされました。
He had in his hand several sheets of a notebook, covered with scribbled writing -- here they are -- and he laid them on my table.	あの方は、数枚の走り書きを――これです――テーブルに出しました。
```Here is my will,'	「『これは、私の遺言書です』
said he.	とあの方は言います。
`I want you, Mr. McFarlane, to cast it into proper legal shape.	『ミスター・マクファーレン、これを法的な形式に整えて欲しい。
I will sit here while you do so.'	作業中、ここに座って待ちますから』
``I set myself to copy it,	「私はさっそく写本を作ることにしました。
and you can imagine my astonishment when I found that, with some reservations, he had left all his property to me.	ところが読んでみると、条件つきで、その財産すべてを、私に遺すというのです。
He was a strange little ferret-like man, with white eyelashes,	ミスター・オールデイカーは体の小さい風変わりな人物で、白い睫毛をしたフェレットのようでした。
and when I looked up at him I found his keen gray eyes fixed upon me with an amused expression.	目を上げると、鋭い灰色の瞳が私のほうを楽しそうに見つめています。
I could hardly believe my own senses as I read the terms of the will,	遺言書の内容を読んでも、私には自分の感覚を信じられませんでした。
but he explained that he was a bachelor with hardly any living relation,	説明によると、あの方は独身であり、親類もほとんど死んでしまった。
that he had known my parents in his youth,	私の両親とは若い頃の知り合いだった。
and that he had always heard of me as a very deserving young man,	常々、私がとても立派な若者であると聞いている。
and was assured that his money would be in worthy hands.	そして、自分の財産を価値のある人間の手に収めてもらいたいのだ、と。
Of course, I could only stammer out my thanks.	当然、私には感謝の言葉をどもりながら繰り返すことしかできませんでした。
The will was duly finished, signed, and witnessed by my clerk.	仕上がった遺言書に、署名と、事務員による連署が行われました。
This is it on the blue paper, and these slips, as I have explained, are the rough draft.	この青い書類がそうです、それからこちらが、ご説明したとおり、下書きです。
Mr. Jonas Oldacre then informed me that there were a number of documents -- building leases, title-deeds, mortgages, scrip, and so forth -- which it was necessary that I should see and understand.	ミスター・ジョナス・オールデイカーは、建物の賃貸契約書や、権利証書や、抵当証書や、仮証書類などといった書類が山ほどあるので、一度目を通して理解しておいて欲しいと言いました。
He said that his mind would not be easy until the whole thing was settled, and he begged me to come out to his house at Norwood that night, bringing the will with me, and to arrange matters.	一切が落ちつくまで安心できないそうで、その夜に、遺言書をもって、ノーウッドの家に足を運び、問題をまとめようと頼まれました。
`Remember, my boy, not one word to your parents about the affair	『そうそう、きみ、ご両親には一言も漏らさないように。
until everything is settled.	何もかもが落ちつくまでね。
We will keep it as a little surprise for them.'	ちょっと驚かせてやれるようにな』
He was very insistent upon this point, and made me promise it faithfully.	あの方はこの点を強く言い張り、私に堅く約束させました。
``You can imagine, Mr. Holmes, that I was not in a humour to refuse him anything that he might ask.	「想像できるでしょう、ミスター・ホームズ、あの方が求めることを拒否できるような気分ではなかったのです。
He was my benefactor,	恩人です。
and all my desire was to carry out his wishes in every particular.	私はただ、あの方の希望にあらゆる点でお応えしたかったのです。
I sent a telegram home, therefore, to say that I had important business on hand, and that it was impossible for me to say how late I might be.	ですから私は、重要な仕事ができたのでどれくらい遅くなるか分からないと、家に電報を打ちました。
Mr. Oldacre had told me that he would like me to have supper with him at nine, as he might not be home before that hour.	ミスター・オールデイカーは9時に家で一緒に夕食をとりたいが、その時間まで家にはいないと言いました。
I had some difficulty in finding his house, however, and it was nearly half-past before I reached it.	もっとも、あの方の家を見つけるのにちょっとてこずりまして、30分ほど遅刻しました。
I found him -- ''	あの方が――」
``One moment!''	「待ってください！」
said Holmes.	とホームズ。
``Who opened the door?''	「誰がドアを開けましたか？」
``A middle-aged woman,	「中年の女性が。
who was, I suppose, his housekeeper.''	たぶん、家政婦なんだと思います」
``And it was she, I presume, who mentioned your name?''	「推測ですが、その女性から、あなたのお名前を口にしましたね？」
``Exactly,''	「そのとおりです」
said McFarlane.	とマクファーレン。
``Pray proceed.''	「続きをどうぞ」
McFarlane wiped his damp brow, and then continued his narrative:	マクファーレンは額ににじんだ汗をぬぐうと、話を続けた――
``I was shown by this woman into a sitting-room,	「その女性は、私を居間にとおしました。
where a frugal supper was laid out.	質素な夕食が準備されています。
Afterwards, Mr. Jonas Oldacre led me into his bedroom, in which there stood a heavy safe.	食後、ミスター・ジョナス・オールデイカーについて寝室に入ったところ、室内には大きな金庫が置いてありました。
This he opened and took out a mass of documents, which we went over together.	あの方が金庫を開いて大量の書類を取り出しましたので、2人で調べ始めました。
It was between eleven and twelve when we finished.	終わったのは11時台だったと思います。
He remarked that we must not disturb the housekeeper.	家政婦の手は煩わせられないということで、
He showed me out through his own French window,	フランス窓から帰るように指示しました。
which had been open all this time.''	窓はずっと開けられていました」
``Was the blind down?''	「ブラインドは降りていましたか？」
asked Holmes.	とホームズが聞いた。
``I will not be sure, but I believe that it was only half down.	「自信はありませんが、半分だけ降ろしてあったような気がします。
Yes,	いや、間違いありません。
I remember how he pulled it up in order to swing open the window.	あの方が窓を押し開こうと、ブラインドを引き上げているところを思い出しました。
I could not find my stick, and he said,	ステッキが見つかりませんでしたが、
`Never mind, my boy,	『気にすることはないよ、きみ。
I shall see a good deal of you now, I hope, and I will keep your stick until you come back to claim it.'	きっと、また何度も会うことになるだろうから、今度会うときまで預かっておくさ』
I left him there,	私は帰りました。
the safe open, and the papers made up in packets upon the table.	そのとき、金庫は開けっ放しで、書類はまとめてテーブルの上に置いてありました。
It was so late that I could not get back to Blackheath, so I spent the night at the Anerley Arms,	ブラックヒースに帰れる時刻ではありませんでしたから、アナリー・アームズで一泊しました。
and I knew nothing more until I read of this horrible affair in the morning.''	今朝の恐ろしい事件のことは、朝刊を読むまで何も知りませんでした」
``Anything more that you would like to ask, Mr. Holmes?''	レストレイドは、この注目すべき解説を聞きながら、2、3度、眉を釣りあげたが、ここでようやく口を開いた。
said Lestrade, whose eyebrows had gone up once or twice during this remarkable explanation.	「他に何か聞いておきたいことはありますか、ミスター・ホームズ？」
``Not until I have been to Blackheath.''	「ブラックヒースに行ってみるまでは何とも」
``You mean to Norwood,''	「ノーウッドじゃないですか」
said Lestrade.	とレストレイド。
``Oh, yes,	「ああ、そうか。
no doubt that is what I must have meant,''	確かにそれですよ」
said Holmes, with his enigmatical smile.	とホームズが謎めいた微笑を浮かべて言った。
Lestrade had learned by more experiences than he would care to acknowledge that that razor-like brain could cut through that	ホームズの剃刀のような頭脳は、レストレイドの理解の及ばないところまで、事実を鋭く切り取ることができる。
which was impenetrable to him.	レストレイドはそれを、口で言う以上に、経験から学んでいた。
I saw him look curiously at my companion.	レストレイドはホームズを興味深げに眺めた。
``I think I should like to have a word with you presently, Mr. Sherlock Holmes,''	「少しお話を伺っておくほうがよさそうですね、ミスター・シャーロック・ホームズ」
said he.	とレストレイド。
``Now, Mr. McFarlane, two of my constables are at the door, and there is a four-wheeler waiting.''	「さて、ミスター・マクファーレン、戸口に警官を2人、外に四輪を待たせてある」
The wretched young man arose, and with a last beseeching glance at us walked from the room.	哀れな若者は立ちあがり、嘆願するような視線を我々に向けると、部屋から出ていった。
The officers conducted him to the cab, but Lestrade remained.	警官はマクファーレンをつれて馬車に乗りこんだが、レストレイドは後に残った。
Holmes had picked up the pages which formed the rough draft of the will, and was looking at them with the keenest interest upon his face.	ホームズは、摘み上げた遺書の下書きを、熱心な興味に満ちた顔で見つめた。
``There are some points about that document, Lestrade,	「なかなか特徴のある文書だね、レストレイド。
are there not?''	どうだ？」
The official looked at them with a puzzled expression.	レストレイドは当惑した表情で書類を眺めた。
``I can read the first few lines,	「最初の数行は読めますね。
and these in the middle of the second page, and one or two at the end.	それに、2枚目の真中あたりと、最後の2、3行も。
Those are as clear as print,''	印刷のようにはっきりと。
``but the writing in between is very bad,	が、しかし、その間の筆跡はかなりひどいな。
and there are three places where I cannot read it at all.''	まったく読めない部分も3ヶ所」
``What do you make of that?'' said Holmes.	「そこから何を想像する？」
``Well, what do you make of it?''	「ふむ、そちらこそ何を？」
``That it was written in a train.	「列車の中で書かれたということさ。
The good writing represents stations, the bad writing movement, and the very bad writing passing over points.	きれいな筆跡は駅を、ひどい筆跡は進行中を、さらにひどい筆跡は転轍機の通過を表しているんだよ。
A scientific expert would pronounce at once that this was drawn up on a suburban line,	科学的専門家なら、この文書は郊外線で書かれたものだと断言するだろう。
since nowhere save in the immediate vicinity of a great city could there be so quick a succession of points.	大都市の周辺部以外に、これほど連続して転轍機が存在しているところはない。
Granting that his whole journey was occupied in drawing up the will,	この推理から、ミスター・オールデイカーは列車の旅の間中、遺言書を書きつづけたのだと思われる。
then the train was an express,	乗っていたのは急行だね。
only stopping once between Norwood and London Bridge.''	ノーウッド―ロンドンブリッジ間で一度しか停車していない」
Lestrade began to laugh.	レストレイドは笑い出した。
``You are too many for me when you begin to get on your theories.	「持論を進めだすとまったく手におえませんね、
Mr. Holmes,''	ミスター・ホームズ」
said he.	とレストレイド。
``How does this bear on the case?''	「それがこの事件にどう影響してくるんですか？」
``Well, it corroborates the young man's story	「そうだな、例の若者の話を補強してくれるね。
to the extent that the will was drawn up by Jonas Oldacre in his journey yesterday.	遺言書がジョナス・オールデイカーによって、昨日、道すがらに書かれたものだというところまで。
It is curious	好奇心をそそられるよ
-- is it not?	――そうだろう？
-- that a man should draw up so important a document in so haphazard a fashion.	――そういう大切な文書を、こんなでたらめな方法で書き上げるとはね。
It suggests that he did not think it was going to be of much practical importance.	どうやら、こいつが実際にたいへん重要なものになるなんて思っていなかったらしい。
If a man drew up a will which he did not intend ever to be effective, he might do it so.''	もし、発効させるつもりがない遺言書を書くんであれば、こんな真似をするかもしれないね」
``Well, he drew up his own death warrant at the same time,''	「まあ、この遺言書と一緒に、自分の死刑執行書を書いたということですよ」
said Lestrade.	とレストレイド。
``Oh, you think so?''	「ほう、君はそう思うかい？」
``Don't you?''	「そうでしょう？」
``Well, it is quite possible,	「なるほど、その可能性は高い。
but the case is not clear to me yet.''	だけどね、僕には事件がまだ明白じゃないんだ」
``Not clear?	「明白じゃない？
Well, if that isn't clear, what could be clear?	だいたい、これが明白でないとすると、いったい何をして明白というのです？
Here is a young man	ここに1人の男がいる。
who learns suddenly that, if a certain older man dies, he will succeed to a fortune.	ある老人が死ねば一財産を相続できるという情報が舞いこんできた。
What does he do?	彼はどうしますか？
He says nothing to anyone,	彼はそのことを誰にも言わない。
but he arranges	代わりに、こう企てるんですよ。
that he shall go out on some pretext to see his client that night.	夜、その老人に会うために出かける。
He waits until the only other person in the house is in bed, and then in the solitude of a man's room he murders him,	家の中にいるもう1人の人物が眠りにつくまで待ち、部屋で老人を殺害する。
burns his body in the wood-pile,	遺体は木材置場で焼き払う。
and departs to a neighbouring hotel.	そして、現場を去り、近くのホテルに泊まる。
The blood-stains in the room and also on the stick are very slight.	部屋の中や、ステッキについた血痕はごくわずか。
It is probable that he imagined his crime to be a bloodless one,	被害者に外傷を残さなかったと思っていたのかもしれない。
and hoped that if the body were consumed it would hide all traces of the method of his death	死体が痛んでしまえば、死因を判定する痕跡も見つからないだろう
-- traces which, for some reason, must have pointed to him.	――何らかの理由で彼が犯人だと指し示す痕跡をね。
Is not all this obvious?''	みんな、明らかなことでしょう？」
``It strikes me, my good Lestrade, as being just a trifle too obvious,''	「胸を打たれるよ、レストレイドくん、あまりにも明らかすぎる些事として」
said Holmes.	とホームズ。
``You do not add imagination to your other great qualities, but if you could for one moment put yourself in the place of this young man,	「君は自分のすばらしい特性の中に、想像力を付け加えようとしないけどね、少しの間、この若者の立場に身を重ねてみるんだ。
would you choose the very night after the will had been made to commit your crime?	君は、問題の遺言書が書かれたその日の夜をだよ、犯行の日時として選ぶのかい？
Would it not seem dangerous to you to make so very close a relation between the two incidents?	この2つの出来事を、そんなに連続して起こすことに危険を感じないのかい？
Again,	まだある。
would you choose an occasion when you are known to be in the house, when a servant has let you in?	君が家の中にいることを誰かに知られているとき、使用人が君を迎え入れたとき、そんなときをチャンスと考えるのかい？
And, finally, would you take the great pains to conceal the body, and yet leave your own stick as a sign that you were the criminal?	おまけに、死体の始末にかなり骨を折っておきながら、自分のステッキを証拠として残していくのかい？
Confess, Lestrade, that all this is very unlikely.''	白状するんだね、レストレイド、どれもまったくありえそうにないって」
``As to the stick, Mr. Holmes, you know as well as I do that a criminal is often flurried, and does such things, which a cool man would avoid.	「ステッキについて言えば、ミスター・ホームズ、ご承知のとおり、犯罪者はときに混乱のあまり、冷静な人間ならやらないようなことをやってしまうものですよ。
He was very likely afraid to go back to the room.	容疑者は部屋に戻るのが怖かったんです。
Give me another theory that would fit the facts.''	他に事実とぴったり合う理論があるのなら、ぜひどうぞ」
``I could very easily give you half a dozen,''	「簡単に半ダースは並べられるよ」
said Holmes.	とホームズ。
``Here, for example, is a very possible	「たとえばさ、こういう話だって可能性がある。
and even probable one.	いや、十分に可能だね。
I make you a free present of it.	無償のプレゼントにしておくよ。
The older man is showing documents which are of evident value.	老人が、見るからに値打ちものと分かる書類を広げている。
A passing tramp sees them through the window,	通りすがりの浮浪者が窓からそれを見る。
the blind of which is only half down.	ブラインドは半分しか降りていない。
Exit the solicitor.	弁護士退出。
Enter the tramp!	浮浪者侵入！
He seizes a stick, which he observes there, kills Oldacre,	そして、目についたステッキを握りしめ、オールデイカーを殺害。
and departs after burning the body.''	死体を焼いて立ち去る」
``Why should the tramp burn the body?''	「なぜ浮浪者は死体を焼かねばならないんですか？」
``For the matter of that, why should McFarlane?''	「その点、マクファーレンはなぜ？」
``To hide some evidence.''	「証拠隠滅のため」
``Possibly the tramp wanted to hide that any murder at all had been committed.''	「浮浪者も殺人の痕跡をすべて隠滅したかったんだろうさ」
``And why did the tramp take nothing?''	「それに、浮浪者はなぜ何もとっていかなかったんですか？」
``Because they were papers that he could not negotiate.''	「なぜなら彼には換金できない書類だったから」
Lestrade shook his head,	レストレイドは首を横に振った。
though it seemed to me that his manner was less absolutely assured than before.	さっきまでの絶対的な自信はややゆらいだようではあったが。
``Well, Mr. Sherlock Holmes, you may look for your tramp,	「それじゃあ、ミスター・シャーロック・ホームズ、浮浪者とやらを探してみるんですね。
and while you are finding him we will hold on to our man.	その間に、我々はあの男の線で調べつづけますから。
The future will show which is right.	時がくればどっちが正しいか判明するでしょう。
Just notice this point, Mr. Holmes:	この点は言っておきますよ、ミスター・ホームズ。
that so far as we know, none of the papers were removed,	我々の知るかぎり、書類は1枚も持ち出されていません。
and that the prisoner is the one man in the world who had no reason for removing them,	そして、容疑者は世界でただひとり、書類を持ち出す必要がない人物です。
since he was heir-at-law, and would come into them in any case.''	彼は法定相続人であり、いかなる場合もすべてを手にするんですから」
My friend seemed struck by this remark.	この言葉はこたえたらしい。
``I don't mean to deny that the evidence is in some ways very strongly in favour of your theory,'' said he.	「いや、その証拠がそれなりに君の考えに味方するってことを否定するつもりはないんだ。
``I only wish to point out that there are other theories possible.	ただ、別の考え方もありえるんじゃないかと言っておきたかっだだけでね。
As you say, the future will decide.	君の言うとおり、時が判定を下してくれるだろう。
Good-morning!	ごきげんよう！
I dare say that in the course of the day I shall drop in at Norwood and see how you are getting on.''	とりあえず、今日中にノーウッドによって、捜査がどれくらい進んだかを見にいくよ」
When the detective departed, my friend rose and made his preparations for the day's work	レストレイドが出ていくと、ホームズは立ち上がり、今日の活動のための準備をした。
with the alert air of a man who has a congenial task before him.	好みの仕事を目前にした人間に見られる、きびきびした様子で。
``My first movement, Watson,''	「捜査の初動は」
said he, as he bustled into his frockcoat,	と、フロックコートをすばやく身につけながら言った。
``must, as I said, be in the direction of Blackheath.''	「言ったとおり、ブラックヒース方面だよ、ワトスン」
``And why not Norwood?''	「なぜノーウッドじゃないんだい？」
