Of my own thoughts it is folly to speak.	私自身の気持は語るも愚かである。
Swooning, I staggered to the opposite wall.	気が遠くなって、私は反対の側の壁へとよろめいた。
For one instant the party upon the stairs remained motionless, through extremity of terror and of awe.	一瞬間、階段の上にいた一行は、極度の恐怖と畏懼（いく）とのために、じっと立ち止った。
In the next, a dozen stout arms were toiling at the wall.	次の瞬間には、幾本かの逞（たくま）しい腕が壁をせっせとくずしていた。
It fell bodily.	壁はそっくり落ちた。
The corpse, already greatly decayed and clotted with gore, stood erect before the eyes of the spectators.	もうひどく腐爛（ふらん）して血魂が固まりついている死骸が、そこにいた人々の眼前にすっくと立った。
Upon its head, with red extended mouth and solitary eye of fire, sat the hideous beast whose craft had seduced me into murder,	その頭の上に、赤い口を大きくあけ、爛々たる片眼（かため）を光らせて、あのいまわしい獣が坐（すわ）っていた。
and whose informing voice had consigned me to the hangman.	そいつの奸策（かんさく）が私をおびきこんで人殺しをさせ、そいつのたてた声が私を絞刑吏に引渡したのだ。
I had walled the monster up within the tomb!	その怪物を私はその墓のなかへ塗りこめておいたのだった！
