but this person made no claim to it - knew nothing of it - had never seen it before.	が主人はその猫を自分のものだとは言わず、――ちっとも知らないし――いままでに見たこともないと言うのだった。
I continued my caresses, and, when I prepared to go home, the animal evinced a disposition to accompany me.	私は愛撫をつづけていたが、家へ帰りかけようとすると、その動物はついて来たいような様子を見せた。
I permitted it to do so;	で、ついて来るままにさせ、
occasionally stooping and patting it as I proceeded.	歩いて行く途中でおりおりかがんで軽く手で叩（たた）いてやった。
When it reached the house it domesticated itself at once, and became immediately a great favorite with my wife.	家へ着くと、すぐに居ついてしまい、すぐ妻の非常なお気に入りになった。
For my own part, I soon found a dislike to it arising within me.	私はというと、間もなくその猫に対する嫌悪の情が心のなかに湧（わ）き起るのに気がついた。
This was just the reverse of what I had anticipated;	これは自分の予想していたこととは正反対であった。
but - I know not how or why it was - its evident fondness for myself rather disgusted and annoyed.	しかし――どうしてだか、またなぜだかは知らないが――猫がはっきり私を好いていることが私をかえって厭（いや）がらせ、うるさがらせた。
By slow degrees, these feelings of disgust and annoyance rose into the bitterness of hatred.	だんだんに、この厭でうるさいという感情が嵩（こう）じてはげしい憎しみになっていった。
I avoided the creature;	私はその動物を避けた。
a certain sense of shame, and the remembrance of my former deed of cruelty, preventing me from physically abusing it.	ある慚愧（ざんき）の念と、以前の残酷な行為の記憶とが、私にそれを肉体的に虐待しないようにさせたのだ。
I did not, for some weeks, strike, or otherwise violently ill use it;	数週の間、私は打つとか、その他手荒なことはしなかった。
but gradually - very gradually - I came to look upon it with unutterable loathing, and to flee silently from its odious presence, as from the breath of a pestilence.	がしだいしだいに――ごくゆっくりと――言いようのない嫌悪の情をもってその猫を見るようになり、悪疫（あくえき）の息吹（いぶき）から逃げるように、その忌（い）むべき存在から無言のままで逃げ出すようになった。
What added, no doubt, to my hatred of the beast, was the discovery, on the morning after I brought it home, that, like Pluto, it also had been deprived of one of its eyes.	疑いもなく、その動物に対する私の憎しみを増したのは、それを家へ連れてきた翌朝、それにもプルートォのように片眼がないということを発見したことであった。
This circumstance, however, only endeared it to my wife,	けれども、この事がらのためにそれはますます妻にかわいがられるだけであった。
who, as I have already said, possessed, in a high degree, that humanity of feeling which had once been my distinguishing trait, and the source of many of my simplest and purest pleasures.	妻は、以前は私のりっぱな特徴であり、また多くのもっとも単純な、もっとも純粋な快楽の源であったあの慈悲ぶかい気持を、前にも言ったように、多分に持っていたのだ。
With my aversion to this cat, however, its partiality for myself seemed to increase.	しかし、私がこの猫を嫌えば嫌うほど、猫のほうはいよいよ私を好くようになってくるようだった。
It followed my footsteps with a pertinacity which it would be difficult to make the reader comprehend.	私のあとをつけまわり、そのしつこさは読者に理解してもらうのが困難なくらいであった。
Whenever I sat, it would crouch beneath my chair, or spring upon my knees, covering me with its loathsome caresses.	私が腰かけているときにはいつでも、椅子（いす）の下にうずくまったり、あるいは膝（ひざ）の上へ上がって、しきりにどこへでもいまいましくじゃれついたりした。
If I arose to walk it would get between my feet and thus nearly throw me down, or, fastening its long and sharp claws in my dress, clamber, in this manner, to my breast.	立ち上がって歩こうとすると、両足のあいだへ入って、私を倒しそうにしたり、あるいはその長い鋭い爪（つめ）を私の着物にひっかけて、胸のところまでよじ登ったりする。
At such times, although I longed to destroy it with a blow, I was yet withheld from so doing, partly by a memory of my former crime, but chiefly - let me confess it at once - by absolute dread of the beast.	そんなときには、殴り殺してしまいたかったけれども、そうすることを差し控えたのは、いくらか自分の以前の罪悪を思い出すためであったが、主としては――あっさり白状してしまえば――その動物がほんとうに怖かった［＃「怖かった」に傍点］ためであった。
This dread was not exactly a dread of physical evil - and yet I should be at a loss how otherwise to define it.	この怖さは肉体的災害の怖さとは少し違っていた、――が、それでもそのほかにそれをなんと説明してよいか私にはわからない。
I am almost ashamed to own - yes, even in this felon's cell, I am almost ashamed to own - that the terror and horror with which the animal inspired me, had been heightened by one of the merest chimaeras it would be possible to conceive.	私は告白するのが恥ずかしいくらいだが――そうだ、この重罪人の監房のなかにあってさえも、告白するのが恥ずかしいくらいだが――その動物が私の心に起させた恐怖の念は、実にくだらない一つの妄想（もうそう）のために強められていたのであった。
My wife had called my attention, more than once, to the character of the mark of white hair, of which I have spoken, and which constituted the sole visible difference between the strange beast and the one I had destroyed.	その猫と前に殺した猫との唯一（ゆいいつ）の眼に見える違いといえば、さっき話したあの白い毛の斑点なのだが、妻はその斑点のことで何度か私に注意していた。
The reader will remember that this mark, although large, had been originally very indefinite;	この斑点は、大きくはあったが、もとはたいへんぼんやりした形であったということを、読者は記憶せられるであろう。
but, by slow degrees - degrees nearly imperceptible, and which for a long time my Reason struggled to reject as fanciful - it had, at length, assumed a rigorous distinctness of outline.	ところが、だんだんに――ほとんど眼につかないほどにゆっくりと、そして、長いあいだ私の理性はそれを気の迷いだとして否定しようとあせっていたのだが――それが、とうとう、まったくきっぱりした輪郭となった。
It was now the representation of an object that I shudder to name	それはいまや私が名を言うも身ぶるいするような物の格好になった。
- and for this, above all, I loathed, and dreaded, and would have rid myself of the monster _had I dared_ - it was now, I say, the image of a hideous - of a ghastly thing - of the GALLOWS !	――そして、とりわけこのために、私はその怪物を嫌い、恐れ、できるなら思いきって［＃「できるなら思いきって」に傍点］やっつけてしまいたいと思ったのであるが、――それはいまや、恐ろしい――もの凄（すご）い物の――絞首台［＃「絞首台」に傍点］の――形になったのだ！
- oh, mournful and terrible engine of Horror and of Crime - of Agony and of Death !	――おお、恐怖と罪悪との――苦悶（くもん）と死との痛ましい恐ろしい刑具の形になったのだ！
And now was I indeed wretched beyond the wretchedness of mere Humanity.	そしていまこそ私は実に単なる人間の惨（みじ）めさ以上に惨めであった。
And _a brute beast _- whose fellow I had contemptuously destroyed	一匹の畜生が［＃「一匹の畜生が」に傍点］――その仲間の奴（やつ）を私は傲然（ごうぜん）と殺してやったのだ
- _a brute beast_ to work out for _me_ - for me a man, fashioned in the image of the High God - so much of insufferable wo!	――一匹の畜生が私に［＃「一匹の畜生が私に」に傍点］――いと高き神の像（かたち）に象（かたど）って造られた人間である私に――かくも多くの堪えがたい苦痛を与えるとは！
Alas!	ああ！
neither by day nor by night knew I the blessing of Rest any more!	昼も夜も私はもう安息の恩恵というものを知らなくなった！
During the former the creature left me no moment alone;	昼間はかの動物がちょっとも私を一人にしておかなかった。
and, in the latter, I started, hourly, from dreams of unutterable fear, to find the hot breath of _the thing_ upon my face, and its vast weight- an incarnate Night-Mare that I had no power to shake off - incumbent eternally upon my _heart !_	夜には、私は言いようもなく恐ろしい夢から毎時間ぎょっとして目覚めると、そいつ［＃「そいつ」に傍点］の熱い息が自分の顔にかかり、そのどっしりした重さが――私には払い落す力のない悪魔の化身が――いつもいつも私の心臓［＃「心臓」に傍点］の上に圧（お）しかかっているのだった！
Beneath the pressure of torments such as these, the feeble remnant of the good within me succumbed.	こういった呵責（かしゃく）に押しつけられて、私のうちに少しばかり残っていた善も敗北してしまった。
Evil thoughts became my sole intimates - the darkest and most evil of thoughts.	邪悪な考えが私の唯一の友となった、――もっとも暗黒な、もっとも邪悪な考えが。
The moodiness of my usual temper increased to hatred of all things and of all mankind;	私のいつもの気むずかしい気質はますますつのって、あらゆる物やあらゆる人を憎むようになった。
while, from the sudden, frequent, and ungovernable outbursts of a fury to which I now blindly abandoned myself, my uncomplaining wife, alas! was the most usual and the most patient of sufferers.	そして、いまでは幾度もとつぜんに起るおさえられぬ激怒の発作に盲目的に身をまかせたのだが、なんの苦情も言わない私の妻は、ああ！それを誰よりもいつもひどく受けながら、辛抱づよく我慢したのだった。
One day she accompanied me, upon some household errand, into the cellar of the old building which our poverty compelled us to inhabit.	ある日、妻はなにかの家の用事で、貧乏のために私たちが仕方なく住んでいた古い穴蔵のなかへ、私と一緒に降りてきた。
The cat followed me down the steep stairs, and, nearly throwing me headlong, exasperated me to madness.	猫もその急な階段を私のあとへついて降りてきたが、もう少しのことで私を真っ逆さまに突き落そうとしたので、私はかっと激怒した。
Uplifting an axe, and forgetting, in my wrath, the childish dread which had hitherto stayed my hand, I aimed a blow at the animal which,	怒りのあまり、これまで自分の手を止めていたあの子供らしい怖さも忘れて、斧（おの）を振り上げ、その動物をめがけて一撃に打ち下ろそうとした。
of course, would have proved instantly fatal had it descended as I wished.	それを自分の思ったとおりに打ち下ろしたなら、もちろん、猫は即座に死んでしまったろう。
But this blow was arrested by the hand of my wife.	が、その一撃は妻の手でさえぎられた。
Goaded, by the interference, into a rage more than demoniacal, I withdrew my arm from her grasp and buried the axe in her brain.	この邪魔立てに悪鬼以上の憤怒に駆られて、私は妻につかまれている腕をひき放し、斧を彼女の脳天に打ちこんだ。
She fell dead upon the spot, without a groan.	彼女は呻（うめ）き声もたてずに、その場で倒れて死んでしまった。
This hideous murder accomplished, I set myself forthwith, and with entire deliberation, to the task of concealing the body.	この恐ろしい殺人をやってしまうと、私はすぐに、きわめて慎重に、死体を隠す仕事に取りかかった。
I knew that I could not remove it from the house, either by day or by night, without the risk of being observed by the neighbors.	昼でも夜でも、近所の人々の目にとまる恐れなしには、それを家から運び去ることができないということは、私にはわかっていた。
Many projects entered my mind.	いろいろの計画が心に浮んだ。
At one period I thought of cutting the corpse into minute fragments, and destroying them by fire.	あるときは死骸を細かく切って火で焼いてしまおうと考えた。
At another, I resolved to dig a grave for it in the floor of the cellar.	またあるときには穴蔵の床にそれを埋める穴を掘ろうと決心した。
Again, I deliberated about casting it in the well in the yard - about packing it in a box, as if merchandize, with the usual arrangements, and so getting a porter to take it from the house.	さらにまた、庭の井戸のなかへ投げこもうかとも――商品のように箱のなかへ入れて普通やるように荷造りして、運搬人に家から持ち出させようかとも、考えてみた。
Finally I hit upon what I considered a far better expedient than either of these.	最後に、これらのどれよりもずっといいと思われる工夫を考えついた。
I determined to wall it up in the cellar - as the monks of the middle ages are recorded to have walled up their victims.	中世紀の僧侶（そうりょ）たちが彼らの犠牲者を壁に塗りこんだと伝えられているように――それを穴蔵の壁に塗りこむことに決めたのだ。
For a purpose such as this the cellar was well adapted.	そういった目的にはその穴蔵はたいへん適していた。
Its walls were loosely constructed, and had lately been plastered throughout with a rough plaster, which the dampness of the atmosphere had prevented from hardening.	そこの壁はぞんざいにできていたし、近ごろ粗い漆喰を一面に塗られたばかりで、空気が湿っているためにその漆喰が固まっていないのだった。
Moreover, in one of the walls was a projection, caused by a false chimney, or fireplace, that had been filled up, and made to resemble the red of the cellar.	その上に、一方の壁には、穴蔵の他のところと同じようにしてある、見せかけだけの煙突か暖炉のためにできた、突き出た一カ所があった。
I made no doubt that I could readily displace the bricks at this point, insert the corpse, and wall the whole up as before, so that no eye could detect any thing suspicious.	ここの煉瓦（れんが）を取りのけて、死骸を押しこみ、誰の目にもなに一つ怪しいことの見つからないように、前のとおりにすっかり壁を塗り潰（つぶ）すことは、造作なくできるにちがいない、と私は思った。
And in this calculation I was not deceived.	そしてこの予想ははずれなかった。
By means of a crow-bar I easily dislodged the bricks, and, having carefully deposited the body against the inner wall, I propped it in that position, while, with little trouble, I re-laid the whole structure as it originally stood.	鉄梃（かなてこ）を使って私はたやすく煉瓦を動かし、内側の壁に死体を注意深く寄せかけると、その位置に支えておきながら、大した苦もなく全体をもとのとおりに積み直した。
Having procured mortar, sand, and hair, with every possible precaution, I prepared a plaster which could not be distinguished from the old, and with this I very carefully went over the new brickwork.	できるかぎりの用心をして膠泥（モルタル）と、砂と、毛髪とを手に入れると、前のと区別のつけられない漆喰をこしらえ、それで新しい煉瓦細工の上をとても念入りに塗った。
When I had finished, I felt satisfied that all was right.	仕上げてしまうと、万事がうまくいったのに満足した。
The wall did not present the slightest appearance of having been disturbed.	壁には手を加えたような様子が少しも見えなかった。
The rubbish on the floor was picked up with the minutest care.	床の上の屑（くず）はごく注意して拾い上げた。
I looked around triumphantly, and said to myself	私は得意になってあたりを見まわして、こう独言（ひとりごと）を言った。
- "Here at least, then, my labor has not been in vain."	――「さあ、これで少なくとも今度だけは己（おれ）の骨折りも無駄（むだ）じゃなかったぞ」
My next step was to look for the beast which had been the cause of so much wretchedness;	次に私のやることは、かくまでの不幸の原因であったあの獣を捜すことであった。
for I had, at length, firmly resolved to put it to death.	とうとう私はそれを殺してやろうと堅く決心していたからである。
Had I been able to meet with it, at the moment, there could have been no doubt of its fate;	そのときそいつに出会うことができたなら、そいつの命はないに決っていた。
but it appeared that the crafty animal had been alarmed at the violence of my previous anger, and forebore to present itself in my present mood.	が、そのずるい動物は私のさっきの怒りのはげしさにびっくりしたらしく、私がいまの気分でいるところへは姿を見せるのを控えているようであった。
It is impossible to describe, or to imagine, the deep, the blissful sense of relief which the absence of the detested creature occasioned in my bosom.	その厭でたまらない生きものがいなくなったために私の胸に生じた、深い、この上なく幸福な、安堵（あんど）の感じは、記述することも、想像することもできないくらいである。
It did not make its appearance during the night	猫はその夜じゅう姿をあらわさなかった。
- and thus for one night at least, since its introduction into the house, I soundly and tranquilly slept;	――で、そのために、あの猫を家へ連れてきて以来、少なくとも一晩だけは、私はぐっすりと安らかに眠った。
aye, slept even with the burden of murder upon my soul!	そうだ、魂に人殺しの重荷を負いながらも眠った［＃「眠った」に傍点］のだ！
The second and the third day passed, and still my tormentor came not.	二日目も過ぎ三日目も過ぎたが、それでもまだ私の呵責者は出てこなかった。
Once again I breathed as a freeman.	もう一度私は自由な人間として呼吸した。
The monster, in terror, had fled the premises forever!	あの怪物は永久にこの屋内から逃げ去ってしまったのだ！
I should behold it no more!	私はもうあいつを見ることはないのだ！
My happiness was supreme!	私の幸福はこの上もなかった！
The guilt of my dark deed disturbed me but little.	自分の凶行の罪はほとんど私を不安にさせなかった。
Some few inquiries had been made, but these had been readily answered.	二、三の訊問（じんもん）は受けたが、それには造作なく答えた。
Even a search had been instituted - but of course nothing was to be discovered.	家宅捜索さえ一度行われた、――が無論なにも発見されるはずがなかった。
I looked upon my future felicity as secured.	私は自分の未来の幸運を確実だと思った。
Upon the fourth day of the assassination, a party of the police came, very unexpectedly, into the house, and proceeded again to make rigorous investigation of the premises.	殺人をしてから四日目に、まったく思いがけなく、一隊の警官が家へやって来て、ふたたび屋内を厳重に調べにかかった。
Secure, however, in the inscrutability of my place of concealment, I felt no embarrassment whatever.	けれども、自分の隠匿（いんとく）の場所はわかるはずがないと思って、私はちっともどぎまぎしなかった。
The officers bade me accompany them in their search.	警官は私に彼らの捜索について来いと命じた。
They left no nook or corner unexplored.	彼らはすみずみまでも残るくまなく捜した。
At length, for the third or fourth time, they descended into the cellar.	とうとう、三度目か四度目に穴蔵へ降りて行った。
I quivered not in a muscle.	私は体の筋一つ動かさなかった。
My heart beat calmly as that of one who slumbers in innocence.	私の心臓は罪もなくて眠っている人の心臓のように穏やかに鼓動していた。
I walked the cellar from end to end.	私は穴蔵を端から端へと歩いた。
I folded my arms upon my bosom, and roamed easily to and fro.	腕を胸の上で組み、あちこち悠々（ゆうゆう）と歩きまわった。
The police were thoroughly satisfied and prepared to depart.	警官はすっかり満足して、引き揚げようとした。
The glee at my heart was too strong to be restrained.	私の心の歓喜は抑えきれないくらい強かった。
I burned to say if but one word, by way of triumph, and to render doubly sure their assurance of my guiltlessness.	私は、凱歌（がいか）のつもりでたった一言でも言ってやり、また自分の潔白を彼らに確かな上にも確かにしてやりたくてたまらなかった。
"Gentlemen,"	「皆さん」
I said at last, as the party ascended the steps,	と、とうとう私は、一行が階投をのぼりかけたときに、言った。
"I delight to have allayed your suspicions.	「お疑いが晴れたことをわたしは嬉（うれ）しく思います。
I wish you all health, and a little more courtesy.	皆さん方のご健康を祈り、それからも少し礼儀を重んぜられんことを望みます。
By the bye, gentlemen, this - this is a very well constructed house."	ときに、皆さん、これは――これはなかなかよくできている家ですぜ」
[In the rabid desire to say something easily, I scarcely knew what I uttered at all.]	〔なにかをすらすら言いたいはげしい欲望を感じて、私は自分の口にしていることがほとんどわからなかった〕
- "I may say an _excellently_ well constructed house.	――「すてきに［＃「すてきに」に傍点］よくできている家だと言っていいでしょうな。
These walls are you going, gentlemen?	この壁は――お帰りですか？
- these walls are solidly put together;"	皆さん――この壁はがんじょうにこしらえてありますよ」
and here, through the mere phrenzy of bravado, I rapped heavily, with a cane which I held in my hand, upon that very portion of the brick-work behind which stood the corpse of the wife of my bosom.	そう言って、ただ気違いじみた空威張（からいば）りから、手にした杖（つえ）で、ちょうど愛妻の死骸が内側に立っている部分の煉瓦細工を、強くたたいた。
But may God shield and deliver me from the fangs of the Arch-Fiend !	だが、神よ、魔王の牙（きば）より私を護（まも）りまた救いたまえ！
No sooner had the reverberation of my blows sunk into silence, than I was answered by a voice from within the tomb!	私の打った音の反響が鎮（しず）まるか鎮まらぬかに、その墓のなかから一つの声が私に答えたのであった！
- by a cry, at first muffled and broken, like the sobbing of a child, and then quickly swelling into one long, loud, and continuous scream, utterly anomalous and inhuman - a howl - a wailing shriek, half of horror and half of triumph, such as might have arisen only out of hell, conjointly from the throats of the dammed in their agony and of the demons that exult in the damnation.	――初めは、子供の啜（すす）り泣きのように、なにかで包まれたような、きれぎれな叫び声であったが、それから急に高まって、まったく異様な、人間のものではない、一つの長い、高い、連続した金切声となり、――地獄に墜（お）ちてもだえ苦しむ者と、地獄に墜（おと）して喜ぶ悪魔との咽喉（のど）から一緒になって、ただ地獄からだけ聞えてくるものと思われるような、なかば恐怖の、なかば勝利の、号泣――慟哭（どうこく）するような悲鳴――となった。
