Cracking DES	DESをクラック
Secrets of	暗号研究、
How federal	連邦機関は
Encryption Research,	盗聴政策と
agencies	こうして
Wiretap Politics	チップ設計の
subvert	プライバシーを
& Chip Design	侵害する
Cracking DES:	DESのクラック：
Secrets of Encryption Research, Wiretap Politics, and Chip Design	暗号研究と盗聴政策、チップ設計の秘密
The test-file, bootstrap, and bootstrap2 listings in Chapter 4 are Copyright &copy;1997 by Network Associates, Inc.	第四章のテストファイル、ブートストラップ、ブートストラップ2の掲載物の著作権保有者は、&copy;1997 by Network Associates, Inc. である。
These listings may be reproduced in whole or in part without payment of royalties.	この掲載物は、全体、部分を問わず、使用料の支払いなしに複製が認められる。
Chapter 10, Architectural Considerations for Cryptanalytic Hardware, is Copyright &copy; 1996 by the authors, Ian Goldberg and David Wagner.	第10章「暗号分析ハードウェアのアーキテクチャ上の考察」は、著者Ian GoldbergとDavid Wagnerが著作権 &copy; 1996 を保有する。
who can be reached at iang@cs.berkeley.edu and daw@cs.berkeley.edu.	著者たちとは iang@cs.berkeley.edu と daw@cs.berkeley.eduで連絡がとれる。
Chapter 11, Efficient DES Key Search: An Update, is Copyright &copy; 1997 by Entrust Technologies.	第11章「効率のよいDES鍵の探索：アップデート」の著作権保有者は、Entrust Technologies &copy; 1997 である。
It may be reproduced in whole or in part without payment of royalties.	これは、全体、部分を問わず、使用料の支払いなしに複製が認められる。
Chapter 9, Breaking One Million DES Keys, is Copyright &copy; 1986.	第 9 章「100 万のDES 鍵を破る」は&copy; 1986 である。
Work done at the University of Leuven, Belgium, and supported by the NFWO, Belgium.	作業はベルギー王国の University of Leuven でおこなわれ、ベルギー王国の NFWO の支援の元で実施された。
It may not be reproduced without the permission of the author,	この部分は著者の許可なく複製を行ってはならない。
who can be reached at desmedt@cs.uwm.edu.	著者とはdesmedt@cs.uwm.eduで連絡がとれる。
Distributed by O'Reilly & Associates, Inc., 101 Morris Street, Sebastopol, CA 95472	原著発売は、O'Reilly & Associates, Inc., 101 Morris Street, Sebastopol, CA 95472 USA である。
May 1998: First Edition.	May 1998: 初版
Many of the designations used by manufacturers and sellers to distinguish their products are claimed as trademarks.	製造業者や販売業者が自分の製品を区別するために使っている名称・呼称の多くは、商標として登録されている。
Where those designations appear in this book, and the publisher was aware of a trademark claim, the designations have been printed in caps or initial caps.	こうした商標が本書に登場し、それが商標であると出版者が認識していた場合には、その名称はすべて大文字か、あるいは頭文字を大文字化して表記してある。
While many precautions have been taken in the preparation of this book, the publisher and distributor assume no responsibility for errors or omissions, or for damages resulting from the use of the information contained herein.	本書の制作にあたっては多大な注意がはらわれてはいるものの、出版者も配布者も、まちがいや欠落については責任をいっさいおわず、さらにここに含まれた情報の利用から生じた損害についてもいっさい責任をおわない。
Foreword ........................................ix	序文 ........................................ix
Preface .......................................xiii	はじめに .......................................xiii
1: Overview.....................................1-1	1: 概論.....................................1-1
Politics of Decryption ......................1-1	解読の政治性.................................1-1
Goals .......................................1-7	ねらい ......................................1-7
History of DES Cracking .....................1-8	DES クラッキングの歴史 ......................1-8
EFF's DES Cracker Project ...................1-8	EFF の DES クラッカープロジェクト ...........1-8
Architecture ................................1-9	アーキテクチャ ..............................1-9
Who Else Is Cracking DES? ..................1-16	ほかにはだれが DES をクラックしているだろう? ..1-16
What To Do If You Depend On DES ............1-17	DES を使っていたらどうすればいいの？ .........1-17
Conclusion .................................1-18	結論 ........................................1-18
2: Design for DES Key Search Array .............2-1	2: DES 鍵探索アレイのデザイン ..................2-1
On-Chip Registers ..........................2-1	チップのレジスタ ............................2-1
Commands ....................................2-4	コマンド ....................................2-4
Search Unit Operation .....................2-4	探索ユニットのはたらき ......................2-4
Sample Programming Descriptions .............2-5	見本プログラムの説明 ........................2-5
Scalability and Performance .................2-9	スケーラビリティと性能 ......................2-9
Host Computer Software ......................2-9	ホストコンピュータのソフト ..................2-9
Glossary ...................................2-10	用語集 .....................................2-10
3. Design for DES Key Search Array Chip-Level Specification ..3-1	3. DES 鍵探索アレイの設計：チップレベルの仕様 ..3-1
ASIC Description .........................................3-1	ASIC の説明 ..............................................3-1
Board description ........................................3-3	基板の説明 ...............................................3-3
Read and Write Timing ....................................3-5	リード／ライトのタイミング ...............................3-5
Addressing Registers .....................................3-7	アドレス指定用レジスタ ...................................3-7
All-active Signal ........................................3-7	All-active 信号 ..........................................3-7
ASIC Register Allocation .................................3-8	ASIC レジスタ割り当て ....................................3-8
4: Scanning the Source Code ..................................41	4: ソースコードのスキャン ..................................4-1
The Politics of Cryptographic Source Code .................4-1	暗号ソースコードの政治性 ..................................4-1
The Paper Publishing Exception ............................4-2	紙の出版物は例外 ..........................................4-2
Scanning ..................................................4-4	スキャン ..................................................4-4
Bootstrapping .............................................4-5	ブートストラップ ..........................................4-5
ftp://ftp.nic.surfnet.nl/surfnet/net-security/encryption/cracking_DES/] [Chapters 5, 6 and 7 (offsite)]	[以下の5, 6, 7 章のソースコードそのものは以下にある：
5: Software Source Code ......................................5-1	5: ソフトウェアのソースコード ......................................5-1
6: Chip Source Code ..........................................6-1	6: チップのソースコード ..........................................6-1
7: Chip Simulator Source Code ................................7-1	7: チップシミュレータのソースコード ................................7-1
8: Hardware Board Schematics (offsite) ....................................8-1	8: ハードウェア：基板の回路 ....................................8-1
Board Schematics ......................................................8-1	基板回路 ......................................................8-1
Sun-4/470 backplane modifications ................................8-10	Sun-4/470 バックプレーンの改造................................8-10
PC Interfaces .......................................................8-12	PC インターフェース .......................................................8-12
Errata ...............................................8-13	正誤表 ...............................................8-13
9: Breaking One Million DES Keys by Yvo Desmedt .........9-1	9: 百万DES鍵を破る：Yvo Desmedt著 .........9-1
Abstract .............................................9-1	概要 .................................................9-1
Introduction .........................................9-1	はじめに .............................................9-1
The basic idea .......................................9-2	基本的な考え方 .......................................9-2
Details of such a machine ............................9-2	マシンの詳細 .........................................9-2
Obtained results and remarks .........................9-4	得られた結果と考察 ...................................9-4
Conclusion ...........................................9-4	結論 .................................................9-4
Acknowledgement ......................................9-5	謝辞 .................................................9-5
vii 10: Architectural Considerations for Cryptanalytic Hardware .. 10-1	10: 暗号解析ハードウェアのアーキテクチャ考察 .. 10-1
11: Efficient DES Key Search--An Update by Michael J. Wiener 11-1	11: 効率のよいDES鍵の探索：アップデート：Michael J. Wiener 著 11-1
Advancing Technology ................11-2	技術の進歩 ..........................11-2
Programmable Hardware ...............11-3	プログラマブル・ハードウェア ........11-3
Conclusion ............................................................................11-4	結論 ............................................................................11-4
12: Authors ......................................................................12-1	12: 著者紹介 ......................................................................12-1
In 1974 the Stanford computer science community ate at Loui's.[1]	1974 年にスタンフォードの計算機科学の連中は、Loui's で食事をした。 [1]
As I sat eating one evening in the fall, Butler Lampson approached me, and in the course of inquiring what I was doing, remarked that the IBM Lucifer system was about to be made a national standard.	秋のある晩にわたしが食事をしていると、Butler Lampson がやってきて、最近なにをやっているときく中で、IBM の Lucifer システムが全国標準規格になるよ、と話してくれた。
I hadn't known it, and it set me thinking.	わたしはそれを知らなかったので、思案をはじめた。
My thoughts went as follows:	考えはこんな具合にすすんだ。
NSA doesn't want a strong cryptosystem as a national standard, because it is afraid of not being able to read the messages.	NSA は、メッセージが読めなくなるといやだから、強い暗号システムを全国標準規格にしたくないんだな。
On the other hand, if NSA endorses a weak cryptographic system and is discovered, it will get a terrible black eye.	一方で、もし NSA が弱い暗号システムを推薦して、それがばれたら、ぼこぼこにされることになる。
Hints that Butler was correct began to appear and I spent quite a lot of time thinking about this problem over the next few months.	Butler が正しいらしいということで、わたしはこの問題についてその後数ヶ月にわたっていろいろ考えることになった。
It led me to think about trap-door cryptosystems and perhaps ultimately public-key cryptography.	そこから落とし穴式の暗号システムについて考えて、そして最終的には公開鍵暗号方式のことを考えるようになった。
When the Proposed Data Encryption Standard was released on the 17th of March 1975 [2], I thought I saw what they had done.	データ暗号化規格（DES）の案が 1975 年 3 月 17 日にリリースされて[2],、わたしはかれらのやったことが見えたと思った。
The basic system might be ok, but the keyspace was on the small side.	基本的なシステムはOKだったけれど、でもキー空間は小さめだ。
It would be hard to search, but not impossible.	キーをさがすのはむずかしいけれど、不可能ではない。
My first estimate was that a machine could be built for $650M that would break DES in a week.	最初の見積もりでは、6.5 億ドルあれば、DES を一週間で破る機械をつくれると思った。
I discussed the idea with Marty Hellman and he took it on with a vengance.	この考えをMarty Hellmanと話し合うと、かれは夢中になってこの計算にとりくんだ。
Before we were through, the estimated cost had fallen to $20M and the time had declined to a day. [3]	話が終わるまでに、見積もりは 2,000 万ドル、時間は一日まで下がった。 [3]
Our paper started a game in the cryptographic community and many papers on searching through DES keys have since been written.	われわれの論文を発端にして、暗号コミュニティではゲームがはじまって、それ以来、DES 鍵を探す論文がたくさん書かれるようになった。
About three years after the publication of our paper, Robert Jueneman --- then at Satellite Business Systems in McLean, Virginia --- wrote "The Data Encryption Standard vs. Exhaustive Search." [4]	われわれの論文発表から 3 年くらいして、Robert Jueneman（当時はバージニア州マクリーンの Satellite Business Systems に所属）が「The Data Encryption Standard vs. Exhaustive Search」という論文を書いた。 [4]
This opus was substantially more optimistic about the chances for DES breaking.	この力作は、DES を破る見通しについて、われわれよりもずっと楽観的だった。
It predicted that by 1985 a half-million dollar investment would get you a DES key every hour and that by 1995, $10 million similarly spent would reduce that time to two seconds, an estimate remarkably close to one made fifteen years later.	この論文の予言では、1985 年までに 50 万ドルの投資で、一時間で DES 鍵を見つけられるようになるし、1995 年までには 1,000 万ドルの投資で、それが 2 秒にまで短縮されるとなっているが、これは 15 年後に実際にできたものを、実に見事に予言している。
A decade later, Yvo Desmedt and Jean-Jaques Quisquater made two contibutions,	10年たって、Yvo DesmedtとJean-Jaques Quisquaterが貢献を 2 つ行ってくれた。
one whimsical, one serious.	一つは冗談交じりで、ひとつは真剣だ。
Using a related "birthday problem" sort of approach, they proposed a machine for attacking many cryptographic problems at a time. [5]	これは関連した「誕生日問題」みたいなアプローチを使ったもので、多数の暗号問題を同時にとけるようなマシンが提案されている。[5]
Their whimsical suggestion took advantage of the fact that the population of China was about the square root of the size of the DES key space.	冗談交じりの提案のほうは、中国の人口が DES 鍵空間の平方根と同じくらいだ、という事実を利用したものだ。
The year 1993 brought a watershed.	1993年は、注目すべき年だった。
Michael Wiener of Bell-Northern Research designed the most solid paper machine yet. [6]	Michael Wiener （Bell-Northern Research）が、最高にしっかりした紙上のマシンを設計したのである。[6]
It would not be too far off to describe it as a Northern Telecom DMS100 telephone switch, specialized to attacking DES.	ノーザンテレコムの　DMS100　電話交換機を　DES　攻撃用に特化したもの、といえばあたらずといえども遠からずだろう。
What made the paper noteworthy was that it used standard Northern Telecom design techniques from the chips to the boards to the cabinets.	この論文が特筆すべきなのは、これがチップから基板からキャビネットまで、すべてノーザンテレコムの標準設計技法を使ったということだ。
It anticipated an investment of under a million dollars for a machine that would recover a key every three hours.	3 時間で鍵を発見するマシンが、100　万ドル以下でできると予想している。
A provocative aside was the observation that the required budget could be hidden in a director's budget at BNR.	非常に挑発的な付記として、この程度の予算なら　Bell-Northern Research 社の部長決裁に入れてしまえる、という点があげられている。
Finally, in 1996, an estimate was prepared by not one or two cryptographers but by a group	最後に 1996 年になると、暗号学者一人や二人ではなく、暗号学者グループによって推定が発表されている。
later, and not entirely sympathetically, called the magnificent seven. [7]	かれらは後に（多少の嫌みもこめて）the magnificent seven [7] と呼ばれている。
This estimate outlined three basic approaches loosely correlated with three levels of resources.	この推定は、必要となるリソース 3 段階とゆるく関連した、3 つのアプローチの概略を述べている。
At the cheap end was scrounging up time on computers you didn't need to own.	いちばん安いものとしては、必ずしも自分が所有しているとは限らないコンピュータ時間をかき集めるやりかた。
In the middle was using programmable logic arrays,	真ん中は、プログラマブルな論理アレイを使うことだ。
possibly PLA machines built for some other purpose such as chip simulation.	たとえば、チップシミュレーションなどほかの目的につくられた PLA マシンを使うことだ。
The high end was the latest refinement of the custom chip approach.	ハイエンドでは、カスタムチップ方式に最新の改良を加えたものがあがっている。
Exhaustive key search is a surprising problem to have enjoyed such popularity.	しらみつぶし式の鍵探索は、こんなに人気がでるとは意外な問題だ。
If it a is mystery why so many of them, myself included, have worked to refine and solidify their estimates, it is an even greater mystery that in the late 1990s, some people have actually begun to carry out key searches.	わたしを含む多くの人たちが、なぜこの推定を精緻にして厳密にしようとがんばったのかもなぞだけれど、それよりさらに大きな謎は、1990年代後半になって、ほんとうにその鍵探索をやりだした人たちがいる、ということだ。
At the 1997 annual RSA cryptographic trade show in San Francisco, a prize was announced for cracking a DES cryptogram [8].	1997 年にサンフランシスコで開かれた、年次 RSA 暗号業界ショーで、DES暗号文をクラックした者に賞金を出すというアナウンスがされた[8]。
The prize was claimed in five months by a loose consortium using computers scattered around the Internet.	5ヶ月後にその賞金を獲得したのは、インターネット中にちらばったコンピュータを使ったゆるい連合体だった。
It was the most dramatic success so far for an approach earlier applied to factoring and to breaking cryptograms in systems with 40-bit keys.	このアプローチは、これまで 40 ビットの鍵をもった暗号文や因数分解には適用されていたものだが、その劇的な成功だった。
At the 1998 RSA show, the prize was offered again. This time the prize was claimed in 39 days [9]	1998年の RSA ショーで、また賞金がだされた。今回、賞金は39日で獲得された [9]。
a result that actually represents a greater improvement than it appears to.	この結果は、実は見た目よりも大きな改善を示している。
The first key was found after a search of only 25% of the key space;	最初の鍵がみつかったのは、鍵空間を 25% しかつぶしていない時点でだった。
the second was not recovered until the 85% mark.	二番目の鍵は、85% をさがし終えてやっと見つかった。
Had the second team been looking for the first key, they would have found it in a month.	つまり二番目のチームが最初のキーを見つけようとしたら、たぶん一月でそれが達成できたことになる。
These efforts used the magnificent seven's first approach.	こうした試みは the magnificent seven の最初のアプローチを使っている。
No application of the second has yet come to light.	二番目のアプローチを使ったものは、いまのところ公表されていない。
This book skips directly to the third.	本書はすぐに三番目のアプローチに飛んで、
It describes a computer built out of custom chips.	カスタムチップを使ったコンピュータについて述べている。
A machine that 'anyone' can build;	「だれでも」つくれるマシンだ。
from the plans it presents --- a machine that can extract DES keys in days at reasonable prices,	本書にでてくる図面をつかえば、そこそこの値段で DES 鍵をものの数日で見つけられる。
or hours at high prices.	金さえかければ、ほんの数時間で。
With the appearance of this book and the machine it represents, the game changes forever.	本書と、本書に書かれたマシンの登場で、事態は完全にかわってしまった。
It is not a question of whether DES keys can be extracted by exhaustive search;	もはや、しらみつぶし探索で DES 鍵が見つかるか、という話ではない。
it is a question of how cheaply they can be extracted and for what purposes.	それがどういう目的で、どれだけ安上がりに見つけられるか、という問題になってきている。
Using a network of general purpose machines that you do not own or control is a perfectly fine way of winning cryptanalytic contests, but it is not a viable way of doing production cryptanalysis.	自分の持っていない、あるいはコントロールできない汎用マシンをネットワーク化する、というのは暗号解析コンテストに勝つには、とてもよい方法ではあるけれど、業務レベルの暗号解析には役にたたない。
For that, you have to be able to keep your activities to yourself.	これをやるには、自分の活動を自分だけにとどめておく必要がある。
You need to be able to run on a piece of hardware that you can protect from unwanted scrutiny.	無用な注意をひかないように保護できるハードでそれを動かせなくてはならない。
This is such a machine.	本書に書かれているのは、まさにそういうマシンだ。
It is difficult to know how many messages have been encrypted with DES in the more than two decades that it has been a standard.	DES は過去 20 年以上、標準となっていたわけだけれど、それでどれだけのメッセージが暗号化されたかは見当もつかない。
Even more difficult is knowing how many of those messages are of enduing interest and how many have already been captured or remain potentially accessible on disks or tapes,	もっと見当がつかないのは、そのなかにいまだに重要性をもつものがどれだけあって、さらにそのどれだけがディスクやテープ上に落とされて、アクセス可能となっているか、ということだ。
but the number, no matter precisely how the question is framed must be large.	でもその数は、この質問をどれだけ限定的に考えたにしても、かなり大きいにちがいない。
All of these messages must now be considered to be vulnerable.	こうしたメッセージのすべてが、いまや弱点にさらされていると考えるべきである。
The vulnerability does not end there, however,	しかしながら、弱点はこれで絶えたわけではない。
for cryptosystems have nine lives.	というのも、暗号システムというのは殺しても死なないくらいしぶといものだからだ。
The most convincing argument that DES is insecure would not outweigh the vast investment in DES equipment that has accumulated throughout the world.	DES が安全ではないとどんなに強力に論じたとしても、世界中でDES機器に大量の投資が行われてしまっているために、それをひっくり返すわけにはいかない。
People will continue using DES whatever its shortcomings, convincing themselves that it is adequate for their needs.	人々はどんなに短所があっても DES を使い続け、自分のニーズにはこれでじゅうぶんだと考え続けるわけだ。
And DES, with its glaring vulnerabilities, will go on pretending to protect information for decades to come.	そして DES は、これだけはっきりと弱点を抱えているのに、今後何十年も情報を守っているかのようなふりを続けるだろう。
