Cracking DES	DESをクラック
Some of the testimony quoted may have been literally true;	ここで引用した証言の一部は、文字通りの意味では正しいものもある。
nevertheless, it is deceptive.	でも、ここにはごまかしが入っている。
All of the time estimates presented by Administration officials were based on use of general-purpose computers to do the job.	政府監督官僚たちが挙げた解読時間推定はすべて、汎用コンピュータを使った数字に基づいている。
But that's fundamentally the wrong way to do it, and they know it.	でもこれはやりかたとしては根本的にまちがっているし、この役人たちはそれを知っているはずなのだ。
A ordinary computer is ill-suited for use as a DES Cracker.	普通のコンピュータは、DESクラッカーとして使うにはむいていない。
In the first place, the design of DES is such that it is inherently very slow in software, but fast in hardware.	そもそもDESのデザインからして、ソフトでやるには性質上とても遅いけれど、ハードでやるととてもはやいのである。
Second, current computers do very little in parallel;	さらに、いまのコンピュータは並列処理をほとんどしない。
the designers don't know exactly what instructions will be executed, and must allow for all combinations.	チップ設計者たちは、どんな命令が実行されるかわからないので、あらゆる組み合わせに対処できるようにしなくてはならないからだ。
The right way to crack DES is with special-purpose hardware.	DESをまともにクラックしようと思ったら、専用ハードを使うことだ。
A custom-designed chip, even with a slow clock, can easily outperform even the fastest general-purpose computer.	カスタムチップは、クロックが遅くても最高速の汎用コンピュータに楽々勝てる。
Besides, you can get many such chips on a single board,	さらには、ボード一枚にチップをたくさんのせることも可能だ。
rather than the one or two on a typical computer's motherboard.	ふつうのコンピュータは、マザーボード上にチップ一つしかない。
There are practical limits to the key sizes which can be cracked by brute-force searching, but since NSA deliberately limited the key size of DES to 56 bits, back in the 1970's when it was designed, DES is crackable by brute force.	ばか力探索方式でクラックできる鍵のサイズには、現実的に考えれば限界はあるけれど、DESが設計された1970年代に、NSAは意図的にDESの鍵のサイズを56ビットに制限したので、DESはばか力方式でクラックできる。
Today's technology might not be able to crack other ciphers with 64-bit or 128-bit keys--or it might.	今日のテクノロジーでは、64ビットや128ビットの鍵をもった暗号方式は、解読できないかもしれない---が、できるかもしれない。
Nobody will know until they have tried, and published the details for scientific scrutiny.	だれかが試して、その結果を公開し、科学的な検討をうけるまでは、だれにもわからない。
Most such ciphers have very different internal structure than DES, and it may be possible to eliminate large numbers of possible keys by taking advantage of the structure of the cipher.	こうした暗号方式は、DESとは内部構造もかなりちがっているので、その方式の構造を利用することでかなりの数の鍵を除外できてしまうかもしれない。
Some senior cryptographers estimated what key sizes were needed for safety in a 1996 paper;*	高名な暗号学者たちが、安全のために必要な鍵のサイズについて1996年の論文で推定を発表している*。
they suggest that to protect against brute force cracking, today's keys should have a minimum of 75 bits, and to protect information for twenty years, a minimum of 90 bits.	それによると、ばか力クラッキングに対抗するためには最低でも75ビット、そして20年にわたって情報を保護するには、最低でも90ビットの鍵がいる、とされている。
The cost of brute-force searching also overstates the cost of recovering encrypted text in the real world.	またばか力方式の探索コストの推定も、現実世界で暗号化テキストを復元するコストを過大に見積もっている。
A key report on the real impact of encryption on law enforcement+ reveals that there are no cases in which a lack of police access to encrypted files resulted in a suspected criminal going free.	法執行に対して暗号が及ぼす現実的なインパクトについての、重要な報告+によると、警察が暗号化ファイルにアクセスできなかったために、容疑者が釈放される結果となった事例は、実は一つもない。
In most cases the plaintext was recovered by other means,	多くの場合、平文はほかの手段で復元されている。
such as asking the suspect for the key, or finding another copy of the information on the disk.	たとえば容疑者に鍵を出すよう要求したり、ディスク上でその情報の別のコピーを見つける、などの方式である。
Even when brute force is the method of choice, keys are seldom truly random, and can be searched in the most likely order.	ばか力方式を使わなければならなかったときにさえ、キーが本当にランダムだったことはほとんどなく、ありそうな順に探すことができた。
Export Controls and DES	輸出規制と DES
The U.S. Government currently restricts the ability of companies, individuals, and researchers to export hardware or software that includes the use of DES for confidentiality.	いまのアメリカ政府は、企業や個人が機密保持のためにDESを使うハードやソフトを輸出することを制限している。
These "export controls" have been a severe impediment to the development of security and privacy for networked computers, cellular phones, and other popular communications devices.	こうした「輸出制限（export controls）」は、ネットワーク化されたコンピュータや携帯電話など、一般用の通信装置のセキュリティとプライバシー開発にとって、強烈な阻害要因となってきた。
The use of encryption algorithms stronger than DES is also restricted.	DESより強い暗号化アルゴリズムの使用も規制されている。
In December 1996, the government formally offered exporters the ability to incorporate DES,	1996年12月、政府は正式に輸出業者に対し、DESを製品に含めていいという許可を与えた。
but nothing stronger, into their products.	ただしそれより強いものは認められない。
The catch is that these companies would have to sign an agreement with the government, obligating them to install "key recovery" into their products within two years.	そしてこの許可の代償として、こうした企業は政府との同意書に署名しなくてはならず、その同意書はその企業たちに、2年以内に製品に「キーリカバリ」を含めるよう義務づけるものとなっていた。
Key recovery technology provides a way for the government to decrypt messages at will, by offering the government a copy of the key used in each message, in a way that the product's user cannot circumvent or control.	キーリカバリは、各メッセージに使った鍵のコピーを提出させて、政府が好きなだけメッセージを解読できるようにして、しかもそれを製品のユーザは防止したりコントロールしたりできないという方式である。
In short, the government's offer was:	一言で、政府が要求していたのは：
collude with us to violate your customers' privacy, or we won't let you export any kind of secure products.	おれたちと野合して顧客のプライバシーを侵害させろ、さもないと高セキュリティ製品はいっさい輸出させてやらない、ということだ。
At the same time, the FBI was let into the group that reviews each individual company's application to export a cryptographic product.	同時に、各個別業の暗号製品輸出申請書を検討するグループにFBIも加えられた。
All reports indicate that the FBI is making good on the threat, by objecting to the export of all kinds of products that pose no threat at all to the national security (having been exportable in previous years before the FBI gained a voice).	あらゆる報告が指摘しているのは、FBIが強力なおどしをかけていて、国家の安全保障に対していっさい脅威とならないようなさまざまな製品（というのも、それらの製品はFBIが口出しするようになるまでは輸出できていたから）についても、輸出に反対しているということだ。
The FBI appears to think that by making itself hated and feared, it will encourage companies to follow orders.	FBIはどうやら、自分が嫌われ、おそれられるようになれば、会社たちが命令にしたがうようになる、と考えているらしい。
Instead it is encouraging companies to overturn the regulatory scheme that lets the FBI abuse the power to control exports.	ところが実際はかえって、企業たちはFBIが輸出規制を悪用できるようにした規制法規の撤回を求めるようになってしまった。
Industry started a major lobbying group called Americans for Computer Privacy (http://www.computerprivacy.org), which is attempting to change the laws to completely decontrol nonmilitary encryption exports.	業界は大規模なロビイング団体Americans for Computer Privacy (http://www.computerprivacy.org)を設立しているが、これは民生暗号輸出についてはいっさい規制がかからないように、法改正を求めている。
Some dozens of companies to signed up for key recovery, though it is unclear how many actually plan to follow through on their promise to deploy the technology.	何十かの企業がキーリカバリに合意したようだが、キーリカバリを導入するという約束を本気で守るつもりの企業が、実際にはいくつあるのかははっきりしない。
You will not find many of these companies trumpeting key recovery in their product advertisements.	こうした企業のなかで、製品の広告にキーリカバリをうたったものはほとんどない。
Users are wary of it since they know it means compromised security.	ユーザは、キーリカバリがセキュリティに制限をつけるものなのを知っているので、あまり歓迎しない。
If customers won't buy such products, companies know it makes no sense to develop them.	もし顧客がそういう製品を買わないのなら、開発しても意味がない。
The best course for companies is probably to develop products that provide actual security, in some jurisdiction in the world which does not restrict their export.	企業としていちばんいいのは、おそらくは本当のセキュリティを提供できるような製品を、世界の中で輸出制限のかからない地域で開発することだ。
Some companies are doing so.	すでにこれをやっている企業もある。
The government's "compromise" offer discourages hesitant companies from taking this step,	でも政府が「妥協案」を提供しているため、足踏みしている企業はあえてここまでやろうとしない。
by providing a more moderate and conciliatory step that they can take instead.	この妥協案では、もっと穏健な折衷案を採用してもいいよ、というものだ。
Companies that go to the effort to build overseas cryptographic expertise all use stronger technology than DES,	わざわざ外国に暗号開発力をおくだけの手間をかけた企業は、みんなDESより強い技術を使っている。
as a selling point and to guard against early obsolescence.	これはセールスポイントでもあり、また技術の陳腐化を防ぐことにもなる。
If those companies can be convinced to stay in the US, play the government's key-recovery game, and stick with DES, the government continues to win, and the privacy of the public continues to lose.	もしこういう企業がアメリカ国内にとどまり、政府のキーリカバリに参加し、DESを見放さないように説得できるなら、政府の勝利は続き、市民のプライバシーは負け続ける。
The success or failure of the government's carrot-and-stick approach depends on keeping industry and the public misled about DES's security.	この政府のニンジンぶら下げ方式の成否は、業界と市民たちがDESのセキュリティについて誤解したままでいてくれるかどうかにかかっている。
If DES-based products were perceived as insecure, there would be little reason for companies to sign away their customers' privacy birthrights in return for a mess of DES pottage.	もしDESを使った製品がセキュリティが低いと思われてしまえば、会社はDESなどというろくでもない代物ごときのために、顧客の生得のプライバシー権を譲り渡すのに同意する理由はない。
If DES-based products are perceived as secure, but the government actually knows that the products are insecure, then the government gets concessions from companies, without impacting its ability to intercept communications.	もしDESを使った製品が高セキュリティと思われていて、でも政府が実はそれが低セキュリティなのを知っているとしたら、政府は企業から譲歩を引き出せる一方で、自分は通信を傍受できる能力を温存できる。
Keeping the public ignorant gives the government the best of both worlds.	そして市民にそれを知られなければ、政府としてはいちばんいい思いができるわけだ。
Political Motivations and EFF's Response	政治的な動機とEFFの対応
We speculate that government officials are deliberately misleading the public about the strength of DES encryption:	われわれは、アメリカ政府官僚が意図的にDES暗号の強さについて誤解するようにしむけているのだと考える。
To encourage the public to continue using DES, so their agencies can eavesdrop on the public.	市民たちにDESを使い続けさせて、政府機関が市民たちを盗聴できるようにする。
To prevent the widespread adoption of stronger standards than DES, which the government would have more trouble decrypting.	政府が解読に苦労するような、DESよりもっと強力な暗号規格が広がるのを防ぐ。
To offer DES exportability as a bargaining-chip,	DESの輸出可能性を取引材料としてちらつかせる。
which actually costs the government little, but is perceived to be valuable.	これは政府にとってはコストがほとんどないけれど、価値があると思われている。
To encourage policy-makers such as Congressmen or the President to impose drastic measures such as key recovery, in the belief that law enforcement has a major encrypted-data problem and no practical way to crack codes.	議員や大統領など、政策立案者たちに、法執行機関が暗号化データでとても困っていて、それを解読する現実的な方法がないと思わせることで、キーリカバリなどのとんでもない手法を採択させる。
As advocates on cryptography policy, we found ourselves in a hard situation.	暗号政策推進者として、われわれはつらい立場におかれることとなった。
It appeared that highly credible people were either deliberately lying to Congress and to the public in order to advance their own harmful agendas, or were advocating serious infringement of civil liberties based on their own ignorance of the underlying issues.	非常に地位の高い人たちが、自分たちの有害な狙いを推進するために、議会や市民に対して意図的にウソをついているか、あるいはそこに含まれる問題について無知なために、市民の自由を深刻なかたちで侵害しようと主張しているとしかわれわれには思えなかった。
Most troubling is the possibility that they were lying.	かれらがウソをついているという可能性がいちばんこわかった。
Perhaps these government executives merely saw themselves as shielding valuable classified efforts from disclosure.	こうした政府官僚は、単に価値の高い機密作業を公開しないための盾になっているつもりだったのかもしれない。
As advocates of good government, we do not see that classifying a program is any justification for an official to perjure themselves when testifying about it.	よい政府を支持する者として、われわれはプログラムを機密にしたいからといって、官僚がそれについて証言するときに自らを欺くようなことは正当化されないと考える。
(Declining to state an opinion is one thing;	（意見を述べるのを拒否するというならまだわかるが、
making untruthful statements as if they were facts is quite another.)	真実でない発言を事実であるかのように述べるとなると、話はまったく別だ）。
The National Research Council studied encryption issues and published a very complete 1996 report.*	National Research Councilは、暗号問題について研究して、1996年に非常に充実した報告を発表した*。
The most interesting conclusion of their report was that "the debate over national cryptography policy can be carried out in a reasonable manner on an unclassified basis".	この報告でいちばん興味深い結論は、「国家の暗号政策に関する議論は、機密としない状態でもじゅうぶんに実施できる」というものだった。
This presumes good faith on the part of the agencies who hide behind classified curtains, though.	これは、機密の影に隠れている政府機関が誠実に対応してくれるものという前提があってのことである。
If it turns out that their public statements are manipulative falsehoods, an honest and reasonable public debate must necessarily exclude them, as dishonest and unreasonable participants.	もしかれらの声明が、世論を操作しようとするウソであるなら、正直でまともな一般議論は絶対にかれらを不正直でまともでない参加者として排除しなくてはならない。
In the alternative, if poor policy decisions are being made based on the ignorance or incompetence of senior government officials, the role of honest advocates should be to inform the debate.	一方で、もし政府高官が無知または無能なために劣悪な政策決定が行われているのであれば、正直な支持者の役割は、議論に貢献することだろう。
In response to these concerns, EFF began a research program.	こうした懸念に答えるため、EFFは研究プログラムを開始した。
Our research results prove that DES can be cracked quickly on a low budget.	この研究結果で、DESが短期間で安上がりにクラックできることが証明された。
This proves that these officials were either lying or incompetent.	これは、役人たちがうそをついていたか、無能だったということを証明している。
The book you are holding documents the research, and allows it to be validated by other scientists.	本書はその研究を記述したもので、ほかの科学者がそれを確認できるようにするためのものだ。
Goals	ねらい
The goal of EFF's DES Cracker research project is to determine just how cheap or expensive it is to build a machine that cracks DES usefully.	EFFのDESクラッカー研究プロジェクトのねらいは、DESをつかいものになるかたちでクラックするマシンをつくるのが、どれだけ安上がりか高価かを見極めることだ。
Technically, we were also interested in exploring good designs for plaintext recognizers.	技術的には、平文認識装置の優れた設計を検討することにも興味があった。
These are circuits that can notice when the result of decryption is likely enough to be correct that specialized software--or a human--should look at it.	平文認識装置とは、復号結果が正しいものである可能性が高く、専用ソフト（または人間）が見てる価値があると認識してくれる回路だ。
Little research has been published on them,* yet they are a vital part of any efficient system for cryptanalysis.	これについてはほとんど研究が発表されていないものの*、暗号解析の有効なシステムにおいてはかならず重要な位置を占める回路だ。
Merely doing the research would let EFF learn the truth about the expense of cracking DES.	この研究をするだけでも、EFFはDESをクラックする費用についての真相を知ることができる。
But only publishing the research and demonstrating the machine would educate the public on the truth about the strength of DES.	でも、その研究を公表して機械をデモすることでのみ、DESの強さについての真相を一般に報せることができる。
Press releases and even technical papers would not suffice;	プレス発表や技術論文だけでは不十分だ。
the appearance of schematics for a million-dollar DES Cracker in Michael Wiener's excellent 1993 paper should have been enough.	もしそれでいいなら、Michael Wienerのすばらしい1993年論文に100万ドルのDESクラッカーの回路が登場しているのだから、すでに用は足りているはずだ。
But people still deploy DES, and Congressmen blindly accept the assurances of high officials about its strength.	でも、人々はいまだにDESを導入し、議員たちはその強さについて、高官たちの保証をめくら滅法にうのみにし続けている。
There are many people who will not believe a truth until they can see it with their own eyes.	自分の目で実際に見るまで、真実であっても信用しないという人は多い。
Showing them a physical machine that can crack DES in a few days is the only way to convince some people that they really cannot trust their security to DES.	DESをものの数日でクラックできる物理的なマシンを本当に見せるというのは、DESにセキュリティを託すことはできないというのを、そういう人たちに納得させる唯一の方法だ。
Another set of people might not believe our claims unless several other teams have reproduced them.	別の人々は、ほかのチームが何度かそのマシンを再現しない限り、われわれの主張を信用しないだろう
(This is a basic part of the scientific method.)	（これは科学的手法の基本的な部分である）。
And many people will naturally be interested in how such a box works, and how it was built for only about $200,000.	それに、多くの人はこういうボックスがどういう仕組みで動くのか、そしてどうやってそれがたった20万ドルでつくれたのか、当然ながら興味を持つだろう。
This book was written for such people.	この本はそういう人たちのためにかかれた。
It contains the complete specifications and design documents for the DES Cracker, as well as circuit diagrams for its boards, and complete listings of its software and its gate array design.	ここにはDESクラッカーの完全な仕様と設計書が掲載されているし、基板の回路図も、ソフトやゲートアレイの設計についても完全なリストがあがっている。
The full publication of our design should enable other teams to rapidly reproduce, validate, and improve on our design.	われわれの設計をすべて公開したことで、ほかのチームは短時間でこれを再現し、確認し、さらに設計を改善させることができる。
* But see: David A. Wagner and Steven M. Bellovin, "A Programmable Plaintext Recognizer," 1994. Available at http://www.research.att.com/‾smb/papers/recog.ps or recog.pdf.	* しかしながら、 David A. Wagner and Steven M. Bellovin, "A Programmable Plaintext Recognizer," 1994 （http://www.research.att.com/‾smb/papers/recog.psまたはrecog.pdf）を見よ。
History of DES Cracking	DES クラッキングの歴史
DES Crackers have been mentioned in the scientific and popular literature since the 1970s.	DESクラッカーは、1970年代から科学文献や一般文献でなんどか言及されてきた。
Whitfield Diffie's Foreword describes several of them.	Whitfield Diffieの序文にもそのいくつかがかかれている。
The most recent detailed description was in a paper by Michael Wiener of Bell Northern Research in 1993.	近年で、いちばん詳細にそれを記述したのは、1993年にBell Northern ResearchのMichael Wienerが発表したものである。
Wiener's paper included a detailed hardware design of a DES Cracker built with custom chips.	Wienerの論文は、カスタムチップで作ったDESクラッカーの詳細設計をふくんでいた。
