Cracking DES	DESをクラック
since many plaintexts like "tholo tt" would appear "interesting" even though they don't match exactly.	「theolo tt」などというのも、正解ではなくても「おもしろい」と見られるからだ。
Using this definition of "interesting", a byte resulting from a wrong key will look interesting only about 8/256ths of the time, or 1/32nd of the time.	この「おもしろい」の定義を使うと、まちがった鍵で出てくるバイトがおもしろくなる可能性は、8/256または1/32だけになる。
All eight bytes resulting from a wrong key will look interesting only 1/32nd to the eighth power (1/32nd of 1/32nd of 1/32nd of 1/32nd of 1/32nd of 1/32nd of 1/32nd of 1/32nd) of the time, or 1/1,099,511,627,776th of the time (1/240 of the time).	8バイトすべてがおもしろくなる可能性は、1/32の8乗(1/32の1/32の1/32の1/32の1/32の1/32の1/32の1/32)、つまりは1/1,099,511,627,776(1/240)しかなくなる。
In other words, a search unit can try an average of a trillion keys before reporting that a wrong key looks interesting.	つまり、探索ユニットは、おもしろそうな鍵を報告するまでに、平均で1兆個くらいの鍵を試せるわけだ。
This lets it search for a long time without slowing down or bothering the software.	だから、止まったり、ソフトにかまったりして速度を落とさずに、かなり長時間探索を続けられることになる。
Once you get it going, a search unit can do one decryption in 16 clock cycles.	いったん動き始めたら、探索ユニットは16クロックサイクルで復号を一つできる。
The chips we have built can run with a clock of 40 Mhz (40 million cycles per second).	われわれの作ったチップは40MHz（1秒に4000万ヘルツ）で動ける。
Dividing 16 into 40 million shows that each search unit can try about 2.5 million keys per second.	16を4000万で割ると、各探索ユニットは毎秒だいたい250万鍵くらいを試せるのがわかる。
In building the search units, we discovered that we could make them run faster if we used simpler circuitry for adding 1 to a key.	探索ユニットをつくるにあたり、鍵に1を足すときの回路を簡単にすればスピードをあげられることを発見した。
Rather than being able to count from a key of O all the way up to a key of all ones, we limited the adder so that it can only count the bottom 32 bits of the key.	全ビットゼロの鍵から、全ビット1の鍵までずっと数えられるようなしかけにせずに、鍵の下32ビットだけ数えるような加算回路を採用してある。
The top 24 bits always remain the same.	てっぺんの24ビットはずっと同じままだ。
At a rate of 2.5 million keys per second, it takes a search unit 1717 seconds (about half an hour) to search all the possible keys that have the same top 24 bits.	毎秒250万鍵という速度だと、てっぺん24ビットが同じ鍵をすべて探索しつくすのには1717秒（約30分）かかる。
At the end of half an hour, the software has to stop the chip, reload it with a new value in the top 24 bits, and start it going again.	その30分が終わったら、ソフトがチップを止めて、24ビットに新しい値を入れ直して、またチップを走らせる。
Feedback Modes	フィードバックモード
The chip can also decrypt ciphertext that was encrypted in "Cipher Block  Chaining" mode.	チップはまた、「暗号ブロック連鎖モード（Cipher Block Chaining）」モードで暗号化された暗号も復号できる設計となっている。
In this mode, the ciphertext of each block is exclusive-OR'd into the plaintext of the next block before it is encrypted.	このモードでは、各ブロックの暗号文は、暗号化される前に次のブロックの平文にXORされる
(An "initialization vector" is exclusive-OR'd into the first block of plaintext.)	（平文の最初のブロックには「初期化ベクトル」がXORされる）。
The search unit knows how to exclusive-OR out an Initialization Vector (IV) after decrypting the first ciphertext, and to exclusive-OR out the first ciphertext after decrypting the second one.	探索ユニットは、最初の暗号文を復号してから、初期化ベクトル（IV）をXORしてはずすやりかたを知っているし、さらに二番目の暗号文を復号してから最初の暗号文をXORしてはずす方法も知っている。
The software specifies the IV at the same time it provides the ciphertext values.	IVの指定は、暗号文の値を指定するときと同時にソフトが指定する。
Blaze Challenge	Blaze 式チャレンジ
In June, 1997 Matt Blaze, a cryptography researcher at AT&T, proposed a different sort of cryptographic challenge.	1997年6月には、AT&Tの暗号研究者のMatt Blazeが、別の種類の暗号問題を提案した。
He wanted a challenge that not even the proponent knew how to solve, without either doing a massive search of the key-space, or somehow cryptanalyzing the structure of DES.	かれが考えていたのは、提案者ですら解決方法を知らず、鍵空間を大量に探索したり、DESの構造を暗号解析しないでもいいような問題だった。
His challenge is merely to find a key such that a ciphertext block of the form XXXXXXXX decrypts to a plaintext block of the form YYYYYYYY,	かれの問題というのは、 XXXXXXXX という形式の鍵が復号されるとYYYYYYYYのようなかたちになる鍵をみつける、というだけのものだ。
where X and Y are any fixed 8-bit value that is repeated across each of the eight bytes of the block.	このとき、XとYはそれぞれ任意の固定8ビット値で、それがブロックの8バイトすべてで繰り返されているわけだ。
We added a small amount of hardware to the search units to help with solving this challenge.	探索ユニットにちょっとハードを追加して、この問題の解決も手伝うことにした。
There is an option to exclusive-OR the right half of the plaintext into the left half, before looking to see if the plaintext is "interesting".	ユニットには、復号した平文がおもしろいかどうかを調べる前に、平文の右半分を左半分にXORするオプションがつけてある。
For plaintexts of the form YYYYYYYY, this will result in a left half of all zeros.	YYYYYYYYという形式の平文では、これは平文の左半分がすべてゼロになるということだ。
We can then set up the plaintext recognizer so it only looks at the left half, and only thinks zeroes are interesting.	こうすれば平文認識を設定するときに、左半分だけを見て、おもしろいのはゼロだけ、ということにしておく。
This will produce a large number of false positives (any plaintext where the left and right halves are equal, like ABCDABCD), but software can screen them out with only about a 1% performance loss.	これは大量の「もっともらしい」結果を作り出す（右半分と左半分が同じになっている平文、たとえばABCDABCDなどはすべてあてはまる）ことになるけれど、でもそれは、パフォーマンスを1%くらい下げるだけで、ソフトによってスクリーニングできる。
Structure Of The Machine	マシンの構成
Now that you know how a single search unit works, let's put them together into the whole machine.	これで探索ユニット一つの仕組みはわかってもらえたので、これを組み立ててマシン全体を作ってみよう。
Each search unit fits inside a custom chip.	各探索ユニットは、カスタムチップの中におさまっている。
In fact, 24 search units fit inside a single chip.	チップ一つには、探索ユニットが24個入っている。
All the search units inside a chip share the same ciphertext blocks. initialization vector, and the same plaintext-recognizer table of "interesting" result values.	一つのチップ内部の探索ユニットは、すべて同じ暗号文ブロックと、初期化ベクトルと、同じ「おもしろい」結果値の表を共有している。
Each search unit has its own key, and each can be stopped and started independently.	各検索ユニットは独立した鍵をもって、独立にとめたり走らせたりできる。
The chip provides a simple interface on its wires.	チップのピンは簡単なインターフェースだけを提供する。
There are a few signals that say whether any of the search units are stopped, some address and data wires so that the software can read and write to the search units, and wires for electrical power and grounding.	探索ユニットのどれかが止まったかを告げる信号がいくつか、ソフトが探索ユニットに読み書きできるような、アドレスとデータ用のピンがいくつか、そして電源と設置用のピンがある。
Since each search unit tries 2.5 million keys per second, a chip with 24 search units will try 60 million keys per second.	各探索ユニットは毎秒250万鍵を探索するので、24の探索ユニットを持ったチップは毎秒6000万鍵をためせる。
But there are a lot of keys to look at.	でも、相手にしている鍵もたくさんある。
For a single chip, it would take 6,950 days (about 19 years) to find the average key,	チップ一個なら、平均で鍵を見つけるのに6,950日かかる（約19年だ）。
or 38 years to search the entire key space.	鍵空間全体を探すには38年かかる。
Since we don't want to wait that long, we use more than one chip.	そんなに待つのはいやだったから、チップはもっとたくさん使うことにした。
Each chip is mounted onto a large circuit board that contains 64 chips,	各チップは、大きな回路基板にマウントされている。
along with a small bit of interface circuitry.	基板一枚に64チップがのり、さらにインターフェース用の回路も少々のっている。
The board blinks a light whenever the software is talking to that board.	基板は、ソフトがその基板とやりとりしているときにはLEDが光るようになっている。
64 other lights show when some search unit in each chip has stopped.	ほかにランプが64個あって、各チップの探索ユニットが止まったときには光ってわかるようになっている。
In normal operation the software will talk to the board every few seconds, to check up on the chips.	ふつうの使用だと、ソフトは数秒ごとに基板とやりとりをして、チップを調べてまわる。
The chips should only stop every once in a while, and should be quickly restarted by the software.	チップはほんのたまにしか止まらず、さらにすぐにソフトで再起動がかけられなくてはならない。
The boards are designed to the mechanical specifications of "9U" VMEbus boards (about 15" by 15").	基板は、「9U」VMEバスの基板の仕様にあわせて設計されている（約38センチx38センチ）。
VMEbus is an industrial standard for computer boards, which was popular in the 1980s.	VMEバスはコンピュータ基板用の工業規格で、1980年代にはよく使われた。
We used the VMEbus form factor because it was easy to buy equipment that such boards plug into;	VMEバスのサイズを使ったのは、そういう基板を差し込める装置が簡単に手に入るからだ。
we don't actually use the VMEbus electrical specifications.	VMEバス自体の電気仕様は使っていない。
9U VMEbus boards are much larger than the average interface card that plugs into a generic PC, so a lot more chips can be put onto them.	9U VMEバス基板は、汎用PCにささるふつうのインターフェースカードよりずっと大きいので、一枚にのるチップの数もずっと多くなる。
Also, 9U VMEbus boards are designed to supply a lot of power, and our DES Cracker chips need it.	さらに9U VMEバス基板は大量の電源が供給できる設計になっていて、DESクラッカーチップにはこれが必要だ。
Since each chip searches 60 million keys per second, a board containing 64 chips will search 3.8 billion keys per second.	各チップは毎秒6000万鍵を探索するので、チップ64個のった基板は、毎秒38億鍵を探索してくれる。
Searching half the key space would take the board about 109 days.	鍵空間を半分探索しつくすには、この基板一枚で109日かかる。
Since we don't want to wait that long either, we use more than one board.	これでもまだ、そんなには待ちたくなかったから、基板ももっとたくさん使うことにした。
The boards are mounted into chassis, also called "card cages".	基板はラック、またの名を「カードケージ」にさした。
In the current design, these chassis are recycled Sun workstation packages from about 1990.	現在の設計では、このラックは1990年頃のSunワークステーションパッケージをリサイクルしたものを使っている。
Sun Microsystems built a large number of systems that used the large 9U VMEbus boards, and provide excellent power and cooling for the boards.	Sun Microsystemsは、大型の9U VMEバス基板を使うシステムをたくさんつくっており、こういうシステムは基板の電源と冷却の点でもきわめて優れている。
The Sun-4/470 chassis provides twelve slots for VMEbus boards, and can easily be modified to handle our requirements.	Sun-4/470 のシャーシはVMEバス基板のスロットを12個分持っていて、こちらの要件にあうようにすぐに改造できた。
Subsequent models may use other physical packaging.	今後のモデルは、物理的なパッケージはちがったものになるだろう。
Each chassis has a connector for a pair of "ribbon cables" to connect it to the next chassis and to the generic PC that runs the software.	各ラックにはコネクタがついていて、そこにはリボンケーブルが2本ついて、となりのラックや、ソフトを動かす汎用PCと接続するようになっている。
The last chassis will contain a "terminator", rather than a connection to the next chassis,	最後のラックは、次のラックがないので、「ターミネータ」（末端抵抗）がついている。
to keep the signals on the ribbon cable from getting distorted when they reach the end of the line.	信号がリボンケーブルの終端にきたとき、そこではねかえって信号をゆがませないようにするために、そういう抵抗をつけておくわけだ。
Since each board searches 3.8 billion keys per second, a chassis containing 12 boards will search 46 billion keys per second.	各基板は一秒で38億鍵を探索するので、基板12枚をさしたラックは、毎秒460億鍵を探索することになる。
At that rate, searching half the key space takes about 9 days.	このスピードだと、鍵空間の半分を探索しつくすのには9日くらいかかることになる。
One chassis full of boards is about 25% faster than the entire worldwide network of machines that solved the RSA "DES-II" challenge in February 1998,	このラック一つに基板をいっぱいにさせば、1998年2月にRSAの「DES-II」チャレンジを解決した全世界のコンピュータを上回る速度となる。
which was testing about 34 billion keys per second at its peak.	このコンテストに参加した全世界のコンピュータ群は、ピーク時に秒速340億鍵をためしていた。
Since an informal design goal for our initial DES Cracker was to crack an average DES key in less than a week, we need more than 12 boards.	最初のDESクラッカーの非公式な目標としては、平均的なDES鍵を1週間以下でクラックすることだったので、基板は12枚以上必要ということになる。
To give ourselves a comfortable margin, we are using 24 boards, which we can fit into two chassis.	じゅうぶんに余裕をみて、基板を24枚使って、それをラック2つにおさめた。
They will search 92 billion keys per second, covering half the key space in about 4.5 days.	これで毎秒920億の鍵を探索してくれるので、鍵空間の半分を4.5日でカバーする。
If the chips consume too much power or produce too much heat for two chassis to handle,* we can spread the 24 boards across three chassis. a	チップがラック一つに入れるには消費電力が大きすぎたり、発熱が大きすぎたりしたら*、基板24枚をラック3つにわければいい。
Table 1-1: Summary of DES Cracker performance	Table 1-1: DES クラッカー性能のまとめ
DeviceHow Many In Next DeviceKeys/SecDays/avg search	デバイスその下のデバイスあたりの数鍵/秒探索あたり平均所要日数
Search Unit242,500,000166,800	探索ユニット242,500,000166,800
Chip6460,000,0006,950	チップ6460,000,0006,950
Board123,840,000,000109	基板123,840,000,000109
Chassis246,080,000,0009.05	ラック246,080,000,0009.05
EFF DES Cracker92,160,000,0004.524	EFF DES クラッカー92,160,000,0004.524
We designed the search unit once.	まず、探索ユニットを一回設計した。
Then we got a speedup factor of more than 36,000 to 1 just by replicating it 24 times in each chip and making 1500 chips.a	そしてそれを各チップごとに24回コピーして、さらにはそのチップを1,500個作っただけで、処理能力は36,000倍になった。
This is what we meant by "highly parallelizable"	これが「高度に並列処理可能（highly parallelizable)」ということだ。
The whole project was budgeted at about US$210,000.	プロジェクト全体で予算は21万ドルほどだった。
Of this, $80,000 is for the labor of designing, integrating, and testing the DES Cracker.	このうち8万ドルはDESクラッカーの設計、組み立て、テストにかかった労働コストである。
The other $130,000 is for materials, including chips, boards, all other components on the boards, card cages, power supplies, cooling, and a PC.	残り13万はチップ、基板、その他基板のコンポーネント、基板のラック、電源、冷却装置、そしてPCなどの直接コストである。
The software for controlling the DES Cracker was written separately, as a volunteer project.	DESクラッカーの制御用ソフトは別個にボランティアプロジェクトとしてかかれた。
It took two or three weeks of work.	作業としては二三週間ほどかかっている。
The entire project was completed within about eighteen months.	プロジェクト全体は、全部で18ヶ月ほどで完成した。
Much of that time was used for preliminary research, before deciding to use a custom chip rather than FPGA's.	その時間の大半は、初期のリサーチに費やされたもので、カスタムチップではなくFPGAを使おうとしていた時間が多い。
The contract to build custom chips was signed in September, 1997,	カスタムチップをつくるための契約は1997年8月にかわされた。
about eight months into the project.	プロジェクトがはじまって8ヶ月くらいたってからだ。
The team contained less than ten people, none of whom worked full-time on the project.	チームは全部で10人以下、しかもフルタイムでこのプロジェクトに取り組んだ者は一人もいない。
They include a project manager, software designer, programmer, chip designer, board designer, hardware technicians, and hardware managers.	チームメンバーは、プロジェクトマネージャ、ソフトデザイナー、プログラマ、チップ設計者、基板設計者、ハード技術者、ハードマネージャから構成される。
* At publication time, we have tested individual chips but have yet not built the full machine	刊行時点では、ここのチップはテストが終わっていたけれど、マシン全体はまだ作り終えていなかった。
If the chips' power consumption or heat production is excessive in a machine containing 1500 chips, we also have the option to reduce the chips' clock rate from 40 MHz down to, say, 30 MHz.	もしチップの消費電力か発熱が大きすぎて、チップ1500個を使ったマシンが無理なら、チップのクロックを40 MHz から、たとえば 30 MHz まで下げるという手もある。
This would significantly reduce the power and heat problems,	こうすれば熱と消費電力の問題は相当へる。
at a cost of 33% more time per search	ただしこの場合、探索時間は33%よけいにかかることになる
(6 days on average).	（つまり平均で6日よけいにかかることになる）。
We could have reduced the per-chip cost, or increased the chip density or search speed, had we been willing to spend more money on design.	もし設計にもっとお金をかける気があれば、チップあたりのコストを下げたり、チップ密度を上げたり、探索速度を向上させることもできたはずだ。
A more complex design could also have been flexible enough to crack other encryption algorithms.	もっと複雑な設計にすれば、ほかの暗号アルゴリズムをクラックできるだけの柔軟性ももてただろう。
The real point is that for a budget that any government, most companies, and tens of thousands of individuals could afford, we built a usable DES Cracking machine.	ここでほんとうに大事な点というのは、どんな政府でも、ほとんどの企業でも、そして何万人もの個人ですら手が届くような予算で、使い物になるDESクラック用マシンがつくれた、ということだ。
The publication of our design will probably in itself reduce the design cost of future machines, and the advance of semiconductor technology also makes this cost likely to drop.	この設計を公開したことで、将来のマシンの設計コストはもっと下がるだろうし、半導体技術の進歩も、コスト低下に貢献するはずだ。
In five years some teenager may well build her own DES Cracker as a high school science fair project.	5年もすれば、10代の子でも、高校の科学博覧会で自前のDESクラッカーがつくれるようになることは、じゅうぶんに考えられる。
Who Else Is Cracking DES?	ほかにはだれがDESをクラックしているだろう?
If a civil liberties group can build a DES Cracker for $200,000, it's pretty likely that governments can do the same thing for under a million dollars.	もし市民自由団体がDESクラッカーを20万ドルでつくれるなら、おそらく政府機関でも100万ドル以下で同じものをつくれるはずだ
(That's a joke.)	（いまのは冗談）。
Given the budget and mission of the US National Security Agency, they must have started building DES Crackers many years ago.	US National Security Agency の予算と使命を考えると、おそらくかれらは何年も前にDESクラッカーをつくりはじめているはずだ。
We would guess that they are now on their fourth or fifth generation of such devices.	われわれの見当では、おそらくそういうマシンの4世代目か5世代目にかかっているだろう。
They are probably using chips that are much faster than the ones we used;	われわれのものよりかなり高速なチップも使っているはずだ。
modern processor chips can run at more than 300 Mhz,	現在のプロセッサは300MHz以上で走る。
eight times as fast as our 40 Mhz chips.	われわれの40MHzチップの8倍以上のはやさだ。
They probably have small "field" units that fit into a suitcase and crack DES in well under a day;	おそらくはスーツケースにおさまるような「野戦用」ユニットもあって、それでもDESを一日でクラックできるだろう。
as well as massive central units buried under Ft. Meade, that find the average DES key in seconds, or find thousands of DES keys in parallel, examining thousands of independent intercepted messages.	フォート・ミードの地下にはすさまじい中央ユニットがあって、ふつうのDES鍵をものの数秒でやぶり、しかも同時に独立に傍受したメッセージを何千も解読しているだろう。
Our design would scale up to finding a DES key in about half an hour, if you used 333,000 chips on more than 5,200 boards.	もし基板5200枚上にチップ33.3万個を載せて使えば、DES鍵は30分くらいでみつかる。
The boards would probably require about 200 parallel port cards to communicate with them;	基板はおそらく、通信用にパラレルポート200くらいが必要だろう。
an IBM-compatible PC could probably drive four such cards, thus requiring about 50 PC's too.	IBM互換パソコンがそういう基板4枚を同時に相手にできるので、これはパソコン50台ということだ。
The software required would be pretty simple:	必要なソフトはごく簡単になる。
the hard part would be the logistics of physical arrangement and repair.	いちばん難しいのは、物理的な配置と修理の物資移動に関わる部分だ。
This is about 200 times as much hardware as the project we built.	これはわれわれがつくったものの200倍のハードとなる。
