Cracking DES	DESをクラック
in which the first plaintext block is XORed with an initialization vector (IV) prior to encryption, and each subsequent plaintext is XOR with the previous ciphertext.	最初の平文ブロックが、初期化ベクトル（IV）とXORされ、その後の平文ブロックは、その前の暗号文とXORされる。
ChipID	チップID
A value used by the host computer to specify which chip on a board is being addressed.	ホストコンピュータが、基板上のどのチップをアクセスするか指定するときに使う値。
Ciphertext	暗号文
Encrypted data.	暗号化されたデータ。
The first of the two ciphertexts to be attacked.	攻撃する暗号文のうち最初のもの。
The second of the two ciphertexts to be attacked.	攻撃する暗号文のうち2番目のもの。
Pre-ANSI C can be supported if required.	必要なら、ANSI C 以前のものもサポート可能。
Any GUI code will probably be written in C++ .	GUIコードはおそらくすべてC++で書かれるはず。
A register used to select the current ciphertext being attacked.	現在攻撃されている暗号文を選ぶためのレジスタ。
The selector is needed because a single DES engine needs to be able to test two ciphertexts to determine whether both are acceptable matches before deciding that a key is good match.	各DESエンジンは、あるキーが見込みありそうだと判断するときに、暗号文を2つテストして両方とも見込みある結果が出ていることを確認するので、このセレクタが必要になる。
The Data Encryption Standard.	データ暗号化規格（The Data Encryption Standard）
A register to make the search units perform an extra operation which XORs the right and left halves of the result together.	復号結果の右半分と左半分をXORをする追加操作を探索ユニットにさせるためのレジスタ。
This is used to add support for Matt Blaze's DES challenge.	Matt BlazeのDES問題の解決をサポートできるように追加された。
Host computer	ホストコンピュータ
The computer that controls the DES search array.	DES探索アレイをコントロールするコンピュータ。
KeyCounter	キーカウンタ
Each search unit has a KeyCounter register which contains the current key being searched.	各探索ユニットにはキーカウンタ・レジスタがあって、現在チェック中の鍵がおさめられている。
These registers are each 7 bytes long, to hold a 56-bit key.	このレジスタはそれぞれ7バイトあり、56ビットの鍵がおさまるようになっている。
Plaintext	平文（Plaintext）
Unencrypted data corresponding to a ciphertext.	暗号文に対応した、暗号化されていないデータ。
An 8-bit register used to mask off plaintext bytes.	8ビットのレジスタで、平文のバイトにマスクをかけるために使う。
This is used to mask off bytes in the plaintext whose values aren't known or are too variable to list in the PlaintextVector.	平文で、値のわかっていないバイトをマスクしておいたり、わかってはいてもPlaintextVectorに記述できるほど明確ではない場合に使う。
A 256-bit register used to specify which byte values can be present in valid plaintexts.	256-bit のレジスタで、見込みある平文でどのバイト値があり得るかを指定するためのもの。
It is the host computer's responsibility to ensure that only a reasonable number of bits are set in the PlaintextVector;	ホストコンピュータは、PlaintextVectorのまともな数のビットがセットされているのを自分で確認する必要がある。
setting too many will cause the DES search units to halt too frequently.	セットされているビットが多すぎれば、DESの探索が止まる回数が多くなりすぎる。
A 64-bit register XORed onto the value derived by decrypting ciphertext 0.	Ciphertext0 を復号した結果にXORされる64-bit レジスタ。
Normally this mask is either zero or set to the CBC mode initialization vector (IV).	ふつうは、このマスクは0ｓｗ、CBCモードのときには初期化ベクトル（IV）にセットされる。
A bit for each search unit which indicates whether it is currently searching, or whether it has stopped at a candidate key.	各探索ユニット上のビットで、現在探索を行っているか、それとも候補鍵を見つけて止まっているかを示す。
Stopped search units can be restarted by loading a key which does not halt and resetting this bit.	止まった探索ユニットを再開するには、止まらない鍵をロードして、このビットをリセットする。
A register containing miscellaneous information about how DES results should be post-processed	DESの結果をどのように事後処理するかについて、各種の情報を入れておくレジスタ。
and also indicating whether any search units on the chip or on the board have halted.	さらに、チップ上または基板上の探索ユニットがどれか止まったかどうかも示す。
A bit in SearchInfo which directs the search engine to do CBC-mode post-processing after decryption	SearchInfo の中のビットで、探索エンジンが復号後にCBCモードの事後処理を行うように指示する
(e.g., XOR the decryption of ciphertext1 with ciphertext0 to produce plaintext1).	（つまりciphertext1の復号結果をciphertext0とXORしてplaintext1をつくるようにする）。
Design for DES Key Search Array Chip-Level Specification	DES 鍵探索アレイの設計：チップレベルの仕様
In this chapter:	本章の内容:
ASIC Description	ASICの説明
Board description	基板の説明
Read and Write Timing	リード／ライトのタイミング
Addressing Registers	アドレス指定用レジスタ
All-active Signal	All-active 信号
ASIC Register Allocation	ASIC レジスタのわりあて
ASIC Description	ASIC の説明
Selects Cipher text 1	Cipher text 1 を選ぶ
Search is active	探索がアクティブ
Plain text bit mask and DES output	平文ビットマスクとDES出力
a Zero is found in any bit position of plain text vector as specified in step 4 of Search Unit Operation (see Chapter 2)	「探索ユニットの仕組み」のStep 4で指定された平文ベクトルのビット位置すべてにゼロが入る（第二章参照）
Perform step 3 of Search Unit Operation (see Chapter 2)	「探索ユニットの仕組み」のStep 3で指定された操作を行う。（第二章参照）
3-2 3-2 Figure 3-1. Search Unit Operation Flow Chart	Figure 3-1. 探索ユニットの動きのフローチャート
To determine the maximum number of bit required for the Key:	鍵に必要な最大のビット数を決めるために：
K= log2(Maximum combinations/number of chips)	K= log2(最大組み合わせ数/チップ数)
= log2(256/(24 cpc * 64 cpb * 24 boards) = log2(1. 95E12) = 42 bits	= log2(256/(24 cpc * 64 cpb * 24 基板) = log2(1. 95E12) = 42 ビット
If we are going to use 32-bit counters, then it will overflow every:	32ビットカウンタを使う場合には、これは以下の間隔でオーバーフローすることになる：
Figure 3-2 State Diagram tor the Search Unit	Figure 3-2 探索ユニットの状態ダイヤグラム
Board description	基板の説明
The PC will interface with the ASICs through a parallel card.	コンピュータはパラレルカード経由でASICとインターフェースする。
The parallel card has three ports, assigned:	パラレルカードにはポートが3つあり、以下のように割り当てられている：
Port A: Address(7:0)	Port A: アドレス(7:0)
Port B: Data(7:0)	Port B: データ(7:0)
Port C: Control, 8 signals	Port C: 制御信号 8 本
To reduce the routing resources on the boards and ASICs we multiplex the address lines.	基板とASICのルーティングリソースを減らすために、アドレス線は多重化してある。
To access a register on the ASIC, it is required that the software latch the address three times:	ASIC上のレジスタをアクセスするためには、ソフトはアドレスを3回ラッチする必要がある。
Board-ID(7:0), Chip-ID(6:0) and then Register address.	基板-ID(7:0), チップ-ID(6:0) 最後にレジスタアドレスである。
Figure 3-3: Search Unit's Block Diagram	Figure 3-3: 探索ユニットのブロックダイヤグラム
Having switches on the board makes the design flexible and expandable.	基板上にスイッチを持つことで、設計が柔軟で拡張しやすいものになる。
Each board has its own unique Board-ID configured on switches:	各基板には、固有の基板 ID があって、これがスイッチで設定できるようになっている。
for example a board with an ID of hexadecimal 5F has its board ID switches configured as follows:	たとえば16進で 5F の基板 ID を持つ基板は、基板 ID スイッチを以下のように設定することなる：
Read and Write Timing	リード／ライトのタイミング
Addressing Registers	アドレス指定用レジスタ
Figure 3-4 Address Bus Scheme	Figure 3-4 アドレスバスのダイヤグラム
All-active Signal	All-active 信号
If low the SearchActive bit together [?].	この信号がlowなら、探索ユニットのどれか（複数可）がとまったことになる。
We will place one AND gate per ASIC and cascade them.	ASICごとにANDゲートを一つおいて、それをカスケード接続している。
ASIC Register Allocation	ASIC レジスタわりあて
Registers Common to All Search Units	全探索ユニットに共通するレジスタ
0x39-0x3eReserved	0x39-0x3e予約済み
Additional Registers for Search Units	探索ユニットのその他レジスタ
0x40-0x47Search Unit 0: Key counter (first 7 bytes) and Search Status	0x40-0x47探索ユニット 0: キーカウンタ (最初の 7 バイト) と Search Status
0x48-0x4fSearch Unit 1: Key counter (first 7 bytes) and Search Status	0x48-0x4f探索ユニット 1: キーカウンタ (最初の 7 バイト) と Search Status
0xf8-0xffSearch Unit 23: Key counter (first 7 bytes) and Search Status	0xf8-0xff探索ユニット 23: キーカウンタ (最初の 7 バイト) と Search Status
Number of register required:	必要なレジスタ数：
58 common registers + 8 * n registers; n = the total number of search units in an ASIC	共通レジスタ 58 + 8 * n レジスタ; n = ASIC内の探索ユニットの総数。
In this case n = 24, therefore 58 + 192 = 250 registers	この倍には n = 24 なので、 58 + 192 = 250 レジスタが必要となる。
Note: The unspecified pins are Non-Connects	Note: 指定のないピンは接続なし
Scanning the Source Code	ソースコードのスキャン
In this chapter:	本章の内容:
The Politics of Cryptographic Source Code	暗号ソースコードの政治性
The Paper Publishing Exception	紙の出版物は例外
Scanning	スキャン
Bootstrapping	ブートストラップ
The next few chapters of this book contain specially formatted versions of the documents that we wrote to design the DES Cracker.	この先の何章かは、DESクラッカーの設計のためにわれわれが書いたドキュメントを、特別な書式で掲載している。
These documents are the primary sources of our research in brute-force cryptanalysis, which other researchers would need in order to duplicate or validate our research results.	これらのドキュメントは、ばか力方式暗号解析研究におけるわれわれの主要なソースであり、ほかの研究者はわれわれの研究結果を再現したり追試したりするためにこれが必要となる。
The Politics of Cryptographic Source Code	暗号ソースコードの政治性
Since we are interested in the rapid progress of the science of cryptography, as well as in educating the public about the benefits and dangers of cryptographic technology,a	われわれは暗号の科学の急速な進歩に関心があるし、さらには市民にたいして暗号技術のメリットや危険性について啓蒙することにも関心がある。
we would have preferred to put all the information in this book on the World Wide Web.	したがって、できればこうした情報をすべてWorld Wide Webに載せたいと思っていた。
There it would be instantly accessible to anyone worldwide who has an interest in learning about cryptography.	そうすれば、暗号の勉強をしたいと思う世界中の人が、だれでもすぐにアクセスできるようになる。
Unfortunately the authors live and work in a country whose policies on cryptography have been shaped by decades of a secrecy mentality and covert control.	残念ながら、著者たちの住んで働いている国では、暗号に関する政策は何十年にもわたる秘密主義と隠密統制のもとで形成されてきている。
Powerful agencies which depend on wiretapping to do their jobs	強力な政府機関が業務のために盗聴を利用している
--as well as to do things that aren't part of their jobs, but which keep them in power	――そして業務以外の、自分の権力を温存するための目的でも。
--have compromised both the Congress and several Executive Branch agencies.	こうした機関が、議会や政府の重要機関を操ってきた。
They convinced Congress to pass unconstitutional laws which limit the freedom of researchers--such as ourselves--to publish their work.	かれらは議会を説得して、研究者――われわれのような――が自分の研究成果を公開する自由を制限するような、憲法違反の法律を可決させてしまった。
(All too often, convincing Congress to violate the Constitution is like convincing a cat to follow a squeaking can opener, but that doesn't excuse the agencies for doing it.)	（議会に憲法違反をするよう説得するのは、ネコにキイキイいう缶切りの音を聞いて（エサがもらえると思って）寄ってくるように説得するのとおなじくらい簡単なことが多いのだけれど、だからといってそういう機関がそういうまねをしていいということにはならない。）
They pressured agencies such as the Commerce Department, State Department, and Department of Justice to not only subvert their oaths of office by supporting these unconstitutional laws, but to act as front-men in their repressive censorship scheme, creating unconstitutional regulations and enforcing them against ordinary researchers and authors of software.	商務省や国務省、法務省などに圧力をかけて、こうした違憲な法律を支持するようにさせて職務上の宣誓を破らせただけでなく、その抑圧的な検閲方式の窓口にさせて、違憲な規制をつくらせ、ふつうの研究者やソフト作者を弾圧するようにさせている。
The National Security Agency is the main agency involved, though they seem to have recruited the Federal Bureau of Investigation in the last several years.	これに関与している主要政府機関は、National Security Agencyであるが、ここ数年はFBIもリクルートされたらしい。
From the outside we can only speculate what pressures they brought to bear on these other parts of the government.	外側にいるわれわれとしては、この機関たちが、政府のほかの部分にたいしてどんな圧力をかけているのか、推測するしかない。
The FBI has a long history of illicit wiretapping, followed by use of the information gained for blackmail, including blackmail of Congressmen and Presidents.	FBIは、違法な盗聴をながいことつづけているし、盗聴のあとは、その情報を脅迫（議員や大統領に対する脅迫も含め）に使っている。
FBI spokesmen say that was "the old bad FBI" and that all that stuff has been cleaned up after J. Edgar Hoover died and President Nixon was thrown out of office.	FBI のスポークスマンは、それが「むかしのわるいFBI」の話であって、J. エドガー・フーヴァーが死んで、ニクソン大統領が失脚してからはもうそういうのは一掃された、と言う。
But these agencies still do everything in their power to prevent ordinary citizens from being able to examine their activities,	でもこうした機関は、ふつうの市民がかれらの活動を調べようとすると、あらゆる手を使ってこれを妨害する。
e.g. stonewalling those of us who try to use the Freedom of Information Act to find out exactly what they are doing.	Freedom of Information 法を使って、かれらがやっていることをはっきり知ろうとすると、協力を拒否するわけだ。
Anyway, these agencies influenced laws and regulations which now make it illegal for U.S. crypto researchers to publish their results on the World Wide Web (or elsewhere in electronic form).	とにかく、こうした機関は法や規制に影響を与えて、アメリカの暗号研究家たちがその結果をWorld Wide Web (あるいはそれ以外の電子的な形）で公開するのを非合法にしてしまった。
The Paper Publishing Exception Several cryptographers have brought lawsuits against the U.S. Government	紙の出版物は例外暗号学者のなかには、アメリカ政府に対する訴訟をおこした人たちもいる。
because their work has been censored by the laws restricting the export of cryptography.	暗号の輸出を禁止する法律のために、自分たちの研究成果が検閲されてしまっているからだ。
(The Electronic Frontier Foundation is sponsoring one of these suits, Bernstein v. Department of Justice, et al ).*	(Electronic Frontier Foundation は、こうした訴訟の一つ Bernstein v. Department of Justice, et al を資金援助している)*。
One result of bringing these practices under judicial scrutiny is that some of the most egregious past practices have been eliminated.	こうした慣行を、裁判で検討してもらうことの結果の一つとして、かつて存在していたきわめてあくどいやり口が使われなくなってきた、ということがある。
For example, between the 1970s and early 1990s, NSA actually did threaten people with prosecution if they published certain scientific papers, or put them into libraries.	たとえば、1970年代から1980年代初期にかけて、ある種の科学論文を刊行したり、それを図書館においたりした研究者にたいして、NSAは刑事訴訟をちらつかせて脅しをかけている。
They also had a "voluntary" censorship scheme for people who were willing to sign up for it.	また、協力しようという人々に対しては「自主的」検閲方式も用意していた。
Once they were sued, the Government realized that their chances of losing a court battle over the export controls would be much greater if they continued censoring books, technical papers, and such.	でも訴えられると、政府としては、こうした本や論文などを検閲し続ければ、輸出制限での法廷闘争においてとても不利になることを理解したわけだ。
Judges understand books.	判事は、本ならわかる。
They understand that when the government denies people the ability to write, distribute, or sell books, there is something very fishy going on.	政府が人々にたいして、本を書いたり頒布したり販売したりするのを禁止するというのは、なにか怪しげなことが行われているのだ、というのも、判事たちは理解できる。
The government might be able to pull the wool over a few judges' eyes about jazzy modern technologies like the Internet, floppy disks, fax machines, telephones, and such.	政府は、インターネットやフロッピーディスク、ファックスや電話といった派手な現代技術についてなら、判事数人の目をくらませることはできるだろう。
But they are unlikely to fool the judges about whether it's constitutional to jail or punish someone for putting ink onto paper in this free country.	でも、この自由な国で、紙にインクをのせただけでだれかを牢屋にぶちこんだり、処罰したりするというのが憲法にてらして正しいかどうか、という点については、ごまかされる判事はいないだろう。
* See http://www.eff.org/pub/Privacy/ITAR_export/Bernstein_case/.	* http://www.eff.org/pub/Privacy/ITAR_export/Bernstein_case/を見よ。
Therefore, the last serious update of the cryptography export controls (in 1996) made it explicit that these regulations do not attempt to regulate the publication of information in books (or on paper in any format).	したがって、暗号の輸出禁止に関する最新の重要なアップデート（1996）では、こうした輸出規制は、情報を本（あるいはそれ以外のあらゆる形式の紙）として出版することに対しては適用されないことが明記されることになった。
They waffled by claiming that they "might" later decide to regulate books--presumably if they won all their court cases	政府機関のほうは、いずれ本も規制の対象にする「かもしれない」――おそらくは、いまの法廷闘争すべてに勝ったら、ということだろう――と煮え切らないことを言ってはいる。
-- but in the meantime, the First Amendment of the United States Constitution is still in effect for books, and we are free to publish any kind of cryptographic information in a book.	でもそれまではアメリカ合州国憲法の修正第一条がまだ本に対しては適用されているので、われわれは本の形でなら、どんな暗号に関する情報を出版するのも自由である。
Such as the one in your hand.	たとえば、いまごらんになっている本書のような。
Therefore, cryptographic research, which has traditionally been published on paper, shows a trend to continue publishing on paper,	したがって、暗号研究はこれまで紙ベースで発表されてきたけれど、今後も紙での発表が続くトレンドを見せている。
while other forms of scientific research are rapidly moving online.	ほかの科学研究は急速にオンライン化されつつあるのだが。
The Electronic Frontier Foundation has always published most of its information electronically.	Electronic Frontier Foundation はこれまで、情報のほとんどを電子的に公開してきた。
We produce a regular electronic newsletter, communicate with our members and the public largely by electronic mail and telephone, and have built a massive archive of electronically stored information about civil rights and responsibilities,	定期的な電子ニュースレターを出し、メンバーや一般市民とのやりとりもほとんどが電子メールと電話で、市民の権利と責任についての電子保存情報をの膨大な資料庫をつくりあげてきた。
which is published for instant Web or FTP access from anywhere in the world.	これは世界中から、すぐにWebやFTP経由でアクセスできるようになっている。
We would like to publish this book in the same form, but we can't yet,	この本も、おなじ形式で出版したいと思ったけれど、でもまだそれは不可能だ。
until our court case succeeds in having this research censorship law overturned.	このためには、われわれの法廷闘争で、研究に対する検閲を認める法律が却下されなくてはならない。
Publishing a paper book's exact same information electronically is seriously illegal in the United States, if it contains cryptographic software.	アメリカでは、暗号ソフトが入った本とまったくおなじ情報を電子的に公開すると、深刻な非合法行為となってしまう。
Even communicating it privately to a friend or colleague, who happens to not live in the United States, is considered by the government to be illegal in electronic form.	それを個人的に、友だちや同僚に教えるだけでも、それが電子的に行われる場合でその相手がアメリカに住んでいない場合には、政府に非合法であるとされてしまう。
The U.S. Department of Commerce has officially stated that publishing a World Wide Web page containing links to foreign locations which contain cryptographic software "is not an export that is subject to the Export Administration Regulations (EAR)."*	アメリカ商務省は、暗号ソフトのある外国のロケーションへのリンクを含んだWorld Wide Web ページを公開しても、それは「輸出監督規制（Export Administration Regulations, EAR）の対象となる輸出にはならない」と公式に発表している。*
This makes sense to us	これはわれわれにも納得がいく
--a quick reductio ad absurdum shows that to make a ban on links effective, they would also have to ban the mere mention of foreign Universal Resource Locators.	――ちょっと「極論にまで誇張」reductio ad absurdum 式の思考実験をしてみれば、リンク禁止が実質的に意味を持つためには、外国の Universal Resource Locatorsを表示すること自体を禁止しなくてはならないことがわかる。
URLs are simple strings of characters,	URL というのはただの文字が並んでいるだけだ。
