The Bolted Door	『閉ざされたドア』
-- the pale-fleshed English kind.	――肉厚で青白いイギリス種、というところでしょうか。
His life, apathetic and motionless, hung in a net of gold, in an equable warm ventilated atmosphere, high above sordid earthly worries.	じいさんの命は、なんの感動もなければ動くこともなく、黄金の網のなかでぬくぬくと気持ちのいい空気を浴びて、下劣な地上の心配事から煩わされることもないままぶら下がっていたんです。
The cardinal rule of his existence was not to let himself be 'worried.' . . .	生活の基本ルールは、自分を『煩わせないこと』だったんですよ。
I remember his advising me to try it myself,	私にもそうするようにアドバイスしてきたのを思えています。
one day when I spoke to him about Kate's bad health, and her need of a change.	ケイトの病気のことを話したことがあるんですよ、ケイトには気晴らしが必要だ、とね。
'I never let myself worry,'	『わしは絶対に悩むことのないよう、気をつけておるのだ』
he said complacently.	とかなんとか、悦に入って言うんです。
'It's the worst thing for the liver	『肝臓に一番良くない
-- and you look to me as if you had a liver.	――なんじゃ、おまえにも肝臓があるとでも言うのか。
Take my advice and be cheerful.	まぁ、わしの言うことを聞いて、気持ちを前向きに持つんじゃな。
You'll make yourself happier and others too.'	おまえが幸せな気持ちでおると、ほかの者もそうなってくる』
And all he had to do was to write a cheque, and send the poor girl off for a holiday!	じいさんがしなきゃならんのは、ただ、かわいそうな娘が休みの日をどこかで過ごせるよう、小切手を書くだけのことだったのに。
"The hardest part of it was that the money half-belonged to us already.	「なによりも辛かったのは、その金は、すでに半分、私たちのものだった、ということです。
The old skin-flint only had it for life, in trust for us and the others.	ケチなじいさんは、死ぬまで、私たちやほかの人間のものをただ預かっているだけだったんです。
But his life was a good deal sounder than mine or Kate's	ところがやつの命は、私やケイトの命より、ずいぶん頑丈にできていた。
-- and one could picture him taking extra care of it for the joke of keeping us waiting.	おまけに待たせている私たちを笑いものにしたいのか、ことさらに気をつけていたんです。
I always felt that the sight of our hungry eyes was a tonic to him.	私たちの飢えた目は、やつにとって強壮剤なんだ、といつも思っていました……。
"Well, I tried to see if I couldn't reach him through his vanity.	「ともかく、やつの虚栄心を足がかりに、なんとか取り入ることができないものだろうか、と思いました。
I flattered him, feigned a passionate interest in his melons.	おべっかを使って、さもメロンに興味があるかのようなふりをしてみたんです。
And he was taken in, and used to discourse on them by the hour.	やつはそれを真に受けて、何時間もメロンの講義をしてくれましたよ。
On fine days he was driven to the green-houses in his pony-chair, and waddled through them, prodding and leering at the fruit, like a fat Turk in his seraglio.	晴れた日には、こまつきの椅子に乗って温室まで行くと、よたよたと中を歩きながら、後宮を行く太ったトルコ人のように、メロンをつついたり、流し目をくれたりしてましたっけ。
When he bragged to me of the expense of growing them I was reminded of a hideous old Lothario bragging of what his pleasures cost.	メロンを育てるのに、どれほど金がかかっているか自慢しだしたのには、老いさらばえた胸が悪くなるような女たらしが、快楽のためにどれほど金を使うか自慢しているところを思い出しました。
And the resemblance was completed by the fact that he couldn't eat as much as a mouthful of his melons -- had lived for years on buttermilk and toast.	自分のメロンは、ほんのひとくちたりとて食べられない、もう何年も、食事はもっぱらバターミルクとトーストだけ、というのを聞いて、その連想は完璧だと思いましたね。
'But, after all, it's my only hobby	『じゃが、どのみちわしのたったひとつの楽しみじゃ。
-- why shouldn't I indulge it?'	それに溺れていかんという理由など、どこにある？』
he said sentimentally.	と、感傷的なことを言っていましたっけ。
As if I'd ever been able to indulge any of mine!	この私は、自分のやりたいことなんて、これまで一度だって夢中になるほどやれたことがないというのにね。
On the keep of those melons Kate and I could have lived like gods. . .	メロンを維持する費用だけで、ケイトとわたしは神のような生活ができたかもしれないのに。
"One day toward the end of the summer,	「夏も終わりに近いある日でした。
when Kate was too unwell to drag herself up to the big house, she asked me to go and spend the afternoon with cousin Joseph.	ケイトが、具合が悪くて、母屋まで身体を引きずっていくこともできない、午後からジョゼフじいさんの所へ行って相手をしてくれ、と頼んできたのです。
It was a lovely soft September afternoon --	気持ちのいい、穏やかな九月の昼下がりでした。
a day to lie under a Roman stone-pine, with one's eyes on the sky, and let the cosmic harmonies rush through one.	ローマカサマツの下に寝ころんで、空を見上げながら、宇宙のハーモニーが心に浮かんでくるのにまかせたくなるような日だった。
Perhaps the vision was suggested by the fact that,	おそらくあることを思いついたのも、そのせいだったんでしょうね。
as I entered cousin Joseph's hideous black walnut library, I passed one of the under-gardeners, a handsome full-throated Italian, who dashed out in such a hurry that he nearly knocked me down.	じいさんの趣味の悪い黒グルミ材でできた書斎に入っていこうとすると、庭師のひとり、ハンサムで声の大きなイタリア人が、私をなぎ倒さんばかりの勢いで、部屋から飛び出してきたんです。
I remember thinking it queer that the fellow, whom I had often seen about the melon-houses, did not bow to me, or even seem to see me.	温室で何度も会っていたのに、会釈もしない、こちらを見ようともしないので、変だと思ったのを覚えています。
< 10 > "Cousin Joseph sat in his usual seat, behind the darkened windows,	「ジョゼフじいさんは暗くした窓を背に、いつもの場所にすわっていました。
his fat hands folded on his protuberant waistcoat, the last number of the Churchman at his elbow,	太った手は、ぶくぶく膨れ上がったチョッキに差しこまれ、『聖職者』の最新号が手元に置いてありました。
and near it, on a huge dish, a fat melon	そのすぐ横には、おおきな皿に、まん丸いメロン
-- the fattest melon I'd ever seen.	――これまで見たこともないほどよく実ったメロンがあったんです。
As I looked at it I pictured the ecstasy of contemplation from which I must have roused him,	それを見て、じいさんをその気にさせることができるにちがいない、と考えて、有頂天になりそうでした。
and congratulated myself on finding him in such a mood, since I had made up my mind to ask him a favour.	なにしろ頼み事をするつもりでしたので、運良くいい気分でいてくれて喜んでいたのです。
Then I noticed that his face,	そのとき、じいさんの表情に気がつきました。
instead of looking as calm as an eggshell, was distorted and whimpering	いつもの卵みたいにつるんとした顔が、歪んですすり泣いていたのです。
-- and without stopping to greet me he pointed passionately to the melon.	私が入っていっても泣きやむ様子もなく、度を失ったようにメロンを指さしました。
"'Look at it, look at it	『見てくれ、これを
-- did you ever see such a beauty?	……こんな美しいものを見たことがあるか？
Such firmness	こんなに実の詰まった、
-- roundness	こんなにもまるまるとした
-- such delicious smoothness to the touch?'	……こんなにも美味そうな、滑らかな手触りをしたものを』
It was as if he had said 'she' instead of 'it,' and when he put out his senile hand and touched the melon I positively had to look the other way.	“これ”という代わりに“この女”とでも言いたげな口調で、老いさらばえた手を伸ばしてメロンを撫で回すのを、むりやりそしらぬ顔をしていなければなりませんでした。
"Then he told me what had happened.	「それからじいさんは何が起こったか教えてくれました。
The Italian under-gardener, who had been specially recommended for the melon-houses	そのイタリア人は、メロン園のために特別に寄越された庭師でした。
-- though it was against my cousin's principles to employ a Papist -- had been assigned to the care of the monster:	カトリック教徒を雇うなんて、じいさんの主義には反していたんですが、そのお化けメロンの面倒を見るために、特別に契約したんです。
for it had revealed itself, early in its existence, as destined to become a monster, to surpass its plumpest, pulpiest sisters, carry off prizes at agricultural shows, and be photographed and celebrated in every gardening paper in the land.	メロンの化け物というのは、ごく早い時期から、ほかのどれよりも肉厚で汁気の多いものになる、品評会では賞をかっさらい、土地の園芸紙に写真と賛辞が載るものになる、ってことが分かるんですね。
The Italian had done well	イタリア人はよくやっていましたよ。
-- seemed to have a sense of responsibility.	責任感があったんでしょうな。
And that very morning he had been ordered to pick the melon,	とにかくその日の朝、メロンを選ぶよう命じられたんです。
which was to be shown next day at the county fair, and to bring it in for Mr. Lenman to gaze on its blonde virginity.	翌日の郡の農産物品評会に出品することになっていて、もぎたてのブロンド美人を、じいさんがじっくり愛でることができるように持ってこい、というわけです。
But in picking it, what had the damned scoundrelly Jesuit done but drop it	ところが採っている最中、このカトリック教徒がなんたることか、落としてしまった。
-- drop it crash on the sharp spout of a watering-pot, so that it received a deep gash in its firm pale rotundity, and was henceforth but a bruised, ruined, fallen melon?	じょうろの尖った注ぎ口の上に落としたもんだから、固くて青くて丸いメロンは深手を負って、台無しになり、文字通り地に落ちたメロンとなったんです。
"The old man's rage was fearful in its impotence	「じいさんは怒りのあまり、茫然自失していました。
-- he shook, spluttered and strangled with it.	ぶるぶる震えているし、しどろもどろだし、息も絶えだえ、という具合でしたね。
He had just had the Italian up and had sacked him on the spot,	ちょうとイタリア人を呼びつけて、その場でクビにしたところだったんです。
without wages or character	労賃も払わなけりゃ、つぎの雇い主への紹介状もなし。
-- had threatened to have him arrested if he was ever caught prowling about Wrenfield.	レンフィールドの近所をうろつきでもしたら、警察に捕まえさせてやる、と脅かした。
'By God, and I'll do it	『絶対にそうしてやるからな
-- I'll write to Washington	――ワシントンに手紙を書くぞ
-- I'll have the pauper scoundrel deported!	――金もないごろつきなど、強制送還させてやる。
I'll show him what money can do!'	金があれば何ができるか、やつに目にもの見せてくれるわ』ってね。
As likely as not there was some murderous Black-hand business under it	十中八九、あくどいことばかりやっている黒手団がらみの仕業にちがいない、
-- it would be found that the fellow was a member of a 'gang.'	あいつがギャングの一味であることなんか、すぐにわかるだろう。
Those Italians would murder you for a quarter.	ああいうイタリア人連中というのは、たった25セントのために人殺しをするんだ。
He meant to have the police look into it. . .	警察を呼ばなくては……。
And then he grew frightened at his own excitement.	そのうちじいさんも自分が興奮しているのが怖くなってきたんです。
'But I must calm myself,'	『落ち着かなきゃならん』
he said.	なんて言ってました。
He took his temperature, rang for his drops, and turned to the Churchman.	熱を計り、ベルを鳴らして飴を持ってこさせ、『聖職者』に救いをもとめようとしました。
He had been reading an article on Nestorianism when the melon was brought in.	メロンが運ばれてくるまで、ネストリウス派の記事を読んでいたんです。
He asked me to go on with it, and I read to him for an hour,	じいさんが続きを読んでくれるように頼んだので、一時間ほど読んでやりました。
in the dim close room, with a fat fly buzzing stealthily about the fallen melon.	薄暗い、空気のこもった部屋は、太った蠅が落ちたメロンのまわりでこそこそと羽音をさせているのが聞こえていましたっけ。
< 11 > "All the while one phrase of the old man's buzzed in my brain like the fly about the melon.	「その間ずっと、じいさんの言ったことが、メロンの周りを飛び回る蠅の羽音のように、頭の中でぶんぶんと鳴っていました。
'I'll show him what money can do!'	『金があれば何ができるか、やつに目にもの見せてくれるわ』
Good heaven!	そうなんです！
If I could but show the old man!	じいさんにこそ、それが見せてやれたら。
If I could make him see his power of giving happiness as a new outlet for his monstrous egotism!	化け物のように肥大した自己意識の新たなはけ口として、じいさんが持っている力を使えば、人を幸せにしてやることだってできるんだ、ということを教えてやれるなら。
I tried to tell him something about my situation and Kate's	私は自分とケイトの窮状を訴えようとしました。
-- spoke of my ill-health, my unsuccessful drudgery, my longing to write, to make myself a name	自分が身体を悪くしていること、苦労している割にうまくいかない仕事のこと、書きたいという気持ち、名をあげたい、という思い……。
-- I stammered out an entreaty for a loan.	つっかえつっかえ、借金を依頼しました。
'I can guarantee to repay you, sir	『かならずお返しします。
-I've a half-written play as security. . .'	書きかけの戯曲を抵当にして』
"I shall never forget his glassy stare.	「じいさんの冷たいまなざしはぜったいに忘れないでしょうね。
His face had grown as smooth as an egg-shell again	卵みたいに滑らかな表情に戻っていました。
-- his eyes peered over his fat cheeks like sentinels over a slippery rampart.	膨れ上がった頬の上で、まるで滑りやすい城壁の上に立つ歩哨のようなじいさんの目が、こちらにじっと注がれてたんです。
"'A half-written play --	『書きかけの戯曲か……。
a play of yours as security?'	おまえの書いた戯曲が抵当とな？』
He looked at me almost fearfully, as if detecting the first symptoms of insanity.	恐ろしいものでも見たような、まるで私から狂気の徴候でも嗅ぎ取ったかのような目つきでしたね。
'Do you understand anything of business?'	『ビジネスというものを、わかっておるかね？』
he enquired mildly.	と、口調だけは穏やかでした。
I laughed and answered:	私は苦笑しながら、
'No, not much.'	『いいえ、それほどには』
"He leaned back with closed lids.	「じいさんは後ろにもたれると、目をつぶりました。
'All this excitement has been too much for me,'	『こう興奮させられ通しでは、わしは参ってしまう。
'If you'll excuse me, I'll prepare for my nap.'	失礼して昼寝の用意でもさせてもらうよ』
And I stumbled out of the room, blindly, like the Italian."	そうして私もイタリア人のように、よろめきながら部屋をあとにすることになったのでした」
Granice moved away from the mantel-piece, and walked across to the tray set out with decanters and soda-water.	グラニスはマントルピースから離れ、部屋を横切って、デカンターと炭酸水が用意されているトレイのところへ行った。
He poured himself a tall glass of soda-water, emptied it, and glanced at Ascham's dead cigar.	自分用に、丈の高いグラスに炭酸水を注ぎ、それを飲み干すと、アスカムの消えた葉巻に目を留めた。
"Better light another,"	「火をつけるのは、別の葉巻にしたほうがいいでしょう」
The lawyer shook his head, and Granice went on with his tale.	弁護士が首を横に振ったので、グラニスは話に戻った。
He told of his mounting obsession	自分に取り憑いて離れない妄想のことや、
-- how the murderous impulse had waked in him on the instant of his cousin's refusal,	レンマンが拒否した瞬間、殺意の衝動がどのように芽生えたか。
and he had muttered to himself:	やがてグラニスはこうつぶやいたのだ。
"By God, if you won't, I'll make you."	「神様、あなたが手をお下しにならないのでしたら、私が代わりましょう」
He spoke more tranquilly as the narrative proceeded,	グラニスの口調は、先へ進むにつれて、穏やかなものになっていった。
as though his rage had died down once the resolve to act on it was taken.	まるでなすべきことが決まったとたん、激しい怒りも治まったかのように。
He applied his whole mind to the question of how the old man was to be "disposed of."	こうして老人を「片付ける」にはどうしたらよいかという問題に専念することになった。
Suddenly he remembered the outcry:	そんなとき思い出したのは、老人の叫び声だ。
"Those Italians will murder you for a quarter!"	『ああいうイタリア人連中というのは、たった25セントのために人殺しをするんだ』
But no definite project presented itself:	だが、具体的な計画は浮かばない。
he simply waited for an inspiration.	インスピレーションがわいてくるのを待つしかなかった。
Granice and his sister moved to town a day or two after the incident of the melon.	グラニスと妹のケイトは、メロン事件から数日して街に戻った。
But the cousins, who had returned, kept them informed of the old man's condition.	けれども休暇から帰ってきた従姉妹たちが、折にふれ、老人の状態を知らせてくれた。
One day, about three weeks later, Granice, on getting home, found Kate excited over a report from Wrenfield.	三週間後のある日、グラニスが家に帰ってみると、ケイトがレンフィールドからの知らせに興奮している。
The Italian had been there again	例のイタリア人がまた現れたらしいのだ。
-- had somehow slipped into the house, made his way up to the library, and "used threatening language."	なんでも家に侵入して、書斎にまで入り込み、「脅し文句を吐いた」のだ、という。
The house-keeper found cousin Joseph gasping, the whites of his eyes showing "something awful."	家政婦が、「何か恐ろしいもの」を見て、白目を剥いて喘いでいるジョゼフ老人を発見したらしい。
The doctor was sent for, and the attack warded off;	医者が呼びにやられ、襲撃はひとまずけりがついた。
and the police had ordered the Italian from the neighbourhood.	警察はそのイタリア人に近隣一帯から立ち退くよう警告を出した。
< 12 > But cousin Joseph, thereafter, languished, had "nerves," and lost his taste for toast and butter-milk.	ところがジョゼフ老人は、それ以来衰弱が「神経」に来て、トーストとバターミルクの食事を取っても味が分からなくなってしまった。
The doctor called in a colleague, and the consultation amused and excited the old man-he became once more an important figure.	ところが医者が別の医者を呼ぶと、こんどは診察が老人の楽しみとなり、ふたたび重要人物の気分を味わった老人は、興奮するようになった。
The medical men reassured the family	医師団は家族に、まったく心配はない、と請け合った。
-- too completely!	元気すぎるほどだ。
-- and to the patient they recommended a more varied diet:	そうして、患者に対しては、もっと多様な食餌療法をするよう勧めた。
advised him to take whatever "tempted him."	つまり、老人に「食べたいと思ったもの」は何でも食べるよう、勧めたのである。
And so one day, tremulously, prayerfully, he decided on a tiny bit of melon.	そこである日、おそるおそる祈るような気持ちで、メロンの小さな一切れを食べることに決めた。
It was brought up with ceremony, and consumed in the presence of the house-keeper and a hovering cousin;	儀式のように育てられたメロンは、家政婦や浮き立っている従姉妹たちの目の前で食された。
and twenty minutes later he was dead. . .	そうして二十分後、老人は死んだ……。
"But you remember the circumstances,"	「当時の状況を覚えておいででしょう」
Granice went on;	とグラニスは続けた。
"how suspicion turned at once on the Italian?	「なぜ容疑者は、すぐに例のイタリア人ということになったのですか？
In spite of the hint the police had given him he had been seen hanging about the house since 'the scene.'	警察が警告を与えたにも拘わらず、『例の件』以来、屋敷の周りをうろつきまわっているのを目撃されている。
It was said that he had tender relations with the kitchen-maid, and the rest seemed easy to explain.	噂では、台所の下働きと関係があった、ということなんですが、そうなると後のことは、簡単に説明がつきます。
But when they looked round to ask him for the explanation he was gone	けれども警察が事情聴取のためにイタリア人を捜したが、見つからなかった
-- gone clean out of sight.	――煙のように消え失せていたのでしたね。
He had been 'warned' to leave Wrenfield,	確かにレンフィールドから出ていくように『警告』はされていた。
and he had taken the warning so to heart that no one ever laid eyes on him again."	そうしてやつもその警告を受けとめたからこそ、だれもふたたびその姿を目にしなかった」
Granice paused.	グラニスはことばを切った。
He had dropped into a chair opposite the lawyer's, and he sat for a moment, his head thrown back, looking about the familiar room.	アスカムの向かいの椅子に腰を下ろすと、しばらくすわったままで頭を後ろに倒し、慣れ親しんだ部屋の中を逆さまに見た。
Everything in it had grown grimacing and alien,	何もかもが歪んで、見たことがないもののようだ。
and each strange insistent object seemed craning forward from its place to hear him.	見慣れない、それぞれに自己主張するものたちが、首を伸ばして自分の話を聞こうとしているように思えた。
"It was I who put the stuff in the melon,"	「メロンに薬をいれたのは私です」
he said.	とグラニスは言った。
"And I don't want you to think I'm sorry for it.	「私がそのことを後悔している、などと思わないでください。
This isn't 'remorse,' understand.	『自責の念』なんかじゃありません。
I'm glad the old skin-flint is dead	わたしは吝嗇なじいさんが死んで、喜んでいるんです。
-- I'm glad the others have their money.	ほかの人間の手にお金が渡ったのもうれしい。
But mine's no use to me any more.	でも、私の遺産は何の役にも立たなかった。
My sister married miserably, and died.	妹は悲惨な結婚をして、死んでしまいました。
And I've never had what I wanted."	そうして私は、ほしいものをなにひとつ手に入れることができなかった」
