The Bolted Door	『閉ざされたドア』
Granice wrinkled his brows.	グラニスは眉をひそめた。
"Why, Flood	「ああ、フラッドだ
-- yes, Flood himself.	――そうだ、フラッドが自分で買い戻したんだ。
I sold it back to him three months later."	私が三ヶ月使ったあとで、もういちどフラッドに売ったんだ」
"Flood?	「フラッド？
The devil!	またあの野郎か。
And I've ransacked the town for Flood.	ぼくはフラッドを、街中捜し回ったんですよ。
That kind of business disappears as if the earth had swallowed it."	ああした業種っていうのは、それこそ地面に呑み込まれでもしたみたいに消えちまうんだ」
Granice, discouraged, kept silence.	意気消沈したグラニスは、ことばもなかった。
"That brings us back to the poison,"	「これで毒物に戻ることになりましたね」
McCarren continued, his note-book out.	マッカランはそうことばを続けて、ノートを取り出した。
"Just go over that again, will you?"	「もういちど、話してもらえますか」
And Granice went over it again.	グラニスは話を繰り返した。
It had all been so simple at the time	当時、毒物を手に入れることはとてもたやすいことだった。
-- and he had been so clever in covering up his traces!	おまけに自分はその痕跡をうまく闇に葬ったのだ。
As soon as he decided on poison he looked about for an acquaintance who manufactured chemicals;	毒殺することに決めると、すぐに知り合いのなかに、だれか化学薬品の製造に携わっている者がないか探した。
and there was Jim Dawes, a Harvard classmate, in the dyeing business	ジム・ドーズというハーヴァードの同級生が染色業界にいた。
-- just the man.	おあつらえむきにね。
But at the last moment it occurred to him that suspicion might turn toward so obvious an opportunity, and he decided on a more tortuous course.	だが、土壇場になって、どう考えても容疑は条件をすべて備えている自分に、まっさきに向かうだろうということが頭に浮かんで、もう少しあからさまではない方法をとることにした。
Another friend, Carrick Venn, a student of medicine	友人の中に、キャリック・ヴェンという医学生がいた。
whom irremediable ill-health had kept from the practice of his profession,	不治の病に冒されていたために、仕事に就けずにいたんだ。
amused his leisure with experiments in physics, for the exercise of which he had set up a simple laboratory.	趣味というのが物理学の実験で、簡単な実験室を持っていた。
Granice had the habit of dropping in to smoke a cigar with him on Sunday afternoons, and the friends generally sat in Venn's work-shop, at the back of the old family house in Stuyvesant Square.	当時、日曜日の午後はそこを訪ねて葉巻を吹かすことにしていたのだが、ヴェンはいつも、ストイフェサント・スクウェアの古い屋敷の裏に建てた実験室に腰を落ち着けていたよ。
Off this work-shop was the cupboard of supplies, with its row of deadly bottles.	実験室の端には中味の詰まった薬品棚があり、劇薬の棚もあった。
Carrick Venn was an original, a man of restless curious tastes,	キャリック・ヴェンは風変わりな男で、その好奇心は休む暇もなかった。
and his place, on a Sunday, was often full of visitors:	だからヴェンのところには、日曜日ともなると、訪れた人でよくごったがえしていたね。
a cheerful crowd of journalists, scribblers, painters, experimenters in divers forms of expression.	ジャーナリストや三文文士、画家のような、さまざまな表現形式を実験している人々の愉快な集まりだったんだ。
Coming and going among so many, it was easy enough to pass unperceived;	出入りする人間があまりに多いので、気がつかれないうちに部屋を移るのなんて簡単だった。
and one afternoon Granice, arriving before Venn had returned home, found himself alone in the work-shop, and quickly slipping into the cupboard, transferred the drug to his pocket.	ある日の午後、ヴェンがまだ戻っておらず、ほかの人間もいなかったのを幸いに、戸棚からこっそりと薬品を取り出し、ポケットにしまい込んだのだ。
< 27 > But that had happened ten years ago; 	だがそれも十年前のこと。
and Venn, poor fellow, was long since dead of his dragging ailment.	気の毒なヴェンが長引く病気で亡くなってからずいぶんになる。
His old father was dead, too, the house in Stuyvesant Square had been turned into a boarding-house,	ヴェンの父親もまた亡くなって、ストイフェサント・スクウェアの屋敷は下宿屋に変わってしまった。
and the shifting life of New York had passed its rapid sponge over every trace of their obscure little history.	移り変わるニューヨークのなかで、名もない人々のささやかな歴史など、スポンジが水を吸うように跡形もなく吸い取られてしまったのだった。
Even the optimistic McCarren seemed to acknowledge the hopelessness of seeking for proof in that direction.	楽天的なマッカランでさえ、薬物から証拠をつかむのが絶望的だということは理解したようだった。
"And there's the third door slammed in our faces."	「これで三番目のドアまで目の前で閉まっちゃっいましたね」
He shut his note-book, and throwing back his head, rested his bright inquisitive eyes on Granice's furrowed face.	ノートをぱたんと閉じると、のびをして、明るく好奇心に満ちた目を、グラニスのしかめ面から離して休ませた。
"Look here, Mr. Granice	「失礼だけど、グラニスさん
-- you see the weak spot, don't you?"	――お話の弱点はおわかりでしょうね？」
The other made a despairing motion.	グラニスはがっくりと肩を落とした。
"I see so many!"	「ありすぎるほどだ」
"Yes:	「そうですね。
but the one that weakens all the others.	でも、なによりも弱い点がある。
Why the deuce do you want this thing known?	何でまたこんなことを明るみにしたいんです？
Why do you want to put your head into the noose?"	なんでまた自分から進んで縛り首の輪の中に頭を入れようとするんですかね」
Granice looked at him hopelessly,	グラニスは絶望的な目を向けた。
trying to take the measure of his quick light irreverent mind.	この頭の回転が速く、軽妙で不遜なマッカランを、どうしたら納得させることができるだろう。
No one so full of a cheerful animal life would believe in the craving for death as a sufficient motive;	元気のいい獣のような生命力に満ちあふれている者はだれも、死への渇望が動機だ、などと言われても信じはしないだろう。
and Granice racked his brain for one more convincing.	頭をしぼってもっと説得力のある説明を考えようとしたとき
But suddenly he saw the reporter's face soften, and melt to a naive sentimentalism.	突然、マッカランの表情が和らぎ、うぶな感じやすさが表れた。
"Mr. Granice	「グラニスさん
-- has the memory of it always haunted you?"	……これまでずっとその記憶に苛まれてきたんですか」
Granice stared a moment, and then leapt at the opening.	一瞬、目を見張ったグラニスは、すぐにそのことばに飛びついた。
"That's it --	「そうなんだ……
the memory of it . . .	その記憶が……」
McCarren nodded vehemently.	マッカランは、熱心にうなずいた。
"Dogged your steps, eh?	「自分のやったことがどこまでもつきまとってくるんですね？
Wouldn't let you sleep?	夜も眠れなかった？
The time came when you had to make a clean breast of it?"	告白すべきときが来たと思ったんですね？」
"I had to.	「告白しなければいけないと思ったのだ。
Can't you understand?"	わかってくれるかね？」
The reporter struck his fist on the table.	記者は握り拳でテーブルをドンと叩いた。
"God, sir!	「当然です。
I don't suppose there's a human being with a drop of warm blood in him that can't picture the deadly horrors of remorse --"	暖かい血が一滴でも通う人間ならだれだって、身を苛む怖ろしいまでの後悔を想像できないはずがありません」
The Celtic imagination was aflame,	マッカランのケルト民族としての想像力に火がついた。
and Granice mutely thanked him for the word.	グラニスは胸の内で彼のことばに感謝する。
What neither Ascham nor Denver would accept as a conceivable motive the Irish reporter seized on as the most adequate;	アスカムもデンヴァーも、このアイルランド人記者が飛びついた動機に納得などしなかった。
and, as he said, once one could find a convincing motive, the difficulties of the case became so many incentives to effort.	確かにマッカランが言うように、ひとたびなるほどと思わせる動機を見つければ、事件が困難であればあるほどそれが刺激になって、がんばろうという気になるものなのだ。
"Remorse	「後悔
-- REMORSE,"	――後悔」
he repeated, rolling the word under his tongue with an accent that was a clue to the psychology of the popular drama;	そのことばを舌先で転がしながら、心理学研究の端緒ともなった大衆演劇のアクセントで繰り返してみる。
and Granice, perversely, said to himself:	その一方でひねくれた気持ちで独り言ちた。
"If I could only have struck that note I should have been running in six theatres at once."	「もしこの発音だけで人を感動させることができるのなら、すぐにでも六つの劇場を満員にできるだろうに」
< 28 > He saw that from that moment McCarren's professional zeal would be fanned by emotional curiosity; 	このときからグラニスには、マッカランの好奇心を感情の側から満たしてやれば、仕事にもいっそう熱を入れることがわかった。
and he profited by the fact to propose that they should dine together, and go on afterward to some music-hall or theatre.	そのうえ一緒に食事をしてからミュージックホールか劇場へ行くというおまけまで手に入れたのである。
It was becoming necessary to Granice to feel himself an object of pre-occupation, to find himself in another mind.	自分が相手の関心の対象であると感じること、相手の心の中に映った自分の姿を確認することが、グラニスにとって必要になっていた。
He took a kind of gray penumbral pleasure in riveting McCarren's attention on his case;	マッカランの注意を事件に釘付けにすることに、後ろめたい喜びを感じていたのである。
and to feign the grimaces of moral anguish became a passionately engrossing game.	さも道徳的に苦しんでいるかのような、苦悶の表情を浮かべてみせるのは、胸躍るゲームのようなところがあった。
He had not entered a theatre for months;	もう何ヶ月も劇場には足を踏み入れていない。
but he sat out the meaningless performance in rigid tolerance, sustained by the sense of the reporter's observation.	だが、マッカランの視線の先にいたいという気持ちに支えられて、なんの意味も感じられない舞台を前に、しかつめらしく寛大な態度で最後まですわっていたのだった。
Between the acts, McCarren amused him with anecdotes about the audience:	幕間にマッカランはグラニスを楽しませようと、観客の逸話を聞かせた。
he knew every one by sight, and could lift the curtain from every physiognomy.	観客全員を知っていて、その外観に隠された秘密を教えてくれる。
Granice listened indulgently.	グラニスは辛抱強く耳を傾けていた。
He had lost all interest in his kind, but he knew that he was himself the real centre of McCarren's attention, and that every word the latter spoke had an indirect bearing on his own problem.	その種のことにはとうに興味はなくしていたが、マッカランの興味の中心にはグラニスがおり、どんな話も間接的に自分に関係してくることを知っていたのだ。
"See that fellow over there	「向こうの人を見てください
-- the little dried-up man in the third row, pulling his moustache?	――三列目に小さくて干からびた感じの人がいるでしょう、口ひげを引っ張っている。
His memoirs would be worth publishing,"	あの人の回想録は、出版する価値があるでしょうね」
McCarren said suddenly in the last entr'acte.	マッカランは最後の幕間で急に言い出した。
Granice, following his glance, recognized the detective from Allonby's office.	視線の先を追ったグラニスは、それがアーロンビーのオフィスからやってきた刑事であることに気がついた。
For a moment he had the thrilling sense that he was being shadowed.	一瞬、目の前が真っ暗になるような、ゾッとするような感覚に襲われた。
"Caesar, if he could talk -- !"	「“シーザー、もし彼が話すことができたなら――”」
McCarren continued.	マッカランは語調を変えた。
"Know who he is, of course?	「どなたかもちろんご存じですよね、
Dr. John B. Stell,	ジョン・Ｂ・ステル博士です。
the biggest alienist in the country --"	国内でも最大の精神鑑定医だ」
Granice, with a start, bent again between the heads in front of him.	グラニスはハッとして、目の前に並ぶ頭の間から、もういちどよく見ようと身を乗り出した。
That man -- the fourth from the aisle?	「その男というのは――通路から四番目の？
You're mistaken.	それはちがうんじゃないかな。
That's not Dr. Stell."	あれはステル博士じゃないだろう」
McCarren laughed.	マッカランは声をあげて笑った。
"Well, I guess I've been in court enough to know Stell when I see him.	「そりゃ法廷で何度も見てるんですから、顔を見ればわかります。
He testifies in nearly all the big cases where they plead insanity."	精神鑑定が必要な大きな事件ともなると、ほとんどあの人が証言してるんですから」
A cold shiver ran down Granice's spine, but he repeated obstinately:	身震いするような冷たいものがグラニスの背筋を伝ったが、グラニスは頑固に繰り返すばかりだ。
"That's not Dr. Stell."	「あれはステル博士なんかじゃない」
"Not Stell?	「博士じゃないって？
Why, man, I know him.	おやおや、ぼくは知ってるって言ってるのに。
Look -- here he comes.	こっちに来ますよ。
If it isn't Stell, he won't speak to me."	もし博士じゃなかったら、ぼくなんかと話したりしないから」
The little dried-up man was moving slowly up the aisle.	小柄な干からびた男はゆっくりと通路をこちらに向かってやってきた。
As he neared McCarren he made a slight gesture of recognition.	マッカランの側まで来ると、軽く目礼する。
"How'do, Doctor Stell?	「こんにちは、ステル先生。
Pretty slim show, ain't it?"	相変わらずガリガリですねぇ」
the reporter cheerfully flung out at him.	マッカランは明るい調子で悪態をついた。
And Mr. J. B. Hewson, with a nod of amicable assent, passed on.	Ｊ・Ｂ・ヒュースンは笑顔でそれに応え、歩み去った。
< 29 > Granice sat benumbed.	グラニスは痺れたようにすわっていた。
He knew he had not been mistaken	まちがえようがない。
-- the man who had just passed was the same man whom Allonby had sent to see him:	アーロンビーが自分のところに寄越した男だ。
a physician disguised as a detective.	精神科医が刑事に化けていたのだ。
Allonby, then, had thought him insane,	では、アーロンビーも正気を疑っていたのだ
like the others -- had regarded his confession as the maundering of a maniac.	――自分の告白を狂人の繰り言と受け取ったほかの人間と同じように。
The discovery froze Granice with horror	これを知ったグラニスは、心底怖ろしくなった。
-- he seemed to see the mad-house gaping for him.	精神病院が大口を開けて、自分を待ちかまえているのが見えるような気がした。
"Isn't there a man a good deal like him	「あの人にたいそう似ている人間を知っているんだが
-- a detective named J. B. Hewson?"	――Ｊ・Ｂ・ヒュースンという名の刑事だよ」
But he knew in advance what McCarren's answer would be.	だが聞く前からマッカランの答えはわかっていた。
"Hewson?	「ヒュースンですって？
J. B. Hewson?	Ｊ・Ｂ・ヒュースン？
Never heard of him.	そんな名前の人間は聞いたことがないなあ。
But that was J. B. Stell fast enough	だけどあれはＪ・Ｂ・ステルでしたよ、
-- I guess he can be trusted to know himself, and you saw he answered to his name."	名前を聞いてすぐに自分のことだとわかったし、それに応えたのをあなただって見たでしょう」
Some days passed before Granice could obtain a word with the District Attorney:	グラニスが地方検事の口から直接事情を聞くことができるまで、数日を要した。
he began to think that Allonby avoided him.	アーロンビーに避けられているのか、と思いかけたところだった。
But when they were face to face Allonby's jovial countenance showed no sign of embarrassment.	だが、実際に顔を合わせてみると、いささかも困惑している様子のない明るい表情をしている。
He waved his visitor to a chair, and leaned across his desk with the encouraging smile of a consulting physician.	椅子を勧めると、机から身を乗り出して、顧問医師が患者を励ますような笑みを浮かべた。
Granice broke out at once:	すぐさまグラニスはまくしたてた。
"That detective you sent me the other day --"	「先日あなたが寄越した刑事は……」
Allonby raised a deprecating hand.	アーロンビーは手をあげてなだめようとする。
" -- I know:	「……わかってるんですよ。
it was Stell the alienist.	精神鑑定医のステルだ。
Why did you do that, Allonby?"	どうしてそんなことをしたんです、アーロンビー」
The other's face did not lose its composure.	相手は動じない。
"Because I looked up your story first	「まず最初にあなたの話を調べてみました
-- and there's nothing in it."	――ところが何も出てこない」
"Nothing in it?"	「ほんとうに何も？」
Granice furiously interposed.	グラニスは乱暴にことばをはさんだ。
"Absolutely nothing.	「まったく何も。
If there is, why the deuce don't you bring me proofs?	もし証拠があるんだったら、いったいどうしてそれを持ってきてくれないんです。
I know you've been talking to Peter Ascham,	あなたがピーター・アスカムに話をしていたのも知っています。
and to Denver, and to that little ferret McCarren of the Explorer.	デンヴァーにも、それから『エクスプローラー』の小僧っ子、マッカランにもね。
Have any of them been able to make out a case for you?	だれか事件を立証してくれる人がいましたか？
No.	だれもいない。
Well, what am I to do?"	となると、わたしはどうしたらいいんでしょう」
Granice's lips began to tremble.	グラニスのくちびるは震え始めた。
"Why did you play me that trick?"	「それでもなんであんな、私をぺてんにかけるようなまねをしたんです」
"About Stell?	「ステルのことを言ってるんですね？
I had to, my dear fellow:	そうする必要があったんです。
it's part of my business.	それも私の仕事の内でね。
Stell is a detective, if you come to that	それに、ステルは刑事でもあるんですよ、もしそのことをおっしゃっているのなら。
-- every doctor is."	鑑定医はみんな」
The trembling of Granice's lips increased, communicating itself in a long quiver to his facial muscles.	くちびるの震えは一層激しくなり、その震えが顔全体に拡がって、あごががくがくとわなないた。
He forced a laugh through his dry throat.	乾いた喉の奥から、むりやり笑い声を押し出す。
"Well	「ほほう
-- and what did he detect?"	……で、やつはいったい何を嗅ぎつけたんです」
"In you?	「あなたから？
Oh, he thinks it's overwork	ステルはオーバーワークだって言ってましたよ
-- overwork and too much smoking.	――過労と過度の喫煙。
If you look in on him some day at his office he'll show you the record of hundreds of cases like yours,	いつか博士のオフィスをちょっとのぞいてごらんになったら、あなたのような症例の記録を何百と見せてくれるでしょうね。
and advise you what treatment to follow.	それにどういった治療が必要か、アドヴァイスもしてくれるでしょう。
It's one of the commonest forms of hallucination.	幻覚症状のもっともありふれたもののひとつですよ。
Have a cigar, all the same."	まあそうはいっても、おひとつ葉巻でもどうぞ」
< 30 > "But, Allonby, I killed that man!"	「だが、アーロンビー、私はほんとうにあの男を殺したんだ！」
The District Attorney's large hand, outstretched on his desk, had an almost imperceptible gesture,	机に広げていた地方検事の大きな手が、ほとんど気がつかないくらいに微かに動いた。
and a moment later, as if an answer to the call of an electric bell, a clerk looked in from the outer office.	するとその直後、呼び鈴に応えたかのように事務員が顔をのぞかせる。
"Sorry, my dear fellow	「失礼、グラニスさん。
-- lot of people waiting.	人を大勢待たせてるんです。
Drop in on Stell some morning,"	いつかの午前中、ステルのところへ行ってください」
Allonby said, shaking hands.	アーロンビーはそう言って、握手をした。
McCarren had to own himself beaten:	マッカランは自分には手に負えなくなった、と認めないわけにはいかなかった。
there was absolutely no flaw in the alibi.	アリバイに何の穴も見つけることができなかったのだ。
And since his duty to his journal obviously forbade his wasting time on insoluble mysteries, he ceased to frequent Granice,	雑誌の仕事が忙しくて、これ以上解決しようのない謎にかかずらわって時間を無駄にすることはできないと、グラニスを訪れるのもやめてしまった。
who dropped back into a deeper isolation.	こうしてグラニスは深い孤独のなかに落ち込んだのである。
For a day or two after his visit to Allonby he continued to live in dread of Dr. Stell.	アーロンビーのところへ行ったあと一日、二日は、ステル博士の影に怯えていた。
Why might not Allonby have deceived him as to the alienist's diagnosis?	精神鑑定医の診断を、アーロンビーが偽らなかったとどうして言えるだろう？
What if he were really being shadowed, not by a police agent but by a mad-doctor?	もし自分がほんとうは刑事ではなく、精神科の医者に尾行されていたとしたら。
To have the truth out, he suddenly determined to call on Dr. Stell.	真相を確かめるために、ただちにステル博士を訪ねる決心をした。
The physician received him kindly, and reverted without embarrassment to the conditions of their previous meeting.	博士はグラニスを親切に迎え入れ、前回の会見を悪びれる風もなく振り返った。
"We have to do that occasionally, Mr. Granice;	「そういうことが必要な場合もあるのですよ、グラニスさん。
it's one of our methods.	手段のひとつとして。
And you had given Allonby a fright."	で、あなたはアーロンビーを脅かしたそうですね」
Granice was silent.	グラニスは何も言わなかった。
He would have liked to reaffirm his guilt, to produce the fresh arguments which had occurred to him since his last talk with the physician;	彼としては自分の罪をもういちど言明した上で、以前ステルと話したあとに考えたことも含めて、新たに話し合ってみたかったのだ。
but he feared his eagerness might be taken for a symptom of derangement, and he affected to smile away Dr. Stell's allusion.	だが、あまりにしつこく言って発狂の徴候と受け取られでもしたら大変だ、と思って、ステルがそれとなく言ったことを、笑顔で受け容れるふりをした。
"You think, then, it's a case of brain-fag	「では先生は、精神疲労であるとお考えなんですね
-- nothing more?"	――それ以上のものではない、と」
"Nothing more.	「そうです。
