TWO GALLANTS	二人の色男
James Joyce	ジェイムズ・ジョイス
THE grey warm evening of August had descended upon the city and a mild warm air, a memory of summer, circulated in the streets.	八月の灰色の暖かい夕暮れが市街に垂れ込め、夏の名残の穏やかな暖かい空気が街路を循環していた。
The streets, shuttered for the repose of Sunday, swarmed with a gaily coloured crowd.	日曜の休息でシャッターの閉められた街路には華やかな色合いの群衆がごった返していた。
Like illumined pearls the lamps shone from the summits of their tall poles upon the living texture below which, changing shape and hue unceasingly, sent up into the warm grey evening air an unchanging unceasing murmur.	光を受ける真珠のように灯火が輝いて高い柱の頂点から照らすその下では、形と色調を絶え間なく変化させる生きた織り物が暖かい灰色の夕暮れの空気の中に変化のない絶え間ないざわめきを放っていた。
Two young men came down the hill of Rutland Square.	二人の若い男がラトランド・スクエアの丘を下ってきた。
One of them was just bringing a long monologue to a close.	その一人はちょうど長広舌を終わろうとしていた。
The other, who walked on the verge of the path and was at times obliged to step on to the road, owing to his companion's rudeness, wore an amused listening face.	もう一人は、連れの傍若無人のせいで歩道の際を歩き、時にはやむをえず道路に踏み出したりしながら、面白そうに聞いている顔をしていた。
He was squat and ruddy.	彼はずんぐりして赤ら顔だった。
A yachting cap was shoved far back from his forehead and the narrative to which he listened made constant waves of expression break forth over his face from the corners of his nose and eyes and mouth.	ヨット帽はぐっと額の後ろに押しやられ、耳を傾けている物語が引き起こす表情の波が繰り返し彼の鼻と目と口の隅から顔中にぱっと広がるのだった。
Little jets of wheezing laughter followed one another out of his convulsed body.	痙攣する彼のからだから、短くあえぐような笑い声が次から次へと噴出した。
His eyes, twinkling with cunning enjoyment, glanced at every moment towards his companion's face.	狡猾な喜びに光る彼の目は、絶えず連れの顔の方をチラチラ見ていた。
Once or twice he rearranged the light waterproof which he had slung over one shoulder in toreador fashion.	一二度彼は、闘牛士のように肩に引っ掛けた軽いレインコートを直した。
His breeches, his white rubber shoes and his jauntily slung waterproof expressed youth.	彼の半ズボン、白いラバーシューズ、気取って引っ掛けたレインコートが若さを表していた。
But his figure fell into rotundity at the waist, his hair was scant and grey and his face, when the waves of expression had passed over it, had a ravaged look.	しかし彼の姿は腰の辺りが丸くなり、髪は薄く灰色で、表情の波が過ぎ去ってしまった後の顔には荒廃した様子があった。
When he was quite sure that the narrative had ended he laughed noiselessly for fully half a minute.	すっかり物語が終わったと確信したところで彼はまるまる三十秒も声を立てずに笑った。
Then he said:	それから彼は言った。
"Well!	「へえ！
... That takes the biscuit!"	・・・そいつは金星だ！」
His voice seemed winnowed of vigour;	彼の声は勢いばかりが吹き飛ばされたようだった。
and to enforce his words he added with humour:	そして彼は自分の言葉を強調しようとユーモアをこめて付け加えた。
"That takes the solitary, unique, and, if I may so call it, recherche biscuit! "	「そいつは一人ぼっちの、類のない、それと、言わせてもらえりゃ、よくぞ見つけた金の星！ってやつだ。」
He became serious and silent when he had said this.	彼はこう言ってしまうとまじめな顔になり沈黙した。
His tongue was tired for he had been talking all the afternoon in a public-house in Dorset Street.	その午後はずっとドーセット・ストリートのパブでしゃべり続けていたので彼は口が疲れていた。
Most people considered Lenehan a leech but, in spite of this reputation, his adroitness and eloquence had always prevented his friends from forming any general policy against him.	多くの人はレネハンをヒルとみなしていたが、この評判にもかかわらず、彼の器用さと雄弁が友人たちをして全般的に彼に対抗する方策を立てさせるのをいつも防いでいた。
He had a brave manner of coming up to a party of them in a bar and of holding himself nimbly at the borders of the company until he was included in a round.	彼は勇ましい態度で、酒場に集まった連中に近寄って一座の縁にすばやく取り付き、ついには輪の中に含まれるのだった。
He was a sporting vagrant armed with a vast stock of stories, limericks and riddles.	彼はぶらぶらしている遊び人で物語、リメリック、なぞなぞをしこたま溜め込んで武器にしていた。
He was insensitive to all kinds of discourtesy.	彼はあらゆる非礼に鈍感だった。
No one knew how he achieved the stern task of living, but his name was vaguely associated with racing tissues.	どうやって彼が生活のための厳しい仕事をやりおおせるのか誰も知らなかったが、彼の名からは漠然と競馬の予想が連想された。
"And where did you pick her up, Corley?"	「それでどこでその女をひっかけたんだ、コーリー？」
he asked.	と彼は尋ねた。
Corley ran his tongue swiftly along his upper lip.	コーリーは舌を上唇に沿ってすばやく走らせた。
"One night, man,"	「ある晩なあ、」
he said,	彼は言った、
"I was going along Dame Street and I spotted a fine tart under Waterhouse's clock and said good- night, you know.	「俺はデイム・ストリートを歩いていてウォーターハウスの時計の下で上玉を見つけてこんばんはと言ってね。
So we went for a walk round by the canal and she told me she was a slavey in a house in Baggot Street.	それで俺たちは運河に沿ってぐるっと散歩に出かけ、彼女はバゴット・ストリートのある家の下女だと俺に言った。
I put my arm round her and squeezed her a bit that night.	その夜俺は彼女に腕を回し、ちょっとばかりぎゅっと抱きしめたよ。
Then next Sunday, man, I met her by appointment.	それから次の日曜になあ、約束して彼女に会った。
We vent out to Donnybrook and I brought her into a field there.	俺たちはドニーブルックに出て俺は彼女をそこの原っぱへ連れ込んだ。
She told me she used to go with a dairyman.	前には牛乳屋と付き合ったと彼女は言った
... It was fine, man.	・・・すばらしかったなあ。
Cigarettes every night she'd bring me and paying the tram out and back.	タバコも毎晩彼女が持ってくる、出るのも戻るのも電車賃は彼女持ちだ。
And one night she brought me two bloody fine cigars--O, the real cheese, you know, that the old fellow used to smoke.	いつの晩だかめちゃくちゃ上等の葉巻を二本持ってきたな−−ああ、本物だぜ、そら、昔の男がいつも吹かしてた
... I was afraid, man, she'd get in the family way.	・・・あいつになあ、がきができちまうんじゃないかと思ったんだが。
But she's up to the dodge."	でもあいつがうまくやってるんだ。」
"Maybe she thinks you'll marry her,"	「ことによるとあんたが彼女と結婚すると思ってるぜ」
said Lenehan.	とレネハンは言った。
"I told her I was out of a job,"	「俺は失業中だと言ったよ」
said Corley.	とコーリーは言った。
"I told her I was in Pim's.	「ピムの店にいると言ったんだ。
She doesn't know my name.	あいつは俺の名前を知らない。
I was too hairy to tell her that.	それを教えるほど俺は甘くなかったってわけよ。
But she thinks I'm a bit of class, you know."	だがあいつは俺のことをちょっと上流と思ってるんでね。」
Lenehan laughed again, noiselessly.	レネハンは再び声を立てずに笑った。
"Of all the good ones ever I heard,"	「今までずいぶんうまい話は聞いたが、」
he said,	彼は言った、
"that emphatically takes the biscuit."	「そいつは断然の金星だ。」
Corley's stride acknowledged the compliment.	コーリーの歩幅はその賛辞に応えていた。
The swing of his burly body made his friend execute a few light skips from the path to the roadway and back again.	彼がたくましいからだを揺らすと彼の友人は歩道から車道へと二三歩軽くスキップをやってのけ、また元に戻った。
Corley was the son of an inspector of police and he had inherited his father's frame and gut.	コーリーは警察の警部補の息子で、父親の骨格と歩き方を受け継いでいた。
He walked with his hands by his sides, holding himself erect and swaying his head from side to side.	彼は両手を脇に、からだをまっすぐにして左右に頭を揺すりながら歩いた。
His head was large, globular and oily;	彼の頭は大きく、球形で脂ぎっていた。
it sweated in all weathers;	天気にかかわらず汗をかいた。
and his large round hat, set upon it sideways, looked like a bulb which had grown out of another.	そしてその上にはすに載った大きな丸い帽子は、一つの球根から生じたもう一つの球根のように見えた。
He always stared straight before him as if he were on parade and, when he wished to gaze after someone in the street, it was necessary for him to move his body from the hips.	彼はいつもまるで行進するように前をまっすぐに見つめ、通りで誰かをじっと目で追いたい時は腰からからだを動かす必要があった。
At present he was about town.	目下彼はぶらぶらしていた。
Whenever any job was vacant a friend was always ready to give him the hard word.	どんな仕事でも空きがあると必ず友人が彼に厳しいことを言ってやろうとてぐすね引いていた。
He was often to be seen walking with policemen in plain clothes, talking earnestly.	彼はしばしば私服の警官と熱心に話しながら歩くところを見られていた。
He knew the inner side of all affairs and was fond of delivering final judgments.	彼はあらゆる事件の内幕に通じ、最終的な判断を下すのを好んだ。
He spoke without listening to the speech of his companions.	彼は相手の話を聞かずに話をした。
His conversation was mainly about himself what he had said to such a person and what such a person had said to him and what he had said to settle the matter.	彼の会話は、彼が誰々に何を言ったとか誰々が彼に何を言ったとか問題を解決するために彼が何を言ったとか、主に自分のことだった。
When he reported these dialogues he aspirated the first letter of his name after the manner of Florentines.	こういう対話を報告するとき彼は自分の名の最初の文字をフローレンス人風に気息音に発音した。
Lenehan offered his friend a cigarette.	レネハンは友人にタバコを差し出した。
As the two young men walked on through the crowd Corley occasionally turned to smile at some of the passing girls but Lenehan's gaze was fixed on the large faint moon circled with a double halo.	人ごみを抜けて歩き続ける二人の若い男たちだが、コーリーは時折すれ違う娘たちの方を向いてにっこりとしたのに、レネハンの視線は二重にかさがかかったほのかな明かりの大きな月にじっと向けられていた。
He watched earnestly the passing of the grey web of twilight across its face.	彼はその表面を横切るたそがれの灰色の朧を真剣に見つめていた。
At length he said:	ようやく彼が言った。
"Well	「それで
... tell me, Corley, I suppose you'll be able to pull it off all right, eh?"	・・・なあ、コーリー、うまいことやってのけられるんだろうな、え？」
Corley closed one eye expressively as an answer.	コーリーは答える代わりに思い入れたっぷりに片目をつぶった。
"Is she game for that?"	「その女をかもにできるかな？」
asked Lenehan dubiously.	レネハンは疑わしげに尋ねた。
"You can never know women."	「女はわからないぜ。」
"She's all right,"	「あいつは大丈夫だ」
said Corley.	とコーリーは言った。
"I know the way to get around her, man.	「だまし方は心得たもんだからな。
She's a bit gone on me."	あいつはちょっとばかり俺にいかれてるんだ。」
"You're what I call a gay Lothario,"	「あんたは俺に言わせりゃ陽気なロサリオだな」
said Lenehan.	とレネハンは言った。
"And the proper kind of a Lothario, too!"	「それも本物のロサリオだ！」
A shade of mockery relieved the servility of his manner.	あざけりの陰が彼の態度の卑屈さをやわらげた。
To save himself he had the habit of leaving his flattery open to the interpretation of raillery.	おべっかをいつでも冷やかしと解釈できるようにしておく習慣が彼自身を救っていた。
But Corley had not a subtle mind.	しかしコーリーは微妙な心の持ち主ではなかった。
"There's nothing to touch a good slavey,"	「おとなしい下女をうれし泣きさせるぐらい造作ないね」
he affirmed.	と彼は断言した。
"Take my tip for it."	「俺に乗ったほうがいいぜ。」
"By one who has tried them all,"	「手当たりしだいやっつけてみた男にね」
said Lenehan.	とレネハンは言った。
"First I used to go with girls, you know,"	「最初のうちは娘と言っても、なあ、」
said Corley, unbosoming;	コーリーは打ち明けるように言った、
"girls off the South Circular.	「サウス・サーキュラーあたりの娘たちと付き合ったものだった。
I used to take them out, man, on the tram somewhere and pay the tram or take them to a band or a play at the theatre or buy them chocolate and sweets or something that way.	俺はいつも電車でどこかへ、なあ、連れ出しては電車賃を払うわ、楽団や劇場の芝居に連れて行くわ、チョコレートや菓子を買ってやるわ、何やかやだったな。
I used to spend money on them right enough,"	あいつらにはいつもほんとに金がかかったぜ」
he added, in a convincing tone, as if he was conscious of being disbelieved.	と、彼は、疑われているのを意識したのか、なるほどと思わせる口調で付け加えた。
But Lenehan could well believe it;	しかしレネハンは十分にそれを信用した。
he nodded gravely.	彼は重々しくうなずいた。
"I know that game,"	「そいつはわかるな、」
he said,	彼は言った、
"and it's a mug's game."	「わりに合わないこった。」
"And damn the thing I ever got out of it,"	「それにそうやって得た物といったら、ええくそ」
said Corley.	とコーリーは言った。
"Ditto here,"	「こっちも同様だ」
said Lenehan.	とレネハンは言った。
"Only off of one of them,"	「たった一人だけは別だが」
said Corley.	とコーリーは言った。
He moistened his upper lip by running his tongue along it.	彼は上唇を舌でなめて湿らせた。
The recollection brightened his eyes.	思い出が彼の目を輝かせた。
He too gazed at the pale disc of the moon, now nearly veiled, and seemed to meditate.	彼もまた、今ではほとんどベールのかかった青白い月の表面を見つめ、瞑想するように見えた。
She was	「彼女は
... a bit of all right,"	・・・ちょっとばかり結構だったな」
he said regretfully.	と彼は残念そうに言った。
He was silent again.	彼は再び沈黙した。
Then he added:	それから付け加えた。
"She's on the turf now.	「彼女も今じゃ街の女だ。
I saw her driving down Earl Street one night with two fellows with her on a car."	いつだかの晩アール・ストリートを二人の男と車で走って行く彼女を見たよ。」
"I suppose that's your doing,"	「そいつはあんたのしたこっちゃないのかな」
said Lenehan.	とレネハンは言った。
"There was others at her before me,"	「彼女には俺の前にも他のやつらがいたさ」
said Corley philosophically.	とコーリーは哲学者のように言った。
This time Lenehan was inclined to disbelieve.	今度はレネハンも信じる気になれなかった。
He shook his head to and fro and smiled.	彼は首を左右に振り、にっこりした。
"You know you can't kid me, Corley,"	「俺をかつごうとしたってだめだぜ、コーリー」
he said.	と彼は言った。
"Honest to God!"	「本当さあ！」
said Corley.	とコーリーは言った。
"Didn't she tell me herself?"	「彼女が自分で俺に言ったんじゃないかなあ？」
Lenehan made a tragic gesture.	レネハンは悲しげなそぶりを装った。
"Base betrayer!"	「下劣な裏切り者！」
he said.	と彼は言った。
As they passed along the railings of Trinity College, Lenehan skipped out into the road and peered up at the clock.	トリニティ・カレッジの柵に沿って進みながら、レネハンはひょいと道路に飛び出て時計をじっと見上げた。
"Twenty after,"	「二十分過ぎだ」
he said.	と彼は言った。
"Time enough,"	「時間は十分だ」
said Corley.	とコーリーは言った。
"She'll be there all right.	「あいつはちゃんとそこにいるさ。
I always let her wait a bit."	俺はいつもあいつを少し待たせるんだ。」
Lenehan laughed quietly.	レネハンは静かに笑った。
'Ecod!	「ったく！
Corley, you know how to take them,"	コーリー、それがとりこにするコツか」
he said.	と彼は言った。
"I'm up to all their little tricks,"	「そういうちょっとした手は何でも使ってやろうってわけさ」
Corley confessed.	とコーリーは打ち明けた。
"But tell me,"	「しかしなあ、」
said Lenehan again,	再びレネハンが言った、
"are you sure you can bring it off all right?	「ちゃんとうまくやれるってのは確かだろうな？
You know it's a ticklish job.	デリケートなところを要する仕事じゃないか。
They're damn close on that point.	その点じゃあ連中はひどくけちだから。
Eh?	ええ？
... What?"	・・・どうだい？」
His bright, small eyes searched his companion's face for reassurance.	彼の輝く小さな目は再保障を見つけ出そうと連れの顔をうかがっていた。
Corley swung his head to and fro as if to toss aside an insistent insect, and his brows gathered.	コーリーはしつこい虫を追い払うかのように首を左右に振り、彼の眉が寄せられた。
"I'll pull it off,"	「うまくやってのけるって」
he said.	と彼は言った。
"Leave it to me, can't you?"	「任せておけないのかよ？」
Lenehan said no more.	レネハンはそれ以上は言わなかった。
He did not wish to ruffle his friend's temper, to be sent to the devil and told that his advice was not wanted.	彼は友の機嫌を損ねて、くたばっちまえとか意見は無用だとか言われたくなかった。
A little tact was necessary.	ちょっとした機転が必要だった。
But Corley's brow was soon smooth again.	しかしコーリーの眉はすぐにまた穏やかになった。
His thoughts were running another way.	彼の考えは別の方に向かっていた。
"She's a fine decent tart,"	「あいつはなかなかの上玉だ」
he said, with appreciation;	と彼は高い評価を下して言った。
"that's what she is."	「そうなんだよなああいつは。」
They walked along Nassau Street and then turned into Kildare Street.	彼らはナッソー・ストリートを歩き、それからキルディア・ストリートへと曲がった。
Not far from the porch of the club a harpist stood in the roadway, playing to a little ring of listeners.	クラブの玄関から遠くない路上にハープ弾きが立ち、小さな輪になった聞き手に演奏していた。
He plucked at the wires heedlessly, glancing quickly from time to time at the face of each new-comer and from time to time, wearily also, at the sky.	彼は、時々新しく人が来るとその顔へ、また時々、あきあきもするので、空へすばやく視線を走らせながら、無頓着に弦をかき鳴らしていた。
His harp, too, heedless that her coverings had fallen about her knees, seemed weary alike of the eyes of strangers and of her master's hands.	彼のハープもまた、カバーがそのひざの辺りまで落ちてしまっているのに無頓着で、見知らぬ人たちの目にも主人の手にもやはりあきあきしているように見えた。
One hand played in the bass the melody of Silent, O Moyle, while the other hand careered in the treble after each group of notes.	彼の一方の手は『サイレント、おおモイル』のメロディを低音で奏で、他方の手は連なる音を繰り返し追うように高音部を走っていた。
The notes of the air sounded deep and full.	その曲の音色は荘重に豊かに響いていた。
The two young men walked up the street without speaking, the mournful music following them.	二人の若い男は、悲しげな音楽がついてくる中、話もせずに通りの端まで歩いた。
When they reached Stephen's Green they crossed the road.	スティーブンス・グリーンに着いた彼らは道路を横切った。
Here the noise of trams, the lights and the crowd released them from their silence.	ここで電車の騒音、光、群衆が彼らを沈黙から解放した。
"There she is!"	「ほら彼女だ！」
said Corley.	とコーリーが言った。
At the corner of Hume Street a young woman was standing.	ヒューム・ストリートの角に若い女が立っていた。
She wore a blue dress and a white sailor hat.	彼女は青い服、白いセーラーハットを着けていた。
She stood on the curbstone, swinging a sunshade in one hand.	彼女は歩道の縁石に立ち、片手で日傘を振っていた。
Lenehan grew lively.	レネハンが元気になった。
"Let's have a look at her, Corley,"	「ちょっと彼女を見てみようぜ、コーリー」
he said.	と彼は言った。
Corley glanced sideways at his friend and an unpleasant grin appeared on his face.	横目で友をチラッと見たコーリーは不快そうに歯をむいた。
"Are you trying to get inside me?"	「俺を出し抜こうとしてるのか？」
he asked.	と彼は尋ねた。
"Damn it!"	「ちくしょう！」
said Lenehan boldly,	レネハンは果敢に言った、
"I don't want an introduction.	「紹介はしていらんよ。
All I want is to have a look at her.	ちょっと見てみたいだけさ。
I'm not going to eat her."	味見するつもりはねえよ。」
... A look at her?"	・・・見るって？」
said Corley, more amiably.	とコーリーはもっと愛想よく言った。
"Well	「じゃあ
... I'll tell you what.	・・・どうするかな。
I'll go over and talk to her and you can pass by."	俺が向こうへ行って話してる、そこを通りかかればいい。」
"Right!"	「オーケー！」
said Lenehan.	とレネハンは言った。
Corley had already thrown one leg over the chains when Lenehan called out:	コーリーの振り上げた片足がすでに鎖を越えたところへレネハンが呼びかけた。
"And after?	「それで後は？
Where will we meet?"	どこで会う？」
"Half ten,"	「十時半」
answered Corley, bringing over his other leg.	とコーリーはもう片方の足を持ち上げて答えた。
"Where?"	「どこで？」
"Corner of Merrion Street.	「メリオン・ストリートの角。
We'll be coming back."	戻ってくるさ。」
"Work it all right now,"	「じゃあちゃんとうまくやってくれよな」
said Lenehan in farewell.	とレネハンはお別れに言った。
Corley did not answer.	コーリーは答えなかった。
He sauntered across the road swaying his head from side to side.	彼は頭を左右に揺すりながらぶらぶらと道路を横切った。
His bulk, his easy pace, and the solid sound of his boots had something of the conqueror in them.	彼の大きさ、そのゆったりした歩み、どっしりしたブーツの音はどこか征服者のようだった。
He approached the young woman and, without saluting, began at once to converse with her.	彼は若い女に近づき、挨拶もせず、すぐに彼女と話を始めた。
She swung her umbrella more quickly and executed half turns on her heels.	彼女は傘をさらに速く振り動かし、かかとを軸に半回転をしてみせていた。
Once or twice when he spoke to her at close quarters she laughed and bent her head.	一度か二度、彼が接近して話しかけると彼女は笑ってうつむいた。
