TWO GALLANTS	二人の色男
Lenehan observed them for a few minutes.	レネハンは数分間彼らを観察した。
Then he walked rapidly along beside the chains at some distance and crossed the road obliquely.	それから彼は距離を置き、鎖に沿って速足で歩き、道路を斜めに横切った。
As he approached Hume Street corner he found the air heavily scented and his eyes made a swift anxious scrutiny of the young woman's appearance.	ヒューム・ストリートの角に近づいた彼は濃厚な香りに満ちた空気に気づき、彼の目は案じ気にすばやく若い女の姿を精査した。
She had her Sunday finery on.	彼女はよそ行きの派手な服を着けていた。
Her blue serge skirt was held at the waist by a belt of black leather.	青いサージのスカートは黒い革のベルトで腰に留められていた。
The great silver buckle of her belt seemed to depress the centre of her body, catching the light stuff of her white blouse like a clip.	ベルトの大きな銀のバックルは、白いブラウスの軽い生地をクリップのようにはさみ、彼女の体の中心をへこませているようだった。
She wore a short black jacket with mother-of-pearl buttons and a ragged black boa.	彼女は真珠貝ボタンとくたびれた黒いボアのついた短い黒のジャケットを着ていた。
The ends of her tulle collarette had been carefully disordered and a big bunch of red flowers was pinned in her bosom stems upwards.	チュールの襟の端には気をつけていたのに乱れた痕があり、大きな赤い花束が胸にピンで留められて茎は上を向いていた。
Lenehan's eyes noted approvingly her stout short muscular body.	レネハンの目は彼女の小柄でたくましい筋肉質のからだを認めて満足げだった。
rank rude health glowed in her face, on her fat red cheeks and in her unabashed blue eyes.	野放図な頑健さが彼女の顔、その太った赤い頬の上、その臆面もない青い目の中に輝いていた。
Her features were blunt.	彼女の顔の造作は鋭くなかった。
She had broad nostrils, a straggling mouth which lay open in a contented leer, and two projecting front teeth.	鼻孔は広がり、満足そうに媚を売る開いた口はだらしなく、前歯が二本出ていた。
As he passed Lenehan took off his cap and, after about ten seconds, Corley returned a salute to the air.	通りすがりにレネハンは帽子を取り、そして十秒ほど後、コーリーが挨拶を空中に返した。
This he did by raising his hand vaguely and pensively changing the angle of position of his hat.	彼はあいまいに手を上げ、考え込むように帽子のかぶり方の角度を変えることでそれをした。
Lenehan walked as far as the Shelbourne Hotel where he halted and waited.	レネハンはシェルボーン・ホテルまで歩き、そこで立ち止まって待った。
After waiting for a little time he saw them coming towards him and, when they turned to the right, he followed them, stepping lightly in his white shoes, down one side of Merrion Square.	しばらく待っていると彼らが彼の方に来るのが見え、彼らが右に曲がると、白い靴の彼は軽い足取りで、メリオン・スクエアの一辺に沿って彼らの後を追った。
As he walked on slowly, timing his pace to theirs, he watched Corley's head which turned at every moment towards the young woman's face like a big ball revolving on a pivot.	彼は彼らのペースに合わせてゆっくり歩き、絶えず若い女の顔に向けられる、軸の周りを回転する大きなボールのようなコーリーの頭をじっと見ていた。
He kept the pair in view until he had seen them climbing the stairs of the Donnybrook tram;	彼は彼らがドニーブルック行きの電車の階段を登るところが見えるまで二人連れから目を離さなかった。
then he turned about and went back the way he had come.	それから彼は回れ右して来た道を取って返した。
Now that he was alone his face looked older.	一人ぼっちになった今、彼の顔は老けて見えた。
His gaiety seemed to forsake him and, as he came by the railings of the Duke's Lawn, he allowed his hand to run along them.	彼の陽気さは彼を見捨てたようで、デュークス・ローンの柵のそばを通り過ぎる時、彼は手をそれに沿って走らせるがままにした。
The air which the harpist had played began to control his movements	ハープ弾きの奏でていた曲が彼の動きを支配し始めた。
His softly padded feet played the melody while his fingers swept a scale of variations idly along the railings after each group of notes.	柔らかいパッドを当てた足がメロディを奏でる一方、五本の指は連なる音を繰り返し追うように柵に沿ってむなしく変奏曲の音階をかき鳴らした。
He walked listlessly round Stephen's Green and then down Grafton Street.	彼はけだるそうにスティーブンス・グリーンのあたりを、それからグラフトン・ストリートを歩いた。
Though his eyes took note of many elements of the crowd through which he passed they did so morosely.	群衆の中を通り過ぎる彼の目はその多くの要素に注意を留めてはいたが、不機嫌にそうしていた。
He found trivial all that was meant to charm him and did not answer the glances which invited him to be bold.	彼は自分を魅惑しようとするものすべてをつまらないものと感じ、大胆になるよう彼を誘う目つきには答えなかった。
He knew that he would have to speak a great deal, to invent and to amuse and his brain and throat were too dry for such a task.	彼はたくさんしゃべってでっち上げて楽しませなければならないとわかっていたが、そういう仕事をするには彼の脳ものども渇きすぎていた。
The problem of how he could pass the hours till he met Corley again troubled him a little.	コーリーとまた会うまでの時間をどうやったらつぶせるかという問題が彼を少し悩ませた。
He could think of no way of passing them but to keep on walking.	彼は歩き続けるほかにそれをつぶす方法を思いつかなかった。
He turned to the left when he came to the corner of Rutland Square and felt more at ease in the dark quiet street, the sombre look of which suited his mood.	ラトランド・スクエアの角に来て左に曲がると、暗く静かな通りは、その陰鬱な様子が彼の気分にぴったりで、気持ちがだいぶ楽になった。
He paused at last before the window of a poor-looking shop over which the words Refreshment Bar were printed in white letters.	上の方に白い文字で軽食堂と書かれたうらぶれた店のショーウィンドーの前でとうとう彼は立ち止まった。
On the glass of the window were two flying inscriptions:	ウィンドのガラスの上には二つの名称が浮かんでいた。
Ginger Beer and Ginger Ale.	ジンジャービールとジンジャーエール。
A cut ham was exposed on a great blue dish while near it on a plate lay a segment of very light plum-pudding.	青い大きな皿に載ったカットしたハムが並べられ、そのそばの皿にはとてもふんわりしたプラムプディングが一切れ置かれていた。
He eyed this food earnestly for some time and then, after glancing warily up and down the street, went into the shop quickly.	彼はしばらくの間この食べ物を熱心に見つめ、それから、通りの左右に用心深く目をやった後、すばやく店に入った。
He was hungry for, except some biscuits which he had asked two grudging curates to bring him, he had eaten nothing since breakfast-time.	彼は、二人のしみったれたバーテンに持ってくるよう頼んだビスケット少々のほか、朝食の時以来何も食べていなかったので、腹が減っていた。
He sat down at an uncovered wooden table opposite two work-girls and a mechanic.	彼は、二人の女工と職工の反対側の、覆いのない木のテーブル席に着いた。
A slatternly girl waited on him.	だらしない娘が彼の給仕についた。
"How much is a plate of peas?"	「エンドウ豆は一皿いくら？」
he asked.	と彼は言った。
"Three halfpence, sir,"	「一ペニー半です」
said the girl.	と娘は言った。
"Bring me a plate of peas,"	「エンドウ豆を一皿持ってきな、」
he said,	彼は言った、
"and a bottle of ginger beer."	「それとジンジャービールを一瓶。」
He spoke roughly in order to belie his air of gentility	彼は自分の上流気取りが見掛け倒しであると装うために乱暴な口をきいた。
for his entry had been followed by a pause of talk.	というのも彼が入った後、話が途切れてしまったからだ。
His face was heated.	彼は顔が熱くなった。
To appear natural he pushed his cap back on his head and planted his elbows on the table.	自然に見えるように頭の上の帽子を後ろに押しやり、ひじをテーブルに立てた。
The mechanic and the two work-girls examined him point by point before resuming their conversation in a subdued voice.	職工と二人の女工は逐一彼を吟味し、それから抑えた声で再び会話を続けた。
The girl brought him a plate of grocer's hot peas, seasoned with pepper and vinegar, a fork and his ginger beer.	娘がコショウと酢で味付けした出来立ての豆の皿とフォークとジンジャービールを持ってきた。
He ate his food greedily and found it so good that he made a note of the shop mentally.	彼はがつがつと食べ物を食べ、なかなか旨かったのでその店を心の中に書きとめた。
When he had eaten all the peas he sipped his ginger beer and sat for some time thinking of Corley's adventure.	豆をすっかり食べてしまった彼はジンジャービールを少しずつ飲み、コーリーの冒険のことを考えながらしばらく座っていた。
In his imagination he beheld the pair of lovers walking along some dark road;	想像の中で、彼はどこかの暗い道を歩いている一組の恋人を見た。
he heard Corley's voice in deep energetic gallantries and saw again the leer of the young woman's mouth.	ひたすら精力的に心遣いをしてみせるコーリーの声も聞こえ、再び媚を売る若い女の口が見えた。
This vision made him feel keenly his own poverty of purse and spirit.	この幻影は彼に彼自身の貧しい財布と精神を鋭く感じさせた。
He was tired of knocking about, of pulling the devil by the tail, of shifts and intrigues.	彼は歩き回ることが、金に窮していることが、計略と策謀がいやになっていた。
He would be thirty-one in November.	彼は十一月に三十一になる。
Would he never get a good job?	絶対に幸運をつかむことはないのだろうか？
Would he never have a home of his own?	絶対に自分の家は持てないのだろうか？
He thought how pleasant it would be to have a warm fire to sit by and a good dinner to sit down to.	暖かい火のそばに座れたら、十分な食事の席に着けたらどんなに愉快だろうと彼は思った。
He had walked the streets long enough with friends and with girls.	友人たちと、そして娘たちともうたくさんというほど歩きに歩いてきた。
He knew what those friends were worth:	そういう友人たちにどれほどの価値があるか彼にはわかっていた。
he knew the girls too.	娘たちについてもわかっていた。
Experience had embittered his heart against the world.	経験は彼の世の中に対する苦い思いを強くした。
But all hope had not left him.	しかしすべての希望が彼を見捨てたわけではなかった。
He felt better after having eaten than he had felt before, less weary of his life, less vanquished in spirit.	食べ終わった後は前より気分がよくなり、それほど人生にうんざりしてはいない、それほど心は打ち負かされていないと感じた。
He might yet be able to settle down in some snug corner and live happily if he could only come across some good simple-minded girl with a little of the ready.	ただ少しばかり現なまを持ったどこかの適当なだまされやすい娘と出くわしさえすれば、彼だっていつかどこかの居心地のいい隅っこに落ち着いて幸せに暮らすことができるかもしれなかった。
He paid twopence halfpenny to the slatternly girl and went out of the shop to begin his wandering again.	彼はだらしない娘に二ペンス半ペニー支払い、店を出て、再びぶらぶら歩き始めた。
He went into Capel Street and walked along towards the City Hall.	彼はケイペル・ストリートに入り、シティ・ホールに向かって歩いた。
Then he turned into Dame Street.	それから彼はデイム・ストリートへと曲がった。
At the corner of George's Street he met two friends of his and stopped to converse with them.	ジョージズ・ストリートの角で彼は友達二人に会い、止まって話を交わした。
He was glad that he could rest from all his walking.	彼は歩いてばかりのところを休むことができて嬉しかった。
His friends asked him had he seen Corley and what was the latest.	友人たちは彼にコーリーに会ったか、最新のニュースは何かと訊いた。
He replied that he had spent the day with Corley.	彼は一日コーリーと一緒だったと答えた。
His friends talked very little.	友人たちはほとんどしゃべらなかった。
They looked vacantly after some figures in the crowd and sometimes made a critical remark.	彼らは何度か群衆の中の人の姿をぼんやりと目で追い、時々批評するように意見を言った。
One said that he had seen Mac an hour before in Westmoreland Street.	一人が一時間前にウエストモーランド・ストリートでマックに会ったと言った。
At this Lenehan said that he had been with Mac the night before in Egan's.	これを聞いてレネハンは昨日の夜イーガンの店でマックと一緒だったと言った。
The young man who had seen Mac in Westmoreland Street asked was it true that Mac had won a bit over a billiard match.	ウエストモーランド・ストリートでマックに会った若い男は、マックがビリヤードの試合で少しばかり勝ったのは本当かと尋ねた。
Lenehan did not know:	レネハンは知らなかった。
he said that Holohan had stood them drinks in Egan's.	イーガンの店ではホラハンが彼らに酒をおごったと彼は言った。
He left his friends at a quarter to ten and went up George's Street.	十時十五分前に彼は友人たちを残してジョージズ・ストリートを行った。
He turned to the left at the City Markets and walked on into Grafton Street.	彼はシティ・マーケットの所で左に曲がり、グラフトン・ストリートへと歩いていった。
The crowd of girls and young men had thinned and on his way up the street he heard many groups and couples bidding one another good-night.	群れをなしていた娘たちや若い男たちは既にまばらになり、通りを行く彼にたくさんのグループやカップルが互いにさよならの挨拶を交わすのが聞こえた。
He went as far as the clock of the College of Surgeons:	彼は王立外科医大学の時計まで行った。
it was on the stroke of ten.	十時を打っていた。
He set off briskly along the northern side of the Green hurrying for fear Corley should return too soon.	彼はコーリーの帰りが早すぎるといけないのできびきびとグリーンの北側に沿って急ぎ始めた。
When he reached the corner of Merrion Street he took his stand in the shadow of a lamp and brought out one of the cigarettes which he had reserved and lit it.	メリオン・ストリートの角に着いた彼はランプの陰に立ち、取って置いたタバコを一本出して火をつけた。
He leaned against the lamp-post and kept his gaze fixed on the part from which he expected to see Corley and the young woman return.	彼は街灯の柱に寄りかかり、コーリーと若い女が帰ってくるのが見えると思われる部分に、視線をじっと据え続けていた。
His mind became active again.	彼の心は再び活発になった。
He wondered had Corley managed it successfully.	コーリーは何とかうまくやってのけたろうかと彼は思った。
He wondered if he had asked her yet or if he would leave it to the last.	あいつは彼女にもう尋ねたろうか、それとも最後に残したろうかと彼は思った。
He suffered all the pangs and thrills of his friend's situation as well as those of his own.	彼は自身の立場だけでなく友達の分の苦痛やスリルまですっかり味わった。
But the memory of Corley's slowly revolving head calmed him somewhat:	しかしコーリーのゆっくりと回転する頭を思い出すといくぶん落ち着いた。
he was sure Corley would pull it off all right.	コーリーはちゃんと見事にやってのけるだろうと確信したのだ。
All at once the idea struck him that perhaps Corley had seen her home by another way and given him the slip.	突然、ことによるとコーリーは別の道を通って彼女を家へ送り、彼をまいてずらかるかもしれないという考えが彼の頭に浮かんだ。
His eyes searched the street:	彼の目は通りを捜していた。
there was no sign of them.	彼らの気配はなかった。
Yet it was surely half-an-hour since he had seen the clock of the College of Surgeons.	そのうえ王立外科医大学の時計を見てから間違いなく三十分になる。
Would Corley do a thing like that?	コーリーがそんなことをするだろうか？
He lit his last cigarette and began to smoke it nervously.	彼は最後のタバコに火をつけ、神経質にすい始めた。
He strained his eyes as each tram stopped at the far corner of the square.	スクエアの向こうの角に電車が停まるたびに彼は目を凝らした。
They must have gone home by another way.	彼らは別の道で家に帰ったに違いなかった。
The paper of his cigarette broke and he flung it into the road with a curse.	タバコの紙が破れ、彼はそれを悪態とともに道に投げつけた。
Suddenly he saw them coming towards him.	不意に彼はこちらに向かって来る彼らを見た。
He started with delight and keeping close to his lamp-post tried to read the result in their walk.	彼は嬉しくて飛び上がり、街灯の柱にぴたりとついたまま、彼らの歩きぶりから結果を読み取ろうとした。
They were walking quickly, the young woman taking quick short steps, while Corley kept beside her with his long stride.	彼らは急いで歩いていて、若い女は短い歩幅で速足に、コーリーの方は大また歩きで彼女のそばについていた。
They did not seem to be speaking.	彼らは話しているように見えなかった。
An intimation of the result pricked him like the point of a sharp instrument.	結果を暗示するものが尖った器具の先端のように彼をちくりと刺した。
He knew Corley would fail;	コーリーが失敗するに違いないことを彼は知った。
he knew it was no go.	うまくいかないことを彼は知った。
They turned down Baggot Street and he followed them at once, taking the other footpath.	彼らはバゴット・ストリートへと曲がり、彼はすぐに彼らを追って反対側の歩道を行った。
When they stopped he stopped too.	彼らが止まった時、彼も止まった。
They talked for a few moments and then the young woman went down the steps into the area of a house.	彼らはほんの少し話をして、それから若い女は一軒の家の地下勝手口への階段を下りていった。
Corley remained standing at the edge of the path, a little distance from the front steps.	コーリーは正面の階段から少し離れた歩道のへりに立ち続けた。
Some minutes passed.	数分が過ぎた。
Then the hall-door was opened slowly and cautiously.	それから玄関のドアがゆっくり、用心深く開けられた。
A woman came running down the front steps and coughed.	一人の女が正面の階段を駆け下りてきて咳払いをした。
Corley turned and went towards her.	コーリーは振り返り、彼女の方へ行った。
His broad figure hid hers from view for a few seconds and then she reappeared running up the steps.	彼の幅広い姿が数秒間彼女を視界から隠し、それから階段を駆け上がる彼女が再び現れた。
The door closed on her and Corley began to walk swiftly towards Stephen's Green.	ドアが彼女の方へ閉まり、コーリーは急ぎ足でスティーブンス・グリーンに向かって歩き始めた。
Lenehan hurried on in the same direction.	レネハンは急いで同じ方向に行った。
Some drops of light rain fell.	小雨が数滴落ちた。
He took them as a warning and, glancing back towards the house which the young woman had entered to see that he was not observed, he ran eagerly across the road.	彼はそれを警告と受け取り、若い女が入っていった家の方をチラッと振り返って観察されていないか見て、焼け付く思いで道路を横切って走った。
Anxiety and his swift run made him pant.	不安と速く走ることで彼はあえいでいた。
He called out:	彼は大声で呼んだ。
"Hallo, Corley!"	「おーい、コーリー！」
Corley turned his head to see who had called him, and then continued walking as before.	コーリーは頭を回転させ、誰が彼を呼んだのか見て、それから前と同じに歩き続けた。
Lenehan ran after him, settling the waterproof on his shoulders with one hand.	レネハンは片手でレインコートに肩を入れながら彼を追った。
"Hallo, Corley!"	「おーい、コーリー！」
he cried again.	と彼は再び叫んだ。
He came level with his friend and looked keenly in his face.	彼は友の真横に来てその顔を熱心に覗き込んだ。
He could see nothing there.	彼はそこに何も見出すことができなかった。
"Well?"	「それで？」
he said.	と彼は言った。
"Did it come off?"	「うまくいったのかい？」
They had reached the corner of Ely Place.	彼らはエリー・プレースの角に着いた。
Still without answering, Corley swerved to the left and went up the side street.	依然答えずにコーリーは急に左に向きを変え、横町を行った。
His features were composed in stern calm.	彼の顔はどこを見ても冷静で人を寄せつけない落ち着きを示していた。
Lenehan kept up with his friend, breathing uneasily.	レネハンは不安そうな息遣いで、友についていった。
He was baffled and a note of menace pierced through his voice.	彼は困惑し、威嚇の気配が彼の声を貫いた。
"Can't you tell us?"	「なぜだまってる？」
he said.	と彼は言った。
"Did you try her?"	「当たってみたのか？」
Corley halted at the first lamp and stared grimly before him.	コーリーは最初の街灯で立ち止まり、いかめしく前方を凝視した。
Then with a grave gesture he extended a hand towards the light and,smiling, opened it slowly to the gaze of his disciple.	それから彼は厳粛なしぐさで手を明かりの方へ差し出してそして、にっこりして、じっと見つめる門弟の前にゆっくりそれを開いた。
A small gold coin shone in the palm.	小さな金のコインが掌で輝いていた。
