In a little district west of Washington Square the streets have run crazy and broken themselves into small strips called "places."	ワシントン・スクエア西にある小地区は、 道路が狂ったように入り組んでおり、「プレース」と呼ばれる区域に小さく分かれておりました。
These "places" make strange angles and curves.	この「プレース」は不可思議な角度と曲線を描いており、
One street crosses itself a time or two.	一、二回自分自身と交差している通りがあるほどでした。
An artist once discovered a valuable possibility in this street.	かつて、ある画家は、この通りが貴重な可能性を持っていることを発見しました。
Suppose a collector with a bill for paints, paper and canvas should, in traversing this route, suddenly meet himself coming back,	例えば絵や紙やキャンバスの請求書を手にした取り立て屋を考えてみてください。取り立て屋は、この道を歩き回ったあげく、 ぐるりと元のところまで戻ってくるに違いありません。
without a cent having been paid on account!	一セントも取り立てることができずにね。
So, to quaint old Greenwich Village the art people soon came prowling,	それで、芸術家たちはまもなく、奇妙で古いグリニッチ・ヴィレッジへとやってき
hunting for north windows and eighteenth-century gables and Dutch attics and low rents.	そして、北向きの窓と十八世紀の切り妻とオランダ風の屋根裏部屋と安い賃貸料を探してうろついたのです。
Then they imported some pewter mugs and a chafing dish or two from Sixth avenue, and became a "colony."	やがて、彼らは しろめ製のマグやこんろ付き卓上なべを一、二個、六番街から持ち込み、 「コロニー」を形成することになりました。
At the top of a squatty, three-story brick Sue and Johnsy had their studio.	ずんぐりした三階建ての煉瓦造りの最上階では、スーとジョンジーがアトリエを持っていました。
"Johnsy" was familiar for Joanna.	「ジョンジー」はジョアンナの愛称です。
One was from Maine; the other from California.	スーはメイン州の、ジョンジーはカリフォルニア州の出身でした。
They had met at the table d'hote of an Eighth street "Delmonico's," and found their tastes in art, chicory salad and bishop sleeves so congenial that the joint studio resulted.	二人は八番街の「デルモニコの店」の定食で出会い、 芸術と、チコリーのサラダと、ビショップ・スリーブの趣味がぴったりだとわかって、 共同のアトリエを持つことになったのでした。
That was in May.	それが五月のことでした。
In November a cold, unseen stranger, whom the doctors called Pneumonia, stalked about the colony,	十一月に入ると、冷たく、目に見えないよそ者がそのコロニーを巡り歩きはじめました。
touching one here and there with his icy fingers.	そのよそ者は医者から肺炎氏と呼ばれ、 氷のような指でそこかしこにいる人に触れていくのでした。
Over on the east side this ravager strode boldly, smiting his victims by scores,	この侵略者は東の端から大胆に歩きまわり、何十人もの犠牲者に襲いかかりました。
but his feet trod slowly through the maze of the narrow and moss-grown "places."	しかし、狭くて苔むした「プレース」の迷宮を通るときにはさすがの彼の足取りも鈍りました。
Mr. Pneumonia was not what you would call a chivalric old gentleman.	肺炎氏は騎士道精神に満ちた老紳士とは呼べませんでした。
A mite of a little woman with blood thinned by California zephyrs was hardly fair game for the red-fisted, short-breathed old duffer.	息が荒く、血にまみれた手を持った年寄りのエセ者が、 カリフォルニアのそよ風で血の気の薄くなっている小柄な婦人を相手に取るなどというのは フェアプレイとは言えますまい。
But Johnsy he smote;	しかし肺炎氏はジョンジーを襲いました。
and she lay, scarcely moving, on her painted iron bedstead,	その結果ジョンジーは倒れ、 自分の絵が描いてある鉄のベッドに横になったまま少しも動けなくなりました。
looking through the small Dutch window-panes at the blank side of the next brick house.	そして小さなオランダ風の窓ガラスごしに、 隣にある煉瓦造りの家の何もない壁を見つめつづけることになったのです。
One morning the busy doctor invited Sue into the hallway with a shaggy, gray eyebrow.	ある朝、灰色の濃い眉をした多忙な医者がスーを廊下に呼びました。
"She has one chance in--let us say, ten,"	「助かる見込みは ―― そう、十に一つですな」
he said, as he shook down the mercury in his clinical thermometer.	医者は、体温計の水銀を振り下げながら言いました。
"And that chance is for her to want to live.	「で、その見込みはあの子が『生きたい』と思うかどうかにかかっている。
This way people have of lining-up on the side of the undertaker makes the entire pharmacopeia look silly.	こんな風に葬儀屋の側につこうとしてたら、どんな薬でもばかばかしいものになってしまう。
Your little lady has made up her mind that she's not going to get well.	あのお嬢さんは、自分はよくならない、と決めている。
Has she anything on her mind?"	あの子が何か心にかけていることはあるかな？」
"She--she wanted to paint the Bay of Naples some day,"	「あの子は ―― いつかナポリ湾を描きたいって言ってたんです」
said Sue.	とスーは言いました。
"Paint?	「絵を描きたいって？
--bosh!	―― ふむ。
Has she anything on her mind worth thinking about twice--a man, for instance?"	もっと倍くらい実のあることは考えていないのかな ―― 例えば男のこととか」
"A man?"	「男？」
said Sue, with a jew's-harp twang in her voice.	スーは びあぼんの弦の音みたいな鼻声で言いました。
"Is a man worth	「男なんて
--but, no,	――いえ、ないです。
doctor;	先生。
there is nothing of the kind."	そういう話はありません」
"Well,	「ふむ。
it is the weakness, then,"	じゃあそこがネックだな」
said the doctor.	医者は言いました。
"I will do all that science, so far as it may filter through my efforts, can accomplish.	「わたしは、自分の力のおよぶ限りのこと、科学ができることはすべてやるつもりだ。
But whenever my patient begins to count the carriages in her funeral procession I subtract 50 per cent from the curative power of medicines.	でもな、患者が自分の葬式に来る車の数を数え始めたら、 薬の効き目も半減なんだよ。
If you will get her to ask one question about the new winter styles in cloak sleeves I will promise you a one-in-five chance for her, instead of one in ten."	もしもあなたがジョンジーに、冬にはどんな外套の袖が流行るのか、 なんて質問をさせることができるなら、 望みは十に一つから五に一つになるって請け合うんだがね」
After the doctor had gone Sue went into the workroom and cried a Japanese napkin to a pulp.	医者が帰ると、スーは仕事部屋に入って日本製のナフキンがぐしゃぐしゃになるまで泣きました。
Then she swaggered into Johnsy's room with her drawing board, whistling ragtime.	やがてスーはスケッチブックを持ち、 口笛でラグタイムを吹きつつ、胸を張ってジョンジーの部屋に入っていきました。
Johnsy lay,	ジョンジーはシーツをかけて横になっていました。
scarcely making a ripple under the bedclothes, with her face toward the window.	しわ一つもシーツに寄せることなく、顔は窓に向けたままでした。
Sue stopped whistling, thinking she was asleep.	ジョンジーが眠っていると思い、スーは口笛をやめました。
She arranged her board and began a pen-and-ink drawing to illustrate a magazine story.	スーはスケッチブックをセットすると、 雑誌小説の挿絵をペンとインクで描きはじめました。
Young artists must pave their way to Art by drawing pictures for magazine stories	若い作家は文学の道を切り開くために雑誌小説を書きます。
that young authors write to pave their way to Literature.	若き画家は芸術の道を切り開くためにその挿絵を描かなければならないのです。
As Sue was sketching a pair of elegant horseshow riding trousers and a monocle on the figure of the hero, an Idaho cowboy, she heard a low sound, several times repeated.	スーが、優美な馬のショー用のズボンと片眼鏡を主人公のアイダホ州カウボーイのために描いているとき、 低い声が数回繰り返して聞こえました。
She went quickly to the bedside.	スーは急いでベッドのそばに行きました。
Johnsy's eyes were open wide.	ジョンジーは目を大きく開いていました。
She was looking out the window and counting--counting backward.	そして窓の外を見ながら数を数えて ―― 逆順に数を数えているのでした。
"Twelve," she said, and a little later "eleven;"	「じゅうに」とジョンジーは言い、少し後に「じゅういち」と言いました。
and then "ten," and "nine;" and then "eight" and "seven," almost together.	それから「じゅう」「く」と言い、それから「はち」と「なな」をほとんど同時に言いました。
Sue looked solicitously out the window.	スーはいぶかしげに窓の外を見ました。
What was there to count?	何を数えているのだろう？
There was only a bare, dreary yard to be seen, and the blank side of the brick house twenty feet, away.	そこには草もなく わびしい庭が見えるだけで、煉瓦の家の何もない壁は二十フィートも向こうなのです。
An old, old ivy vine, gnarled and decayed at the roots, climbed half way up the brick wall.	根元が節だらけで腐りかかっている、 とても、とても古いつたがその煉瓦の壁の中ほどまで這っていました。
The cold breath of autumn had stricken its leaves from the vine until its skeleton branches clung, almost bare, to the crumbling bricks.	冷たい秋の風は つたの葉に吹き付けて、もう裸同然となった枝は崩れかかった煉瓦にしがみついているのでした。
"What is it, dear?"	「なあに？」
asked Sue.	スーは尋ねました。
"Six," said Johnsy, in almost a whisper.	「ろく」とジョンジーはささやくような声で言いました。
"They're falling faster now.	「早く落ちてくるようになったわ。
Three days ago there were almost a hundred.	三日前は百枚くらいあったのよ。
It made my head ache to count them.	数えていると頭が痛くなるほどだったわ。
But now it's easy.	でもいまは簡単。
There goes another one.	ほらまた一枚。
There are only five left now."	もう残っているのは五枚だけね」
"Five what, dear.	「何が五枚なの？
Tell your Sudie."	スーちゃんに教えてちょうだい」
"Leaves.	「葉っぱよ。
On the ivy vine.	つたの葉っぱ。
When the last one falls I must go, too.	最後の一枚が散るとき、わたしも一緒に行くのよ。
I've known that for three days.	三日前からわかっていたの。
Didn't the doctor tell you?"	お医者さんは教えてくれなかったの？」
"Oh, I never heard of such nonsense,"	「まあ、そんな馬鹿な話は聞いたことがないわよ」
complained Sue, with magnificent scorn.	スーはとんでもないと文句を言いました。
"What have old ivy leaves to do with your getting well?	「古いつたの葉っぱと、あなたが元気になるのと、 どんな関係があるっていうの？
And you used to love that vine so, you naughty girl.	あなたは、あのつたをとても大好きだったじゃない、おばかさん。
Don't be a goosey.	そんなしょうもないこと言わないでちょうだい。
Why, the doctor told me this morning that your chances for getting well real soon were--let's see exactly what he said--he said the chances were ten to one!	あのね、お医者さんは今朝、あなたがすぐによくなる見込みは ―― えっと、 お医者さんが言ったとおりの言葉で言えば ―― 「一に十だ」って言うのよ。
Why, that's almost as good a chance as we have in New York when we ride on the street cars or walk past a new building.	それって、ニューヨークで電車に乗るとか、 建設中のビルのそばを通るぐらいしか危なくないってことよ。
Try to take some broth now,	ほらほら、スープを少し飲んで。
and let Sudie go back to her drawing,	そしてこのスーちゃんをスケッチに戻らせてね。
so she can sell the editor man with it, and buy port wine for her sick child, and pork chops for her greedy self."	そしたらスーちゃんは編集者にスケッチを売ってね、 病気のベビーにはポートワインを買ってね、 はらぺこの自分にはポークチョップを買えるでしょ」
"You needn't get any more wine,"	「もう、ワインは買わなくていいわ」
said Johnsy, keeping her eyes fixed out the window.	目は窓の外に向けたまま、ジョンジーは言いました。
"There goes another.	「ほらまた一枚。
No, I don't want any broth.	ええ、もう、スープもいらないの。
That leaves just four.	残りの葉は たったの四枚。
I want to see the last one fall before it gets dark.	暗くなる前に最後の一枚が散るのを見たいな。
Then I'll go, too."	そして私もさよならね」
"Johnsy, dear,"	「ジョンジー、ねえ」
said Sue, bending over her,	スーはジョンジーの上にかがみ込んで言いました。
"will you promise me to keep your eyes closed, and not look out the window until I am done working?	「お願いだから目を閉じて、私の仕事が終わるまで窓の外を見ないって約束してくれない？
I must hand those drawings in by to-morrow.	この絵は、 明日までに出さなきゃいけないのよ。
I need the light,	描くのに明かりがいるの。
or I would draw the shade down."	でなきゃ日よけを降ろしてしまうんだけど」
"Couldn't you draw in the other room?"	「他の部屋では描けないの？」
asked Johnsy, coldly.	とジョンジーは冷たく尋ねました。
"I'd rather be here by you,"	「あなたのそばにいたいのよ」
said Sue.	とスーは答えました。
"Besides I don't want you to keep looking at those silly ivy leaves."	「それに、あんなつたの葉っぱなんか見てほしくないの」
"Tell me as soon as you have finished,"	「終わったらすぐに教えてね」
said Johnsy, closing her eyes, and lying white and still as a fallen statue,	とジョンジーは言い、目を閉じ、 倒れた像のように白い顔をしてじっと横になりました。
"because I want to see the last one fall.	「最後の一枚が散るのを見たいの。
I'm tired of waiting.	もう待つのは疲れたし。
I'm tired of thinking.	考えるのにも疲れたし。
I went to turn loose my hold on everything,	自分がぎゅっと握り締めていたものすべてを放したいの。
and go sailing down, down,	そしてひらひらひらっと行きたいのよ。
just like one of those poor, tired leaves."	あの哀れで、疲れた木の葉みたいに」
"Try to sleep,"	「もうおやすみなさい」
said Sue.	とスーは言いました。
"I must call Behrman up to be my model for the old hermit miner.	「ベーアマンさんのところまで行って、年老いた穴倉の隠遁者のモデルをしてもらわなくっちゃいけないの。
I'll not be gone a minute.	すぐに戻ってくるわ。
Don't try to move 'till I come back."	戻ってくるまで動いちゃだめよ」
Old Behrman was a painter who lived on the ground floor beneath them.	ベーアマン老人はスーたちの下の一階に住んでいる画家でした。
He was past sixty and had a Michael Angelo's Moses beard curling down from the head of a satyr along the body of an imp.	六十は越していて、 ミケランジェロのモーセのあごひげが、 カールしつつ森の神サチュロスの頭から小鬼の体へ垂れ下がっているという風情です。
Behrman was a failure in art.	ベーアマンは芸術的には失敗者でした。
Forty years he had wielded the brush without getting near enough to touch the hem of his Mistress's robe.	四十年間、絵筆をふるってきましたが、芸術の女神の衣のすそに触れることすらできませんでした。
He had been always about to paint a masterpiece, but had never yet begun it.	傑作をものするんだといつも言っていましたが、 いまだかつて手をつけたことすらありません。
For several years he had painted nothing except now and then a daub in the line of commerce or advertising.	ここ数年間は、ときおり商売や広告に使うへたな絵以外には まったく何も描いていませんでした。
He earned a little by serving as a model to those young artists in the colony who could not pay the price of a professional.	ときどき、プロのモデルを雇うことのできないコロニーの若い画家のためにモデルになり、わずかばかりの稼ぎを得ていたのです。
He drank gin to excess, and still talked of his coming masterpiece.	ジンをがぶがぶのみ、これから描く傑作について今でも語るのでした。
For the rest he was a fierce little old man, who scoffed terribly at softness in any one, and who regarded himself as especial mastiff-in-waiting to protect the two young artists in the studio above.	ジンを飲んでいないときは、ベーアマンは気むずかしい小柄な老人で、 誰であれ、軟弱な奴に対してはひどくあざ笑い、 自分のことを、 階上に住む若き二人の画家を守る特別なマスチフ種の番犬だと思っておりました。
Sue found Behrman smelling strongly of juniper berries in his dimly lighted den below.	ベーアマンはジンのジュニパーベリーの香りをぷんぷんさせて、階下の薄暗い部屋におりました。
In one corner was a blank canvas on an easel that had been waiting there for twenty-five years to receive the first line of the masterpiece.	片隅には何も描かれていないキャンバスが画架に乗っており、 二十五年もの間、傑作の最初の一筆が下ろされるのを待っていました。
She told him of Johnsy's fancy,	スーはジョンジーの幻想をベーアマンに話しました。
and how she feared she would, indeed, light and fragile as a leaf herself, float away when her slight hold upon the world grew weaker.	この世に対するジョンジーの関心がさらに弱くなったら、 彼女自身が一枚の木の葉のように弱くもろく、 はらはらと散ってしまうのではないか…。スーはそんな恐れもベーアマンに話しました。
Old Behrman, with his red eyes, plainly streaming, shouted his contempt and derision for such idiotic imaginings.	ベーアマン老人は、赤い目をうるませつつ、 そんなばかばかしい想像に、軽蔑と嘲笑の大声を上げたのです。
"Vass!"	「なんだら！」
he cried.	とベーアマンは叫びました。
"Is dere people in de world mit der foolishness to die because leafs dey drop off from a confounded vine?	「いったいぜんたい、 葉っぱが、けしからん つたから散るから死ぬなんたら、ばかなこと考えている人がいるのか。
I haf not heard of such a thing.	そんなのは聞いたこともないぞ。
No, I will not bose as a model for your fool hermit-dunderhead.	あほ隠居ののろまのモデールなんかやらんぞ。
Vy do you allow dot silly pusiness to come in der prain of her?	何でらそんなんたらつまらんことをあの子のあたまに考えさせるんだら。
Ach, dot poor lettle Miss Johnsy."	あのかわいそうなかわいいヨーンジーに」
"She is very ill and weak,"	「病気がひどくて、体も弱っているのよ」
said Sue,	とスーは言いました。
"and the fever has left her mind morbid and full of strange fancies.	「高熱のせいで、気持ちが落ち込んでて、おかしな考えで頭がいっぱいなのよ。
Very well, Mr. Behrman,	えーえ、いいわよベーアマンさん。
if you do not care to pose for me, you needn't.	もしも私のためにモデルになってくれないなら、しなくて結構よ。
But I think you are a horrid old--old flibbertigibbet."	でも、あなたはいやな老いぼれの ―― 老いぼれのコンコンチキだわ」
"You are just like a woman!"	「あんたも女ってわけだ」
yelled Behrman.	とベーアマンは叫びました。
"Who said I will not bose?	「モデールにならんと誰が言ったらんか。
Go on.	いいかね。
I come mit you.	あんたと一緒に行くったらさ。
For half an hour I haf peen trying to say dot I am ready to bose.	モーデルの準備はできてると、三十分もの間、言おうとしたったらさ。
Gott!	ゴット！
dis is not any blace in which one so goot as Miss Yohnsy shall lie sick.	ここは、 ヨーンジーさんみたいな素敵なお嬢さんが病気で寝込むところじゃないったら。
Some day I vill baint a masterpiece, and ve shall all go away.	いつか、わしが傑作を描いたらって、 わしらはみんなここを出ていくんだら。
Gott!	ゴット！
yes."	そうなんだら」
Johnsy was sleeping when they went upstairs.	上の階に着いたとき、ジョンジーは眠っていました。
Sue pulled the shade down to the window-sill, and motioned Behrman into the other room.	スーは日よけを窓のしきいまで引っ張りおろし、ベーアマンを別の部屋へ呼びました。
In there they peered out the window fearfully at the ivy vine.	そこで二人はびくびくしながら窓の外のつたを見つめました。
Then they looked at each other for a moment without speaking.	そして一言も声を出さず、しばし二人して顔を見合わせました。
A persistent, cold rain was falling, mingled with snow.	ひっきりなしに冷たい雨が降り続き、みぞれまじりになっていました。
Behrman, in his old blue shirt, took his seat as the hermit-miner on an upturned kettle for a rock.	ベーアマンは青い古シャツを着て、 ひっくり返したなべを大岩に見たて、穴倉の隠遁者として座りました。
When Sue awoke from an hour's sleep the next morning she found Johnsy with dull, wide-open eyes staring at the drawn green shade.	次の朝、一時間ねむったスーが目を覚ますと、 ジョンジーはどろんとした目を大きく開いて、降ろされた緑の日よけを見つめていました。
"Pull it up;	「日よけをあげて。
I want to see,"	見たいの」
she ordered, in a whisper.	ジョンジーはささやくように命じました。
Wearily Sue obeyed.	スーはしぶしぶ従いました。
But, lo! after the beating rain and fierce gusts of wind that had endured through the livelong night, there yet stood out against the brick wall one ivy leaf.	けれども、ああ、打ち付ける雨と激しい風が長い夜の間荒れ狂ったというのに、 つたの葉が一枚、煉瓦の壁に残っておりました。
It was the last on the vine.	それは、最後の一枚の葉でした。
Still dark green near its stem, but with its serrated edges tinted with the yellow of dissolution and decay,	茎のつけねは深い緑で、 ぎざぎざのへりは黄色がかっておりました。
it hung bravely from a branch some twenty feet above the ground.	その葉は勇敢にも地上二十フィートほどの高さの枝に残っているのでした。
"It is the last one,"	「これが最後の一枚ね」
said Johnsy.	ジョンジーが言いました。
"I thought it would surely fall during the night.	「昨晩のうちに散ると思っていたんだけど。
I heard the wind.	風の音が聞こえていたのにね。
It will fall to-day,	でも今日、あの葉は散る。
and I shall die at the same time."	一緒に、私も死ぬ」
"Dear, dear!"	「ねえ、お願いだから」
said Sue, leaning her worn face down to the pillow,	スーは疲れた顔を枕の方に近づけて言いました。
"think of me, if you won't think of yourself.	「自分のことを考えないっていうなら、せめて私のことを考えて。
What would I do?"	私はどうしたらいいの？」
But Johnsy did not answer.	でも、ジョンジーは答えませんでした。
The lonesomest thing in all the world is a soul when it is making ready to go on its mysterious, far journey.	神秘に満ちた遠い旅立ちへの準備をしている魂こそ、 この世で最も孤独なものなのです。
