The fancy seemed to possess her more strongly as one by one the ties that bound her to friendship and to earth were loosed.	死という幻想がジョンジーを強くとらえるにつれ、 友人や地上とのきずなは弱くなっていくようでした。
The day wore away, and even through the twilight they could see the lone ivy leaf clinging to its stem against the wall.	昼が過ぎ、たそがれどきになっても、 たった一枚残った つたの葉は、壁をはう枝
And then, with the coming of the night the north wind was again loosed, while the rain still beat against the windows and pattered down from the low Dutch eaves.	やがて、夜が来るとともに北風が再び解き放たれる一方、雨は窓を打ち続け、低いオランダ風のひさしからは雨粒がぼたぼたと落ちていきました。
When it was light enough Johnsy, the merciless, commanded that the shade be raised.	朝が来て明るくなると、ジョンジーは無慈悲にも、日よけを上げるようにと命じました。
The ivy leaf was still there.	つたの葉は、まだそこにありました。
Johnsy lay for a long time looking at it.	ジョンジーは横になったまま、長いことその葉を見ていました。
And then she called to Sue,	やがて、スーを呼びました。
who was stirring her chicken broth over the gas stove.	スーはチキンスープをガスストーブにかけてかき混ぜているところでした。
"I've been a bad girl, Sudie,"	「わたしは、とても悪い子だったわ、スーちゃん」
said Johnsy.	とジョンジーは言いました。
"Something has made that last leaf stay there to show me how wicked I was.	「何かが、あの最後の葉を散らないようにして、 わたしが何て悪いことを思っていたか教えてくれたのね。
It is a sin to want to die.	死にたいと願うのは、罪なんだわ。
You may bring me a little broth now, and some milk with a little port in it, and--no; bring me a hand-mirror first,	ねえ、スープを少し持ってきて、それから中にワインを少し入れたミルクも、それから ―― ちがうわ、まず鏡を持ってきて。
and then pack some pillows about me,	それから枕を何個か私の後ろに押し込んで。
and I will sit up and watch you cook."	そしたら体を起こして、あなたが料理するのが見られるから」
An hour later she said.	それから一時間たって、ジョンジーはこう言いました。
"Sudie,	「スーちゃん。
some day I hope to paint the Bay of Naples."	わたし、いつか、ナポリ湾を描きたいのよ」
The doctor came in the afternoon,	午後にあの医者がやってきました。
and Sue had an excuse to go into the hallway as he left.	帰り際、スーも廊下に出ました。
"Even chances,"	「五分五分だ」
said the doctor, taking Sue's thin, shaking hand in his.	と医者はスーの細く震えている手をとって言いました。
"With good nursing you'll win.	「よく看病すればあなたの勝ちになる。
And now I must see another case I have downstairs.	これからわたしは下の階にいる別の患者を診なければならん。
Behrman, his name is--some kind of an artist, I believe.	ベーアマンと言ったな ―― 画家、なんだろうな。
Pneumonia, too.	この患者も肺炎なんだ。
He is an old, weak man, and the attack is acute.	もう高齢だし、体も弱っているし、急性だし。
There is no hope for him;	彼の方は、助からんだろう。
but he goes to the hospital to-day to be made more comfortable."	だが今日、病院に行って、もう少し楽になるだろう」
The next day the doctor said to Sue:	次の日、医者はスーに言いました。
"She's out of danger.	「もう危険はない。
You've won.	あなたの勝ちだ。
Nutrition and care now--that's all."	あと必要なのは栄養と看病 ―― それだけだよ」
And that afternoon Sue came to the bed where Johnsy lay,	その午後、スーはベッドのところに来ました。
contentedly knitting a very blue and very useless woolen shoulder scarf,	ジョンジーはそこで横になっており、とても青くて全く実用的じゃないウールのショルダースカーフを満足げに編んでおりました。
and put one arm around her, pillows and all.	スーは、枕も何もかも全部まとめて抱きかかえるように手を回しました。
"I have something to tell you, white mouse,"	「ちょっと話したいことがあるのよ、白ねずみちゃん」
she said.	とスーは言いました。
"Mr. Behrman died of pneumonia to-day in the hospital.	「今日、ベーアマンさんが病院で肺炎のためお亡くなりになったの。
He was ill only two days.	病気はたった二日だけだったわ。
The janitor found him on the morning of the first day in his room downstairs helpless with pain.	一日目の朝、下の自分の部屋で痛みのためどうしようもない状態になっているのを 管理人さんが見つけたんですって。
His shoes and clothing were wet through and icy cold.	靴も服もぐっしょり濡れていて、氷みたいに冷たくなっていたそうよ。
They couldn't imagine where he had been on such a dreadful night.	あんなひどい晩にいったいどこに行ってたのか、 はじめは想像もできなかったみたいだけど、
And then they found a lantern, still lighted, and a ladder that had been dragged from its place,	まだ明かりのついたランタンが見つかって、それから、元の場所から引きずり出されたはしごが見つかったのよ。
and some scattered brushes, and hha palette with green and yellow colors mixed on it,	それから、散らばっていた筆と、緑と黄色が混ぜられたパレットも。
and--look out the window, dear,	それから、 ―― ねえ、窓の外を見てごらんなさい。
at the last ivy leaf on the wall.	あの壁のところ、最後の一枚のつたの葉を見て。
Didn't you wonder why it never fluttered or moved when the wind blew?	どうして、あの葉、風が吹いてもひらひら動かないのか、不思議に思わない？
Ah, darling, it's Behrman's masterpiece	ああ、ジョンジー、 あれがベーアマンさんの傑作なのよ
--he painted it there	―― あの葉は、ベーアマンさんが描いたものなのよ。
the night that the last leaf fell."	最後の一枚の葉が散った夜に」
