IN MIDSUMMER DAYS	真夏の夢
The walls of the room were made of new pinewood and only varnished with oil, so that all the knots were visible.	その室のかべというのは新しい荒（あら）けずりの松板でヴァニスをかけただけですから、節がよく見えていました。
And the knots in the knot-holes looked for all the world like so many eyes.	黒ずんだ枝の切り去られたなごりのたまご形の節の数々は目の玉のように思いなされました。
"Oh!  Just look at all the eyes, mammy,"	「まあたくさんな目が」
exclaimed the little girl.	とそう言いだしました。
Yes, there were eyes of every descriptio;	なるほどいろいろな目がありました。
big eyes, eloquent eyes, grave eyes;	大きくって親切らしいまじめな目や、
little shining baby eyes, with a lurking smile in the corner;	小さくかがやくあいきょうのある子どもの目や、
wicked eyes, which showed too much white;	白目の多過ぎるおこったらしい目や、
frank and candid eyes, which looked one straight into the heart;	心の中まで見ぬきそうなすきのない目などがありました。
and, over there, a big, gentle mother's eye, which regarded the dead girl lovingly;	またそこに死んでいるむすめをなつかしそうに打ち見やる、大きなやさしい母らしい目もありまして、
and a transparent tear of resin trembled on the lid, and sparkled in the setting sun like a green and red diamond.	その眼中にはすき通るような松やにの涙が宿って、夕日の光をうけて金剛石（こんごうせき）のようにきらきら光っていました。
"Is she asleep?"	「そこにいるお嬢（じょう）さんはねむっていらっしゃるの」
asked the child, looking into the face of the dead girl.	と子どもははじめて死骸（しがい）に気がついて、おかあさんにたずねました。
"Yes, she is asleep."	「そうです、ねむっていらっしゃるんです」
"Is she a bride, mammy?"	「花よめさんでしょうか、ママ」
"Yes, darling."	「そうです花よめさんです」
The mother had recognised her.	よく見るとおかあさんはそのむすめを見知っているのでした。
It was the girl who was to be a bride on Midsummer day, when her sailor lover would return home;	そのむすめは真夏のころ帰って来るあの船乗りの花よめとなるはずでしたが、
but the sailor had written to say that he would not be home until the autumn, and his letter had broken her heart;	その船乗りが秋にならなければ帰れないという手紙をよこしたので、落胆（らくたん）してしまったのでした。
for she could not bear to wait until the autumn, when the leaves would drop dead from the trees	木の葉が落ちつくして、こがらしのふき始める秋まで待つ事はたえ切れなかったのです。
She had heard the song of the dove and taken it to heart.	おかあさんは鳩の歌に耳をかたむけて、その言うことばがよくわかっていたのですから、
The young mother left the cottage;	この屋敷（やしき）を出て行くにつけても
now she knew where she would go.	行く先が知れていました。
She put the heavy basket down outside the gate and took the child into her arms;	重い手かごを門の外に置いて、子どもを抱き上げて、
and so she walked across the meadow which separated her from the shore.	自分と海岸との間に横たわる広野をさしておかあさんは歩きだしました。
and the pollen water was calm and blue;	むすめはかくまで海がおだやかで青いのに大喜びをしましたが、
and presently it was not water through which they sailed, but the blue blossoms of the flax,	よく見ると二人の帆走っているのは海原（うなばら）ではなくって美しくさきそろった矢車草（やぐるまそう）の花の中でした。
which she gathered in her outstretched hands.	むすめは手をのばしてそれを摘み取りました。
And the flowers bent down and rose up again, whispering, lapping against the sides of the boat like little waves.	花は起きたり臥（ふ）したりしてさざなみのように舷（げん）に音をたてました。
but presently a white mist enveloped them, and they heard the plashing of real waves,	しばらくすると二人はまた白い霧に包まれました上にほんとうの波の声さえ聞こえてきました。
but above the mist they heard a lark singing.	しかし霧の上では雲雀が高くさえずっていました。
"How does the lark come to sing on the sea?"	「どうして雲雀は海の上なんぞで鳴くんでしょう」
asked the child.	と子どもが聞きました。
"The sea is so green that the lark takes it for a meadow,"	「海があんまり緑ですから、雲雀は野原だと思っているんでしょう」
answered the mother.	とおかあさんは説き明かしました。
The mist had dispersed again.	とたちまち霧は消えてしまって、
The sky was blue and the lark was still singing.	空は紺青（こんじょう）に澄（す）みわたって、その中を雲雀がかけていました。
Then they saw, straight before them, in the middle of the sea, a green island	遠い遠い所に木のしげった島が見えます。
with a white, sandy beach, and people, dressed all in pure white, walking hand in hand.	白砂（しらすな）の上を人々が手を取り合って行きかいしております。
The setting sun shone on the golden roof of a colonnade, where white fires burnt in sacred sacrificial vessels;	祭壇（さいだん）から火の立ち登る柱廊下（ちゅうろうか）の上にそびえた黄金の円屋根（まるやね）に夕ぐれの光が反映（うつ）って、
and the green island was spanned by a rainbow, the colour of which was rose-red and sedge-green.	島の空高く薔薇色と藍緑色とのにじがかかっていました。
"What is it, mammy?"	「あれはなんですか、ママ」
The mother could make no reply.	おかあさんはなんと答えていいか知りませんでした。
"Is it the Kingdom of Heaven of which the dove sang?	「あれが鳩の歌った天国ですか、
What is the Kingdom of Heaven, mammy?"	いったい天国とはなんでしょう、ママ」
"A place, darling, where all people love one another," answered the mother, "where there is neither grief nor strife."	「そこはね、みんながおたがいに友だちになって、悲しい事も争闘（あらそい）もしない所です」
"Then let us go there,"	「私はそこに行きたいなあ」
said the child.	と子どもが言いました。
"Yes, we will go,"	「私もですよ」
said the tired, forsaken little mother.	と憂（う）さ辛（つら）さに浮（う）き世（よ）をはかなんださびしいおかあさんも言いました。
