And at last they looked at Dorothy again.	そしてやっと、再びドロシーを眺めました。
"Why should I do this for you?"	「なぜ私がお前のためにそんなことをせねばならんのだ？」
asked Oz.	とオズは訪ねます。
"Because you are strong and I am weak;	「だってあなたは強くてあたしは弱いんですもの。
because you are a Great Wizard and I am only a little girl."	あなたはえらい魔法使いで、わたしはただの寄る辺ない女の子でしかないんです」
"But you were strong enough to kill the Wicked Witch of the East,"	「だがおまえは東の邪悪な魔女を殺すだけの力を持っていたではないか」
said Oz.	とオズ。
"That just happened,"	「あれは成り行きです。
returned Dorothy simply;	どうしようもなかったんです」
"I could not help it."	とドロシーはきっぱり答えました。
"Well,"	頭は言いました。
said the Head,	「そうか。
"I will give you my answer.	私の答えを伝えよう。
You have no right to expect me to send you back to Kansas unless you do something for me in return.	カンザスに送り返せというからには、かわりに私のたのみをきかなくてはならない。
In this country everyone must pay for everything he gets.	この国では、自分の手に入れるものについてはすべてそれなりの代償を支払うのだ。
If you wish me to use my magic power to send you home again you must do something for me first.	私の魔法の力を使って家に送り返してほしいのであれば、まずは私のためにやらなくてはならないことがある。
Help me and I will help you."	私を助けてくれたら、私もおまえを助けよう」
"What must I do?"	「何をしなくてはいけないのでしょうか？」
asked the girl.	と少女はたずねます。
"Kill the Wicked Witch of the West,"	「西の邪悪な魔女を殺すがいい」
answered Oz.	とオズが答えました。
"But I cannot!"	「でもそんなの無理です！」
exclaimed Dorothy, greatly surprised.	とドロシーは大いに驚いてさけびました。
"You killed the Witch of the East and you wear the silver shoes, which bear a powerful charm.	「おまえは東の魔女を殺したし、おまえのはいている銀のくつは強力な魔法を持っている。
There is now but one Wicked Witch left in all this land,	いまやこの地に残る邪悪な魔女はたった一人。
and when you can tell me she is dead I will send you back to Kansas--but not before."	それが死んだと言えるようになったら、カンザスに送り返してやろう――だがそれまではだめだ」
The little girl began to weep,	少女は泣き出しました。
she was so much disappointed;	本当にがっかりしてしまったのです。
and the eyes winked again and looked upon her anxiously,	すると目はまたまばたきして心配そうに彼女を見つめました。
as if the Great Oz felt that she could help him if she would.	まるでえらいオズが、ドロシーさえその気になれば自分を助けてくれるのに、とでも思っているかのようでした。
"I never killed anything, willingly,"	「あたしはわざと生き物を殺したことは一度もないんです」
she sobbed.	とドロシーはすすり泣きました。
"Even if I wanted to, how could I kill the Wicked Witch?	「それに殺したくったって、どうすれば邪悪な魔女なんか殺せるんですか？
If you, who are Great and Terrible, cannot kill her yourself, how do you expect me to do it?"	偉大でおそろしいあなたですらご自分で殺せないものを、どうやってあたしに殺せとおっしゃるんですか？」
"I do not know,"	頭は言いました。
said the Head;	「知らんな。
"but that is my answer,	だがそれが私の答えだ。
and until the Wicked Witch dies you will not see your uncle and aunt again.	そして邪悪な魔女が死ぬまでは、おまえはおじさんにもおばさんにも会えぬのだ。
Remember that the Witch is Wicked--tremendously Wicked -and ought to be killed.	忘れるな、この魔女は邪悪だ――とんでもなく邪悪だ――だから死なねばならぬのだ。
Now go, and do not ask to see me again until you have done your task."	さあ行け、そして仕事を終えるまではもう私に会おうとしてはならぬ」
Sorrowfully Dorothy left the Throne Room and went back where the Lion and the Scarecrow and the Tin Woodman were waiting to hear what Oz had said to her.	ドロシーは悲しくてたまりませんでしたが玉座の間を去り、ライオンやかかしやブリキの木こりがオズの返事を聞こうと待っているところへ戻りました。
"There is no hope for me,"	「もう何の希望もないわ。
she said sadly,	オズは西の邪悪な魔女を殺すまではおうちに返してくれないんですって。
"for Oz will not send me home until I have killed the Wicked Witch of the West; and that I can never do."	そんなの無理よ」
Her friends were sorry, but could do nothing to help her;	友達みんな、ドロシーをかわいそうに思いましたが、どうにも手助けしようがありません。
so Dorothy went to her own room and lay down on the bed and cried herself to sleep.	だからドロシーは部屋に戻ってベッドに横たわり、泣きながら眠ってしまいました。
The next morning the soldier with the green whiskers came to the Scarecrow and said:	翌朝、緑のヒゲをはやした兵隊がかかしのところにやってきてこう言いました。
"Come with me,	「いっしょにいらしてください。
for Oz has sent for you."	オズがお呼びです」
So the Scarecrow followed him and was admitted into the great Throne Room,	そこでかかしは後にしたがい、大玉座の間に通されました。
where he saw, sitting in the emerald throne, a most lovely Lady.	するとそこのエメラルドの玉座にすわっているのは、実に美しい女性でした。
She was dressed in green silk gauze and wore upon her flowing green locks a crown of jewels.	緑の絹のガーゼを身にまとい、流れる緑の巻き毛の上に宝石をちりばめた王冠をかぶっています。
Growing from her shoulders were wings, gorgeous in color and so light that they fluttered if the slightest breath of air reached them.	その肩からは翼が生えていて、豪華な色合いをして実に軽く、ごくわずかな風にでも吹かれるとそよぐのです。
When the Scarecrow had bowed, as prettily as his straw stuffing would let him, before this beautiful creature, she looked upon him sweetly, and said:	この美しい生き物の前でかかしが、そのわらの詰め物で可能な限りきれいにおじぎをしてみせると、女性は優しくかかしを見下ろしてこう言いました。
"I am Oz, the Great and Terrible.	「我こそはオズ、偉大にして恐ろしき存在です。
Who are you, and why do you seek me?"	お前は何者ですの、そして何故私を求めるのですか？」
Now the Scarecrow, who had expected to see the great Head Dorothy had told him of, was much astonished;	さてかかしは、ドロシーが話してくれた巨大な頭に会うものと思っていたので、とてもびっくりしていました。
but he answered her bravely.	でも勇気を出してこう答えました。
"I am only a Scarecrow, stuffed with straw.	「ぼくはただのかかしで、わらが詰まっているだけです。
Therefore I have no brains, and I come to you praying that you will put brains in my head instead of straw,	ですから脳がないので、頭にわらのかわりに脳を入れてくれるようお願いしにまいったのです。
so that I may become as much a man as any other in your dominions."	そうすればあなたの領土にいるだれにもまけないいっぱしの人物になれるでしょうから」
"Why should I do this for you?"	「なぜわたしがそんなことをしなければいけませんの？」
asked the Lady.	と婦人がたずねます。
"Because you are wise and powerful, and no one else can help me,"	「だってあなたは賢くで強力でいらっしゃるし、ほかにだれもぼくを助けられる人はいないんです」
answered the Scarecrow.	とかかしは答えました。
"I never grant favors without some return,"	「おかえしなしに願いを聞き届けたりはしませんのよ」
said Oz;	とオズ。
"but this much I will promise.	「でもこれだけは約束しましょう。
If you will kill for me the Wicked Witch of the West, I will bestow upon you a great many brains,	わたしのために、西の邪悪な魔女を殺してくれたら、大量に脳みそを差し上げましょう。
and such good brains that you will be the wisest man in all the Land of Oz."	それも実によい脳みそで、オズの国で最高の賢者になれるようなものを」
"I thought you asked Dorothy to kill the Witch,"	「魔女を殺せというのはドロシーに頼んだことじゃないんですか」
said the Scarecrow, in surprise.	かかしは驚いて言いました。
"So I did.	「頼みましたよ。
I don't care who kills her.	だれがあの魔女を殺そうとかまわないのです。
But until she is dead I will not grant your wish.	でもあの魔女が死ぬまでは、望みはかなえてあげません。
Now go, and do not seek me again until you have earned the brains you so greatly desire."	さあ行きなさい、そしてその求めてやまない脳みそを勝ち取るまでは、もうわたしに会おうとしてはなりません」
The Scarecrow went sorrowfully back to his friends and told them what Oz had said;	かかしはとても悲しい気持ちで友人たちのところへ戻り、オズの言ったことを話しました。
and Dorothy was surprised to find that the Great Wizard was not a Head, as she had seen him, but a lovely Lady.	ドロシーは、大魔法使いが自分の見たような頭ではなく、美しい婦人だったときいてびっくりしました。
"All the same,"	「そうは言ってもね、
said the Scarecrow,	あの女性はブリキの木こりに負けないくらい心が入り用だね」
"she needs a heart as much as the Tin Woodman."	とかかし。
On the next morning the soldier with the green whiskers came to the Tin Woodman and said:	翌朝、緑のヒゲをはやした兵隊がブリキの木こりのところにきて言いました。
"Oz has sent for you.	「オズがお呼びです。
Follow me."	こちらへどうぞ」
So the Tin Woodman followed him and came to the great Throne Room.	そこでブリキの木こりは後について大きな玉座の間にやってきました。
He did not know whether he would find Oz a lovely Lady or a Head, but he hoped it would be the lovely Lady.	オズが美しい婦人になるか頭になるかは知りませんでしたが、美しい婦人だといいな、とは思いました。
"For,"	「だって、
he said to himself,	もし頭なら絶対に心なんかもらえないだろう。
"if it is the head, I am sure I shall not be given a heart, since a head has no heart of its own and therefore cannot feel for me.	頭には心臓がないから、ぼくに同情したりはできないはずだ。
But if it is the lovely Lady I shall beg hard for a heart, for all ladies are themselves said to be kindly hearted.	でも美しい婦人なら、とにかく拝み倒して心をもらうんだ。
But when the Woodman entered the great Throne Room he saw neither the Head nor the Lady,	でも木こりが大きな玉座の間にはいると、そこにいたのは頭でもなければ婦人でもありません。
for Oz had taken the shape of a most terrible Beast.	オズは実におそろしい獣の姿をしていたのです。
It was nearly as big as an elephant, and the green throne seemed hardly strong enough to hold its weight.	大きさはゾウほどもあって、緑の玉座でもその重みをささえきれるか怪しそうです。
The Beast had a head like that of a rhinoceros, only there were five eyes in its face.	獣はサイのような頭をしていましたが、顔には目が五つもあります。
There were five long arms growing out of its body, and it also had five long, slim legs.	体からは長い腕が五本生え、長く細い脚も五本はえています。
Thick, woolly hair covered every part of it, and a more dreadful-looking monster could not be imagined.	前進をぶあついもじゃもじゃの毛が覆っていて、これ以上はないというくらい恐ろしげです。
It was fortunate the Tin Woodman had no heart at that moment,	ブリキの木こりに今のところ心臓がなかったのは幸運でした。
for it would have beat loud and fast from terror.	あったら恐ろしくてすごい音でドキドキしたでしょうから。
But being only tin, the Woodman was not at all afraid,	でもただのブリキの木こりはちっともこわくありませんでした。
although he was much disappointed.	ただとてもがっかりしただけです。
"I am Oz, the Great and Terrible,"	「我こそはオズ、偉大にして恐ろしき存在である。
spoke the Beast, in a voice that was one great roar.	お前は何者だ、そして何故私を求めるのか？」
"Who are you, and why do you seek me?"	と獣は、すさまじい咆哮のような声で一息に言いました。
"I am a Woodman, and made of tin.	「わたしは木こりで、ブリキでできています。
Therefore I have no heart, and cannot love.	だから心がなく、愛することができません。
I pray you to give me a heart	お願いですから心をください。
that I may be as other men are."	ほかの人々と同じようになりたいのです」
"Why should I do this?"	「なぜそんなことを私がせねばならんのだ？」
demanded the Beast.	と獣が問いただします。
"Because I ask it,	「わたしがお願いするからです。
and you alone can grant my request,"	そしてこの望みをかなえられるのはあなただけだからです」
answered the Woodman.	と木こりは答えました。
Oz gave a low growl at this, but said, gruffly:	オズはこれを聞いて低くうなりましたが、不機嫌そうにこう言いました。
"If you indeed desire a heart, you must earn it."	「本当に心を望むのであれば、それを勝ち取らねばならない」
"How?"	「どうやって？」
asked the Woodman.	と木こりがききます。
"Help Dorothy to kill the Wicked Witch of the West,"	獣は申します。
replied the Beast.	「ドロシーが西の邪悪な魔女を殺すのを手伝え。
"When the Witch is dead, come to me,	魔女が死んだら戻ってこい。
and I will then give you the biggest and kindest and most loving heart in all the Land of Oz."	そうしたらオズの国で最大の最も親切で愛に満ちた心をくれてやろう」
So the Tin Woodman was forced to return sorrowfully to his friends and tell them of the terrible Beast he had seen.	そこでブリキの木こりは仕方なく悲しい思いで友達のところに戻り、自分の見た恐ろしい獣のことを話しました。
They all wondered greatly at the many forms the Great Wizard could take upon himself,	みんな、大魔法使いがいろいろな姿を取れることを大いに不思議がりました。
and the Lion said:	するとライオンは言いました。
"If he is a Beast when I go to see him, I shall roar my loudest, and so frighten him that he will grant all I ask.	「わたしが会見するときにオズが獣だったら、思いっきり吠えて怖がらせて、望みをかなえさせよう。
And if he is the lovely Lady, I shall pretend to spring upon her, and so compel her to do my bidding.	そして美しい婦人だったら、飛びかかるふりをして、こちらの要求にしたがうようにさせよう。
And if he is the great Head, he will be at my mercy;	そして大きな頭だったら、こっちの思うつぼだ。
for I will roll this head all about the room until he promises to give us what we desire.	部屋中その頭をゴロゴロ頃がして、こちらの願いを叶えると約束するまでやめない。
So be of good cheer, my friends,	だから友人諸君、元気を出したまえ。
for all will yet be well."	すべてはまだよくなる見込みがあるんだから」
The next morning the soldier with the green whiskers led the Lion to the great Throne Room and bade him enter the presence of Oz.	翌朝、緑のヒゲの兵隊がライオンを大きな玉座の間に案内して、オズにお目通りするよううながしました。
The Lion at once passed through the door, and glancing around saw, to his surprise, that before the throne was a Ball of Fire,	ライオンはすぐにドアを入り、見回して目に入ったのは、驚いたことに玉座の前にいる火の玉でした。
so fierce and glowing he could scarcely bear to gaze upon it.	実に強烈に燃えて輝いていたので、ほとんど正視できません。
His first thought was that Oz had by accident caught on fire and was burning up;	最初、オズがうっかり自分に火をつけてしまって炎上しているのかと思いました。
but when he tried to go nearer, the heat was so intense that it singed his whiskers, and he crept back tremblingly to a spot nearer the door.	でも近づこうとしてもあまりに熱がすごくて、ヒゲが焦げてしまったので、ライオンはふるえながらコソコソと、ドアに近い場所に戻りました。
Then a low, quiet voice came from the Ball of Fire, and these were the words it spoke:	すると火の玉から低く静かな声がして、こう申しました。
"I am Oz, the Great and Terrible.	「我こそはオズ、偉大にして恐ろしき存在である。
Who are you, and why do you seek me?"	お前は何者ですか、そして何故私を求めるのですか？」
And the Lion answered,	そしてライオンはこう答えます。
"I am a Cowardly Lion, afraid of everything.	「わたしは臆病ライオンで、すべてがこわいのです。
I came to you to beg that you give me courage,	勇気を与えてくださいとお願いに参りました。
so that in reality I may become the King of Beasts, as men call me."	そうすれば人間たちが呼ぶような百獣の王に本当になれるからです」
"Why should I give you courage?"	「なぜ勇気をやらねばならないのでしょう？」
demanded Oz.	とオズが問いただします。
"Because of all Wizards you are the greatest, and alone have power to grant my request,"	「あらゆる魔法使いの中であなたが最も偉大ですし、この望みをかなえられるのはあなただけだからです」
answered the Lion.	とライオンは答えました。
The Ball of Fire burned fiercely for a time, and the voice said,	火の玉はしばし強烈に燃え上がり、そして声がこう言いました。
"Bring me proof that the Wicked Witch is dead,	「西の邪悪な魔女が死んだという証拠を持ってきなさい。
and that moment I will give you courage.	そうしたら一瞬で勇気をあげます。
But as long as the Witch lives, you must remain a coward."	でも魔女が生き続ける限り、おまえも臆病なままです」
The Lion was angry at this speech, but could say nothing in reply, and while he stood silently gazing at the Ball of Fire it became so furiously hot that he turned tail and rushed from the room.	ライオンはそう言われて腹がたちましたが、何も返答できず、だまって火の玉を見つめているうちにそれがとんでもなく熱くなってたので、しっぽを巻いて部屋から逃げ出しました。
He was glad to find his friends waiting for him, and told them of his terrible interview with the Wizard.	すると友人たちが待っていてくれたのでうれしく思いまして、この魔法使いとの恐ろしい面談の話を聞かせました。
"What shall we do now?"	「じゃあどうしましょう？」
asked Dorothy sadly.	とドロシーが悲しそうにたずねました。
"There is only one thing we can do,"	「できることは一つしかない」
returned the Lion,	とライオンが答えます。
"and that is to go to the land of the Winkies, seek out the Wicked Witch, and destroy her."	「それはウィンキーたちの国に行って、邪悪な魔女を探し出して倒すことだ」
"But suppose we cannot?"	「でもできなかったら？」
said the girl.	と少女。
"Then I shall never have courage,"	「そうしたらわたしは決して勇気をもてないだろう」
declared the Lion.	とライオンが宣言しました。
"And I shall never have brains,"	「そしてぼくは決して脳みそをもてない」
added the Scarecrow.	とかかしが言い足します。
"And I shall never have a heart,"	「そしてわたしは決して心を持てない」
spoke the Tin of Woodman.	とブリキの木こり。
"And I shall never see Aunt Em and Uncle Henry,"	「そしてあたしは二度とエムおばさんやヘンリーおじさんに会えないのね」
said Dorothy, beginning to cry.	と言ってドロシーは泣き出しました。
"Be careful!"	緑の少女が叫びました。
cried the green girl.	「気をつけて！
"The tears will fall on your green silk gown and spot it."	涙がその緑の絹のガウンに落ちたらしみになりますよ」
So Dorothy dried her eyes and said,	そこでドロシーは涙をふいて言いました。
"I suppose we must try it;	「やるしかないようね。
but I am sure I do not want to kill anybody, even to see Aunt Em again."	でもあたしは絶対にだれも殺したくないのよ、エムおばさんにまた会うためとはいえ」
"I will go with you;	「わたしもいっしょに行こう。
but I'm too much of a coward to kill the Witch,"	でも臆病すぎて魔女を殺せないだろうが」
said the Lion.	とライオン。
"I will go too,"	「ぼくも行くよ」
declared the Scarecrow;	とかかしが宣言します。
"but I shall not be of much help to you, I am such a fool."	「でもあまり役には立てないだろうなあ、こんなにバカだから」
"I haven't the heart to harm even a Witch,"	「わたしは魔女を殺せるほどの心臓すらないんだよ」
remarked the Tin Woodman;	とブリキの木こりが言います。
"but if you go I certainly shall go with you."	「でもきみが行くなら、わたしも是非とも行こう」
Therefore it was decided to start upon their journey the next morning, and the Woodman sharpened his axe on a green grindstone and had all his joints properly oiled.	そういうわけで、翌朝出発することに決めまして、木こりは緑の砥石で斧を研いで、間接に全部きちんと油をさしました。
The Scarecrow stuffed himself with fresh straw and Dorothy put new paint on his eyes that he might see better.	かかしは新鮮なわらを詰め直し、ドロシーが目をきれいに描き直してもっとよく見えるようにしてあげました。
The green girl, who was very kind to them, filled Dorothy's basket with good things to eat, and fastened a little bell around Toto's neck with a green ribbon.	みんなにとても親切だった緑の少女は、ドロシーのバスケットにおいしい食べ物をたくさん詰めてくれて、トトの首に緑のリボンで小さな鈴をつけてくれました。
They went to bed quite early and slept soundly until daylight, when they were awakened by the crowing of a green cock that lived in the back yard of the Palace, and the cackling of a hen that had laid a green egg.	みんなずいぶん早く寝て、日が昇るまでぐっすり眠りましたが、宮殿の裏にすむ緑のオンドリのときの声と、緑の卵を産んだめんどりのコッコという鳴き声で目が覚めました。
12.  The Search for the Wicked Witch	12　邪悪な魔女をさがして
The soldier with the green whiskers led them through the streets of the Emerald City until they reached the room where the Guardian of the Gates lived.	緑のひげをはやした兵隊は、エメラルドの都の通りを案内して、一同は門の守備兵の住む部屋にやってきました。
This officer unlocked their spectacles to put them back in his great box, and then he politely opened the gate for our friends.	この係官はみんなのめがねの鍵をはずし、大きな箱に戻すと、礼儀正しくわれらが友人たちのために門を開けてくれました。
"Which road leads to the Wicked Witch of the West?"	「西の邪悪な魔女のところに行く道はどれですか？」
asked Dorothy.	とドロシーがたずねました。
"There is no road,"	「そんな道はないな。
answered the Guardian of the Gates.	そっちの方に行きたがる人はだれもおらんから」
"No one ever wishes to go that way."	と門の守備兵が答えました。
"How, then, are we to find her?"	「じゃあどうやって魔女をさがせというの？」
inquired the girl.	少女は問い詰めます。
"That will be easy,"	「それなら簡単だ。
