for it could not cut me.	ブリキは斧で切れませんから。
There was only one danger--that my joints would rust;	危険は一つだけ――関節がさびることです。
but I kept an oil-can in my cottage and took care to oil myself whenever I needed it.	でも小屋に油のカンを置いて、必要ならいつでも自分の手入れをしていました。
However, there came a day when I forgot to do this, and, being caught in a rainstorm, before I thought of the danger my joints had rusted, and I was left to stand in the woods until you came to help me.	ところが、ある日これを忘れてしまい、夕立につかまって、しまったと思う間もなく関節がさびついて、そのまま森の中に立っていたところへあなたたちがきて助けてくれたわけです。
It was a terrible thing to undergo, but during the year I stood there I had time to think that the greatest loss I had known was the loss of my heart.	ひどい経験でしたが、その間にいろいろ考えて、なくしたものの中でいちばん大きかったのは、心をなくしたことだなあ、と思ったんですよ。
While I was in love I was the happiest man on earth;	恋をしているときには、この世でいちばんの幸せ者でした。
but no one can love who has not a heart,	でも、心がない人なんかだれも愛してくれません。
and so I am resolved to ask Oz to give me one.	だから、オズに心をくれるよう是非ともお願いするんです。
If he does, I will go back to the Munchkin maiden and marry her."	もらえたら、あのマンチキン娘のところへいって、結婚するつもりです」
Both Dorothy and the Scarecrow had been greatly interested in the story of the Tin Woodman, and now they knew why he was so anxious to get a new heart.	ドロシーもかかしも、ブリキの木こりのお話にとても感心しましたし、これでなぜあんなに心をほしがるのかもわかりました。
"All the same,"	「それでも、ぼくは心より脳みそをお願いするな。
said the Scarecrow,	心があっても、バカはそれをどう使うかわからないだろうから」
"I shall ask for brains instead of a heart; for a fool would not know what to do with a heart if he had one."	とかかしが言います。
"I shall take the heart,"	ブリキの木こりは言い返しました。
returned the Tin Woodman;	「わたしは心をとりますね。
"for brains do not make one happy,	脳みそでは幸せになれません。
and happiness is the best thing in the world."	この世でいちばん大事なのは幸せなんですから」
Dorothy did not say anything,	ドロシーは何も言いませんでした。
for she was puzzled to know which of her two friends was right, and she decided if she could only get back to Kansas and Aunt Em, it did not matter so much whether the Woodman had no brains and the Scarecrow no heart, or each got what he wanted.	というのも、友だち二人のどっちが正しいのかわかりかねたし、それに自分はカンザスのエムおばさんのところに帰りさえすれば、木こりに脳がなくてもかかしに心がなくても、あるいは二人が望み通りのものを手に入れても、あまり関係ないわと思ったからです。
What worried her most was that the bread was nearly gone,	いちばん心配だったのは、パンがほとんどなくなりかけているということでした。
and another meal for herself and Toto would empty the basket.	トトと自分があと一回ご飯をたべたら、バスケットは空になってしまいます。
To be sure neither the Woodman nor the Scarecrow ever ate anything, but she was not made of tin nor straw, and could not live unless she was fed.	確かに木こりもかかしも何も食べませんが、ドロシーはブリキやわらではできていないし、食べ物を食べないと生きられません。
6.  The Cowardly Lion	6　臆病ライオン
All this time Dorothy and her companions had been walking through the thick woods.	いままでずっと、ドロシーとその仲間たちは深い森の中を歩いていました。
The road was still paved with yellow brick, but these were much covered by dried branches and dead leaves from the trees, and the walking was not at all good.	道はまだ黄色いれんがが敷かれていましたが、木の枯れ枝や落ち葉でかなりおおわれていて、歩くのもずいぶんと苦労します。
There were few birds in this part of the forest,	森のこのあたりには鳥がほとんどおりません。
for birds love the open country where there is plenty of sunshine.	鳥はお日様のいっぱい当たる、開けた場所が好きなのです。
But now and then there came a deep growl from some wild animal hidden among the trees.	でもときどき、木の間にかくれている野生の動物がたてる深いうなり声が聞こえてきました。
These sounds made the little girl's heart beat fast,	そういう音は、少女の心臓をどきどきさせました。
for she did not know what made them;	どんな動物がその音をたてているかわからなかったからです。
but Toto knew, and he walked close to Dorothy's side, and did not even bark in return.	でもトトにはわかりましたので、ドロシーのとなりにぴったりくっついて、吠え返したりもしませんでした。
"How long will it be,"	「森から出るまでにあとどのくらい？」
the child asked of the Tin Woodman,	と子供はブリキの木こりにたずねます。
"I cannot tell,"	「わかりません」
was the answer,	というのが答えでした。
"for I have never been to the Emerald City.	「わたしはエメラルドの都に行ったことがありませんから。
But my father went there once, when I was a boy, and he said it was a long journey through a dangerous country,	でもお父さんが昔、わたしが子供の頃にでかけて、危険な国を通り抜ける長旅だったと言っていましたよ。
although nearer to the city where Oz dwells the country is beautiful.	でもオズの住む都の近くになるときれいだとのことです。
But I am not afraid so long as I have my oil-can, and nothing can hurt the Scarecrow,	でも、油のカンがある限りわたしはこわいものなしですし、だれもかかしにはけがをさせられません。
while you bear upon your forehead the mark of the Good Witch's kiss, and that will protect you from harm."	あなたはおでこによい魔女のキスのしるしをつけているので、害から守ってもらえますよ」
"But Toto!"	「でもトトは？
said the girl anxiously.	トトは何が守ってくれるの？」
"What will protect him?"	と少女は心配そうに言いました。
"We must protect him ourselves if he is in danger,"	「トトが危険にあったら、わたしたちが守ってあげないといけませんね」
replied the Tin Woodman.	とブリキの木こりが答えました。
Just as he spoke there came from the forest a terrible roar, and the next moment a great Lion bounded into the road.	そう言ったそのとき、森からおそろしい吠え声が聞こえて、次の瞬間に大きなライオンが道に飛び出してきました。
With one blow of his paw he sent the Scarecrow spinning over and over to the edge of the road,	前足の一撃で、かかしはクルクルとふっとんで道の端に転がりました。
and then he struck at the Tin Woodman with his sharp claws.	それから鋭い爪をブリキの木こりに向かって振るいました。
But, to the Lion's surprise, he could make no impression on the tin, although the Woodman fell over in the road and lay still.	でもブリキには何の跡もつかず、木こりが道に倒れて動かなくなっただけだったので、ライオンはおどろきました。
Little Toto, now that he had an enemy to face, ran barking toward the Lion,	小さなトトは、いまや直面すべき敵ができたので、吠えながらライオンにむかっていきました。
and the great beast had opened his mouth to bite the dog, when Dorothy, fearing Toto would be killed, and heedless of danger, rushed forward and slapped the Lion upon his nose as hard as she could, while she cried out:	そして大きな獣が口をあけて犬にかみつこうとしたとき、ドロシーはトトが殺されるのではないかとおびえて、危険もかえりみずに進み出ると、ライオンの鼻づらを思いっきりひっぱたいてこう叫びました。
"Don't you dare to bite Toto!	「トトをかんだら承知しないから！
You ought to be ashamed of yourself, a big beast like you, to bite a poor little dog!"	恥を知りなさい、あなたみたいな大きな獣が、小さいあわれな犬をかむなんて！」
"I didn't bite him,"	「かんでないよう」
said the Lion, as he rubbed his nose with his paw where Dorothy had hit it.	とライオンは、ドロシーにぶたれた鼻を前足でさすりました。
"No, but you tried to,"	「でもかもうとしたでしょう。
she retorted.	からだは大きいくせに、臆病ものね」
"You are nothing but a big coward."	とドロシーは言い返します。
"I know it,"	「やっぱりそうか」
said the Lion, hanging his head in shame.	とライオンは、恥ずかしそうに頭をたれました。
"I've always known it.	「やっぱりね。
But how can I help it?"	でもどうしようもないでしょうに」
"I don't know, I'm sure.	「そんなの知らないわよ、まったく。
To think of your striking a stuffed man, like the poor Scarecrow!"	あんなわらをつめた、あわれなかかしみたいな人を叩くなんて！」
"Is he stuffed?"	「わらがつまってるの？」
asked the Lion in surprise, as he watched her pick up the Scarecrow and set him upon his feet, while she patted him into shape again.	とライオンはおどろいて言いながら、ドロシーがかかしを助け起こして立たせる、ポンポンと叩いて形を整えるのを見つめました。
"Of course he's stuffed,"	「決まってるでしょう」
replied Dorothy, who was still angry.	ドロシーはまだ怒っています。
"That's why he went over so easily,"	「それであんなにかんたんに倒れたのか。
remarked the Lion.	あんなにコロコロころがっていったんで驚いたよ。
"It astonished me to see him whirl around so.	もう一人もわら入りかい？」
Is the other one stuffed also?"	とライオン。
"No,"	「いいえ。
"he's made of tin."	ブリキ製よ」
And she helped the Woodman up again.	とドロシーは木こりも助け起こします。
"That's why he nearly blunted my claws,"	「それで爪がなまくらになりかけたのか。
"When they scratched against the tin it made a cold shiver run down my back.	爪がブリキをひっかいたときには、背筋がゾーッとしたよ。
What is that little animal you are so tender of?"	それとそのかわいがってる小さな動物は何？」
"He is my dog, Toto,"	「あたしの犬のトトよ」
answered Dorothy.	とドロシー。
"Is he made of tin, or stuffed?"	「それもブリキかわらなの？」
asked the Lion.	とライオンがききます。
"Neither.	「いいえ、どっちでもないわ。
He's a--a--a meat dog,"	トトは……えーと……肉の犬よ」
said the girl.	と少女は言いました。
"Oh!	「ふーん、
He's a curious animal and seems remarkably small, now that I look at him.	おもしろい動物だね、それにこうしてみるとえらく小さいや。
No one would think of biting such a little thing, except a coward like me,"	わたしみたいな臆病者でもなければ、こんな小さな動物をかもうとはしないでしょう」
continued the Lion sadly.	とライオンは悲しそうに続けます。
"What makes you a coward?"	「どうしてそんなに臆病なの？」
asked Dorothy, looking at the great beast in wonder,	とドロシーは、不思議そうに巨大な獣を見つめました。
for he was as big as a small horse.	というのも子馬くらいの大きさがある動物だったからです。
"It's a mystery,"	ライオンは答えました。
replied the Lion.	「それはわからない。
"I suppose I was born that way.	生まれつきそうだったんでしょう。
All the other animals in the forest naturally expect me to be brave, for the Lion is everywhere thought to be the King of Beasts.	森の他の動物たちは、当然わたしが勇敢なものと思ってるんだよ、というのもライオンはどこでも百獣の王だと思われてるからね。
I learned that if I roared very loudly every living thing was frightened and got out of my way.	思いっきり吠えれば、他の生き物はみんなこわがって逃げ出すことがわかった。
Whenever I've met a man I've been awfully scared; but I just roared at him, and he has always run away as fast as he could go.	人間に会うと、いつもすごく怖くなるんだが、吠えるだけでみんな全速力で逃げ出す。
If the elephants and the tigers and the bears had ever tried to fight me, I should have run myself--I'm such a coward;	ゾウやトラやクマがわたしに刃向かおうとしたら、わたしも逃げ出すだろう――すごく臆病なんだよ。
but just as soon as they hear me roar they all try to get away from me, and of course I let them go."	でもみんな、わたしが吠えるのを聞いたとたん、逃げだそうとするし、わたしももちろんそれを見逃すんだ」
"But that isn't right.	「でもそんなばかな。
The King of Beasts shouldn't be a coward,"	百獣の王が臆病だなんて」
said the Scarecrow.	とかかし。
"I know it,"	「そうなんだよ」
returned the Lion, wiping a tear from his eye with the tip of his tail.	とライオンは答えて、しっぽの先で目から涙をぬぐいました。
"It is my great sorrow, and makes my life very unhappy.	「それがわたしの大いなる悲劇で、おかげでとても不幸せな一生なんだよ。
But whenever there is danger, my heart begins to beat fast."	でも危険に出会うたびに、胸がどきどきしてしまうんだ」
"Perhaps you have heart disease,"	「心臓の病気かも知れませんよ」
said the Tin Woodman.	とブリキの木こり。
"It may be,"	「そうかもしれない」
said the Lion.	とライオン。
"If you have,"	「でももしそうなら、ありがたく思わなくっちゃ。
continued the Tin Woodman,	心があることが証明されたんですからね。
"you ought to be glad, for it proves you have a heart.	わたしはといえば、心がないから、心臓病にもなれないんですよ」
For my part, I have no heart; so I cannot have heart disease."	とブリキの木こりは続けました。
"Perhaps,"	「うーむ。
said the Lion thoughtfully,	心がなければ臆病者にならずにすむかもしれない」
"if I had no heart I should not be a coward."	とライオンは考えこみます。
"Have you brains?"	「脳みそは持ってるの？」
asked the Scarecrow.	とかかし。
"I suppose so.	「たぶんあるだろう。
I've never looked to see,"	調べたことはない」
replied the Lion.	とライオン。
"I am going to the Great Oz to ask him to give me some,"	「ぼくはえらいオズのところへいって、脳みそを少しくれるよう頼むんだ。
remarked the Scarecrow,	ぼくの頭はわらがつまってるから」
"for my head is stuffed with straw."	とかかしは言いました。
"And I am going to ask him to give me a heart,"	「そしてわたしは心をくれるよう頼むんだ」
said the Woodman.	と木こり。
"And I am going to ask him to send Toto and me back to Kansas,"	「そしてあたしは、トトといっしょにカンザスへ返してくれるよう頼むの」
added Dorothy.	とドロシーがつけ加えます。
"Do you think Oz could give me courage?"	「オズはわたしに勇気をくれると思うかい？」
asked the Cowardly Lion.	と臆病ライオンはたずねました。
"Just as easily as he could give me brains,"	「ぼくに脳みそをくれるくらい楽にね」
said the Scarecrow.	とかかし。
"Or give me a heart,"	「あるいはわたしに心をくれるくらい楽に」
said the Tin Woodman.	とブリキの木こり。
"Or send me back to Kansas,"	「それかあたしをカンザスに送り返すくらい楽に」
said Dorothy.	とドロシー。
"Then, if you don't mind, I'll go with you,"	「それなら、もしよければ、いっしょに行かせてもらおう」
said the Lion,	とライオン。
"for my life is simply unbearable without a bit of courage."	「多少の勇気がないと人生が耐え難いんだよ」
"You will be very welcome," answered Dorothy, "for you will help to keep away the other wild beasts.	「大歓迎よ、あなたがいれば、ほかの獣がよってこないもの。
It seems to me they must be more cowardly than you are if they allow you to scare them so easily."	あなたを見てそんなにすぐに怯えるなら、他の動物たちのほうがずっと臆病なんじゃないかと思うんだけど」
"They really are,"	「いやその通りなんだよ。
said the Lion,	でもそれでわたしが勇敢になるわけじゃないし、自分が臆病だと知っている限りは不幸なんだ」
"but that doesn't make me any braver, and as long as I know myself to be a coward I shall be unhappy."	とライオン。
So once more the little company set off upon the journey, the Lion walking with stately strides at Dorothy's side.	そこで一行は旅に出発いたしまして、ライオンは堂々たる歩みでドロシーの横を歩きました。
Toto did not approve this new comrade at first,	トトはこの新しい仲間を最初は認めておりませんでした。
for he could not forget how nearly he had been crushed between the Lion's great jaws.	というのも、ライオンの大きなあごでかみくだかれそうになったのを忘れてはいなかったからです。
But after a time he became more at ease, and presently Toto and the Cowardly Lion had grown to be good friends.	でもやがてもっとうちとけるようになり、すぐにトトと臆病ライオンはよい友だちになりました。
During the rest of that day there was no other adventure to mar the peace of their journey.	その日はもうそれ以上は、一行の平穏を乱すような冒険はありませんでした。
Once, indeed, the Tin Woodman stepped upon a beetle that was crawling along the road, and killed the poor little thing.	まあ一度だけ、ブリキの木こりが道を這っているカナブンをふんづけて、かわいそうな虫を殺してしまったことはありました。
This made the Tin Woodman very unhappy,	おかげでブリキの木こりはとても悲しくなりました。
for he was always careful not to hurt any living creature;	いつも生き物を傷つけないように注意していたからです。
and as he walked along he wept several tears of sorrow and regret.	だから歩きながら、悲しみと後悔の涙を流しました。
These tears ran slowly down his face and over the hinges of his jaw, and there they rusted.	涙はゆっくりと顔をつたい、あごのちょうつがいにかかり、さびさせてしまいました。
When Dorothy presently asked him a question the Tin Woodman could not open his mouth, for his jaws were tightly rusted together.	やがてドロシーが質問をしたときにも、あごがしっかりとさびついてしまって口が開けません。
He became greatly frightened at this and made many motions to Dorothy to relieve him, but she could not understand.	木こりはとてもこわくなって、ドロシーになんとかしてくれと身振りで伝えましたが、わかってもらえませんでした。
The Lion was also puzzled to know what was wrong.	ライオンもまた、どうしたのか知りたがりました。
But the Scarecrow seized the oil-can from Dorothy's basket and oiled the Woodman's jaws, so that after a few moments he could talk as well as before.	でもかかしが油のカンをドロシーのバスケットから取り出して、木こりのアゴに油を差し、まもなく木こりはまたしゃべれるようになりました。
"This will serve me a lesson,"	「これでいい勉強になりましたよ。
said he,	ちゃんと足下に注意しないといけませんね。
"to look where I step.	今度ムシやカナブンを殺したら、絶対にまた泣いてしまうし、泣くとアゴがさびて口がきけなくなってしまいます」
For if I should kill another bug or beetle I should surely cry again, and crying rusts my jaws so that I cannot speak."	と木こりは言いました。
Thereafter he walked very carefully, with his eyes on the road, and when he saw a tiny ant toiling by he would step over it, so as not to harm it.	それからというもの、木こりはとても気をつけて、道をしっかり見ながら歩きまして、小さなアリがいっしょうけんめい歩いているときにもちゃんと上を乗りこえて、傷つけないようにしました。
The Tin Woodman knew very well he had no heart, and therefore he took great care never to be cruel or unkind to anything.	ブリキの木こりは自分に心がないのをよく知っていましたから、他のものに残酷なことをしたり、不親切なことをしたりしないように気をくばっていたのです。
"You people with hearts,"	木こりはこう言うのでした。
he said,	「きみたち心ある人々は、
"have something to guide you, and need never do wrong;	導いてくれるものがあるんだから、まちがったことなんかすることもないでしょう。
but I have no heart, and so I must be very careful.	でもわたしは心がないのだから、とても気をつけないと。
When Oz gives me a heart of course I needn't mind so much."	オズが心をくれたら、こんなに気をつけなくてもいいはずですが」
7.  The Journey to the Great Oz	7　えらいオズへの旅
They were obliged to camp out that night under a large tree in the forest,	その夜は、森の大きな木の下で野宿をするしかありませんでした。
for there were no houses near.	近くには家がなかったのです。
The tree made a good, thick covering to protect them from the dew, and the Tin Woodman chopped a great pile of wood with his axe and Dorothy built a splendid fire that warmed her and made her feel less lonely.	その木は夜露から守ってくれるすぐれた分厚い覆いとなりましたし、ブリキの木こりは斧でたくさん薪を切り倒したので、ドロシーはすばらしいたき火をたいて暖まり、さびしさもまぎれました。
She and Toto ate the last of their bread, and now she did not know what they would do for breakfast.	トトといっしょに最後のパンを食べてしまい、朝ご飯はどうしたらいいのかわかりませんでした。
"If you wish," said the Lion, "I will go into the forest and kill a deer for you.	「なんだったら、森にいってシカを殺してきてあげよう。
You can roast it by the fire,	火で焼くといい。
since your tastes are so peculiar that you prefer cooked food,	きみの舌はずいぶん奇妙だから、料理した食べ物のほうがいいんだろうからね。
and then you will have a very good breakfast."	そうすればとてもおいしい朝ご飯になる」
"Don't!	「やめてください！
Please don't,"	お願いですから」
begged the Tin Woodman.	とブリキの木こりが必死で頼みました。
"I should certainly weep if you killed a poor deer, and then my jaws would rust again."	「あなたがかわいそうなシカを殺したら、わたしはまちがいなく泣いてしまうし、そうしたらまたアゴがさびてしまう」
But the Lion went away into the forest and found his own supper, and no one ever knew what it was,	でもライオンは森の中にでかけて自分の晩ご飯を見つけ、それがなんだかだれにもわかりませんでした。
for he didn't mention it.	というのも、ライオンが話さなかったからです。
And the Scarecrow found a tree full of nuts and filled Dorothy's basket with them, so that she would not be hungry for a long time.	そしてかかしはナッツでいっぱいの木を見つけて、それをドロシーのバスケットに詰めましたから、ドロシーは当分おなかがすかなくてすむようになりました。
She thought this was very kind and thoughtful of the Scarecrow, but she laughed heartily at the awkward way in which the poor creature picked up the nuts.	ドロシーは、かかしがとても親切でよく気がつくと思いましたが、かわいそうなかかしがナッツを拾い上げる様子がぶきっちょだったので、心底笑ってしまいました。
His padded hands were so clumsy and the nuts were so small that he dropped almost as many as he put in the basket.	詰め物の手はとても不器用で、ナッツはあまりに小さくて、バスケットに入れるのと同じくらいこぼしています。
