For a day and a night I traveled through the air, and on the morning of the second day I awoke and found the balloon floating over a strange and beautiful country.	丸一昼夜も空中を旅して、二日目の朝に目を覚ますと、気球は見慣れない美しい国の上をただよっていたんじゃ。
"It came down gradually, and I was not hurt a bit.	気球はだんだんおりてきたので、わしは怪我一つなかった。
But I found myself in the midst of a strange people, who, seeing me come from the clouds, thought I was a great Wizard.	でもまわりは見慣れぬ人ばかりで、その人たちは雲からおりてきたわしを見て、大魔法使いだと思ったんじゃよ。
Of course I let them think so,	もちろん、わしはその誤解をといたりはしなかった。
because they were afraid of me, and promised to do anything I wished them to.	みんなわしを恐れて、こちらの望みを何でもかなえると約束してくれたもんでな。
"Just to amuse myself, and keep the good people busy, I ordered them to build this City, and my Palace;	単なる座興と、善良な人々を手持ちぶさたにしないために、わしはみんなにこの都と宮殿を造るように命じたんじゃ。
and they did it all willingly and well.	みんな喜んで立派に仕上げてくれたよ。
Then I thought, as the country was so green and beautiful, I would call it the Emerald City;	そしてわしは、この国が緑にあふれて美しいので、エメラルドの都と呼ぼうと考えた。
and to make the name fit better I put green spectacles on all the people, so that everything they saw was green."	そしてその名前にもっとふさわしいように、みんなに緑のメガネをかけさせたので、見たものがすべて緑色に見えるようになったわけだ」
"But isn't everything here green?"	「でもここでは何でも緑色じゃないんですか？」
asked Dorothy.	とドロシーがたずねました。
"No more than in any other city,"	「いやいや、他の都市と同じだよ」
replied Oz;	とオズ。
"but when you wear green spectacles, why of course everything you see looks green to you.	「でも緑のめがねをかけたら、まあもちろん目に入るものはなんでも緑色に見えるわな。
The Emerald City was built a great many years ago, for I was a young man when the balloon brought me here, and I am a very old man now.	エメラルドの都はもう何年も前に建てられたんだよ、わしが風船に運ばれてきたときには若者だったし、いまやもう老人だ。
But my people have worn green glasses on their eyes so long that most of them think it really is an Emerald City, and it certainly is a beautiful place, abounding in jewels and precious metals, and every good thing that is needed to make one happy.	でもここの人々はもう長いこと緑のめがねをかけているので、ほとんどの人は本当にここがエメラルドの都だと思っているし、確かにここは美しい場所で、宝石や貴金属もたくさんあって、人を幸せにするよいものならなんでもある。
I have been good to the people, and they like me;	わしは人々によくしてきたし、みんなわしが好きじゃ。
but ever since this Palace was built, I have shut myself up and would not see any of them.	でもこの宮殿ができてからというもの、わしは閉じこもってだれにも会っていない。
"One of my greatest fears was the Witches,	わしがとてもおそれていたのが魔女たちだ。
for while I had no magical powers at all I soon found out that the Witches were really able to do wonderful things.	わしは何の魔力も持ってはいないが、魔女たちは本当に不思議なことができるのだということがやがてわかったからな。
There were four of them in this country, and they ruled the people who live in the North and South and East and West.	この国には四人の魔女がおり、それぞれ東西南北に住む人々を支配しておる。
Fortunately, the Witches of the North and South were good, and I knew they would do me no harm;	ありがたいことに、北と南の魔女たちはよい魔女だし、わしに危害を加えないのもわかっとった。
but the Witches of the East and West were terribly wicked, and had they not thought I was more powerful than they themselves, they would surely have destroyed me.	だが東と西の魔女はとんでもなく邪悪で、わしが自分たちより強力だと思わなければ、まちがいなくわしを倒しただろう。
As it was, I lived in deadly fear of them for many years;	そんなわけで、わしは何年もびくびくしながら暮らしておった。
so you can imagine how pleased I was when I heard your house had fallen on the Wicked Witch of the East.	だからあんたの家が東の邪悪な魔女の上に落っこちたときいて、わしはどんなにうれしかったかわかるじゃろ。
When you came to me, I was willing to promise anything if you would only do away with the other Witch;	あんたがここへきたとき、わしはもう片方の魔女さえかたづけてくれればどんな約束でもするつもりだった。
but, now that you have melted her, I am ashamed to say that I cannot keep my promises."	でもあんたが西の魔女をとかしたいま、恥ずかしながら約束は果たせんのだよ」
"I think you are a very bad man,"	「あなたはとても悪い人だと思うわ」
said Dorothy.	とドロシー。
"Oh, no, my dear;	「いやいやおじょうちゃん。
I'm really a very good man,	わしはとても善人だよ。
but I'm a very bad Wizard, I must admit."	ただダメな魔術師ではあることは認めねばならんな」
"Can't you give me brains?"	「ぼくに脳をくれることはできないんですか？」
asked the Scarecrow.	とかかしがたずねました。
"You don't need them.	「そんなものいらんよ。
You are learning something every day.	あんたは毎日何かを学んでおる。
A baby has brains, but it doesn't know much.	赤ん坊は脳みそを持っているが、大してものを知らん。
Experience is the only thing that brings knowledge, and the longer you are on earth the more experience you are sure to get."	知識をもたらすのは経験だけだし、この世にいれば経験は確実に手に入る」
"That may all be true,"	「それはその通りかもしれないけれど、
said the Scarecrow,	でもあんたが脳みそをくれるまでぼくは不満だな」
"but I shall be very unhappy unless you give me brains."	とかかし。
The false Wizard looked at him carefully.	にせ魔法使いは、じっくりとかかしをながめました。
"Well,"	「ふむ」
he said with a sigh,	とオズはため息をつきながら言いました。
"I'm not much of a magician, as I said;	「わしは言ったとおり、大した魔術師ではない。
but if you will come to me tomorrow morning, I will stuff your head with brains.	でも明日の朝にここにきたら、あんたの頭に脳みそをつめてやろう。
I cannot tell you how to use them, however;	でもその使い方は教えられんぞ。
you must find that out for yourself."	それは自分で見つけるしかない」
"Oh, thank you--thank you!"	「ああ、ありがとう――ありがとうございます！」
cried the Scarecrow.	とかかしは叫びました。
"I'll find a way to use them, never fear!"	「使い方なら見つけますとも、ご心配なく！」
"But how about my courage?"	「でもわたしの勇気はどうなる？」
asked the Lion anxiously.	とライオンは不安そうにたずねます。
"You have plenty of courage, I am sure,"	「勇気ならたっぷりお持ちだよ、まちがいなく」
answered Oz.	とオズは答えました。
"All you need is confidence in yourself.	「あとは自信を持てばいいだけのことだ。
There is no living thing that is not afraid when it faces danger.	危険に直面したときにこわがらない生き物なんかいやしない。
The True courage is in facing danger when you are afraid,	本当の勇気とは、こわくても危険に立ち向かうということなんだよ。
and that kind of courage you have in plenty."	そういう勇気なら、あんたはたっぷり持ってるじゃないか」
"Perhaps I have, but I'm scared just the same,"	「そうかもしれないが、それでもやっぱりこわいんだよ。
said the Lion.	自分がこわいことを忘れられるような勇気をもらわないかぎり、わたしも大いに不満だぞ」
"I shall really be very unhappy unless you give me the sort of courage that makes one forget he is afraid."	とライオン。
"Very well,	「しょうがない。
I will give you that sort of courage tomorrow,"	では明日、その手の勇気をあげよう」
replied Oz.	とオズが答えます。
"How about my heart?"	「わたしの心は？」
asked the Tin Woodman.	とブリキの木こり。
"Why, as for that,"	「なんと、それはだな、
answered Oz,	心をほしがるほうがまちがっとると思うぞ。
"I think you are wrong to want a heart.	ほとんどの人は心のおかげで不幸になっとる。
It makes most people unhappy.	それを知ってれば、心がなくて運がいいのもわかる」
If you only knew it, you are in luck not to have a heart."	とオズ。
"That must be a matter of opinion,"	「それは人それぞれの意見ってやつでしょう」
said the Tin Woodman.	とブリキの木こり。
"For my part, I will bear all the unhappiness without a murmur, if you will give me the heart."	「わたしはといえば、心さえもらえたら不幸なんかいくらでも文句をいわずに耐えましょう」
"Very well,"	「しょうがない」
answered Oz meekly.	とオズは弱々しそうにいいました。
"Come to me tomorrow	「明日おいで。
and you shall have a heart.	そうしたら心をあげる。
I have played Wizard for so many years that I may as well continue the part a little longer."	もう何年も魔法使いを演じてきたんだから、もう少し続けることにしようかね」
"And now,"	「そしてあたしはどうやってカンザスに帰れるの？」
said Dorothy,	とドロシー。
"We shall have to think about that,"	「それはちょっと考えてみないとな」
replied the little man.	と小男は答えました。
"Give me two or three days to consider the matter	「二三日考えさせとくれ。
and I'll try to find a way to carry you over the desert.	なんとか砂漠をこえてあんたを運ぶ手を考えてみよう。
In the meantime you shall all be treated as my guests, and while you live in the Palace my people will wait upon you and obey your slightest wish. a	その間、あんたたちはわしのお客として扱われ、この宮殿に暮らす間はわが臣民たちがあんたたちに仕え、どんな望みにでもしたがってくれる。
There is only one thing I ask in return for my help--such as it is.	この手助けのかわりとしてわしがお願いするのはただ一つ――こんなざまなもんでな。
You must keep my secret and tell no one I am a humbug."	わしの秘密を守って、ペテン師だとだれにもいわないでほしい」
They agreed to say nothing of what they had learned, and went back to their rooms in high spirits.	みんな、ここで知ったことを何も言わないことに同意して、期待に胸をおどらせて部屋に戻りました。
Even Dorothy had hope that "The Great and Terrible Humbug," as she called him, would find a way to send her back to Kansas, and if he did she was willing to forgive him everything.	ドロシーですら、彼女の呼ぶ「ひどい大ペテン師」が自分をカンザスに送り返す方法を見つけてくれるという希望をいだいていましたし、もしそれができれば、すべてを許してあげてもいいと思っていました。
16.  The Magic Art of the Great Humbug	16　大ペテン師の魔術
Next morning the Scarecrow said to his friends:	翌朝、かかしは友人たちにこういいました。
"Congratulate me.	「お祝いしておくれ。
I am going to Oz to get my brains at last.	これからオズのところにいってついに脳みそをもらうんだ。
When I return I shall be as other men are."	戻ってきたら、他の人並みになってるぞ」
"I have always liked you as you were,"	「もともとそのままのあなたが気に入っていたのに」
said Dorothy simply.	とドロシーはあっさりいいました。
"It is kind of you to like a Scarecrow,"	「かかしを気に入ってくれるとはご親切にどうも。
"But surely you will think more of me when you hear the splendid thoughts my new brain is going to turn out."	でも新しい脳みそが生み出すすばらしい考えをきいたら、ぼくにまちがいなく一目おくようになるよ」
Then he said good-bye to them all in a cheerful voice and went to the Throne Room, where he rapped upon the door.	とかかしは言って、みんなに楽しげにさよならを告げると玉座の間にむかい、ドアを叩きました。
"Come in,"	「お入り」
said Oz.	とオズ。
The Scarecrow went in and found the little man sitting down by the window, engaged in deep thought.	かかしが部屋に入ると、小男は窓辺にすわってじっと考えこんでいます。
"I have come for my brains,"	「脳みそをもらいにきましたよ」
remarked the Scarecrow, a little uneasily.	とかかしは、ちょっと不安に思いながらも言いました。
"Oh, yes;	「おおそうだね。
sit down in that chair, please,"	そこの椅子におすわり。
"You must excuse me for taking your head off, but I shall have to do it in order to put your brains in their proper place."	ちょっと失礼してあんたの頭をはずすが、脳をちゃんとした場所に入れるにはこうするしかないもんでな」
"That's all right,"	「かまいませんよ。
said the Scarecrow.	次に取り付けたときにましなものになってるなら、どうぞ頭をはずしてくださいな」
"You are quite welcome to take my head off, as long as it will be a better one when you put it on again."	とかかし。
So the Wizard unfastened his head and emptied out the straw.	そこで魔法使いはかかしの頭をはずし、わらを全部取り出しました。
Then he entered the back room and took up a measure of bran, which he mixed with a great many pins and needles.	そして裏部屋に入ると飼料(しりょう) をいっぱい取り出して、そこにたくさんの針やピンを混ぜました。
Having shaken them together thoroughly, he filled the top of the Scarecrow's head with the mixture and stuffed the rest of the space with straw, to hold it in place.	それをしっかりゆすって混ぜると、かかしの頭のてっぺんにその混ぜものを詰めてから、残りの部分にわらをつめてそれを固定しました。
When he had fastened the Scarecrow's head on his body again he said to him,	かかしの頭を胴体につけなおすと、オズはこう告げました。
"Hereafter you will be a great man, for I have given you a lot of bran-new brains."	「これからあんたは偉大な人物になるぞ、あんたにあげたのは思慮（しりょう）深い脳みそだからな」
The Scarecrow was both pleased and proud at the fulfillment of his greatest wish, and having thanked Oz warmly he went back to his friends.	かかしは最大の望みがかなえられたので嬉しくもあり、誇らしくもありましたので、オズに心から感謝して友だちのところに戻りました。
Dorothy looked at him curiously.	ドロシーはおもろそうにかかしをながめました。
His head was quite bulged out at the top with brains.	頭のてっぺんが脳みそでかなりふくれあがっているのです。
"How do you feel?"	「気分はいかが？」
"I feel wise indeed,"	かかしはまじめそうに答えました。
he answered earnestly.	「実に賢い気分だよ。
"When I get used to my brains I shall know everything."	脳みそになれたらもうなんでもわかるはず」
"Why are those needles and pins sticking out of your head?"	「なんで頭から針やピンが突きだしてるんだい？」
asked the Tin Woodman.	とブリキの木こり。
"That is proof that he is sharp,"	「鋭い頭の証拠だよ」
remarked the Lion.	とライオン。
"Well, I must go to Oz and get my heart,"	「ではわたしもオズに心をもらってこなければ」
said the Woodman.	と木こりは言いました。
So he walked to the Throne Room and knocked at the door.	そして玉座の間に向かうと戸を叩きました。
"Come in,"	「お入り」
called Oz, and the Woodman entered	とオズが呼ぶと木こりは部屋に入って
and said,	「心をもらいにきました」
"I have come for my heart."	と言いました。
"Very well,"	「よかろう」
answered the little man.	と小男。
"But I shall have to cut a hole in your breast, so I can put your heart in the right place.	でも胸を切って穴をあけないと、心をちゃんとした場所に入れられないんだよ。
I hope it won't hurt you."	痛くないといいがな」
"Oh, no,"	「いやいや。
answered the Woodman.	何も感じませんよ」
"I shall not feel it at all."	と木こり。
So Oz brought a pair of tinsmith's shears and cut a small, square hole in the left side of the Tin Woodman's breast.	そこでオズは金切りばさみを取り出して、ブリキの木こりの胸の左側に、小さな四角い穴を開けました。
Then, going to a chest of drawers, he took out a pretty heart,	それからひきだしのついたたんすのところへ行くと、きれいな心を取り出しました。
made entirely of silk and stuffed with sawdust.	それは全部絹でできていて、おがくずがつまっています。
"Isn't it a beauty?"	「なんともきれいじゃないか？」
"It is, indeed!"	木こりはおおいに喜びました。
replied the Woodman, who was greatly pleased.	「ええ、本当にきれいです！
"But is it a kind heart?"	でもやさしい心なんでしょうか？」
"Oh, very!"	「ああそりゃもう！」
answered Oz.	とオズは答えて、
He put the heart in the Woodman's breast and then replaced the square of tin, soldering it neatly together where it had been cut.	心を木こりの胸に入れると、切り抜いたブリキをもとに戻して切り口をきれいにハンダづけしました。
"There,"	「そら。
"now you have a heart that any man might be proud of.	これであんたはだれでも誇りに思うような心の持ち主だ。
I'm sorry I had to put a patch on your breast, but it really couldn't be helped."	胸に継ぎをあてなきゃならなかったのはご愁傷様だが、ほかにどうしようもなくてな」
"Never mind the patch,"	「継ぎはかまいませんよ」
exclaimed the happy Woodman.	と幸せな木こりは叫びました。
"I am very grateful to you, and shall never forget your kindness."	「心から感謝しますよ、ご親切は決して忘れません」
"Don't speak of it,"	「なんのなんの」
replied Oz.	とオズは答えます。
Then the Tin Woodman went back to his friends, who wished him every joy on account of his good fortune.	そしてブリキの木こりは友人たちのもとへと戻り、みんな木こりの幸運を心底喜んであげたのでした。
The Lion now walked to the Throne Room and knocked at the door.	こんどはライオンが玉座の間に向かい、ドアを叩きました。
"Come in,"	「お入り」
said Oz.	とオズ。
"I have come for my courage,"	「勇気をもらいにきましたよ」
announced the Lion, entering the room.	とライオンは部屋を入るなり宣言しました。
"Very well,"	「よろしい。
answered the little man;	あげよう」
"I will get it for you."	と小男は答えます。
He went to a cupboard and reaching up to a high shelf took down a square green bottle, the contents of which he poured into a green-gold dish, beautifully carved.	オズは食器棚へ行くと、高い棚にある四角い緑のびんをおろして、その中身を美しい彫り物のされた緑金色のお皿に注ぎました。
Placing this before the Cowardly Lion, who sniffed at it as if he did not like it, the Wizard said:	それを臆病ライオンの前におくと、ライオンはそれをくんくんかいで気に入らない様子でしたが、魔法使いはこう言いました。
"Drink."	「お飲み」
"What is it?"	「これはなんです？」
asked the Lion.	とライオン。
"Well,"	「うむ。
"if it were inside of you, it would be courage.	あんたの中にあったらこれは勇気になる。
You know, of course, that courage is always inside one;	もちろんご存じの通り、勇気はつねにその人の中にあるんだよ。
so that this really cannot be called courage until you have swallowed it.	だからこれはあんたが飲まないと勇気とはいえない。
Therefore I advise you to drink it as soon as possible."	というわけで、さっさと飲むようにおすすめするぞ」
The Lion hesitated no longer, but drank till the dish was empty.	ライオンはもうためらうことなく、お皿を飲み干しました。
"How do you feel now?"	「気分はどうだね」
asked Oz.	とオズ。
"Full of courage,"	「勇気りんりん」
replied the Lion, who went joyfully back to his friends to tell them of his good fortune.	とライオンは答え、大喜びで友だちのどころに戻って身の幸運を語るのでした。
Oz, left to himself, smiled to think of his success in giving the Scarecrow and the Tin Woodman and the Lion exactly what they thought they wanted.	オズは一人になると、かかしやブリキの木こりやライオンに、ずばり自分たちがほしいと思ったものをあげるのに成功したことを考えてにっこりしました。
"How can I help being a humbug," he said, "when all these people make me do things that everybody knows can't be done?	「こういう連中がみんな、できないとだれでも知ってることをやらせようとするんだから、こっちだってペテン師になるしかないだろうが。
It was easy to make the Scarecrow and the Lion and the Woodman happy,	かかしとライオンと木こりを幸せにするのは簡単だった。
because they imagined I could do anything.	だって、わしが何でもできると思いこんでおったからな。
But it will take more than imagination to carry Dorothy back to Kansas, and I'm sure I don't know how it can be done."	でもドロシーをカンザスに送り返すには、想像力だけじゃ無理だし、どうすればいいのかわからないことしかわからんぞ」
17.  How the Balloon Was Launched	17　とびたつ気球
For three days Dorothy heard nothing from Oz.	三日にわたって、ドロシーにはオズから何の連絡もありません。
These were sad days for the little girl,	少女にとっては悲しい日々でした。
although her friends were all quite happy and contented.	でも友だちはみんな、とっても幸せで満足していました。
The Scarecrow told them there were wonderful thoughts in his head;	かかしは、頭の中にすばらしい考えがわいてくると話します。
but he would not say what they were because he knew no one could understand them but himself.	でも、自分以外にはだれもわからないから、とそれを話してはくれません。
When the Tin Woodman walked about he felt his heart rattling around in his breast;	ブリキの木こりがそこらを歩くと、胸の中で心がガタガタ言っているのが感じられました。
and he told Dorothy he had discovered it to be a kinder and more tender heart than the one he had owned when he was made of flesh.	そして木こりに言わせると、それは木こりが肉だった頃にもっていたものよりも優しく繊細な心なのだそうです。
The Lion declared he was afraid of nothing on earth, and would gladly face an army or a dozen of the fierce Kalidahs.	ライオンはもうこの世の何もこわくなく、どんな軍隊でもおそろしいカリダを一ダースでも喜んで相手にするぞと宣言しました。
Thus each of the little party was satisfied except Dorothy, who longed more than ever to get back to Kansas.	こうして一行のそれぞれは、ドロシー以外みんな満足しておりましたが、ドロシーは前にもましてカンザスに帰りたくてたまりませんでした。
On the fourth day, to her great joy, Oz sent for her,	四日目に、オズがよびにきたのでドロシーは大喜びでした。
and when she entered the Throne Room he greeted her pleasantly:	そして玉座の間に入ると、オズは気持ちよく歓迎してくれました。
"Sit down, my dear;	「おすわり、おじょうちゃん。
I think I have found the way to get you out of this country."	ここから連れ出してあげる方法が見つかったと思うよ」
"And back to Kansas?"	「カンザスに戻れるの？」
she asked eagerly.	ドロシーはわくわくしてたずねました。
