and in less time than five minutes all these dear things were in full bloom.	そして数分もしないうちに、家も庭も花が咲き誇ったのでした。
Oh, how beautiful the little house was now!	まぁ、どれほどその小さな家は美しかったことでしょう！
But it was at last finished true as true,	でもとうとう本当のおしまいです。
and they had to leave it and return to the dance.	妖精たちはその場を離れて、ダンスに戻りました。
They all kissed their hands to it as they went away, and the last to go was Brownie.	去るときは家にむかって投げキッスをして、最後に家を離れるのはブローニーでした。
She stayed a moment behind the others to drop a pleasant dream down the chimney.	ブローニーは、煙突から楽しい夢を投げ込むために、他の妖精たちより少しあとまでとどまっていたのでした。
All through the night the exquisite little house stood there in the Figs taking care of Maimie,	よくできた小さな家はイチジクの森のその場所にマイミーを守るようにして、夜通し立っていました。
and she never knew.	マイミーはまったくそのことを知りませんでした。
She slept until the dream was quite finished and woke feeling deliciously cosy just as morning was breaking from its egg,	マイミーは夢がすっかり終わるまでぐっすり寝ており、まるで朝がたまごから生まれてきたようなとても快適な気分で目をさましました。
and  then she almost fell asleep again,	そしてそれから再び眠くなって、
and then she called out, "Tony,"	「トニー」と声をかけました。
for she thought she was at home in the nursery.	マイミーはすっかり家の子供部屋にいると思い込んでいましたから。
As Tony made no answer, she sat up, whereupon her head hit the roof,	トニーがなんの返事もしないので、マイミーは起き上がると、屋根に頭をぶつけてしまいました。
and it opened like the lid of a box,	すると屋根は箱のふたみたいに開きました。
and to her bewilderment she saw all around her the Kensington Gardens lying deep in snow.	さらにマイミーを驚かせたことに、ケンジントン公園はあたり一面雪景色でした。
As she was not in the nursery she wondered whether this was really herself, so she pinched her cheeks,	マイミーは自分が子供部屋にいないので、本当にこれが夢じゃないかと、自分のほおをつねってみました。
and then she knew it was herself,	そして現実だということがわかりました。
and this reminded her that she was in the middle of a great adventure.	頬をつねって、マイミーがすごい冒険の真っ最中だということも思い出しました。
She remembered now everything that had happened to her from the closing of the gates up to her running away from the fairies,	マイミーは、閉門以降、妖精たちから逃げ出すまでに起こったこと全てを思い出しました。
but however, she asked herself,	でもマイミーは自問自答してみました。
had she got into this funny place?	このすてきな場所にはどうやってはいりこんだのかしら？
She stepped out by the roof, right over the garden, and then she saw the dear house in which she had passed the night.	屋根から外へ、庭の右のあたりにでてみると、一晩をすごしたその素敵な家を見ることができました。
It so entranced her that she could think of nothing else.	あまりに魅力的だったので、他のことはなにも考えられないくらいでした。
"Oh, you darling, oh, you sweet, oh, you love!"	「あらまぁ、素敵、なんてきれいなお家なの！」
she cried.	マイミーはおもわず声をあげました。
Perhaps a human voice frightened the little house, or maybe it now knew that its work was done,	たぶん人の声が小さな家を驚かせたのでしょう、あるいは役目は果たしたと思ったのかもしれません。
for no sooner had Maimie spoken than it began to grow smaller;	マイミーが話しかけると、すぐにその家は小さくなりました。
it shrank so slowly that she could scarce believe it was shrinking,	とてもゆっくり小さくなったので、マイミーには小さくなっているのが信じられませんでした。
yet she soon knew that it could not contain her now.	でもすぐにもう自分が中には入れないことはわかりました。
It always remained as complete as ever, but it became smaller and smaller,	全てが前と同じなのですが、ただだんだん小さくなっていくのです。
and the garden dwindled at the same time,	そして庭も同時にだんだん小さくなるのでした。
and the snow crept closer, lapping house and garden up.	雪がしのびよってきて、家と庭をすっかり包んでしまいました。
Now the house was the size of a little dog's kennel, and now of a Noah's Ark,	もう家は犬小屋と同じ大きさぐらい、そしてノアの箱舟と同じ大きさになりました。
but still you could see the smoke and the door-handle and the roses on the wall, every one complete.	でもまだ煙突の煙やドアの取ってや壁のばらはみることができましたし、全てがそのままでした。
The glow-worm fight was waning too, but it was still there.	ホタルの明かりも青白くともっています。
"Darling, loveliest, don't go!"	「ねぇ、きれいなお家、行かないで！」
Maimie cried, falling on her knees,	マイミーはひざまずいてさけびました。
for the little house was now the size of a reel of thread, but still quite complete.	小さな家は、今や糸巻きくらいの大きさになりましたが、まだ全てがそのままでした。
But as she stretched out her arms imploringly the snow crept up on all sides until it met itself,	マイミーがお願いするように両手をのばしたとき、雪があちらこちらから忍び寄りました。
and where the little house had been was now one unbroken expanse of snow.	そして小さな家があった所は、まっさらな雪が広がっているだけでした。
Maimie stamped her foot naughtily, and was putting her fingers to her eyes, when she heard a kind voice say,	マイミーはやんちゃにも足を踏みならしましたが、指で涙を拭おうとしたときに、やさしい声が聞こえました。
"Don't cry, pretty human, don't cry,"	「泣かないで、かわいい子、泣かないで」
and then she turned round and saw a beautiful little naked boy regarding her wistfully.	マイミーが振り返ると、彼女の方を何かを求めるように見つめる、美しい小さなはだかの男の子を目にしました。
She knew at once that he must be Peter Pan.	マイミーは、すぐにピーターパンにちがいないと分かりました。
Lock-out Time	４章　閉門の時間
It is frightfully difficult to know much about the fairies,	妖精について詳しくなろうとすることは、恐ろしく難しいことです。
and almost the only thing known for certain is that there are fairies wherever there are children.	ただ一つはっきりしていることは、子供がいるところには妖精がいるということです。
Long ago children were forbidden the Gardens,	ずっと昔、子供はケンジントン公園にはいることを禁じられていました。
and at that time there was not a fairy in the place;	そのとき、公園に妖精は一人もいませんでした。
then the children were admitted, and the fairies came trooping in that very evening.	子供が公園に入ることを許されると、まさにその晩に妖精たちもぞろぞろ集まってきました。
They can't resist following the children,	妖精たちは我慢できず、子供たちのあとをついて行ってしまうのです。
but you seldom see them, partly because they live in the daytime behind the railings, where you are not allowed to go, and also partly because they are so cunning.	ただあなたがめったに妖精を目にすることがないのは、一つには、昼間、妖精たちは子供が行くのを禁じられている垣根の裏に住んでいるからですし、もう一つには妖精たちがずるがしこいからでした。
They are not a bit cunning after Lock-out,	妖精たちは、閉門後はこれっぽちもずるがしこいということはありません。
but until Lock-out, my word!	でも閉門までといったら、言葉にしがたいほどです！
When you were a bird you knew the fairies pretty well,	あなたが鳥だったときは、妖精たちのことをとてもよく知っています。
and you remember a good deal about them in your babyhood, which it is a great pity you can't write down,	そしてあなたがあかんぼうのときは、妖精について多くのことを覚えていますが、ただそれを書き記すことができないのは、とても残念なことです。
for gradually you forget,	だんだんあなたは忘れて行きます。
and I have heard of children who declared that they had never once seen a fairy.	妖精なんて一人もみたことないや、と言いはる子供のことをわたしは耳にしたことがあります。
Very likely if they said this in the Kensington Gardens, they were standing looking at a fairy all the time.	とてもありそうなことですが、もしケンジントン公園でそういったなら、始終妖精を目にしながらそこに立っていることになるのです。
The reason they were cheated was that she pretended to be something else.	子供たちがだまされてしまうのは、妖精がなにか別のもののふりをしているからです。
This is one of their best tricks.	これが妖精のよくつかう手口のひとつで、
They usually pretend to be flowers,	妖精はふつう花のふりをします。
because the court sits in the Fairies' Basin,	なぜならその場所は、妖精の溜まり場に位置していましたから。
and there are so many flowers there, and all along the Baby Walk, that a flower is the thing least likely to attract attention.	そして赤ん坊の道沿いにはたくさんの花があったので、一本の花ではまったく興味をひかないのです。
They dress exactly like flowers, and change with the seasons, putting on white when lilies are in and blue for blue-bells, and so on.	妖精たちはまさに花のように着飾り、ゆりがさいているときは白く、ツリガネスイセンが咲いているときは青くといった具合に季節によって装いをかえました。
They like crocus and hyacinth time best of all, as they are partial to a bit of colour,	妖精たちはクロッカスとヒヤシンスの色が大好きで、その季節が一番お気に入りでした。
but tulips (except white ones, which are the fairy-cradles) they consider garish, and they sometimes put off dressing like tulips for days,	でもチューリップ（白以外です、白いチューリップは妖精のゆりかごです）は派手すぎると妖精たちは思っていたので、時々チューリップみたいに着飾ることを何日も先延ばしにしました。
so that the beginning of the tulip weeks is almost the best time to catch them.	なので、だいたいチューリップが咲き始める最初の数週間が、妖精たちを見つける一番いい季節だったりします。
When they think you are not looking they skip along pretty lively,	妖精たちは、あなたが見ていないと思っているときは、とてもいきいきとスキップをしています。
but if you look and they fear there is no time to hide, they stand quite still, pretending to be flowers.	しかしあなたが目をやって、隠れるひまがないと、妖精は花のふりをしてぴくりとも動きません。
Then, after you have passed without knowing that they were fairies, they rush home and tell their mothers they have had such an adventure.	そしてあなたが妖精たちだとは気づかずに通り過ぎると、いそいで家に帰ってお母さんにこんな大冒険をしたんだよと報告するのでした。
The Fairy Basin, you remember, is all covered with ground-ivy (from which they make their castor-oil),	覚えてらっしゃるでしょうか、妖精の溜まり場はツタで覆われていて、妖精たちはツタからヒマシ油を作りました。
with flowers growing in it here and there.	そのあちらこちらに花が育っていました。
Most of them really are flowers, but some of them are fairies.	花のほとんどは本当の花でしたが、いくらかは妖精でした。
You never can be sure of them, but a good plan is	あなたは、どれが妖精か決してはっきりとはわからないでしょう、でもよい方法があります。
to walk by looking the other way, and then turn round sharply.	別の方を見ながら歩いていて、突然振り返るのです。
Another good plan, which David and I sometimes follow, is to stare them down.	もう一つのよい方法は、デビットとわたしが時々やった方法ですが、じっと見つめることです。
After a long time they can't help winking,	ずっと見つめていると、妖精たちはまばたきしてしまいます。
and then you know for certain that they are fairies.	そうすれば、確かにそれが妖精だということがわかるでしょう。
There are also numbers of them along the Baby Walk,	赤ん坊の道沿いにも何人もの妖精がいます。
which is a famous gentle place, as spots frequented by fairies are called.	赤ん坊の道は有名な場所で、妖精たちがよく訪れるところといわれています。
Once twenty-four of them had an extraordinary adventure.	かつて２４人の妖精が、そこで大冒険をくりひろげました。
They were a girls' school out for a walk with the governess,	妖精たちは、女教師といっしょに女学校から散歩に出かけました。
and all wearing hyacinth gowns,	みんなヒヤシンスのガウンを着ていました。
when she suddenly put her finger to her mouth, and then they all stood still on an empty bed and pretended to be hyacinths.	突然教師が口に指をあてると、全員花壇の空いているところに立って、ヒヤシンスのふりをしました。
Unfortunately, what the governess had heard was two gardeners coming to plant new flowers in that very bed.	ついていないことに、教師がききつけたのは、２人の庭師がまさにその花壇の空いている所に花を植えにきた音でした。
They were wheeling a handcart with flowers in it,	かれらは手押し車に花をのせてやってきました。
and were quite surprised to find the bed occupied.	そしてその場所に花が植えられているのをみてとても驚きました。
"Pity to lift them hyacinths,"	「ヒヤシンスを抜くのはかわいそうだなぁ」
said the one man.	一人がいいましたが
"Duke's orders,"	「公爵の命令だからな」
replied the other,	ともう一人が応えました。
and, having emptied the cart, they dug up the boarding-school and put the poor, terrified things in it in five rows.	そして手押し車から花を下ろすと、その寄宿学校を掘り起こして、とてもかわいそうなことに妖精たちを５列にして手押し車にのせました。
Of course, neither the governess nor the girls dare let on that they were fairies,	もちろん教師も生徒もあえて自分たちが妖精だとばらすものはいません。
so they were carted far away to a potting-shed, out of which they escaped in the night without their shoes,	そして遠くの小屋まで運ばれていきましたが、夜のうちに、そこからくつもはかずに逃げ出しました。
but there was a great row about it among the parents, and the school was ruined.	でも親たちの間ではそのことで大さわぎになり、学校はつぶれてしまいました。
As for their houses, it is no use looking for them,	妖精たちの家を探しても無駄なことです。
because they are the exact opposite of our houses.	なぜならわたしたちの家とは似ても似つかないものだからです。
You can see our houses by day but you can't see them by dark.	わたしたちの家は、昼間はみえますが、暗くなるとみることができません。
Well, you can see their houses by dark,	でも妖精たちの家は、暗くなると見えるものなのです。
but you can't see them by day,	でも昼間はみることができません。
for they are the colour of night,	妖精たちの家は、夜の色なのです。
and I never heard of anyone yet who could see night in the daytime.	昼間に夜を見たことがある人の話は聞いたことがないでしょう。
This does not mean that they are black,	妖精たちの色が黒というわけではありません。
for night has its colours just as day has, but ever so much brighter.	夜にも昼とおなじように色があるのです、ただ昼の方がはるかに明るいだけなんです。
Their blues and reds and greens are like ours with a light behind them.	妖精たちの青や赤や緑は、わたしたちのものと同じようなもので、背後から光でてらされているのです。
The palace is entirely built of many-coloured glasses, and is quite the loveliest of all royal residences,	妖精の宮殿はあたり一面がいろいろな色のガラスで作られていて、どんな王族の住居と比べてもひけをとらないものです。
but the queen sometimes complains because the common people will peep in to see what she is doing.	でも女王は自分が何をしているか一般の人が覗いていると、ときどき文句をいいました。
They are very inquisitive folk, and press quite hard against the glass,	妖精たちはとても知りたがりやだったので、ガラスに強く顔を押しつけるのでした。
and that is why their noses are mostly snubby.	それが妖精たちの鼻が、たいがいしし鼻である理由だったりします。
The streets are miles long and very twisty,	宮殿の道は何マイルも続いていて、とても曲がりくねっています。
and have paths on each side made of bright worsted.	両側には、はなやかな毛糸でつくられた小道がありました。
The birds used to steal the worsted for their nests, but a policeman has been appointed to hold on at the other end.	鳥たちは毛糸を自分たちの巣をつくるために盗んでいったので、警官が一人、一方の端をきちんとつかんでいるように任命されたぐらいです。
One of the great differences between the fairies and us is that they never do anything useful.	妖精たちとわたしたちの大きく違うところの一つは、妖精たちは役にたつことはなにもしないということです。
When the first baby laughed for the first time, his laugh broke into a million pieces, and they all went skipping about.	最初のあかんぼうが生まれて最初に微笑むとき、その笑いが無数の破片になって、とびはねます。
That was the beginning of fairies.	それこそが、妖精の生まれるところです。
They look tremendously busy, you know,	あなたも知ってるように、妖精たちはいつもとても忙しそうに見えました。
as if they had not a moment to spare,	まるで余分な時間は少しもないといった具合です。
but if you were to ask them what they are doing, they could not tell you in the least.	でももし妖精たちに何をしているのかを尋ねたら、何一つ説明できなかったでしょう。
They are frightfully ignorant,	妖精たちはびっくりするほど無知です。
and everything they do is make-believe.	そしてやっていることといったら、してるふりだけなのです。
They have a postman,	妖精たちには郵便屋がいます。
but he never calls except at Christmas with his little box,	でもクリスマスのとき小さな箱を持ってくる以外は、やってくることはまずありません。
and though they have beautiful schools, nothing is taught in them;	すてきな学校がありましたが、そこではなにも教えていないのです。
the youngest child being chief person is always elected mistress,	もっとも幼い子供がいつも教師として選ばれました。
and when she has called the roll, they all go out for a walk and never come back.	でも教師が出席をとると、生徒は外に歩きに出かけてしまい、戻ってこないのです。
It is a very noticeable thing that, in fairy families, the youngest is always chief person, and usually becomes a prince or princess,	妖精の家族ではもっとも年が若い者が必ず主人であり、たいてい王子や王女になることはとても注目すべきことです。
and children remember this, and think it must be so among humans also,	子供はそのことを覚えているので、人間の世界でもそうに違いないと考えるのです。
and that is why they are often made uneasy when they come upon their mother furtively putting new frills on the basinette.	そしてそれがお母さんにひそかにゆりかごに新しいフリルをつけているのを見ると、不機嫌になる理由でしょう。
You have probably observed that your baby-sister wants to do all sorts of things that your mother and her nurse want her not to do:	あなたはたぶん、あなたのあかんぼうの妹がお母さんや乳母がしてほしくないと思うことなら何でもしたがることに気づいていることでしょう。
to stand up at sitting-down time, and to sit down at standing-up time, for instance, or to wake up when she should fall asleep, or to crawl on the floor when she is wearing her best frock, and so on,	座っていなければならないときに立ち上がり、立ち上がるときには座り込み、寝なければならないときには目を覚まし、一番いい服をきているときに床をはいまわったりといった具合です。
and perhaps you put this down to naughtiness.	たぶんあなたは、それをやんちゃなせいにするかもしれません。
But it is not;	でもそうではないのです。
it simply means that she is doing as she has seen the fairies do;	それは単に、妖精たちがしていることをみたままに真似しているだけです。
she begins by following their ways, and it takes about two years to get her into the human ways.	生まれたては妖精のやり方を真似して、人間のやり方になれるまでにはだいたい２年ぐらいかかるものです。
Her fits of passion, which are awful to behold, and are usually called teething, are no such thing;	あかんぼうのかんしゃくのけいれんは、見ているのは恐ろしいもので、しばしば歯が生えてくるからと言われていますが、ぜんぜんそんな理由ではありません。
they are her natural exasperation,	それはあかんぼうにとってごく自然な怒りのしるしなのです。
because we don't understand her, though she is talking an intelligible language.	とてもわかりやすい言葉だというのに、わたしたちが理解できないから、怒っているのです。
She is talking fairy.	子供は話す妖精です。
The reason mothers and nurses know what her remarks mean, before other people know, as that "Guch" means "Give it to me at once," while "Wa" is "Why do you wear such a funny hat?" is because, mixing so much with babies, they have picked up a little of the fairy language.	他の人が気づく前に母親や乳母があかんぼうの言ってること、たとえば“ちょ”が“わたしにすぐそれをちょうだい”とか“なっ”が“なぜそんなにおかしな帽子をかぶっているの”に気づくのは、あかんぼうとふれあっているので、妖精のことばをすこしばかり理解しているということなのです。
Of late David has been thinking back hard about the fairy tongue, with his hands clutching his temples,	最近、デビットは、両手でこめかみを強く押さえて昔を振り返り、妖精の言葉を思い出そうとしました。
and he has remembered a number of their phrases which I shall tell you some day if I don't forget.	そしてわたしが忘れなければ、いつかお話しできるいくつかの言い回しを思い出しました。
He had heard them in the days when he was a thrush,	デビットは、自分がつぐみだったときにその言い回しを聞いたということです。
and though I suggested to him that perhaps it is really bird language he is remembering, he says not,	わたしが、たぶんそれは鳥の言葉じゃないかなとほのめかしたときも、彼はそうじゃないといいはりました。
