Never, Tony felt, could he hope for a better chance.	トニーもそう思いましたが、これほどいいチャンスはないでしょう。
He had to feel this,	トニーはそう思うべきだったのです。
for Maimie so plainly felt it for him.	というのも、マイミーも明らかにトニーの代わりにそう思っていたぐらいですから。
Her eager eyes asked the question,	マイミーの目はこう訴えかけているようでした。
"Is it to-day?"	「今日でしょ？」
and he gasped and then nodded.	トニーは息をのみ、うなずきました。
Maimie slipped her hand into Tony's, and hers was hot, but his was cold.	マイミーはトニーの手に自分の手を滑り込ませると、マイミーの手はとても暖たかでしたが、トニーの手は冷え切っていました。
She did a very kind thing;	マイミーはとてもやさしくしました。
she took off her scarf and gave it to him!	スカーフをとると、お兄ちゃんに渡したのでした！
"In case you should feel cold,"	「寒くなったらね」
she whispered.	マイミーはささやきました。
Her face was aglow, but Tony's was very gloomy.	マイミーの顔は赤らんでいましたが、トニーの顔ときたらまっさおでした。
As they turned on the top of the Hump he whispered to her,	３人が丘の上までやってきたとき、トニーはマイミーに耳打ちしました。
"I'm afraid Nurse would see me, so I sha'n't be able to do it."	「ばあやに見つかっちゃうと、なんにもできないや」
Maimie admired him more than ever for being afraid of nothing but their ayah, when there were so many unknown terrors to fear, and she said aloud,	マイミーは、これからまだ未知の恐ろしいことが起きるかもしれないのに、乳母のことしか恐れていないなんて、いよいよお兄ちゃんを尊敬し、大きな声でこういいました。
"Tony, I shall race you to the gate,"	「お兄ちゃん、門までかけっこしよう」
and in a whisper,	そして小さな声で
"Then you can hide,"	「それで、かくれればいいわ」と。
and off they ran.	２人は駆け出しました。
Tony could always outdistance her easily,	トニーは、いつも簡単にマイミーをはるかに引き離すことができました。
but never had she known him speed away so quickly as now,	今ほどの勢いでかけていくお兄ちゃんを見たことはありません。
and she was sure he hurried that he might have more time to hide.	マイミーは、隠れる時間をかせぐために急いでいるに違いないと思っていました。
"Brave, brave!"	「勇敢だわ、勇敢！」
her doting eyes were crying	マイミーの信じきっているひとみは、そう訴えかけていました。
when she got a dreadful shock;	とその時マイミーは大ショックをうけました。
instead of hiding, her hero had run out at the gate!	かくれるどころか、尊敬すべきお兄ちゃんは門の外へと駆け出して行ってしまったのです！
At this bitter sight Maimie stopped blankly,	このつらい光景を目にして、マイミーはぽかんと立ちつくしました。
as if all her lapful of darling treasures were suddenly spilled,	まるでエプロンいっぱいのすばらしい宝物を、突然あたり一面に撒き散らしてしまったみたいにです。
and then for very disdain she could not sob;	そしてあまりに軽蔑しきったので、泣くことすらできませんでした。
in a swell of protest against all puling cowards she ran to St. Govor's Well and hid in Tony's stead.	あまりに臆病なお兄ちゃんへの反感でいっぱいになって、マイミーは聖ガーバーの井戸へ駆け出して行き、トニーの代わりにそこに隠れました。
When the ayah reached the gate and saw Tony far in front she thought her other charge was with him and passed out.	乳母が門のところまでやってきたとき、トニーははるか前に行っており、乳母はもう一人、マイミーもいっしょに行って姿が見えなくなったのだと思いました。
Twilight came on, and scores and hundreds of people passed out,	たそがれどきになり、みんな公園から出て行きます。
including the last one, who always has to run for it, but Maimie saw them not.	最後の一人は、いつも駆け足で出て行かなければなりません。
She had shut her eyes tight and glued them with passionate tears.	マイミーは目をぎゅっと閉じて、思いがけず涙がでて目を開けることができませんでした。
When she opened them something very cold ran up her legs and up her arms and dropped into her heart.	目を開けたとき、なにかとても冷たいものが手と足をすーっと登ってきて、心臓のところに落ちてきました。
It was the stillness of the Gardens.	それは公園の静けさでした。
Then she heard clang, then from another part _clang_, then _clang_, _clang_ far away.	それからカランという音を聞き、他からもカラン、別でカラン、遠くでカラン、
It was the Closing of the Gates.	門の閉まる音でした。
Immediately the last clang had died away Maimie distinctly heard a voice say,	すぐに最後のカランという音も聞こえなくなり、マイミーははっきりとこう言っている声をききました。
"So that's all right."	「万事問題なし」
It had a wooden sound and seemed to come from above,	木がしゃべっているような音で、上から聞こえてきました。
and she looked up in time to see an elm tree stretching out its arms and yawning.	そこで見上げてみると、すぐに楡の木が両腕を伸ばして、あくびをしているのが目に入りました。
She was about to say,	マイミーは思わず
"I never knew you could speak!"	「木がしゃべるなんて！」と声にだすところでした。
when a metallic voice that seemed to come from the ladle at the well remarked to the elm,	ただ金属からでるｔような声が井戸のところのひしゃくから聞こえてきて、楡の木に意見しました。
"I suppose it is a bit coldish up there?"	「そこはちょっと寒くないかい？」
and the elm replied,	そして楡の木は答えました。
"Not particularly, but you do get numb standing so long on one leg,"	「そうでもないよ、ところで君はそんなに長い間一本足で立っていて、しびれてくるだろう」
and he flapped his arms vigorously just as the cabmen do before they drive off.	そして楡の木は、ちょうど御者が動き出す前にするように力強く手を振り回しました。
Maimie was quite surprised to see that a number of other tall trees were doing the same sort of thing	マイミーは多くの背の高い木が、楡の木とおなじような動作をするのをみて本当にびっくりしました。
and she stole away to the Baby Walk and crouched observantly under a Minorca Holly	そしてこっそりと赤ん坊の道まで出ていくと、注意を払いながらミノルカのヒイラギの木の下に身をかくしました。
which shrugged its shoulders but did not seem to mind her.	ヒイラギの木は両肩をひょいとすくめましたが、マイミーには気づかないようでした。
She was not in the least cold.	マイミーはすこしも寒くはありません。
She was wearing a russet-coloured pelisse and had the hood over her head,	あずき色の子供用オーバーを着ていましたし、頭にはフードもかぶっていました。
so that nothing of her showed except her dear little face and her curls.	そして外から見ると、かわいい小さな顔と巻き毛以外はなにも見えません。
The rest of her real self was hidden far away inside so many warm garments that in shape she seemed rather like a ball.	その他の部分はあたたかな洋服にすっぽりつつまれていて、姿はまるまるとしたボールのようでした。
She was about forty round the waist.	まるでウエストのサイズが４０もあるみたいです。
There was a good deal going on in the Baby Walk,	赤ん坊の道には、いろいろなものが行き来しました。
when Maimie arrived in time to see a magnolia and a Persian lilac step over the railing and set off for a smart walk.	マイミーが着いた時は、マグノリア（もくれん）とペルシアライラックが柵を越えて、さっそうと歩いて行くところでした。
They moved in a jerky sort of way certainly, but that was because they used crutches.	たしかに彼らはてきぱきと動いていましたが、それは松葉杖を使っていたからです。
An elderberry hobbled across the walk, and stood chatting with some young quinces,	ニワトコは道をびっこを引きながら横切り、年若そうなカリンと立ち話をしていました。
and they all had crutches.	みんな松葉杖をついていて、
The crutches were the sticks that are tied to young trees and shrubs.	松葉杖とは若い枝や下のほうの枝に結び付けられたステッキのことです。
They were quite familiar objects to Maimie, but she had never known what they were for until to-night.	松葉杖はマイミーにとって、よく目にするものでしたが、今夜までどんな風に使うものか知りませんでした。
She peeped up the walk and saw her first fairy.	マイミーは道をこっそりのぞいて、初めて妖精をみました。
He was a street boy fairy who was running up the walk closing the weeping trees.	その妖精は男の子の浮浪児で道をかけまわっては、垂れ下がった枝を閉じているのでした。
The way he did it was this,	そのやり方はこうです。
he pressed a spring in the trunk and they shut like umbrellas, deluging the little plants beneath with snow.	妖精が木の幹に飛びかかると、木は傘みたいに枝を閉じ、木の下の小さな草木の上に雪をどさりと落とすのです。
"Oh, you naughty, naughty child!"	「わんぱく坊や、まったくわんぱくなんだから！」
Maimie cried indignantly,	マイミーは腹をたてて叫びました。
for she knew what it was to have a dripping umbrella about your ears.	マイミーも、耳元のところに雨がしたたる傘をもってこられることがどういうことかは知ってましたから。
Fortunately the mischievous fellow was out of earshot,	運がよいことに、いたずらな妖精はマイミーの声が聞こえなかったみたいです。
but the chrysanthemums heard her,	ただ菊の花が、マイミーの声を聞いていました。
and they all said so pointedly	菊の花は辛らつに
"Hoity-toity, what is this?"	「いやはや、どういうことだい？」と言い放ち、
that she had to come out and show herself.	マイミーは出て来ざるをえませんでした。
Then the whole vegetable kingdom was rather puzzled what to do.	そして植物界は、どうしようかすっかり困ってしまいました。
"Of course it is no affair of ours,"	「もちろん、私たちには関係ないですから」
a spindle tree said after they had whispered together,	マユミの木は、みんなと何やらささやきあってからそう言いました。
"but you know quite well you ought not to be here, and perhaps our duty is to report you to the fairies;	「でもここにいちゃいけないって知ってるでしょうに、私たちとしてはあなたのこと、妖精たちに言わなきゃならないわ。
what do you think yourself?"	自分ではどう思ってるの？」
"I think you should not,"	「妖精たちには言わないで」
Maimie replied, which so perplexed them that they said petulantly there was no arguing with her.	マイミーがそう答えたので、みんなは困ってしまって、怒りっぽい口調でマイミーのことなんかあれこれ言いたくもないと言いました。
"I wouldn't ask it of you,"	「もし自分で悪いことだと思ってたら、頼まないわ」
she assured them, "if I thought it was wrong,"	マイミーはみんなに断言しました。
and of course after this they could not well carry tales.	もちろんこう言われては、告げ口できません。
They then said,	みんなは口々にこういいました
"Well-a-day,"	「なんてことのなの」
"Such is life!"	「人生なんてそんなもの！」とか。
for they can be frightfully sarcastic,	木たちの口ぶりときたら、まったく嫌みになるときがあるのです。
but she felt sorry for those of them who had no crutches, and she said good-naturedly,	でもマイミーは、松葉杖をもっていない木たちのことをかわいそうに思ったので、いい子の発言をしました。
"Before I go to the fairies' ball, I should like to take you for a walk one at a time;	「妖精たちの舞踏会に行く前に、一人ずつ散歩に連れていってあげる。
you can lean on me, you know."	私にもたれかかればいいわ」
At this they clapped their hands,	これを聞いて、みんな拍手喝さいです。
and she escorted them up to the Baby Walk and back again,	マイミーは、みんなを赤ん坊の道まで連れていき戻ってきました。
one at a time,	一度に一人ずつ。
putting an arm or a finger round the very frail, setting their leg right when it got too ridiculous,	とてもよろよろしている木は腕や指でささえてやり、足元がおぼつかない木にはまっすぐ歩けるようにしました。
and treating the foreign ones quite as courteously as the English, though she could not understand a word they said.	外国の木が何を言ってるのかさっぱりマイミーは分かりませんでしたけど、英国の木と同じくらい礼儀正しく接しました。
They behaved well on the whole, though some whimpered that she had not taken them as far as she took Nancy or Grace or Dorothy,	木たちもみんなだいたい礼儀正しかったですが、なかにはナンシーやグレースやドロシーを連れて行ったところまで私をつれて行ってくれないの、とめそめそ泣くものもいました。
and others jagged her,	またマイミーにぎざぎざをつけるものもいました。
but it was quite unintentional, and she was too much of a lady to cry out.	ただわざとではありませんし、マイミーは礼儀正しい女の子でしたので叫び声はあげませんでした。
So much walking tired her and she was anxious to be off to the ball,	マイミーはあんまり歩いたので疲れましたし、舞踏会に遅れるのではと心配になりました。
but she no longer felt afraid.	でも、もう恐い気持ちは全然ありません。
The reason she felt no more fear was that it was now night-time,	恐くなくなったのは、夜の時間になったからでもあります。
and in the dark, you remember, Maimie was always rather strange.	暗くなると、そうです、マイミーはかなり変わった女の子になりますから。
They were now loath to let her go,	木たちはマイミーを行かせたがりません。
for,	それで
"If the fairies see you," they warned her, "they will mischief you,	「妖精たちがあなたを見たら、いたずらするよ。
stab you to death or compel you to nurse their children or turn you into something tedious, like an evergreen oak."	つついたり子供の面倒をみさせたり、なにか退屈なもの、一年中緑のかしの木なんかにかえてしまうかもしれないよ」と注意しました。
As they said this they looked with affected pity at an evergreen oak,	こういいながら、木たちは悪いなぁと思いながらかしの木を見ました。
for in winter they are very envious of the evergreens.	実は、一年中緑のかしの木をねたましく思っていたのです。
"Oh, la!"	「ふーん！」
replied the oak bitingly,	かしの木は辛らつに言い返しました。
"how deliciously cosy it is to stand here buttoned to the neck and watch you poor naked creatures shivering!"	「ここに首までボタンをしめて立っていて、君らがはだかでぶるぶる震えてるのを見るのはどんなに楽しいことか」
This made them sulky though they had really brought it on themselves,	自分たちで言い出したくせに、こう言われると他の木たちは、すっかりすねてしまいました。
and they drew for Maimie a very gloomy picture of the perils that faced her if she insisted on going to the ball.	そしてマイミーにもし舞踏会に行くとだだをこねると、どんな危険がまちうけているかさも憂鬱そうに説明するのでした。
She learned from a purple filbert that the court was not in its usual good temper at present,	マイミーは、すでにムラサキハシバミから宮殿はいつものような平穏な様子ではないということを聞いていました。
the cause being the tantalising heart of the Duke of Christmas Daisies.	それは、クリスマスひなぎく公爵のじりじりさせる心のせいなのです。
He was an Oriental fairy, very poorly of a dreadful complaint, namely, inability to love,	クリスマスひなぎく公爵は東洋の妖精で、ひどい病気にかかっており、つまり愛することができないためにとても不幸でした。
and though he had tried many ladies in many lands he could not fall in love with one of them.	いろいろな土地でさまざまな女の人を愛そうとしたのですが、誰も愛することができませんでした。
Queen Mab, who rules in the Gardens, had been confident that her girls would bewitch him,	ケンジントン公園を治めていたマブ女王は、自分の娘たちなら公爵をうっとりさせることができるだろうと自信をもっていました。
but alas, his heart, the doctor said, remained cold.	ただ医者がいうには、公爵の心は凍ったままなのでした。
This rather irritating doctor, who was his private physician, felt the Duke's heart immediately after any lady was presented, and then always shook his bald head	このかなりいらいらさせる医者は、公爵のかかりつけの医者で、女性が公爵の面前に現われるとすぐに公爵の心に手をあてて、はげあがった頭をいつも左右にふると、
and murmured, "Cold, quite cold!"	「冷たい、きわめて冷たいですな」とつぶやきました。
Naturally Queen Mab felt disgraced, and first she tried the effect of ordering the court into tears for nine minutes,	もちろんマブ女王は面目をつぶされたと感じて、最初は、９分間の間、宮殿を涙であふれさせることを試してみました。
and then she blamed the Cupids and decreed that they should wear fools' caps until they thawed the Duke's frozen heart.	それからキューピッドを責め、公爵の凍りついた心をとかすまで道化者の帽子をかぶるよう命令しました。
"How I should love to see the Cupids in their dear little fools' caps!"	「なんとしても、道化者の帽子をかぶったキューピッドをみたいわ」
Maimie cried, and away she ran to look for them very recklessly,	とマイミーはさけぶと、向こう見ずにもキューピッドを探しにかけだしました。
for the Cupids hate to be laughed at.	キューピッドというものは、笑われるのが大嫌いなのですが。
It is always easy to discover where a fairies' ball is being held,	妖精たちの舞踏会が開かれている場所を探し出すのは、いつも簡単なことです。
as ribbons are stretched between it and all the populous parts of the Gardens, on which those invited may walk to the dance without wetting their pumps.	というのも舞踏会の場所と公園の人通りがはげしい場所との間にはリボンがはりわたされていて、招待された人たちは舞踏用の靴が濡れないように、ダンスするところまでその上を歩いて行けましたから。
This night the ribbons were red and looked very pretty on the snow.	今夜のリボンは赤で、雪の上でひときわ映えました。
Maimie walked alongside one of them for some distance without meeting anybody,	マイミーは、誰にも出会うことなくしばらくリボンの一つにそって歩いて行きました。
but at last she saw a fairy cavalcade approaching.	しかしついにマイミーは妖精の大パレードが近づいてくるのを目にしました。
To her surprise they seemed to be returning from the ball,	びっくりしたことに、パレードは舞踏会から引き返してくるようでした。
and she had just time to hide from them by bending her knees and holding out her arms and pretending to be a garden chair.	マイミーは膝を折り両腕をのばし、公園の椅子のようなふりをしてぎりぎりパレードから姿を隠しました。
There were six horsemen in front and six behind, in the middle walked a prim lady wearing a long train held up by two pages, and on the train,	前に６人、後ろに６人が馬に乗っていて、真ん中に２人の小姓に服の長いすそをもたせている上品な女性が歩いていました。
as if it were a couch, reclined a lovely girl, for in this way do aristocratic fairies travel about.	まるで長いすに腰かけているようで、一人の愛らしい少女がもたれかかっており、これが上流階級の妖精たちが旅をするやり方でした。
She was dressed in golden rain, but the most enviable part of her was her neck,	女性は金色のドレスに身をつつんでいましたが、なんといってももっとも羨望の的なのは首でした。
which was blue in colour and of a velvet texture, and of course showed off her diamond necklace as no white throat could have glorified it.	色が青くビロードの手触りで、白いのどではそれほど映えないぐらい、ダイアモンドのネックレスをいっそう引き立たせていました。
The high-born fairies obtain this admired effect by pricking their skin,	生まれが高貴な妖精たちは、このみとれる効果を上げるために、肌に針をさすのです。
which lets the blue blood come through and dye them,	針をさすと、青い血が出てきて肌が青く染まるのです。
and you cannot imagine anything so dazzling unless you have seen the ladies' busts in the jewellers' windows.	そしてあなたが宝石商のショーウィンドウで女性の上半身でも見たことがない限り、それほど目がくらむものを想像することさえできないでしょう。
Maimie also noticed that the whole cavalcade seemed to be in a passion,	マイミーは、大パレードが怒っているようにも見えることにも気づきました。
tilting their noses higher than it can be safe for even fairies to tilt them,	妖精ができうるかぎり鼻をつんと上に向けていたのです。
and she concluded that this must be another case in which the doctor had said "Cold, quite cold!"	マイミーはまたあの医者に「冷たい、きわめて冷たいですな」と言われたにちがいないと思いました。
Well, she followed the ribbon to a place where it became a bridge over a dry puddle	さて、マイミーはリボンをたどって、水のかれた水たまりにかかっている橋のようになっている所までやってきました。
into which another fairy had fallen and been unable to climb out.	そこでは、ある妖精が水たまりにはまりこみ這い上がれなくなっていました。
At first this little damsel was afraid of Maimie, who most kindly went to her aid, but soon she sat in her hand chatting gaily and explaining	初めこの小さな少女はマイミーを恐がっていましたが、マイミーがやさしく彼女を助け出したので、すぐにマイミーの腕の中で楽しそうに話し出しました。
that her name was Brownie, and that though only a poor street singer she was on her way to the ball to see if the Duke would have her.	自分の名前はブローニーで、今はしがない街の歌い手だけど、舞踏会に行って公爵にお目にかかろうと思うのと話してくれたのです。
"Of course," she said, "I am rather plain,"	「もちろん、わたしは目立たない女の子よ」
and this made Maimie uncomfortable,	少女がそう言うのを聞いて、マイミーは居心地が悪くなってしまいました。
for indeed the simple little creature was almost quite plain for a fairy.	というのもこの飾り気のない小さな少女は、妖精としては全く地味でしたから。
It was difficult to know what to reply.	なんて答えていいのかわかりません。
"I see you think I have no chance,"	「あなたが、わたしにはチャンスがないって思ってるのはわかるわ」
Brownie said falteringly.	ブローニーはためらいながら言いました。
"I don't say that,"	「そんなこといってない」
Maimie answered politely,	マイミーは礼儀正しく答えました。
"of course your face is just a tiny bit homely, but--"	「もちろんあなたの顔は、少しばかり平凡だけどね、でもね」
