PETER PAN IN KENSINGTON GARDENS 　James Matthew Barrie	ケンジントン公園のピーターパン
Peter Pan	1. ピーターパン
The Thrush's Nest	2. つぐみの巣
The Little House	3. ちいさな家
Lock-Out Time	4. ロック・アウトの時間
Peter Pan	１章　ピーターパンの章
If you ask your mother whether she knew about Peter Pan when she was a little girl she will say,	もしお母さんに、幼かった頃にピーターパンを知っていたかどうかたずねたら、こう答えるでしょう。
"Why, of course, I did, child,"	「もちろん、知っていたに決まってるじゃないの、かわいい子」。
and if you ask her whether he rode on a goat in those days	そしてピーターが、その頃やぎに乗っていたかどうかもたずねたら、
she will say, "What a foolish question to ask, certainly he did."	「なんてばかげたこと聞くの、もちろん乗っていたにきまってるわよ」と答えるでしょう。
Then if you ask your grandmother whether she knew about Peter Pan when she was a girl,	次におばあちゃんに同じ事をたずねても、
she also says, "Why, of course, I did, child,"	「おやまぁ、もちろん知っていたに決まってるよ、かわいい子」と答えるでしょう。
but if you ask her whether he rode on a goat in those days, she says she never heard of his having a goat.	けれども、その頃ピーターはやぎに乗っていたかどうかを聞くと、やぎを飼っていたなんてことは聞いたこともないよ、と答えます。
Perhaps she has forgotten,	たぶんおばあちゃんは忘れてしまったのでしょう。
just as she sometimes forgets your name and calls you Mildred, which is your mother's name.	なんせあなたの名前も時々忘れてしまって、お母さんの名前の「ミルドレッド」と、あなたに呼びかけるくらいですから。
Still, she could hardly forget such an important thing as the goat.	でもやぎみたいな大切なことを、おばあちゃんが思い出せないなんて事があるでしょうか？
Therefore there was no goat when your grandmother was a little girl.	つまりおばあちゃんが幼い頃には、やぎはいなかったのです。
This shows that,	だからこういうことです。
in telling the story of Peter Pan, to begin with the goat (as most people do) is as silly as to put on your jacket before your vest.	ピーターパンのお話をするにあたって、みんながそうするように、やぎのことから始めるのはベストを着る前に上着を着こむほどばかげたことなんです。
Of course, it also shows that Peter is ever so old, but he is really always the same age,	もちろん、ピーターはとても年をとってるってことにもなりますが、実際のところはずっと年をとらないのです。
so that does not matter in the least.	だから年のことなんて全然問題にもなりません。
His age is one week, and though he was born so long ago he has never had a birthday, nor is there the slightest chance of his ever having one.	ピーターの歳は生まれて１週間で、ずっと昔に生まれたのですが、まだ１回も誕生日が来たこともなければ、これから来ることもないでしょう。
The reason is that he escaped from being a human when he was seven days' old;	その理由というのは、生後７日目に人になることから逃げ出したからです。
he escaped by the window and flew back to the Kensington Gardens.	窓から抜けだして、ケンジントン公園へ飛んで帰ってきたのです。
If you think he was the only baby who ever wanted to escape,	これまでで、ピーターが逃げ出したいだなんて思った、たった一人の赤ん坊だったんじゃないの？
it shows how completely you have forgotten your own young days.	と考えるのは、どれほど自分が幼かった頃のことをすっかり忘れてしまっているかを示しているようなものです。
When David heard this story first he was quite certain that he had never tried to escape,	デビットが初めてこの話を聞いたとき、自分は逃げようとした事なんかないや、と思いこんでいたものです。
but I told him to think back hard, pressing his hands to his temples,	私はこめかみを両手で押さえてよく思い出してご覧なさいと言いました。
and when he had done this hard, and even harder, he distinctly remembered a youthful desire to return to the tree-tops, and with that memory came others, as that he had lain in bed planning to escape as soon as his mother was asleep, and how she had once caught him half-way up the chimney.	デビットが一心にそうしてみると、木のてっぺんに戻りたいと幼心に思っていたこと、その記憶が次の記憶へつながって、ベッドに横になっていた時に、お母さんが眠ったらすぐにでも逃げ出す計画を立てていたこと、かつて煙突に半分のぼったところでお母さんにどうやって捕まっちゃったかを、はっきりと思い出したのでした。
All children could have such recollections if they would press their hands hard to their temples,	全ての子供はもしこめかみを両手で強く押さえて思い出せば、このような思い出を持っているものです。
for, having been birds before they were human, they are naturally a little wild during the first few weeks,	なぜなら子供たちは人になる前は鳥だったので、生まれたての数週間はちょっと動物っぽいところがあるのです。
and very itchy at the shoulders, where their wings used to be.	肩の、かつて翼があったあたりがとてもムズムズするのでした。
So David tells me.	これが、デビットが私に話してくれたことです。
I ought to mention here that the following is our way with a story:	私がここで言っておかなきゃいけないのは、私たちの方法でお話するってことです。
First, I tell it to him, and then he tells it to me, the understanding being that it is quite a different story;	つまり最初に私がデビットにお話をして、それからデビットが私にお話をする、そうすると全く違ったお話になるってことが分かるでしょう。
and then I retell it with his additions, and so we go on until no one could say whether it is more his story or mine.	私は自分のお話をデビットの分に足して話すし、話をすすめていけば、デビットのお話なのか私のお話なのか、どちらのお話だなんて誰にもいえなくなるでしょう。
In this story of Peter Pan, for instance, the bald narrative and most of the moral reflections are mine, though not all,	このピーターパンのお話に関して言えば、例えばつまらない部分と、道徳に関しての小言の、全部ではないにしてもほとんどは私のお話です。
for this boy can be a stern moralist,	というのもピーターパンは、きちんと道徳を守ることもあるからです。
but the interesting bits about the ways and customs of babies in the bird-stage are mostly reminiscences of David's,	でも子供が鳥だった頃のやり方や習慣のちょっとしたおもしろいことは、ほとんどデビットが思い出したことです。
recalled by pressing his hands to his temples and thinking hard.	こめかみを強く両手で押えてじっくり考えて。
Well, Peter Pan got out by the window, which had no bars.	さてピーターパンは窓から出て行きましたけど、そこには柵はありませんでした。
Standing on the ledge he could see trees far away,	窓棚の上に立っていると、遠くの木々がみえました。
which were doubtless the Kensington Gardens,	そこは間違いなくケンジントン公園です。
and the moment he saw them he entirely forgot that he was now a little boy in a nightgown,	公園を見ていたときは、ねまきをきた小さな男の子だってことをすっかり忘れていました。
and away he flew, right over the houses to the Gardens.	そして公園まで、家のすぐ上を越えて飛んでいったのです。
It is wonderful that he could fly without wings,	翼もなしに飛ぶことができるなんて不思議です。
but the place itched tremendously,	ただ翼の生える場所は、とてもムズムズするのでした。
and, perhaps we could all fly if we were as dead-confident-sure of our capacity to do it as was bold Peter Pan that evening.	そしてたぶん、勇敢なピーターパンがその夜に飛べるって固く強く信じたほど私たちも信じれば、みんなが空を飛べることでしょう。
He alighted gaily on the open sward, between the Baby's Palace and the Serpentine,	ピーターは、赤ん坊の王宮とサーペンタイン池の間の広々とした芝生に楽しそうに降り立ちました。
and the first thing he did was to lie on his back and kick.	最初にピーターがしたことは仰向けに横たわって、けるように足を動かすことでした。
He was quite unaware already that he had ever been human,	ピーターは、自分がかつて人だったとは全く知りません。
and thought he was a bird, even in appearance, just the same as in his early days,	そして自分は外見も、幼い頃からずっと同じで、鳥のままだと思っていました。
and when he tried to catch a fly he did not understand that the reason he missed it	だからハエを一匹捕まえようとして、失敗してしまう理由が全然わからないのでした。
was because he had attempted to seize it with his hand,	失敗する理由は、手でハエを捕まえようとしていたからなんです。
which, of course, a bird never does.	もちろん鳥はそんなことをしません。
He saw, however, that it must be past Lock-out Time,	でもピーターには、門が閉まる頃に違いないということは分かりました。
for there were a good many fairies about, all too busy to notice him;	なぜなら周りにたくさんの素敵な妖精たちがいましたが、みんな忙しそうにしていて、ピーターに気づかなかったからでした。
they were getting breakfast ready, milking their cows, drawing water, and so on,	妖精たちは、朝食の準備をしたり、牛の乳をしぼったり、水を汲んできたりしていました。
and the sight of the water-pails made him thirsty, so he flew over to the Round Pond to have a drink.	何杯ものバケツに水が入っているのをみて、ピーターはのどが乾き、水を飲むために丸い池まで飛んでいきました。
He stooped, and dipped his beak in the pond;	ピーターはかがんで、くちばしを池の水につけました。
he thought it was his beak, but, of course, it was only his nose,	ピーターはくちばしだと思ってましたが、もちろん鼻でした。
and, therefore, very little water came up,	だからほとんど水は飲めませんでした。
and that not so refreshing as usual, so next he tried a puddle, and he fell flop into it.	そして水はいつものようにそれほどきれいではなかったので、次にピーターは水たまりを試してみましたが、ドボンと落っこちてしまいました。
When a real bird falls in flop, he spreads out his feathers and pecks them dry, but Peter could not remember what was the thing to do, and he decided, rather sulkily, to go to sleep on the weeping beech in the Baby Walk.	本物の鳥が落っこちたら、羽を広げて、くちばしでついばんでかわかすのでしたが、ピーターはどうしてよいかわからなかったので、すごく不機嫌になって、赤ん坊の道にある枝が垂れ下がっているブナの木にとまって寝ることにしたのでした。
At first he found some difficulty in balancing himself on a branch, but presently he remembered the way, and fell asleep.	最初のうちは枝の上でどうにもバランスが取れなかったのですが、すぐにバランスの取り方を思い出し、眠りにつきました。
He awoke long before morning, shivering,	夜明け前に目を覚ますと、ぶるっと身を震わして
and saying to himself,	「こんな寒い夜に外で過ごしたことはないなぁ」
"I never was out in such a cold night;"	とひとりごとを言いました。
he had really been out in colder nights when he was a bird, but, of course, as everybody knows, what seems a warm night to a bird is a cold night to a boy in a nightgown.	本当は鳥だった頃に、もっと寒い夜を外で過ごしたこともあったのですが、みなさんご存じの通り、鳥にとっては暖かに思える夜でも、ねまきだけの子供にとっては寒い夜なのです。
Peter also felt strangely uncomfortable, as if his head was stuffy,	ピーターはまた、頭が重いみたいでなんとなく落ち着かない感じがしました。
he heard loud noises that made him look round sharply, though they were really himself sneezing.	大きな音を耳にして、あたりをすばやく見まわしましたが、それは実際には自分のくしゃみでした。
There was something he wanted very much,	ピーターには、とっても欲しいものがありました。
but, though he knew he wanted it, he could not think what it was.	でも欲しいことは分かっていたのに、何が欲しいのかまではわかりません。
What he wanted so much was his mother to blow his nose, but that never struck him, so he decided to appeal to the fairies for enlightenment.	とっても欲しかったのは、鼻をかんでくれるお母さんでしたが、ピーターに思い浮かぶはずもなかったので、教えてくれるように妖精にお願いすることにしました。
They are reputed to know a good deal.	妖精が良い知恵を持っていることは、知られていることです。
There were two of them strolling along the Baby Walk, with their arms round each other's waists, and he hopped down to address them.	赤ん坊の道には、お互いの腰に手を回してぶらぶらしている２人の妖精がいたので、ピーターは話しかけるためにひょいと飛び出ました。
The fairies have their tiffs with the birds, but they usually give a civil answer to a civil question,	妖精というものは鳥とはちょっといざこざがあるものですが、ふつうは礼儀正しい質問をすれば、きちんとした返事をしてくれます。
and he was quite angry when these two ran away the moment they saw him.	なので、目があった瞬間に２人とも逃げ出したとき、ピーターはかんかんに怒りました。
Another was lolling on a garden-chair, reading a postage-stamp which some human had let fall, and when he heard Peter's voice he popped in alarm behind a tulip.	別の妖精ときたら、公園の椅子に腰掛けて人間が落としていった切手を見ていたのですが、ピーターの声を聞いたとたん、驚いてチューリップの向こうにひょいと隠れてしまいました。
To Peter's bewilderment he discovered that every fairy he met fled from him.	ピーターが戸惑ったことに、出会う妖精、出会う妖精がみんな自分の前から逃げてしまうのでした。
A band of workmen, who were sawing down a toadstool, rushed away, leaving their tools behind them.	毒きのこを切り倒していた一団の妖精は道具をおいて逃げ出してしまいましたし、
A milkmaid turned her pail upside down and hid in it.	乳搾りをしていた妖精はバケツをひっくり返してその中に隠れてしまう始末です。
Soon the Gardens were in an uproar.	やがて公園は大騒ぎになりました。
Crowds of fairies were running this way and that, asking each other stoutly, who was afraid, lights were extinguished, doors barricaded,	妖精たちの群はあちらこちらへ駆けまわり、だれが恐がってるの？と大声で尋ねあいながら、明かりをけし、ドアにバリケードを築くありさまでした。
and from the grounds of Queen Mab's palace came the rubadub of drums, showing that the royal guard had been called out.	マブ女王の宮殿の広場ではドンドンと太鼓が打ち鳴らされ、それは王宮の警備員が召集されたしるしでした。
A regiment of Lancers came charging down the Broad Walk, armed with holly-leaves, with which they jog the enemy horribly in passing.	騎兵の連隊が、すれ違うときには敵にしっかりつきささるようにセイヨウヒイラギの葉で身を固め、広い道へ突撃してきました。
Peter heard the little people crying everywhere that there was a human in the Gardens after Lock-out Time,	子供の妖精が、あちこちで「門が閉まったのにまだ人がいるんだよ」と大声をだしているのをピーターは耳にしました。
but he never thought for a moment that he was the human.	でも一瞬たりとて自分が人間だとは考えたこともなかったので、
He was feeling stuffier and stuffier, and more and more wistful to learn what he wanted done to his nose,	だんだん混乱して、どうしたらいいか全然わかりません。
but he pursued them with the vital question in vain;	妖精に聞いてみようと後をつけてまわりましたが、むだでした。
the timid creatures ran from him, and even the Lancers, when he approached them up the Hump, turned swiftly into a side-walk, on the pretence that they saw him there.	臆病な生き物の妖精はピーターから逃げ回り、「あっちでピーターを見かけたぞ」なんてうそをついて、騎兵隊でさえピーターが丘に登ると、あわてて歩道へ引き返すしまつでした。
Despairing of the fairies, he resolved to consult the birds,	ピーターは妖精に相談することはあきらめて、鳥に相談することにしました。
but now he remembered, as an odd thing, that all the birds on the weeping beech had flown away when he alighted on it,	ただあのブナに止まっていた鳥がみんな、ピーターが枝に降り立ったとき飛び去ってしまったことを珍しいことに思い出したのでした。
and though that had not troubled him at the time, he saw its meaning now.	その時はなんのことかわからなかったのでしたが、いまやっとその意味がわかりました。
Every living thing was shunning him.	生き物はみな彼を避けているのです。
Poor little Peter Pan, he sat down and cried, and even then he did not know that, for a bird, he was sitting on his wrong part.	かわいそうにちっちゃなピーターパンは、そうと知らなかったとはいえ、鳥としてはおかしな場所に座りこんで泣いているのに気づきもしませんでした。
It is a blessing that he did not know, for otherwise he would have lost faith in his power to fly,	気づかなかったのは幸いなことです、というのも気づいていたら飛べるという自信をなくしていたでしょうから。
and the moment you doubt whether you can fly, you cease forever to be able to do it.	飛べるかどうか疑いを持ったときは、もう永遠に飛べなくなってしまっているものなのです。
Now, except by flying, no one can reach the island in the Serpentine,	さて、飛ぶ以外には、サーペンタイン池の島までたどり着く方法はありません。
for the boats of humans are forbidden to land there,	なぜなら人間たちのボートはそこに横づけすることを禁止されていたからです。
and there are stakes round it, standing up in the water, on each of which a bird-sentinel sits by day and night.	島の周りには水中にくいが打たれており、そのひとつひとつに見張りの鳥がそれぞれ一
It was to the island that Peter now flew to put his strange case before old Solomon Caw,	ピーターは、その島へ自分のいっぷう変わった問題を老ソロモン・コーに相談するために飛んでいったのでした。
and he alighted on it with relief,	ピーターはその島に降り立って、ほっとしました。
much heartened to find himself at last at home, as the birds call the island.	鳥たちがその島を呼ぶように、ついに我が家に帰ってきたようでとても元気づけられたのです。
All of them were asleep, including the sentinels, except Solomon,	鳥たちは見張り番までみんな、ソロモンを除いて眠っていました。
who was wide awake on one side, and he listened quietly to Peter's adventures, and then told him their true meaning.	ソロモンは、島の一方の側で目をさましており、静かにピーターの冒険に耳をかたむけ、冒険の本当の意味をピーターに語るのでした。
"Look at your night-gown, if you don't believe me,"	「わしのいう事を疑うのなら、おまえのねまきをみてごらん」
Solomon said, and with staring eyes Peter looked at his nightgown, and then at the sleeping birds.	ソロモンは言いました、そしてピーターはまず自分のねまきを、それから寝ている他の鳥たちをじっと見つめました。
Not one of them wore anything.	鳥たちはもちろんなにも着てはいません。
"How many of your toes are thumbs?"	「おまえの足の指の何本が親指かい？」
said Solomon a little cruelly, and Peter saw to his consternation, that all his toes were fingers.	ソロモンはちょっと意地悪にそう言いました、そしてピーターは見て、びっくりぎょうてんしてしまいました、なんせ自分の足の指はすべて手の指と同じだったんですから。
The shock was so great that it drove away his cold.	あんまりびっくりぎょうてんしたので、寒さをすっかり忘れるほどでした。
"Ruffle your feathers,"	「おまえの羽毛を逆立てみなさい」
said that grim old Solomon, and Peter tried most desperately hard to ruffle his feathers, but he had none.	情け容赦なく老ソロモンは続けました、ピーターは必死になって羽毛を逆立てようとしましたが、羽毛がないのでした。
Then he rose up, quaking, and for the first time since he stood on the window-ledge, he remembered a lady who had been very fond of him.	それからふるえながら立ちあがって、窓棚の所に立ってから初めて、自分のことを大事にしてくれたお母さんを思い出しました。
"I think I shall go back to mother,"	「お母さんの所に帰ろうかな？」
he said timidly.	おずおずとピーターは言いました。
"Good-bye,"	「それではさらばじゃな」
replied Solomon Caw with a queer look.	なんともいえない表情でソロモン・コーは答えました。
But Peter hesitated.	でもピーターはためらっていました。
"Why don't you go?"	「いかないのか？」
the old one asked politely.	老ソロモンは親切にそうたずねました。
"I suppose,"	「僕は、」
said Peter huskily,	ピーターはかすれた声で言いました。
"I suppose I can still fly?"	「僕はまだ飛べるかな？」
You see, he had lost faith.	ほら、ピーターときたら自信をなくしてしまったのでした。
"Poor little half-and-half,"	「かわいそうな、半分鳥で半分人の子供よ」
said Solomon, who was not really hard-hearted,	ソロモンは言いました、本当は冷酷無情というわけではなかったのでした。
"you will never be able to fly again, not even on windy days.	「もう二度と飛べないよ、風が強い日でもな。
You must live here on the island always."	おまえはずっとここで暮らしていかなきゃならん」
"And never even go to the Kensington Gardens?"	「ケンジントン公園にもいけないの？」
Peter asked tragically.	ピーターは、悲しみにうちひしがれてたずねました。
"How could you get across?"	「どうやってここを渡っていくというんだ？」
said Solomon.	ソロモンは言うと、
He promised very kindly, however,	しかしとてもやさしくこう約束しました。
to teach Peter as many of the bird ways as could be learned by one of such an awkward shape.	こんなかわった姿のピーターでも学べるような多くの鳥たちの方法を教えてやるよと。
"Then I sha'n't be exactly a human?"	「じゃあ僕はちゃんとした“人”にはなれないんだね」
Peter asked.	ピーターはたずねました。
"No."	「ああ」
"Nor exactly a bird?"	「ちゃんとした“鳥”にも」
"No."	「ああ」
"What shall I be?"	「何になるの？」
"You will be a Betwixt-and-Between,"	「どっちつかずになるんだろうな」
Solomon said,	ソロモンはそう答えました。
and certainly he was a wise old fellow,	確かにソロモンはかしこい年寄りでした。
for that is exactly how it turned out.	というのもまさにその通りであることが後に分かったのでした。
The birds on the island never got used to him.	その島の鳥たちは、決してピーターに慣れませんでした。
