"my eyes are all that I have left.	「残っているのは私の両目だけだ。
They are made of rare sapphires,	私の両目は珍しいサファイアでできている。
which were brought out of India a thousand years ago.	これは一千年前にインドから運ばれてきたものだ。
Pluck out one of them and take it to him.	私の片目を抜き出して、彼のところまで持っていっておくれ。
He will sell it to the jeweller, and buy food and firewood, and finish his play."	彼はそれを宝石屋に売って、食べ物と薪を買って、芝居を完成させることができるだろう」
"Dear Prince,"	「王子様」
said the Swallow,	とツバメは言いました。
"I cannot do that";	「私にはできません」
and he began to weep.	そしてツバメは泣き始めました。
"Swallow, Swallow, little Swallow,"	「ツバメさん、ツバメさん、小さなツバメさん」
said the Prince,	と王子は言いました。
"do as I command you."	「私が命じたとおりにしておくれ」
So the Swallow plucked out the Prince's eye, and flew away to the student's garret.	そこでツバメは王子の目を取り出して、 屋根裏部屋へ飛んでいきました。
It was easy enough to get in, as there was a hole in the roof.	屋根に穴があいていたので、入るのは簡単でした。
Through this he darted, and came into the room.	ツバメは穴を通ってさっと飛び込み、部屋の中に入りました。
The young man had his head buried in his hands, so he did not hear the flutter of the bird's wings,	その若者は両手の中に顔をうずめるようにしておりましたので、 鳥の羽ばたきは聞こえませんでした。
and when he looked up he found the beautiful sapphire lying on the withered violets.	そして若者が顔を上げると、そこには美しいサファイアが枯れたスミレの上に乗っていたのです。
"I am beginning to be appreciated,"	「私も世の中に認められ始めたんだ」
he cried;	若者は大声を出しました。
"this is from some great admirer.	「これは誰か、熱烈なファンからのものだな。
Now I can finish my play,"	これで芝居が完成できるぞ」
and he looked quite happy.	若者はとても幸福そうでした。
The next day the Swallow flew down to the harbour.	次の日、ツバメは波止場へ行きました。
He sat on the mast of a large vessel and watched the sailors hauling big chests out of the hold with ropes.	大きな船のマストの上にとまり、 水夫たちが大きな箱を船倉からロープで引きずり出すのを見ました。
"Heave a-hoy!" they shouted as each chest came up.	箱が一つ出るたびに「よいこらせ！」と水夫たちは叫びました。
"I am going to Egypt"!	「僕はエジプトに行くんだよ！」
cried the Swallow, but nobody minded,	とツバメも大声を出しましたが、誰も気にしませんでした。
and when the moon rose he flew back to the Happy Prince.	月が出るとツバメは幸福の王子のところに戻りました。
"I am come to bid you good-bye,"	「おいとまごいにやってきました」
he cried.	ツバメは声をあげました。
"Swallow, Swallow, little Swallow,"	「ツバメさん、ツバメさん、小さなツバメさん」
said the Prince,	と王子は言いました。
"will you not stay with me one night longer?"	「もう一晩泊まってくれませんか」
"It is winter,"	「もう冬です」
answered the Swallow,	ツバメは答えました。
"and the chill snow will soon be here.	「冷たい雪がまもなくここにも降るでしょう。
In Egypt the sun is warm on the green palm-trees, and the crocodiles lie in the mud and look lazily about them.	エジプトでは太陽の光が緑のシュロの木に温かく注ぎ、 ワニたちは泥の中に寝そべってのんびり過ごしています。
My companions are building a nest in the Temple of Baalbec, and the pink and white doves are watching them, and cooing to each other.	友人たちは、バールベック寺院の中に巣を作っており、 ピンクと白のハトがそれを見て、クークーと鳴き交わしています。
Dear Prince,	王子様。
I must leave you,	僕は行かなくちゃなりません。
but I will never forget you,	あなたのことは決して忘れません。
and next spring I will bring you back two beautiful jewels in place of those you have given away.	来年の春、僕はあなたがあげてしまった宝石二つの代わりに、 美しい宝石を二つ持って帰ってきます。
The ruby shall be redder than a red rose, and the sapphire shall be as blue as the great sea."	ルビーは赤いバラよりも赤く、 サファイアは大海のように青いものになるでしょう」
"In the square below,"	「下のほうに広場がある」
said the Happy Prince,	と幸福の王子は言いました。
"there stands a little match-girl.	「そこに小さなマッチ売りの少女がいる。
She has let her matches fall in the gutter, and they are all spoiled.	マッチを溝に落としてしまい、全部駄目になってしまった。
Her father will beat her if she does not bring home some money,	お金を持って帰れなかったら、お父さんが女の子をぶつだろう。
and she is crying.	だから女の子は泣いている。
She has no shoes or stockings, and her little head is bare.	あの子は靴も靴下もはいていないし、何も頭にかぶっていない。
Pluck out my other eye, and give it to her,	私の残っている目を取り出して、あの子にやってほしい。
and her father will not beat her."	そうすればお父さんからぶたれないだろう」
"I will stay with you one night longer,"	「もう一晩、あなたのところに泊まりましょう」
said the Swallow,	ツバメは言いました。
"but I cannot pluck out your eye.	「でも、あなたの目を取り出すなんてできません。
You would be quite blind then."	そんなことをしたら、あなたは何も見えなくなってしまいます」
"Swallow, Swallow, little Swallow,"	「ツバメさん、ツバメさん、小さなツバメさん」
said the Prince,	と王子は言いました。
"do as I command you."	「私が命じたとおりにしておくれ」
So he plucked out the Prince's other eye, and darted down with it.	そこでツバメは王子のもう片方の目を取り出して、下へ飛んでいきました。
He swooped past the match-girl, and slipped the jewel into the palm of her hand.	ツバメはマッチ売りの少女のところまでさっと降りて、 宝石を手の中に滑り込ませまし
"What a lovely bit of glass,"	「とってもきれいなガラス玉！」
cried the little girl;	その少女は言いました。
and she ran home, laughing.	そして笑いながら走って家に帰りました。
Then the Swallow came back to the Prince.	それからツバメは王子のところに戻りました。
"You are blind now,"	「あなたはもう何も見えなくなりました」
he said,	とツバメは言いました。
"so I will stay with you always."	「だから、ずっとあなたと一緒にいることにします」
"No, little Swallow,"	「いや、小さなツバメさん」
said the poor Prince,	とかわいそうな王子は言いました。
"you must go away to Egypt."	「あなたはエジプトに行かなくちゃいけない」
"I will stay with you always,"	「僕はずっとあなたと一緒にいます」
said the Swallow,	ツバメは言いました。
and he slept at the Prince's feet.	そして王子の足元で眠りました。
All the next day he sat on the Prince's shoulder, and told him stories of what he had seen in strange lands.	次の日一日、ツバメは王子の肩に止まり、珍しい土地で見てきたたくさんの話をしました。
He told him of the red ibises, who stand in long rows on the banks of the Nile, and catch gold-fish in their beaks;	ナイル川の岸沿いに長い列をなして立っていて、 くちばしで黄金の魚を捕まえる赤いトキの話。
of the Sphinx, who is as old as the world itself, and lives in the desert, and knows everything;	世界と同じくらい古くからあり、 砂漠の中に住んでいて、何でも知っているスフィンクスの話。
of the merchants, who walk slowly by the side of their camels, and carry amber beads in their hands;	琥珀のロザリオを手にして、ラクダの傍らをゆっくり歩く貿易商人の話。
of the King of the Mountains of the Moon, who is as black as ebony, and worships a large crystal;	黒檀のように黒い肌をしており、大きな水晶を崇拝している月の山の王の話。
of the great green snake that sleeps in a palm-tree, and has twenty priests to feed it with honey-cakes;	シュロの木で眠る緑の大蛇がいて、二十人の僧侶が蜂蜜のお菓子を食べさせている話。
and of the pygmies who sail over a big lake on large flat leaves, and are always at war with the butterflies.	広く平らな葉に乗って大きな湖を渡り、蝶といつも戦争しているピグミーの話。
"Dear little Swallow,"	「可愛い小さなツバメさん」
said the Prince,	王子は言いました。
"you tell me of marvellous things,	「あなたは驚くべきことを聞かせてくれた。
but more marvellous than anything is the suffering of men and of women.	しかし、苦しみを受けている人々の話ほど驚くべきことはない。
There is no Mystery so great as Misery.	度しがたい悲しみ以上に解きがたい謎はないのだ。
Fly over my city, little Swallow,	小さなツバメさん、町へ行っておくれ。
and tell me what you see there."	そしてあなたの見たものを私に教えておくれ」
So the Swallow flew over the great city, and saw the rich making merry in their beautiful houses, while the beggars were sitting at the gates.	ツバメはその大きな町の上を飛びまわり、 金持ちが美しい家で幸せに暮らす一方で、 乞食がその家の門の前に座っているのを見ました。
He flew into dark lanes, and saw the white faces of starving children looking out listlessly at the black streets.	暗い路地に入っていき、ものうげに黒い道を眺めている空腹な子供たちの青白い顔を見ました。
Under the archway of a bridge two little boys were lying in one another's arms to try and keep themselves warm.	橋の通りの下で小さな少年が二人、互いに抱き合って横になり、暖め合っていました。
"How hungry we are!"	「お腹がすいたよう」
they said.	と二人は口にしていましたが
"You must not lie here,"	「ここでは横になっていてはいかん」
shouted the Watchman, and they wandered out into the rain.	と夜警が叫び、二人は雨の中へとさまよい出ました。
Then he flew back and told the Prince what he had seen.	それからツバメは王子のところへ戻って、 見てきたことを話しました。
"I am covered with fine gold,"	「私の体は純金で覆われている」
said the Prince,	と王子は言いました。
"you must take it off, leaf by leaf, and give it to my poor;	「それを一枚一枚はがして、貧しい人にあげなさい。
the living always think that gold can make them happy."	生きている人は、金があれば幸福になれるといつも考えているのだ」
Leaf after leaf of the fine gold the Swallow picked off, till the Happy Prince looked quite dull and grey.	ツバメは純金を一枚一枚はがしていき、とうとう幸福の王子は完全に輝きを失い、灰色になってしまいました。
Leaf after leaf of the fine gold he brought to the poor, and the children's faces grew rosier, and they laughed and played games in the street.	ツバメが純金を一枚一枚貧しい人に送ると、子供たちの顔は赤みを取り戻し、笑い声をあげ、通りで遊ぶのでした。
"We have bread now!"	「パンが食べられるんだ！」
they cried.	と大声で言いました。
Then the snow came,	やがて、雪が降ってきました。
and after the snow came the frost.	その後に霜が降りました。
The streets looked as if they were made of silver, they were so bright and glistening;	通りは銀でできたようになり、 たいそう光り輝いておりました。
long icicles like crystal daggers hung down from the eaves of the houses, everybody went about in furs, and the little boys wore scarlet caps and skated on the ice.	水晶のような長いつららが家ののきから下がり、みんな毛皮を着て出歩くようになり、 子供たちは真紅の帽子をかぶり、氷の上でスケートをしました。
The poor little Swallow grew colder and colder,	かわいそうな小さなツバメにはどんどん寒くなってきました。
but he would not leave the Prince,	でも、ツバメは王子の元を離れようとはしませんでした。
he loved him too well.	心から王子のことを愛していたからです。
He picked up crumbs outside the baker's door when the baker was not looking and tried to keep himself warm by flapping his wings.	パン屋が見ていないとき、ツバメはパン屋のドアの外でパン屑を拾い集め、翼をぱたぱたさせて自分を暖めようとしました。
But at last he knew that he was going to die.	でも、とうとう自分は死ぬのだとわかりました。
He had just strength to fly up to the Prince's shoulder once more.	ツバメには、王子の肩までもう一度飛びあがるだけの力しか残っていませんでした。
"Good-bye, dear Prince!"	「さようなら、愛する王子様」
he murmured,	ツバメはささやくように言いました。
"will you let me kiss your hand?"	「あなたの手にキスをしてもいいですか」
"I am glad that you are going to Egypt at last, little Swallow,"	「あなたがとうとうエジプトに行くのは、私もうれしいよ、小さなツバメさん」
said the Prince,	と王子は言いました。
"you have stayed too long here; but you must kiss me on the lips, for I love you."	「あなたはここに長居しすぎた。 でも、キスはくちびるにしておくれ。 私もあなたを愛しているんだ」
"It is not to Egypt that I am going,"	「私はエジプトに行くのではありません」
said the Swallow.	とツバメは言いました。
"I am going to the House of Death.	「死の家に行くんです。
Death is the brother of Sleep, is he not?"	『死』というのは『眠り』の兄弟、ですよね」
And he kissed the Happy Prince on the lips, and fell down dead at his feet.	そしてツバメは幸福の王子のくちびるにキスをして、死んで彼の足元に落ちていきました。
At that moment a curious crack sounded inside the statue, as if something had broken.	その瞬間、像の中で何かが砕けたような奇妙な音がしました。
The fact is that the leaden heart had snapped right in two.	それは、鉛の心臓がちょうど二つに割れた音なのでした。
It certainly was a dreadfully hard frost.	ひどく寒い日でしたから。
Early the next morning the Mayor was walking in the square below in company with the Town Councillors.	次の日の朝早く、市長が市会議員たちと一緒に、像の下の広場を歩いておりました。
As they passed the column he looked up at the tatue:	柱を通りすぎるときに市長が像を見上げました。
"Dear me! how shabby the Happy Prince looks!"	「おやおや、この幸福の王子は何てみすぼらしいんだ」
he said.	と市長は言いました。
"How shabby indeed!"	「何てみすぼらしいんだ」
cried the Town Councillors,	市会議員たちは叫びました。
who always agreed with the Mayor;	彼らはいつも市長に賛成するのです。
and they went up to look at it.	皆は像を見ようと近寄っていきました。
"The ruby has fallen out of his sword, his eyes are gone, and he is golden no longer,"	「ルビーは剣から抜け落ちてるし、目は無くなってるし、もう金の像じゃなくなっているし」
said the Mayor in fact,	と市長は言いました
"he is litttle beter than a beggar!"	「これでは乞食とたいして変わらんじゃないか」
"Little better than a beggar,"	「乞食とたいして変わらんじゃないか」
said the Town Councillors.	と市会議員たちが言いました。
"And here is actually a dead bird at his feet!"	「それに、死んだ鳥なんかが足元にいる」
continued the Mayor.	市長は続けました。
"We must really issue a proclamation that birds are not to be allowed to die here."	「われわれは実際、鳥類はここで死ぬことあたわずという布告を出さねばならんな」
And the Town Clerk made a note of the suggestion.	そこで書記がその提案を書きとめました。
So they pulled down the statue of the Happy Prince.	そこで彼らは幸福の王子の像を下ろしました。
"As he is no longer beautiful he is no longer useful,"	「もう美しくないから、役にも立たないわけだ」
said the Art Professor at the University.	大学の芸術の教授が言いました。
Then they melted the statue in a furnace, and the Mayor held a meeting of the Corporation to decide what was to be done with the metal.	溶鉱炉で像を溶かすときに、その金属を使ってどうするかを決めるため、市長は市議会を開きました。
"We must have another statue, of course,"	「もちろん他の像を立てなくてはならない」
he said,	と市長は言いました。
"and it shall be a statue of myself."	「そしてその像は私の像でなくてはなるまい」
"Of myself,"	「いや、私の像です」
said each of the Town Councillors, and they quarrelled.	と市会議員たちがそれぞれ言い、口論になりました。
When I last heard of them they were quarrelling still.	私が彼らのうわさを最後に聞いたときも、まだ口論していました。
"What a strange thing!"	「おかしいなあ」
said the overseer of the workmen at the foundry.	鋳造所の労働者の監督が言いました。
"This broken lead heart will not melt in the furnace. We must throw it away."	「この壊れた鉛の心臓は溶鉱炉では溶けないぞ。 捨てなくちゃならんな」
So they threw it on a dust-heap	心臓は、ごみために捨てられました。
where the dead Swallow was also lying.	そこには死んだツバメも横たわっていたのです。
"Bring me the two most precious things in the city," said God to one of His Angels; 	神さまが天使たちの一人に「町の中で最も貴いものを二つ持ってきなさい」とおっしゃいました。
and the Angel brought Him the leaden heart and the dead bird.	その天使は、神さまのところに鉛の心臓と死んだ鳥を持ってきました。
"You have rightly chosen," said God,	神さまは「よく選んできた」とおっしゃいました。
"for in my garden of Paradise this little bird shall sing for evermore, and in my city of gold the Happy Prince shall praise me."	「天国の庭園でこの小さな鳥は永遠に歌い、黄金の都でこの幸福の王子は私を賛美するだろう」
