The Time Machine	タイムマシン
`Well, mace in one hand and Weena in the other, I went out of that gallery and into another and still larger one,	片手に金てこ、片手にウィーナで、わたしはその展示室を出て、別のもっと大きな展示室に入りました。
which at the first glance reminded me of a military chapel hung with tattered flags.	そこはぼろぼろの旗が下がった軍の礼拝堂を思わせました。
The brown and charred rags that hung from the sides of it, I presently recognized as the decaying vestiges of books.	壁の両側からぶら下がっている茶色い焦げたボロは、やがて腐食した無数の本だとわかりました。
They had long since dropped to pieces, and every semblance of print had left them.	ずっと昔にこなごなになり、あらゆる印刷物らしさがすでに消え失せていました。
But here and there were warped boards and cracked metallic clasps that told the tale well enough.	でも、あちこちには曲がった板やひびの入った金属のクリップがあって、それで十分にわかりました。
Had I been a literary man I might, perhaps, have moralized upon the futility of all ambition.	もし文筆家であれば、ここであらゆる野心の無力さについて道徳論を一節ぶったところでしょう。
But as it was, the thing that struck me with keenest force was the enormous waste of labour to which this sombre wilderness of rotting paper testified.	でもそのとき実に強く感じられたのは、この腐食する紙の陰鬱な荒野が証言している、壮大な労働の無駄でした。
At the time I will confess that I thought chiefly of the PHILOSOPHICAL TRANSACTIONS and my own seventeen papers upon physical optics.	正直申し上げて、そのときわたしがもっぱら考えていたのは PHILOSOPHICAL TRANSACTIONS と、わたし自身の物理光学に関する論文十七編のことだったのです。
`Then, going up a broad staircase, we came to what may once have been a gallery of technical chemistry.	それから広い階段をのぼって、かつては化学技術の展示室だったとおぼしきところに出ました。
And here I had not a little hope of useful discoveries.	ここで役に立つ発見があろうとはまるで期待していませんでした。
Except at one end where the roof had collapsed, this gallery was well preserved.	でも屋根が陥没した一端を除けば、この展示室はよく残っていました。
I went eagerly to every unbroken case.	壊れていないケースを一つ残らず、熱心に見て回りました。
And at last, in one of the really air-tight cases, I found a box of matches.	そして最後に、実に機密性の高いケースの一つで、マッチの箱を見つけたのです。
Very eagerly I tried them.	期待に胸を躍らせてそれを試してみました。
They were perfectly good.	完全に使えます。
They were not even damp.	湿気てさえいませんでした。
I turned to Weena.	わたしはウィーナの方に向き直りました。
"Dance," I cried to her in her own tongue.	そして彼女のことばで「踊り」といいました。
For now I had a weapon indeed against the horrible creatures we feared.	というのもいまやわたしは、恐れていた恐ろしい生き物に対する武器を手に入れたからです。
And so, in that derelict museum, upon the thick soft carpeting of dust, to Weena's huge delight, I solemnly performed a kind of composite dance,	そしてその荒廃した博物館で、厚く柔らかいほこりのカーペットの上で、ウィーナが大喜びしたことに、わたしは荘厳に一種の組み合わせダンスを上演しました。
whistling THE LAND OF THE LEAL as cheerfully as I could.	The Land of the Leal をできるだけ陽気に口笛で吹きながら、
In part it was a modest CANCAN, in part a step dance, in part a skirt-dance (so far as my tail-coat permitted), and in part original.	部分的にはお粗末なカンカンダンス、部分的にはステップダンス、部分的にはスカートダンス（わたしの燕尾服が許す限り）、そして一部は即興です。
For I am naturally inventive, as you know.	というのも、わたしはご存じの通り生まれつき発明の才がありますので。
`Now, I still think that for this box of matches to have escaped the wear of time for immemorial years was a most strange, as for me it was a most fortunate thing.	さて、いまでもこのマッチ箱が果てしない時の腐食を逃れたというのは実に奇妙なことだと思いますが、わたしにとっては実に幸運なことでした。
Yet, oddly enough, I found a far unlikelier substance,	でも、奇妙なことに、マッチよりずっと意外な物質も見つけたのです。
and that was camphor.	それは樟脳でした。
I found it in a sealed jar, that by chance, I suppose, had been really hermetically sealed.	封をしたびんの中にあって、たぶんそれが偶然にも、実に魔法のように気密に封印されていたんだと思います。
I fancied at first that it was paraffin wax, and smashed the glass accordingly.	最初はパラフィンワックスかと思って、ガラスを叩き割りました。
But the odour of camphor was unmistakable.	でも樟脳のにおいは間違いがたいものです。
In the universal decay this volatile substance had chanced to survive, perhaps through many thousands of centuries.	何もかもが腐敗する中で、この不安定な物質は偶然にも、何千世紀を通じて生き残っていたのです。
It reminded me of a sepia painting I had once seen done from the ink of a fossil Belemnite that must have perished and become fossilized millions of years ago.	何百万年もの昔に絶滅して化石化した、化石のイカ墨で描かれた、セピア色の絵のことを思い出しましたよ。
I was about to throw it away, but I remembered that it was inflammable and burned with a good bright flame	捨てかけたところで、樟脳が可燃性で、しかも実に明るい炎をあげることを思い出しました
--was, in fact, an excellent candle	――樟脳は優れたロウソクにもなるのです
--and I put it in my pocket.	――だからポケットにしまいました。
I found no explosives, however, nor any means of breaking down the bronze doors.	でも爆発物は見つからず、ブロンズのドアを破る手段も見つかりませんでした。
As yet my iron crowbar was the most helpful thing I had chanced upon.	いまだに金てこが手に入ったいちばん有用なものでした。
Nevertheless I left that gallery greatly elated.	とはいえ、そのギャラリーをわたしは意気揚々と立ち去ったのです。
`I cannot tell you all the story of that long afternoon.	この長い午後の話をすべてお話しするわけにはいきません。
It would require a great effort of memory to recall my explorations in at all the proper order.	あの探検をすべて正しい順序で思い出すには、かなり記憶をふりしぼらなくてはならないでしょう。
I remember a long gallery of rusting stands of arms, and how I hesitated between my crowbar and a hatchet or a sword.	錆びゆく武器の並んだ展示室があって、自分の金てこを捨ててなたか剣を取ろうかと、しばらくためらったものです。
I could not carry both, however, and my bar of iron promised best against the bronze gates.	でも両方とも運ぶわけにはいきませんでしたし、ブロンズの門に対してはこの鉄の棒がいちばんいいと思えました。
There were numbers of guns, pistols, and rifles.	多くの銃、拳銃、ライフルがありました。
The most were masses of rust, but many were of some new metal, and still fairly sound.	ほとんどは錆の固まりになっていましたが、新しい金属でできたものも多く、かなりしっかりしていました。
But any cartridges or powder there may once have been had rotted into dust.	でもかつてあったであろう薬莢や火薬は、腐食してほこりになっていました。
One corner I saw was charred and shattered;	一角を見ると、焦げて砕け散っています。
perhaps, I thought, by an explosion among the specimens.	展示物の中で爆発があったのかな、と思いました。
In another place was a vast array of idols	別のところには、たくさんの偶像がありました
--Polynesian, Mexican, Grecian, Phoenician, every country on earth I should think.	――ポリネシア、メキシコ、ギリシャ、フェニキア、世界の思いつく限りありとあらゆる国から。
And here, yielding to an irresistible impulse, I wrote my name upon the nose of a steatite monster from South America that particularly took my fancy.	そしてここでは、どうしようもない衝動に負けて、わたしは自分の名前を特に気に入った南米からのステアタイト製化け物の鼻に書いてしまいました。
`As the evening drew on, my interest waned.	晩が近づくにつれて、興味が薄れてきました。
I went through gallery after gallery, dusty, silent, often ruinous, the exhibits sometimes mere heaps of rust and lignite, sometimes fresher.	展示室から展示室へとめぐりましたが、どこもほこりまみれで、無音で、しばしば荒廃し、展示物はときにはただのサビと褐炭の山と化し、時にはもっと新鮮な状態でした。
In one place I suddenly found myself near the model of a tin-mine, and then by the merest accident I discovered, in an air-tight case, two dynamite cartridges!	一カ所では、突然スズ鉱山の模型の近くにいるのに気がついて、そしてほんの偶然から、気密ケースの中に、ダイナマイトのカートリッジが二つあるのを発見しました！
I shouted	「ユリイカ！」
"Eureka!"	と叫んで、そのケースを喜々として壊しましたよ。
Then came a doubt.	それから疑念が生じました。
I hesitated.	ためらいました。
Then, selecting a little side gallery, I made my essay.	それから、ちょっとした脇の展示室を使って、試験を行いました。
I never felt such a disappointment as I did in waiting five, ten, fifteen minutes for an explosion that never came.	五分、十分、十五分と待って、爆発が決して起きなかったときほどの失望を感じたことはありませんでした。
Of course the things were dummies,	もちろんそれは、ただの模型だったのです。
as I might have guessed from their presence.	その在処からして当然わかるべきでした。
I really believe that had they not been so, I should have rushed off incontinently and blown Sphinx, bronze doors, and (as it proved) my chances of finding the Time Machine, all together into nonexistence.	本当にそれがほんものだと信じていて、だから考えもせずにでかけてスフィンクスも、ブロンズのドアも、そして（後からわかったように）タイムマシンを発見する機会も、まるごと消滅させていたところでした。
`It was after that, I think, that we came to a little open court within the palace.	宮殿内のちょっと開けた場所にやってきたのは、その後だったと思います。
It was turfed, and had three fruit-trees.	土が盛ってあり、果樹が三本ありました。
So we rested and refreshed ourselves.	そこで休んで飲食をしました。
Towards sunset I began to consider our position.	日が暮れかけるにつれて、自分の立場を考え始めました。
Night was creeping upon us, and my inaccessible hiding-place had still to be found.	夜が迫ってきていて、わが誰にも手の届かない隠れ場所は未だに見つかりません。
But that troubled me very little now.	でもそれはいまや心配の種にはなりませんでした。
I had in my possession a thing that was, perhaps, the best of all defences against the Morlocks	わたしはモーロックたちに対する防御として、おそらくは最高のものを所有していました
--I had matches!	――マッチがあったのです！
I had the camphor in my pocket, too, if a blaze were needed.	さらに閃光が必要な場合には、樟脳もあります。
It seemed to me that the best thing we could do would be to pass the night in the open, protected by a fire.	できる最高のことは、開けた場所でたき火に守られて夜を過ごすことだと思えました。
In the morning there was the getting of the Time Machine.	朝には、タイムマシンをどうやって手に入れるかという問題があります。
But now, with my growing knowledge, I felt very differently towards those bronze doors.	でもいまや、知識が増すにつれて、あのブロンズのドアについての印象もかなり変わってきました。
Up to this, I had refrained from forcing them, largely because of the mystery on the other side.	いままでは、それをこじ開けようとはしませんでしたが、それは向こう側に何があるかわからなかったせいが大きいのです。
They had never impressed me as being very strong, and I hoped to find my bar of iron not altogether inadequate for the work.	前から大して頑丈なものとは思えませんでしたし、それをこじあけるのに十分使えるだけの鉄棒を探そうと思っていました」
`We emerged from the palace while the sun was still in part above the horizon.	「わたしたちは、太陽がまだ少し地平線上にあるときに宮殿から出てきました。
I was determined to reach the White Sphinx early the next morning,	翌朝早くに白いスフィンクスまでたどりつこうと思っていました。
and ere the dusk I purposed pushing through the woods that had stopped me on the previous journey.	そして日没前にわたしは前の旅でわたしを止めた森の中を強行しようと提案しました。
My plan was to go as far as possible that night, and then, building a fire, to sleep in the protection of its glare.	計画は、夜のうちになるべく遠くまででかけ、たき火をして、その輝きの保護下で眠ろうということでした。
Accordingly, as we went along I gathered any sticks or dried grass I saw, and presently had my arms full of such litter.	そのために、道々見かけた枝や乾いた草を片端から拾い、すぐに両腕はこうしたがらくたでいっぱいになりました。
Thus loaded, our progress was slower than I had anticipated, and besides Weena was tired.	こんな荷物を持ったために、われわれの歩みは予想よりも遅く、それにウィーナも疲れていました。
And I began to suffer from sleepiness too;	そしてわたしも睡眠不足に苦しむようになりました。
so that it was full night before we reached the wood.	だから森にたどりつくまでに真っ暗になっていました。
Upon the shrubby hill of its edge Weena would have stopped, fearing the darkness before us;	森の縁の茂み状の丘で、ウィーナは目の前の闇を恐れて止まったことでしょう。
but a singular sense of impending calamity, that should indeed have served me as a warning, drove me onward.	でも来るべき争乱の突出した感覚が、本来わたしにも警告として働くべきだったのに、わたしを先に押しやりました。
I had been without sleep for a night and two days, and I was feverish and irritable.	わたしは二日と一晩にわたり寝ておらず、熱っぽくて怒りっぽくなっていました。
I felt sleep coming upon me,	眠りが襲ってくるのを感じました。
and the Morlocks with it.	そして同時にモーロックたちも。
`While we hesitated, among the black bushes behind us, and dim against their blackness, I saw three crouching figures.	ためらううちに、背後の黒い茂みの中で、黒を背景におぼろとはいえ、三つの姿がしゃがんでいるのが目に入りました。
There was scrub and long grass all about us, and I did not feel safe from their insidious approach.	まわりはずっと茂みや背の高い草で、かれらの狡猾な接近から安全だとは思えませんでした。
The forest, I calculated, was rather less than a mile across.	見積もりでは、森は幅 1.6 キロもありません。
If we could get through it to the bare hill-side, there, as it seemed to me, was an altogether safer resting-place;	もしむきだしの丘陵地まで出られたら、そこのほうがずっと休息地としては安全だと思えました。
I thought that with my matches and my camphor I could contrive to keep my path illuminated through the woods.	マッチと樟脳があれば、なんとか森林の中で道を照らし続けられると思ったのです。
Yet it was evident that if I was to flourish matches with my hands I should have to abandon my firewood;	でも、手でマッチをつけるなら、薪は捨てなくてはなりません。
so, rather reluctantly, I put it down.	そこで、いささかがっかりしつつ、わたしはそれを下に置きました。
And then it came into my head that I would amaze our friends behind by lighting it.	そのとき、これに火をつければ後続の友人たちを驚かせられるな、と思いつきました。
I was to discover the atrocious folly of this proceeding, but it came to my mind as an ingenious move for covering our retreat.	後でこの行為のどうしようもない愚かさを思い知るのですが、そのときは退路を隠すための賢明な動きだと思えたのです。
`I don't know if you have ever thought what a rare thing flame must be in the absence of man and in a temperate climate.	人類のいない温帯気候において、炎がどんなに珍しい物かをお考えになったことがあるでしょうか。
The sun's heat is rarely strong enough to burn, even when it is focused by dewdrops, as is sometimes the case in more tropical districts.	太陽の熱は、熱帯の一部で時々ある場合とはちがって、露で集中したときにも燃えるほど強烈にはほとんどなりません。
Lightning may blast and blacken, but it rarely gives rise to widespread fire.	雷が炸裂して黒こげにすることはあっても、大規模な火事を起こすことはめったにありません。
Decaying vegetation may occasionally smoulder with the heat of its fermentation, but this rarely results in flame.	腐った植生は、たまに腐敗熱でくすぶることはありますが、炎をあげることはまずありません。
In this decadence, too, the art of fire-making had been forgotten on the earth.	退廃の中で、火をおこす技術も地上から忘れ去られたのです。
The red tongues that went licking up my heap of wood were an altogether new and strange thing to Weena.	わが木の山をなめる赤い舌は、ウィーナにとってまるで新しく不思議なものでした。
`She wanted to run to it and play with it.	彼女は駆け寄って、火と遊ぼうとしました。
I believe she would have cast herself into it had I not restrained her.	抑えてやらなかったら、火に飛び込んだんじゃないかと思います。
But I caught her up, and in spite of her struggles, plunged boldly before me into the wood.	でもわたしは彼女を捕まえると、いやがるのもかまわずに、まっすぐ目の前の森に飛び込みました。
For a little way the glare of my fire lit the path.	しばらくは、火の輝きが行く手を照らしてくれました。
Looking back presently, I could see, through the crowded stems, that from my heap of sticks the blaze had spread to some bushes adjacent, and a curved line of fire was creeping up the grass of the hill.	振り返ってみると、密生した枝の隙間から、炎が隣接する茂みに広がったのが見え、そして火の曲がった線が丘の草を焼いていました。
I laughed at that, and turned again to the dark trees before me.	わたしはそれを見て笑い、そしてまた正面の暗い木に向かいました。
It was very black, and Weena clung to me convulsively, but there was still, as my eyes grew accustomed to the darkness, sufficient light for me to avoid the stems.	真っ暗で、ウィーナはガタガタふるえながらしがみついて来ましたが、目が闇に慣れるにつれて、まだ枝を避けるのに十分な光はありました。
Overhead it was simply black, except where a gap of remote blue sky shone down upon us here and there.	頭上はひたすら真っ暗で、ただ遠くの青い空があちこちで降り注いでいました。
I struck none of my matches because I had no hand free.	両手がふさがっていたので、マッチは擦りませんでした。
Upon my left arm I carried my little one, in my right hand I had my iron bar.	左腕には小さなウィーナを抱え、右手には鉄棒を持っていたのです。
`For some way I heard nothing but the crackling twigs under my feet, the faint rustle of the breeze above, and my own breathing and the throb of the blood-vessels in my ears.	しばらくは、足の下で折れる小枝の音、頭上でざわめくかすかな微風、自分の呼吸音と耳の血管の脈動以外は何も聞こえませんでした。
Then I seemed to know of a pattering about me.	やがて、まわりにパタパタという音が聞こえたようです。
I pushed on grimly.	わたしはむっつりと先へ進みました。
The pattering grew more distinct, and then I caught the same queer sound and voices I had heard in the Under-world.	パタパタという音はもっとはっきりしてきて、それから地下世界で聞いたのと同じ奇妙な音や声が耳をとらえました。
There were evidently several of the Morlocks, and they were closing in upon me.	明らかにモーロックたち何人かで、それが迫ってきているのです。
Indeed, in another minute I felt a tug at my coat, then something at my arm.	そしてもう一分もすると、上着が引っ張られるのを感じ、それから何かが腕をつかみました。
And Weena shivered violently, and became quite still.	ウィーナはガタガタと身震いすると、まったく動かなくなりました。
`It was time for a match.	マッチをつける潮時でした。
But to get one I must put her down.	でもつけるには、ウィーナを下ろさなくてはなりません。
I did so, and, as I fumbled with my pocket, a struggle began in the darkness about my knees,	下ろして、ポケットを探るうちに、ひざのあたりの闇でなにやら争いが始まりました。
perfectly silent on her part and with the same peculiar cooing sounds from the Morlocks.	ウィーナはまったくの無音で、モーロックたちからは相変わらずのクークーいう音です。
Soft little hands, too, were creeping over my coat and back, touching even my neck.	また柔らかい小さな手がわたしの上着と背中にしのびより、首筋さえ触っていました。
Then the match scratched and fizzed.	そのとき、マッチが擦れて火を放ちました。
I held it flaring, and saw the white backs of the Morlocks in flight amid the trees.	その炎が燃えるままに掲げ、そしてモーロックたちの白い背中が、木々の間を逃げ去るのが見えました。
I hastily took a lump of camphor from my pocket, and prepared to light is as soon as the match should wane.	急いでポケットから樟脳の固まりを出すと、マッチの火が衰えたらすぐに点火できるように準備しました。
Then I looked at Weena.	そしてウィーナを見ました。
She was lying clutching my feet and quite motionless, with her face to the ground.	彼女はわたしの足をつかんで横たわり、まったく身動きせず、地面に顔を向けています。
With a sudden fright I stooped to her.	急に怖くなって、ウィーナのほうへ身をかがめました。
She seemed scarcely to breathe.	ほとんど息もしていないようです。
I lit the block of camphor and flung it to the ground, and as it split and flared up and drove back the Morlocks and the shadows,	樟脳のかたまりに火をつけてそれを地面に投げると、割れて燃え上がり、モーロックと影を押し戻しました。
I knelt down and lifted her.	そして跪くと、彼女を抱き上げました。
The wood behind seemed full of the stir and murmur of a great company!	背後の森は、盛大なお仲間たちの気配と物音だらけのようでした！
`She seemed to have fainted.	彼女は気絶したようでした。
I put her carefully upon my shoulder and rose to push on, and then there came a horrible realization.	わたしは慎重に彼女を肩に抱え上げ、立ち上がってさらに進もうとしましたが、そこで恐ろしいことに気がつきました。
