The Time Machine	タイムマシン
Then someone suggested that their plaything should be exhibited in the nearest building, and so I was led past the sphinx of white marble, which had seemed to watch me all the while with a smile at my astonishment, towards a vast grey edifice of fretted stone.	そしてだれかが、おもちゃを手近な建物で展示しようと思いついたようで、わたしは白い大理石のスフィンクス（それはずっとこちらを観察し、驚きぶりに微笑するようでした）の横を通って、腐食した石造の広大な灰色の建築物につれてこられました。
As I went with them the memory of my confident anticipations of a profoundly grave and intellectual posterity came, with irresistible merriment, to my mind.	連れだって歩くうちに、圧倒的に深遠で知的な子孫への確信をもった期待がふと思い出され、我ながらおかしくてたまりませんでした。
`The building had a huge entry, and was altogether of colossal dimensions.	建物は巨大な入り口をしていて、全体はとてつもない大きさでした。
I was naturally most occupied with the growing crowd of little people, and with the big open portals that yawned before me shadowy and mysterious.	もちろん一番興味をひいたのは、増える一方の小さな人々の群衆で、また目の前で影をつくりなぞめいた様子で口を開ける、大きな開いた入り口も興味をおぼえました。
My general impression of the world I saw over their heads was a tangled waste of beautiful bushes and flowers, a long neglected and yet weedless garden.	かれらの頭上ごしに見た世界の全般的な印象は、美しい茂みや花のごちゃごちゃした荒れ地、長く放置されていたのに雑草のない庭園、というものでした。
I saw a number of tall spikes of strange white flowers,	背の高い奇妙な白い花が突出しているのをたくさん見かけました。
measuring a foot perhaps across the spread of the waxen petals.	たぶんすべすべの花びらは、差し渡しで30センチはあったでしょうか。
They grew scattered, as if wild, among the variegated shrubs, but, as I say, I did not examine them closely at this time.	それは色とりどりの茂みの中、あちこちに散らばって生え、野生のようでしたが、でも申し上げたように、そのときにはじっくり観察はしませんでした。
The Time Machine was left deserted on the turf among the rhododendrons.	タイムマシンはシャクナゲの中の土盛りの上に、無人で残されました。
`The arch of the doorway was richly carved, but naturally I did not observe the carving very narrowly,	入り口のアーチは豊かに彫られていましたが、もちろんその彫刻をあまり細かく見はしませんでした。
though I fancied I saw suggestions of old Phoenician decorations as I passed through, and it struck me that they were very badly broken and weather-worn.	ただし通過するときに、古いフェニキア装飾のなごりを見たような気はして、さらにそれがひどく壊れていて風化しているのに驚かされました。
Several more brightly clad people met me in the doorway, and so we entered,	明るいふくを着た人々がもう何人か戸口でわたしを迎え、みんなで中に入りました。
I, dressed in dingy nineteenth-century garments, looking grotesque enough, garlanded with flowers, and surrounded by an eddying mass of bright, soft-colored robes and shining white limbs, in a melodious whirl of laughter and laughing speech.	わたしはむさくるしい一九世紀の衣服をまとって、それだけでもグロテスクなのに、花で飾り立てられて、明るく柔らかな色合いのローブと輝く白い手足のうねる集団に囲まれ、メロディアスな笑いと楽しげな会話の渦中にいたのです。
`The big doorway opened into a proportionately great hall	巨大な入り口は、それに比例して巨大な広間に出ました。
hung with brown.	そこは薄暗くなっていました。
The roof was in shadow, and the windows, partially glazed with coloured glass and partially unglazed, admitted a tempered light.	屋根は影になっていて、窓は部分的には色つきガラスで覆われ、部分的にはガラスなしでしたが、抑えた光を通していました。
The floor was made up of huge blocks of some very hard white metal,	床は何かとても堅い白い金属の大きなブロックでできていました。
not plates nor slabs	プレートでもスラブでもありません
--blocks, and it was so much worn,	――ブロックで、しかもかなりすり減っていました。
as I judged by the going to and fro of past generations, as to be deeply channelled along the more frequented ways.	たぶん過去の世代が行ったり来たりしたせいで、通り道の部分は深くえぐれています。
Transverse to the length were innumerable tables made of slabs of polished stone, raised perhaps a foot from the floor, and upon these were heaps of fruits.	その広間の長手方向に沿って、磨いた石のスラブでできたテーブルが無数にあって、それが床から30センチほど持ち上がっており、そのてっぺんには果物の山がありました。
Some I recognized as a kind of hypertrophied raspberry and orange, but for the most part they were strange.	一部は、一種の肥大したラズベリーとオレンジだと見受けられましたが、ほとんどは見たことのないものです。
`Between the tables was scattered a great number of cushions.	テーブルの間にはものすごい数のクッションが散乱しています。
Upon these my conductors seated themselves, signing for me to do likewise.	そのクッションの上に、わたしの先導者たちはすわり、わたしにもすわれと身振りで示します。
With a pretty absence of ceremony they began to eat the fruit with their hands, flinging peel and stalks, and so forth, into the round openings in the sides of the tables.	見事なまでに何の儀式もなく、かれらは手づかみで果物を食べはじめ、皮や芯などはテーブルのまわりの丸い空地に投げ捨てています。
I was not loath to follow their example,	わたしもかれらの顰みに習うのはやぶさかではありませんでした。
for I felt thirsty and hungry.	のどが乾いて腹も減っていたからです。
As I did so I surveyed the hall at my leisure.	そしてそうしながら、暇を見てはその広間を観察していました。
`And perhaps the thing that struck me most was its dilapidated look.	そして何よりも驚いたのは、その荒れ果てた様子だったかもしれません。
The stained-glass windows, which displayed only a geometrical pattern, were broken in many places, and the curtains that hung across the lower end were thick with dust.	ステンドガラスの窓は、幾何学模様しか示していませんでしたが、あちこちで割れていて、その低い部分にかかっているカーテンにはほこりが厚くこびりついています。
And it caught my eye that the corner of the marble table near me was fractured.	そして手近な大理石のテーブルのかどが砕けているのも目につきました。
Nevertheless, the general effect was extremely rich and picturesque.	それでも、全般的な雰囲気はきわめて豊かで壮麗でした。
There were, perhaps, a couple of hundred people dining in the hall,	その広間で食事をしているひとは、数百人ほどだったでしょうか。
and most of them, seated as near to me as they could come, were watching me with interest, their little eyes shining over the fruit they were eating.	そのほとんどが、できるだけわたしの近くにすわり、興味津々でわたしをながめ、食べている果物の上で小さな目を輝かせています。
All were clad in the same soft and yet strong, silky material.	みんな同じ、柔らかいのに強い絹状の材質を身にまとっていました。
`Fruit, by the by, was all their diet.	ちなみに、かれらの食事は果物だけでした。
These people of the remote future were strict vegetarians, and while I was with them, in spite of some carnal cravings, I had to be frugivorous also.	遙か未来のこの人々は厳格な菜食主義者で、かれらといっしょにいる間は、ある程度の肉体的な渇望にもかかわらず、わたしもまた果物だけ食べるしかありませんでした。
Indeed, I found afterwards that horses, cattle, sheep, dogs, had followed the Ichthyosaurus into extinction.	実はあとでわかったのですが、馬も、牛も、羊も、イヌも、すべてイクシオザウルスの後を追って絶滅してしまったのでした。
But the fruits were very delightful;	でもその果物はすばらしくおいしいものでした。
one, in particular, that seemed to be in season all the time I was there	特にわたしがいた間ずっとシーズンだったらしき果物
--a floury thing in a three-sided husk	――三面のさやに入った小麦粉状のものです
--was especially good, and I made it my staple.	――は特においしくて、それがわたしの主食でした。
At first I was puzzled by all these strange fruits, and by the strange flowers I saw, but later I began to perceive their import.	最初はこうした各種の奇妙な果物や、目にした奇妙な花にとまどいましたが、やがてその重要性が理解できるようになってきました。
`However, I am telling you of my fruit dinner in the distant future now.	でも、いまは遙か未来の果物の夕食の話をしていたんでしたっけ。
So soon as my appetite was a little checked, I determined to make a resolute attempt to learn the speech of these new men of mine.	やがて食欲が少しおさまり、わが新しい人々のことばを断固として学ぼうという決意をしたのです。
Clearly that was the next thing to do.	明らかにそれが次にやるべきことでした。
The fruits seemed a convenient thing to begin upon, and holding one of these up I began a series of interrogative sounds and gestures.	手始めにその果物を使うのがお手軽そうでしたので、それを持ち上げて、一連の問いただすような音や身振りを開始しました。
I had some considerable difficulty in conveying my meaning.	いわんとするところを伝えるのはずいぶん苦労しました。
At first my efforts met with a stare of surprise or inextinguishable laughter,	最初のうち、その努力はオドロキの凝視か、とめどない笑いをもって迎えられたのです。
but presently a fair-haired little creature seemed to grasp my intention and repeated a name.	でもやがて、金髪の小さな生き物がこちらの意図を理解して、名前を何度も繰り返しました。
They had to chatter and explain the business at great length to each other, and my first attempts to make the exquisite little sounds of their language caused an immense amount of amusement.	連中はぺちゃくちゃしゃべって、何が行われているかを延々とお互いに説明しあわなければすまないようで、その言語の見事なかわいい音をたてようという最初の試みは、すさまじくおもしろがられたのでした。
However, I felt like a schoolmaster amidst children, and persisted, and presently I had a score of noun substantives at least at my command;	でも、自分が子供たちの中の校長先生のような気分になって、辛抱強く続けるうちに、やがていくつかの名詞句を使いこなせるようになりました。
and then I got to demonstrative pronouns, and even the verb "to eat."	それから指示代名詞、そして「食べる」という動詞もものにしました。
But it was slow work, and the little people soon tired and wanted to get away from my interrogations,	でもそれは遅々としてはかどらず、小さな人々はやがて退屈して、こちらの質問から逃げようとしはじめます。
so I determined, rather of necessity, to let them give their lessons in little doses when they felt inclined.	そこでわたしは、むしろ必要にかられて、向こうの気が向いたときにすこしずつ教えてもらおうと決めたのです。
And very little doses I found they were before long,	そしてすぐに、それがいかに少しずつかを思い知ることになりました。
for I never met people more indolent or more easily fatigued.	というのも、これほど怠惰ですぐに疲れる人は見たことがなかったくらいだったのです。
`A queer thing I soon discovered about my little hosts, and that was their lack of interest.	この小さなご主人たちについてすぐに気がついた奇妙な点は、かれらが関心を持っていないということです。
They would come to me with eager cries of astonishment, like children, but like children they would soon stop examining me and wander away after some other toy.	かれらは子供のように、驚きの叫びをあげつつやってきますが、子供のようにやがてこちらを調べるのをやめて、ほかのおもちゃをおいかけてふらふらと向こうにいってしまいます。
The dinner and my conversational beginnings ended, I noted for the first time that almost all those who had surrounded me at first were gone.	夕食と会話の発端がおわって気がつくと、こちらを囲んでいた人々はほとんど全員いなくなっています。
It is odd, too, how speedily I came to disregard these little people.	またわたし自身、すぐにこの小さな人々を無視するようになったのも奇妙なことです。
I went out through the portal into the sunlit world again as soon as my hunger was satisfied.	飢えがおさまると同時に、入り口を通って日に照らされた外に出ました。
I was continually meeting more of these men of the future, who would follow me a little distance, chatter and laugh about me, and, having smiled and gesticulated in a friendly way, leave me again to my own devices.	これら未来の人々にはさらに続々と会いましたが、みんなしばらくついてきて、ぺちゃくちゃしゃべっては笑い、親しげに微笑して身振りをしてみせると、またわたしを放ってどこかへ行ってしまいます。
`The calm of evening was upon the world as I emerged from the great hall, and the scene was lit by the warm glow of the setting sun.	大ホールから出ると、夕暮れの穏やかさが世界を覆いつつあり、あたりは夕日の暖かい光に照らされていました。
At first things were very confusing.	最初、ものごとは実に困惑させるものでした。
Everything was so entirely different from the world I had known	何もかも、自分の知っている世界とはまるでちがっています
--even the flowers.	――花でさえも。
The big building I had left was situated on the slope of a broad river valley, but the Thames had shifted perhaps a mile from its present position.	後にしてきた大建築は、広い川による峡谷の斜面に立っていましたが、テームズ川は現在の位置から一マイルほどもずれていたでしょう。
I resolved to mount to the summit of a crest perhaps a mile and a half away,	二キロかそこら離れたところにある丘のてっぺんに上ってやろうと思いました。
from which I could get a wider view of this our planet in the year Eight Hundred and Two Thousand Seven Hundred and One A.D.	そこからなら、紀元802千2701年の地球をもっと広く見渡せるでしょう。
For that, I should explain, was the date the little dials of my machine recorded.	ちなみに、タイムマシンの小さなダイヤルが記録していたのはそういう日付けでした。
`As I walked I was watching for every impression that could possibly help to explain the condition of ruinous splendour in which I found the world	歩きながら、世界のおかれた豪華な廃墟状態をなんとか説明するのに役立つどんな印象でもいいから探し回ったものです
--for ruinous it was.	――というのも、廃墟状態にはちがいなかったからです。
A little way up the hill, for instance, was a great heap of granite, bound together by masses of aluminium, a vast labyrinth of precipitous walls and crumpled heaps, amidst which were thick heaps of very beautiful pagoda-like plants--nettles possibly--but wonderfully tinted with brown about the leaves, and incapable of stinging.	たとえばちょっと丘をあげると、巨大な大理石の山が大量のアルミのかたまりでまとめられていて、急な壁の広大な迷路やくしゃくしゃの山があって、その中に非常に美しいパゴダのような植物――イラクサかもしれません――があったのですが、それが葉のまわりがすばらしい茶色に染まっていて、トゲもないのです。
It was evidently the derelict remains of some vast structure, to what end built I could not determine.	なにやら巨大な構造物の倒壊した残骸なのは明らかでしたが、何のために建てられたものかは見極められませんでした。
It was here that I was destined, at a later date, to have a very strange experience	後になって、非常に奇妙な体験を運命付けられていたのはここでした
--the first intimation of a still stranger discovery	――もっと奇妙な発見に初めて出くわすことになるのです
--but of that I will speak in its proper place.	――が、その件についてはまた折りを見て話すことにしましょう。
`Looking round with a sudden thought, from a terrace on which I rested for a while, I realized that there were no small houses to be seen.	突然思いついて、しばらく休んでいたテラスからあたりを見回すと、小さな家がどこにも見あたらないのに気がつきました。
Apparently the single house, and possibly even the household, had vanished.	明らかに戸建て住宅や、それどころか世帯そのものが消えたようです。
Here and there among the greenery were palace-like buildings, but the house and the cottage, which form such characteristic features of our own English landscape, had disappeared.	緑の中のあちこちに、宮殿のような建物がありましたが、わがイギリスの風景で実に特徴的な性質を形成している家屋や小屋は、消えていました。
`"Communism,"	「共産主義か」
said I to myself.	とつぶやきが口をついて出ました。
`And on the heels of that came another thought.	そしてそこからの連想で別の思いつきが浮かびました。
I looked at the half-dozen little figures that were following me.	わたしは、後についてきた半ダースほどの小さな姿を見ました。
Then, in a flash, I perceived that all had the same form of costume, the same soft hairless visage, and the same girlish rotundity of limb.	そして一瞬で、その全員が同じ形の服装をし、同じ柔らかい毛のない顔立ちと、同じ女の子じみた丸みを帯びた手足をしていることに気がつきました。
It may seem strange, perhaps, that I had not noticed this before.	今までこれに気がつかなかったのは奇妙に思えるかもしれません。
But everything was so strange.	でも何もかもがあまりに奇妙だったのです。
Now, I saw the fact plainly enough.	いまや、事態がはっきりと見えてきました。
In costume, and in all the differences of texture and bearing that now mark off the sexes from each other, these people of the future were alike.	服装でも、その他現在では両性のちがいを示す各種の特徴や装束の差においても、この未来の人々はまったく同じだったのです。
And the children seemed to my eyes to be but the miniatures of their parents.	そして子どもたちは、わたしの目には親のミニチュア版にしか見えませんでした。
I judged, then, that the children of that time were extremely precocious, physically at least,	その時点で、この時代の子どもたちは少なくとも肉体的には実に早熟だと判断しましたが。
and I found afterwards abundant verification of my opinion.	後にこの見解の裏付けは山ほど得られました。
`Seeing the ease and security in which these people were living, I felt that this close resemblance of the sexes was after all what one would expect;	この人々が暮らしている安楽さと安全性を見ると、男女がそっくりなのも考えてみれば予想がつくなと感じました。
for the strength of a man and the softness of a woman, the institution of the family, and the differentiation of occupations are mere militant necessities of an age of physical force;	男の強さと女の柔和さは家族のための制度であり、職業の区分は物理的な力の時代において圧倒的だった必要性にすぎないのです。
where population is balanced and abundant, much childbearing becomes an evil rather than a blessing to the State;	人口がおちついて豊富になれば、多産は国にとっては喜びではなく悪となります。
where violence comes but rarely and off-spring are secure, there is less necessity	暴力がほとんど生じず、子どもたちが安全なところでは、効率のいい家族の必要性は下がり
--indeed there is no necessity	――いやまったく不要となり
--for an efficient family, and the specialization of the sexes with reference to their children's needs disappears.	――子供のニーズに応えるために性の役割特化も消えます。
We see some beginnings of this even in our own time, and in this future age it was complete.	われわれの時代ですらその萌芽は見られますし、この未来の時代にはそれが完成されたのです。
This, I must remind you, was my speculation at the time.	申し上げておきますが、これはその時点でのわたしの推測です、
Later, I was to appreciate how far it fell short of the reality.	後に、これがいかに現実に及ばないものだったかを思い知らされることになるのですが。
`While I was musing upon these things, my attention was attracted by a pretty little structure,	こうしたものをおもしろがって眺めているうちに、きれいな小構造物に目が向きました。
like a well under a cupola.	キューポラの下の井戸のようなものです。
I thought in a transitory way of the oddness of wells still existing, and then resumed the thread of my speculations.	いまだに井戸があるというのは不思議だな、とふと思いましたが、また思索を続けました。
There were no large buildings towards the top of the hill, and as my walking powers were evidently miraculous, I was presently left alone for the first time.	丘のてっぺんには大きな建造物はなく、そしてわたしの歩行力はどうやらすさまじいものだったようで、じきに初めて一人にしておいてもらえました。
With a strange sense of freedom and adventure I pushed on up to the crest.	自由と冒険の奇妙な感覚を持って、わたしは頂上まで登りました。
`There I found a seat of some yellow metal that I did not recognize, corroded in places with a kind of pinkish rust and half smothered in soft moss,	そこにはなにやら見たこともない黄色い金属の座席があって、それがあちこちピンクがかったさびで腐食し、柔らかいコケで半分覆われています。
the arm-rests cast and filed into the resemblance of griffins' heads.	腕置きは、グリフィンの頭を模して鋳造・彫刻されています。
I sat down on it, and I surveyed the broad view of our old world under the sunset of that long day.	そこにすわり、その長い一日の日暮れの下に広がる、われらが古き世界の広い眺めを見渡しました。
It was as sweet and fair a view as I have ever seen.	それはこれまで見たこともないほど甘く美しい眺めでした。
The sun had already gone below the horizon and the west was flaming gold, touched with some horizontal bars of purple and crimson.	太陽はすでに地平線の下にもぐり、西の空は燃えるような黄金で、そこにいくつか紫と深紅の水平の雲がたなびいています。
Below was the valley of the Thames, in which the river lay like a band of burnished steel.	眼下にはテームズ川の峡谷で、そこに川が磨かれた鉄のように横たわっています。
I have already spoken of the great palaces dotted about among the variegated greenery,	すでに濃淡様々な緑のあちこちに点在するすごい場所についてはお話しました。
some in ruins and some still occupied.	一部は廃墟、一部はまだ居住されています。
