The Time Machine	タイムマシン
The Time Traveller (for so it will be convenient to speak of him) was expounding a recondite matter to us.	時間旅行者（と便宜上呼んでおく）はわれわれにとっては難解な事柄を述べ立てていた。
His grey eyes shone and twinkled, and his usually pale face was flushed and animated.	その灰色の目は輝き、きらめいて、そしていつもは青白い顔も紅潮して生き生きとしている。
The fire burned brightly, and the soft radiance of the incandescent lights in the lilies of silver caught the bubbles that flashed and passed in our glasses.	火が明るく燃え、銀の百合の中の白熱光からの柔らかい放射が、われわれのグラスの中をきらめきながらたちのぼるあぶくをとらえている。
Our chairs, being his patents, embraced and caressed us rather than submitted to be sat upon, and there was that luxurious after-dinner atmosphere when thought roams gracefully free of the trammels of precision.	われわれの椅子は、かれの発明品なので、単に漫然と座られるにとどまらず、われわれを包み込み愛撫して、そこにはあの思考が厳密性の束縛を逃れて優雅に奔走する、晩餐後の豪華な雰囲気があった。
And he put it to us in this way--marking the points with a lean forefinger--as we sat and lazily admired his earnestness over this new paradox (as we thought it:) and his fecundity.	そしてかれは――論点を細い人差し指で印しつつ――われわれが座ってこの新しいパラドックス（とわれわれが思ったもの）についてのかれの真剣さと活力について、怠惰に感嘆するのを前に、このようにして説明してくれたのだった。
`You must follow me carefull.	「わたしの話に慎重についてきてほしい。
I shall have to controvert one or two ideas that are almost universally accepted.	ほとんど全面的に受け容れられている観念をいくつか覆さざるを得ないでしょう。
The geometry, for instance, they taught you at school is founded on a misconception.'	たとえば学校で教わった幾何学は、ある誤解に基づいているのです」
`Is not that rather a large thing to expect us to begin upon?'	「われわれの手始めとするには、それはいささか話がでかくはありませんかね」
said Filby, an argumentative person with red hair.	と赤毛の議論好きなフィルビーが述べた。
`I do not mean to ask you to accept anything without reasonable ground for it.	「合理的な根拠なしに何かを受け容れろと要求するつもりはありません。
You will soon admit as much as I need from you.	あなたたちはじきに、わたしが必要なだけのことを認めることになるのですし。
You know of course that a mathematical line, a line of thickness NIL, has no real existence.	みなさんはもちろん、数学的な線、厚みなしの線は本当の意味では実在しないということはご存じですよね。
They taught you that?	そこまでは教わりましたか？
Neither has a mathematical plane.	数学的な面もそうです。
These things are mere abstractions.'	こうしたものはただの抽象概念です」
`That is all right,'	「それはそのとおり」
said the Psychologist.	と心理学者。
`Nor, having only length, breadth, and thickness, can a cube have a real existence.'	「同じく、長さと幅と厚さを持つだけの立方体も現実には存在し得ません」
`There I object,'	「それには反対します」
said Filby.	とフィルビー。
`Of course a solid body may exist.	「固体はもちろん存在できますよ。
All real things--'	あらゆる現実のモノは――」
`So most people think.	「ほとんどの人はそう考えます。
But wait a moment.	でもちょっと待ってくださいよ。
Can an INSTANTANEOUS cube exist?'	瞬間的な立方体は存在できるでしょうか？」
`Don't follow you,'	「よくわかりませんが」
said Filby.	とフィルビー。
`Can a cube that does not last for any time at all, have a real existence?'	「ちょっとの時間すら保たない立方体は、本当に実在しているといえますか？」
Filby became pensive.	フィルビーは考え込んでしまった。
`Clearly,'	時間旅行者は続けた。
the Time Traveller proceeded,	「明らかに、すべての実体は4つの方向に延長を持たなくてはなりません。
it must have Length, Breadth, Thickness, and--Duration.	長さ、幅、厚さ、そして――期間です。
But through a natural infirmity of the flesh, which I will explain to you in a moment, we incline to overlook this fact.	でも肉体の自然な弱点（これについてはすぐに説明しますが）によって、われわれはこの事実を見過ごしがちなのです。
There are really four dimensions, three which we call the three planes of Space, and a fourth, Time.	実際には次元は4つあって、そのうち3つはわれわれが空間の3方向と呼ぶもので、4つめが時間です。
There is, however, a tendency to draw an unreal distinction between the former three dimensions and the latter,	でも、最初の3つと最後の時間との間に、実在しない区別をする傾向があります。
because it happens that our consciousness moves intermittently in one direction along the latter from the beginning to the end of our lives.'	なぜならわれわれの意識は絶え間なく時間にそって一方向に、人生の始まりから終わりへと移動するからです」
`That,'	「それは」
said a very young man, making spasmodic efforts to relight his cigar over the lamp;	とあるとても若い男が、ランプで葉巻に火をつけ直そうとしてスパスパと痙攣じみた努力をしつつ述べた。
`that . . . very clear indeed.'	「それは……非常にはっきりしていますね」
`Now, it is very remarkable that this is so extensively overlooked,'	「さて、これがかくも徹底して見過ごされているというのは、実に驚くべきことです」
continued the Time Traveller, with a slight accession of cheerfulness.	と時間旅行者は、ちょっと陽気さを増して続けた。
`Really this is what is meant by the Fourth Dimension,	「実はこれこそが4次元というものなのです。
though some people who talk about the Fourth Dimension do not know they mean it.	ただし4次元の話をする人の中には、自分が時間のことを語っているとは気がついていない人もいますが。
It is only another way of looking at Time.	それは単に、別の見方をした時間でしかないのです。
THERE IS NO DIFFERENCE BETWEEN TIME AND ANY OF THE THREE DIMENSIONS OF SPACE	時間と、空間の3つの次元との間には、なんらちがいはありません。
EXCEPT THAT OUR CONSCIOUSNESS MOVES ALONG IT.	唯一の差は単にわれわれの意識が時間に沿って動くというだけです。
But some foolish people have got hold of the wrong side of that idea.	でも一部の愚かな人々は、この考え方を変な捉え方をしていますよ。
You have all heard what they have to say about this Fourth Dimension?'	この4次元について、そういう人が何を語っているかお聴きになっていますよね？」
`_I_ have not,'	「わしは聞いとらんぞ」
said the Provincial Mayor.	と地区長官。
`It is simply this.	「単にこういうことです。
That Space, as our mathematicians have it, is spoken of as having three dimensions,	空間は、われらが数学者諸君によれば、3つの次元を持つかのように言われています。
which one may call Length, Breadth, and Thickness,	長さ、幅、厚さといってもいいでしょう。
and is always definable by reference to three planes, each at right angles to the others.	そしてそれは常に、お互いに直角に交わる3つの平面を参照することで定義できる、と。
But some philosophical people have been asking why THREE dimensions particularly	でも一部の哲学的な人々は、なぜことさら3つの次元なのか、と考えました
--why not another direction at right angles to the other three?	――ほかの3平面と直角に交わるもう一つの方向があったっていいじゃないか？
--and have even tried to construct a Four-Dimension geometry.	――そして4次元幾何学を構築しようとさえしたのです。
Professor Simon Newcomb was expounding this to the New York Mathematical Society only a month or so ago.	サイモン・ニューコーム教授は、これをニューヨーク数学会にほんの一月ほど前に提案していましたよ。
You know how on a flat surface, which has only two dimensions,	2次元しかない平面上に3次元固体の絵を表現できますね。
we can represent a figure of a three-dimensional solid, and similarly they think that by models of thee dimensions they could represent one of four	だから同じようにして、3次元の模型によってかれらは4次元の固体を表現できると考えているのです
--if they could master the perspective of the thing.	――もしその透視法さえつかめれば、というわけです。
See?'	ご理解いただけましたか？」
`I think so,'	「まあなんとか」
murmured the Provincial Mayor;	と地区長官はつぶやいた。
and, knitting his brows, he lapsed into an introspective state, his lips moving as one who repeats mystic words.	そして眉根をよせて、長考状態に入り込み、その唇を神秘的な呪文を唱える者のように動かしていた。
`Yes, I think I see it now,'	「うん、わかったと思う」
he said after some time, brightening in a quite transitory manner.	しばらくしてかれは、突然うって変わったように明るく述べた。
`Well, I do not mind telling you I have been at work upon this geometry of Four Dimensions for some time.	「では言わせていただきますが、このわたしも4次元幾何学についてはかなり前から研究していたのです。
Some of my results are curious.	いくつかの結果は奇妙なものです。
For instance, here is a portrait of a man at eight years old,	たとえば、ここに8歳の男性の肖像があります。
another at fifteen, another at seventeen, another at twenty-three, and so on.	こちらは15歳、こちらは17、こちらは23、という具合です。
All these are evidently sections,	これらは明らかに、いわば断面図です。
as it were, Three-Dimensional representations of his Four-Dimensioned being, which is a fixed and unalterable thing.	固定され改変不可能な4次元の存在の、3次元表現というわけです」
`Scientific people,'	これが適切に理解されるだけの間をおいて、時間旅行者は続けた。
proceeded the Time Traveller, after the pause required for the proper assimilation of this,	「科学的な人々は、
`know very well that Time is only a kind of Space.	時間が空間の一種だということをよく知っています。
Here is a popular scientific diagram,	ここによくある科学的な図があります。
a weather record.	気象記録ですな。
This line I trace with my finger shows the movement of the barometer.	いまわたしが指でなぞっている線は、気圧計の動きを示しています。
Yesterday it was so high, yesterday night it fell, then this morning it rose again, and so gently upward to here.	昨日はとても高く、昨晩は下がり、今朝は上がって、じわじわとここまで上昇しました。
Surely the mercury did not trace this line in any of the dimensions of Space generally recognized?	もちろん水銀は、一般に認識される空間の次元のどれかに沿って、この線をたどったわけではありませんよね。
But certainly it traced such a line,	でも、それはまちがいなくこの線をたどったわけです。
and that line, therefore, we must conclude was along the Time-Dimension.'	したがってこの線は、時間次元に沿ってのものだったと結論せざるを得ません」
`But,'	医師は、暖炉の石炭を凝視しながら述べた。
said the Medical Man, staring hard at a coal in the fire,	「しかし、
`if Time is really only a fourth dimension of Space, why is it, and why has it always been, regarded as something different?	もし時間が空間の４番目の次元にすぎないのであれば、なぜそれは、いまも昔も、何かちがったものとして受け取られていたのでしょうか？
And why cannot we move in Time as we move about in the other dimensions of Space?'	そしてなぜわれわれは、空間の他の次元のように時間の中を移動できないのでしょうか？」
The Time Traveller smiled.	時間旅行者はにっこりした。
`Are you sure we can move freely in Space?	「空間の中を自由に移動できるというのは本当ですか？
Right and left we can go,	左右にも行けます。
backward and forward freely enough, and men always have done so.	前後も確かに自由自在ですし、人は常にそうしてきました。
I admit we move freely in two dimensions.	だから二次元でわれわれが自由に動くことは認めます。
But how about up and down?	でも上下はどうでしょう？
Gravitation limits us there.'	重力がわれわれをそこで制約します」
`Not exactly,'	「そうとはいえない。
said the Medical Man.	気球があります」
`There are balloons.'	と医師。
`But before the balloons, save for spasmodic jumping and the inequalities of the surface, man had no freedom of vertical movement.'	「でも気球以前は、けいれんじみたジャンプや地表面の不均等以外では、人は垂直方向を移動する自由がありませんでした」
`Still they could move a little up and down,'	「それでも、ちょっとは上下に移動できましたよ」
said the Medical Man.	と医師。
`Easier, far easier down than up.'	「下るほうが上がるより簡単ですね。
`And you cannot move at all in Time,	「でも時間の中ではまったく動けない。
you cannot get away from the present moment.'	現在からは逃れられない」
`My dear sir, that is just where you are wrong.	「おことばではありますが、そこがまさにあなたのまちがっているところなのです。
That is just where the whole world has gone wrong.	全世界がまちがっているのも、まさにそこなのです。
We are always getting away from the present movement.	われわれは常に、現在の動きから遠ざかっているのです。
Our mental existences, which are immaterial and have no dimensions, are passing along the Time-Dimension with a uniform velocity from the cradle to the grave.	われわれの意識存在は、非物質的で次元を持ちませんが、ゆりかごから墓場まで一定速度で時間次元に沿って移動しているので。
Just as we should travel DOWN if we began our existence fifty miles above the earth's surface.'	ちょうど、われわれの存在が地表面から80キロのところで始まったとしたら、われわれが下へ向かって移動するのと同じようにね」
`But the great difficulty is this,'	「でも大きな問題点がありますよ」
interrupted the Psychologist.	と心理学者が割り込んだ。
`You CAN move about in all directions of Space, but you cannot move about in Time.'	「空間ではすべての方向に動けますが、時間の中では動き回れないじゃありませんか」
`That is the germ of my great discovery.	「それが我が偉大な発見の難点でした。
But you are wrong to say that we cannot move about in Time.	でも、われわれが時間の中を動き回れないというのはまちがっています。
For instance, if I am recalling an incident very vividly I go back to the instant of its occurrence:	たとえば、わたしがある出来事をとても鮮明に思い出していたら、わたしはそれが起きた瞬間に戻っているわけです：
I become absent-minded, as you say.	文字通り、意識がお留守になるわけですね。
I jump back for a moment.	一瞬、時間を飛んで戻っているわけです。
Of course we have no means of staying back for any length of Time,	もちろん、長期にわたって戻ったままとなる手段は持っていません。
any more than a savage or an animal has of staying six feet above the ground.	野蛮人や動物が、地上2メートルに居続けられないのと同じことです。
But a civilized man is better off than the savage in this respect.	でも文明人はこの点で、野蛮人よりも成果を挙げています。
He can go up against gravitation in a balloon, and why should he not hope that ultimately he may be able to stop or accelerate his drift along the Time-Dimension, or even turn about and travel the other way?'	文明人は気球に乗って重力に逆らえますし、だから最終的には、時間次元に沿って自分の流れを止めたり、それを加速したり、あるいは向きを変えて逆行できると期待すべきでない法もないでしょうに」
`Oh, THIS,'	フィルビーが口を開いた。
began Filby,	「まったく、そこまでいくとまるっきり――」
`Why not?'	「なぜダメなんです？」
said the Time Traveller.	と時間旅行者。
`It's against reason,'	「道理に反してる」
said Filby.	とフィルビー。
`What reason?'	「何の道理です？」
said the Time Traveller.	と時間旅行者。
`You can show black is white by argument,'	「議論で白を黒と言いくるめることはできるが、わたしは絶対に納得しないでしょう」
said Filby,	とフィルビー。
`Possibly not,'	「そうかもしれません」
said the Time Traveller.	と時間旅行者は述べた。
`But now you begin to see the object of my investigations into the geometry of Four Dimensions.	「でも、わたしが四次元の幾何学について調べだした狙いはわかってきたでしょう。
Long ago I had a vague inkling of a machine--'	昔、わたしはばくぜんとある機械の着想を――」
`To travel through Time!'	「時間の中を旅行する機械ですか！」
exclaimed the Very Young Man.	と非常に若い男が叫んだ。
`That shall travel indifferently in any direction of Space and Time, as the driver determines.'	「運転手の決めたとおり、時間でも空間でも構わずにどんな方向へも旅行する機械の着想を得たのです」
Filby contented himself with laughter.	フィルビーはそれを笑い飛ばした。
`But I have experimental verification,'	「でも実験による証明があるんですよ」
said the Time Traveller.	と時間旅行者。
`It would be remarkably convenient for the historian,'	「歴史学者には実に便利でしょうなあ」
the Psychologist suggested.	と心理学者が指摘した。
`One might travel back and verify the accepted account of the Battle of Hastings, for instance!'	「過去に戻って、たとえばヘイスティングスの戦いについての定説を確認できますぞ！」
`Don't you think you would attract attention?'	医師が述べた。
said the Medical Man.	「目立ちすぎると思いませんか？
`Our ancestors had no great tolerance for anachronisms.'	われわれの先祖は、時代錯誤をあまり大目には見てくれませんでしたから」
`One might get one's Greek from the very lips of Homer and Plato,'	「ギリシャ語を、ホメロスやプラトン自身の口から習えるかも」
the Very Young Man thought.	と非常に若い男性が考えた。
`In which case they would certainly plough you for the Little-go.	「そうなったら、学位予備試験についてさぞかし根ほり葉ほり聞かれることでしょう。
The German scholars have improved Greek so much.'	ドイツの学者たちがギリシャ語を大幅に改良しましたからな」
`Then there is the future,'	「そして未来のこともある。
said the Very Young Man.	考えてもごらんなさい！
`Just think!	全財産を投資して、複利で増えるようにしてから、未来へとひとっ飛び！」
One might invest all one's money, leave it to accumulate at interest, and hurry on ahead!'	と非常に若い男性。
`To discover a society,'	「厳格な共産主義を基盤に構築された社会が見つかるだろうね」
said I,	とわたし。
`Of all the wild extravagant theories!'	「まったく、現実離れしたとんでもない理論だ！」
began the Psychologist.	と心理学者が口を開いた。
`Yes, so it seemed to me,	「はい、わたしにもそう思えました。
and so I never talked of it	だからこの話はしなかったのです。
until--'	それが――」
`Experimental verification!'	「実験による証明ですと！」
cried I.	とわたしは叫んだ。
`You are going to verify THAT?'	「それが実証できるとでも？」
`The experiment!'	「実験だ！」
cried Filby, who was getting brain-weary.	と、頭が混乱しはじめていたフィルビーも叫んだ。
`Let's see your experiment anyhow,'	「何はともあれ、あなたの実験を拝見しようじゃありませんか」
said the Psychologist,	と心理学者
`though it's all humbug, you know.'	「とはいえ、どうせみんなでたらめでしょうが」
The Time Traveller smiled round at us.	時間旅行者は一同を見回してにっこりした。
Then, still smiling faintly, and with his hands deep in his trousers pockets, he walked slowly out of the room, and we heard his slippers shuffling down the long passage to his laboratory.	そして、その微笑をかすかに残しつつ、両手をズボンのポケットに深くつっこんだまま、かれはゆっくりと部屋を出て、そしてかれの研究室までの長い廊下を下るかれのスリッパの音が聞こえるだけとなった。
The Psychologist looked at us.	心理学者がみんなを見回した。
`I wonder what he's got?'	「何が出てきますかね」
`Some sleight-of-hand trick or other,'	「なにやら手品かなんかでしょう」
said the Medical Man,	と医師。
and Filby tried to tell us about a conjurer he had seen at Burslem;	そしてフィルビーは、バースレムで見かけたいかさま師の話をしようとした。
but before he had finished his preface the Time Traveller came back, and Filby's anecdote collapsed.	でも導入部が終わるより先に、時間旅行者が戻ってきたので、フィルビーの小話もそれっきりとなった。
The thing the Time Traveller held in his hand was a glittering metallic framework, scarcely larger than a small clock, and very delicately made.	時間旅行者が手に持っていたのは、輝く金属の枠組みで小型の時計よりちょっと大きいだけで、実に入念に作られていた。
There was ivory in it, and some transparent crystalline substance.	象牙と、透明な水晶状の物質も使われていた。
And now I must be explicit,	そしてここでわたしは厳密な物言いをする必要がある。
for this that follows	というのも続いて起こったことは
--unless his explanation is to be accepted	――かれの説明を認めるのでない限り
--is an absolutely unaccountable thing.	――まったく説明のつかないことだったからだ。
He took one of the small octagonal tables that were scattered about the room, and set it in front of the fire, with two legs on the hearthrug.	かれは部屋のあちこちにおかれていた小さな八角形のテーブルを一つ持ってくると、暖炉の火の前に置いて、テーブルの脚の二本がじゅうたんのにかかるようにした。
On this table he placed the mechanism.	そのテーブルにかれはこの機械をおいた。
Then he drew up a chair, and sat down.	そして椅子を寄せると座った。
The only other object on the table was a small shaded lamp, the bright light of which fell upon the model.	テーブルの上にある物体は、他には小さな笠つきのランプだけで、その明るい光が模型を照らしている。
There were also perhaps a dozen candles about,	あとはまわりにろうそくが1ダースもあっただろうか。
two in brass candlesticks upon the mantel and several in sconces, so that the room was brilliantly illuminated.	マントルピースの上の真鍮製ろうそく立てに2本、ほかに壁に取り付けた燭台に何本かあって、部屋全体が明るく照らされていた。
I sat in a low arm-chair nearest the fire, and I drew this forward so as to be almost between the Time Traveller and the fireplace.	わたしは暖炉にいちばん近い、低いソファにすわっていたので、それを前に引き寄せて、ほとんど時間旅行者と暖炉の間に割り込みそうになった。
Filby sat behind him, looking over his shoulder.	時間旅行者の背後にはフィルビーがすわり、その肩越しにのぞきこんでいる。
The Medical Man and the Provincial Mayor watched him in profile from the right,	医師と地区長官は、右から時間旅行者の横顔を見ていた。
the Psychologist from the left.	心理学者は左からだ。
